client_id	path	sentence	up_votes	down_votes	age	gender	accents	variant	locale	segment
4eeeb22a3bbb52e5215593a09a845f0f8c496e0a7c498c6d1e9e5e0f8730f79bf16b2b30483dfcc771d430918f27e3ce8b546d068017302109c5c76ca75b0944	common_voice_fi_23102155.mp3	Mutta suhaisinko samalla vahingossa itseäni piikillä?	2	0	thirties	male			fi	
4eeeb22a3bbb52e5215593a09a845f0f8c496e0a7c498c6d1e9e5e0f8730f79bf16b2b30483dfcc771d430918f27e3ce8b546d068017302109c5c76ca75b0944	common_voice_fi_23102156.mp3	Tervahöyryjä kulkea jumpsuttaa.	2	0	thirties	male			fi	
4eeeb22a3bbb52e5215593a09a845f0f8c496e0a7c498c6d1e9e5e0f8730f79bf16b2b30483dfcc771d430918f27e3ce8b546d068017302109c5c76ca75b0944	common_voice_fi_23102157.mp3	Eikö sinun nauriisi ole edellä?	2	0	thirties	male			fi	
4eeeb22a3bbb52e5215593a09a845f0f8c496e0a7c498c6d1e9e5e0f8730f79bf16b2b30483dfcc771d430918f27e3ce8b546d068017302109c5c76ca75b0944	common_voice_fi_23220963.mp3	Sellainen ratkaisu, ettei tehdä mitään, on mahdoton.	2	0	thirties	male			fi	
4eeeb22a3bbb52e5215593a09a845f0f8c496e0a7c498c6d1e9e5e0f8730f79bf16b2b30483dfcc771d430918f27e3ce8b546d068017302109c5c76ca75b0944	common_voice_fi_23221053.mp3	Näihin taisi palaa kaikki pisteet, ajattelin.	2	0	thirties	male			fi	
4eeeb22a3bbb52e5215593a09a845f0f8c496e0a7c498c6d1e9e5e0f8730f79bf16b2b30483dfcc771d430918f27e3ce8b546d068017302109c5c76ca75b0944	common_voice_fi_23221055.mp3	Hirviön päässä oli puu, josta olin napannut hedelmän.	2	0	thirties	male			fi	
4eeeb22a3bbb52e5215593a09a845f0f8c496e0a7c498c6d1e9e5e0f8730f79bf16b2b30483dfcc771d430918f27e3ce8b546d068017302109c5c76ca75b0944	common_voice_fi_23221057.mp3	Tuollainen askellus sopi ainoastaan ihmiselle, joten sen oli oltava Mysteerimies.	2	0	thirties	male			fi	
4eeeb22a3bbb52e5215593a09a845f0f8c496e0a7c498c6d1e9e5e0f8730f79bf16b2b30483dfcc771d430918f27e3ce8b546d068017302109c5c76ca75b0944	common_voice_fi_23221115.mp3	Erittäin hyvää jälkeä.	2	1	thirties	male			fi	
4eeeb22a3bbb52e5215593a09a845f0f8c496e0a7c498c6d1e9e5e0f8730f79bf16b2b30483dfcc771d430918f27e3ce8b546d068017302109c5c76ca75b0944	common_voice_fi_23221117.mp3	Avaa yhden kirjeistä.	2	0	thirties	male			fi	
4eeeb22a3bbb52e5215593a09a845f0f8c496e0a7c498c6d1e9e5e0f8730f79bf16b2b30483dfcc771d430918f27e3ce8b546d068017302109c5c76ca75b0944	common_voice_fi_23221119.mp3	Äänestäjillä ei ole nyt ollut missään mahdollisuutta kertoa kantaansa perustuslain laadinnasta.	2	0	thirties	male			fi	
4eeeb22a3bbb52e5215593a09a845f0f8c496e0a7c498c6d1e9e5e0f8730f79bf16b2b30483dfcc771d430918f27e3ce8b546d068017302109c5c76ca75b0944	common_voice_fi_23221121.mp3	Oikeanpuoleisessa eteisessä palaa pieni seinälamppu.	2	0	thirties	male			fi	
4eeeb22a3bbb52e5215593a09a845f0f8c496e0a7c498c6d1e9e5e0f8730f79bf16b2b30483dfcc771d430918f27e3ce8b546d068017302109c5c76ca75b0944	common_voice_fi_23221122.mp3	Ole hyvä	2	1	thirties	male			fi	
4eeeb22a3bbb52e5215593a09a845f0f8c496e0a7c498c6d1e9e5e0f8730f79bf16b2b30483dfcc771d430918f27e3ce8b546d068017302109c5c76ca75b0944	common_voice_fi_23360880.mp3	Euroopan on tarpeen tullen toimittava yhtenä rintamana.	2	0	thirties	male			fi	
4eeeb22a3bbb52e5215593a09a845f0f8c496e0a7c498c6d1e9e5e0f8730f79bf16b2b30483dfcc771d430918f27e3ce8b546d068017302109c5c76ca75b0944	common_voice_fi_23360882.mp3	"Ilmatar, älä säikäytä noin", ääni sanoi henkeä haukkoen.	2	0	thirties	male			fi	
4eeeb22a3bbb52e5215593a09a845f0f8c496e0a7c498c6d1e9e5e0f8730f79bf16b2b30483dfcc771d430918f27e3ce8b546d068017302109c5c76ca75b0944	common_voice_fi_23360883.mp3	Hän suhtautui niiden sisältöön laskennallisena haasteena.	2	0	thirties	male			fi	
4eeeb22a3bbb52e5215593a09a845f0f8c496e0a7c498c6d1e9e5e0f8730f79bf16b2b30483dfcc771d430918f27e3ce8b546d068017302109c5c76ca75b0944	common_voice_fi_23360884.mp3	Saaret ja niemet verhoutuvat siniseen autereeseen.	2	0	thirties	male			fi	
4eeeb22a3bbb52e5215593a09a845f0f8c496e0a7c498c6d1e9e5e0f8730f79bf16b2b30483dfcc771d430918f27e3ce8b546d068017302109c5c76ca75b0944	common_voice_fi_23360887.mp3	Hän tiesi, että lähtisin juoksemaan Finiania vastaan, mutta Nancy piti riskiä liian suurena.	2	0	thirties	male			fi	
4eeeb22a3bbb52e5215593a09a845f0f8c496e0a7c498c6d1e9e5e0f8730f79bf16b2b30483dfcc771d430918f27e3ce8b546d068017302109c5c76ca75b0944	common_voice_fi_23360888.mp3	Ja suostuu antamaan toisellekin osuutensa, Maunolle.	2	0	thirties	male			fi	
4eeeb22a3bbb52e5215593a09a845f0f8c496e0a7c498c6d1e9e5e0f8730f79bf16b2b30483dfcc771d430918f27e3ce8b546d068017302109c5c76ca75b0944	common_voice_fi_23360891.mp3	Äänestämme rajoittavia tarkistuksia vastaan.	2	0	thirties	male			fi	
4eeeb22a3bbb52e5215593a09a845f0f8c496e0a7c498c6d1e9e5e0f8730f79bf16b2b30483dfcc771d430918f27e3ce8b546d068017302109c5c76ca75b0944	common_voice_fi_23360892.mp3	Hyvää päivää	2	0	thirties	male			fi	
4eeeb22a3bbb52e5215593a09a845f0f8c496e0a7c498c6d1e9e5e0f8730f79bf16b2b30483dfcc771d430918f27e3ce8b546d068017302109c5c76ca75b0944	common_voice_fi_23360893.mp3	Rautaesirippu ja kylmä sota johtivat Euroopassa kahden sotilasliiton syntyyn	2	0	thirties	male			fi	
4eeeb22a3bbb52e5215593a09a845f0f8c496e0a7c498c6d1e9e5e0f8730f79bf16b2b30483dfcc771d430918f27e3ce8b546d068017302109c5c76ca75b0944	common_voice_fi_23360894.mp3	Äänestämme sen vuoksi sähkön ja polttoaineen korkeimman mahdollisen vähimmäisverotuksen puolesta.	2	0	thirties	male			fi	
4eeeb22a3bbb52e5215593a09a845f0f8c496e0a7c498c6d1e9e5e0f8730f79bf16b2b30483dfcc771d430918f27e3ce8b546d068017302109c5c76ca75b0944	common_voice_fi_23360895.mp3	Kana levittelee siipiään vihaisesti.	2	0	thirties	male			fi	
4eeeb22a3bbb52e5215593a09a845f0f8c496e0a7c498c6d1e9e5e0f8730f79bf16b2b30483dfcc771d430918f27e3ce8b546d068017302109c5c76ca75b0944	common_voice_fi_23360896.mp3	Äänestin sen suositusten puolesta.	2	0	thirties	male			fi	
4eeeb22a3bbb52e5215593a09a845f0f8c496e0a7c498c6d1e9e5e0f8730f79bf16b2b30483dfcc771d430918f27e3ce8b546d068017302109c5c76ca75b0944	common_voice_fi_23360898.mp3	Vai toi se Sinikanteleen vaimo lehmäänsä.	2	0	thirties	male			fi	
4eeeb22a3bbb52e5215593a09a845f0f8c496e0a7c498c6d1e9e5e0f8730f79bf16b2b30483dfcc771d430918f27e3ce8b546d068017302109c5c76ca75b0944	common_voice_fi_23360899.mp3	Sitä täytyi hänen nyt pysähtyä katsomaan.	2	0	thirties	male			fi	
4eeeb22a3bbb52e5215593a09a845f0f8c496e0a7c498c6d1e9e5e0f8730f79bf16b2b30483dfcc771d430918f27e3ce8b546d068017302109c5c76ca75b0944	common_voice_fi_23360900.mp3	Alma oli kuin huumeessa.	2	0	thirties	male			fi	
4eeeb22a3bbb52e5215593a09a845f0f8c496e0a7c498c6d1e9e5e0f8730f79bf16b2b30483dfcc771d430918f27e3ce8b546d068017302109c5c76ca75b0944	common_voice_fi_23360901.mp3	Epilogi	2	0	thirties	male			fi	
4eeeb22a3bbb52e5215593a09a845f0f8c496e0a7c498c6d1e9e5e0f8730f79bf16b2b30483dfcc771d430918f27e3ce8b546d068017302109c5c76ca75b0944	common_voice_fi_23360905.mp3	"Meidän pitää valmistautuu pahimpaa", Nancy sanoi sotilaallisen urheasti.	2	0	thirties	male			fi	
4eeeb22a3bbb52e5215593a09a845f0f8c496e0a7c498c6d1e9e5e0f8730f79bf16b2b30483dfcc771d430918f27e3ce8b546d068017302109c5c76ca75b0944	common_voice_fi_23360907.mp3	Elämme digitaalista aikaa.	2	0	thirties	male			fi	
4eeeb22a3bbb52e5215593a09a845f0f8c496e0a7c498c6d1e9e5e0f8730f79bf16b2b30483dfcc771d430918f27e3ce8b546d068017302109c5c76ca75b0944	common_voice_fi_23360908.mp3	Jonkin sortin johtaja oli siellä vastassa.	2	0	thirties	male			fi	
4eeeb22a3bbb52e5215593a09a845f0f8c496e0a7c498c6d1e9e5e0f8730f79bf16b2b30483dfcc771d430918f27e3ce8b546d068017302109c5c76ca75b0944	common_voice_fi_23360910.mp3	Keskikaupungilla oli liikettä niin, että hämmästytti.	2	0	thirties	male			fi	
4eeeb22a3bbb52e5215593a09a845f0f8c496e0a7c498c6d1e9e5e0f8730f79bf16b2b30483dfcc771d430918f27e3ce8b546d068017302109c5c76ca75b0944	common_voice_fi_23360911.mp3	Sellainen helle, että linnutkin ovat hiljaa.	2	0	thirties	male			fi	
4eeeb22a3bbb52e5215593a09a845f0f8c496e0a7c498c6d1e9e5e0f8730f79bf16b2b30483dfcc771d430918f27e3ce8b546d068017302109c5c76ca75b0944	common_voice_fi_23360913.mp3	Minulla on nälkä	2	0	thirties	male			fi	
4eeeb22a3bbb52e5215593a09a845f0f8c496e0a7c498c6d1e9e5e0f8730f79bf16b2b30483dfcc771d430918f27e3ce8b546d068017302109c5c76ca75b0944	common_voice_fi_23360915.mp3	Ei ollut oikeastaan halua mihinkään.	2	0	thirties	male			fi	
4eeeb22a3bbb52e5215593a09a845f0f8c496e0a7c498c6d1e9e5e0f8730f79bf16b2b30483dfcc771d430918f27e3ce8b546d068017302109c5c76ca75b0944	common_voice_fi_23360917.mp3	Mutta leppyi siitä.	2	0	thirties	male			fi	
4eeeb22a3bbb52e5215593a09a845f0f8c496e0a7c498c6d1e9e5e0f8730f79bf16b2b30483dfcc771d430918f27e3ce8b546d068017302109c5c76ca75b0944	common_voice_fi_23360919.mp3	Tutkimusdataahan me sinne mennään keräämään, mutta mikä estää ottamasta samalla iloa irti?	2	0	thirties	male			fi	
4eeeb22a3bbb52e5215593a09a845f0f8c496e0a7c498c6d1e9e5e0f8730f79bf16b2b30483dfcc771d430918f27e3ce8b546d068017302109c5c76ca75b0944	common_voice_fi_23382916.mp3	Se olisi aivan varmasti tyhjä muista pedoista.	2	0	thirties	male			fi	
4eeeb22a3bbb52e5215593a09a845f0f8c496e0a7c498c6d1e9e5e0f8730f79bf16b2b30483dfcc771d430918f27e3ce8b546d068017302109c5c76ca75b0944	common_voice_fi_23382920.mp3	Kaikki tehtävät ovat tärkeitä, jotta pääsemme strategian tavoitteeseen olla globaali vaikuttaja.	2	0	thirties	male			fi	
4eeeb22a3bbb52e5215593a09a845f0f8c496e0a7c498c6d1e9e5e0f8730f79bf16b2b30483dfcc771d430918f27e3ce8b546d068017302109c5c76ca75b0944	common_voice_fi_23391456.mp3	Äänestämme koko päätöslauselmaa vastaan.	2	0	thirties	male			fi	
4eeeb22a3bbb52e5215593a09a845f0f8c496e0a7c498c6d1e9e5e0f8730f79bf16b2b30483dfcc771d430918f27e3ce8b546d068017302109c5c76ca75b0944	common_voice_fi_23391457.mp3	Ymmärtäväthän nuo meidän lapset sen verran.	2	0	thirties	male			fi	
4eeeb22a3bbb52e5215593a09a845f0f8c496e0a7c498c6d1e9e5e0f8730f79bf16b2b30483dfcc771d430918f27e3ce8b546d068017302109c5c76ca75b0944	common_voice_fi_23391458.mp3	Sika urahtelee tallissa tyytyväisenä itsekseen.	2	0	thirties	male			fi	
4eeeb22a3bbb52e5215593a09a845f0f8c496e0a7c498c6d1e9e5e0f8730f79bf16b2b30483dfcc771d430918f27e3ce8b546d068017302109c5c76ca75b0944	common_voice_fi_23391460.mp3	Quique oli vahvaluonteinen ja ystävilleen lojaali.	2	0	thirties	male			fi	
4eeeb22a3bbb52e5215593a09a845f0f8c496e0a7c498c6d1e9e5e0f8730f79bf16b2b30483dfcc771d430918f27e3ce8b546d068017302109c5c76ca75b0944	common_voice_fi_23391467.mp3	Ensinnäkin ne olivat jyrkät ja niissä oli jalansijat molemmille jaloille erikseen.	2	0	thirties	male			fi	
4eeeb22a3bbb52e5215593a09a845f0f8c496e0a7c498c6d1e9e5e0f8730f79bf16b2b30483dfcc771d430918f27e3ce8b546d068017302109c5c76ca75b0944	common_voice_fi_23391469.mp3	Sillä kadulla Victor kosi minua vuosia sitten ilotulitteiden räiskyessä uutenavuotena.	2	0	thirties	male			fi	
4eeeb22a3bbb52e5215593a09a845f0f8c496e0a7c498c6d1e9e5e0f8730f79bf16b2b30483dfcc771d430918f27e3ce8b546d068017302109c5c76ca75b0944	common_voice_fi_23391471.mp3	Kyse olisi enää sekunneista, ja alus mulskahtaisi suoraan suon silmään.	2	0	thirties	male			fi	
4eeeb22a3bbb52e5215593a09a845f0f8c496e0a7c498c6d1e9e5e0f8730f79bf16b2b30483dfcc771d430918f27e3ce8b546d068017302109c5c76ca75b0944	common_voice_fi_23391472.mp3	Ei sillä, että se olisi Malikista vähemmän ruipeloista tehnyt.	2	0	thirties	male			fi	
4eeeb22a3bbb52e5215593a09a845f0f8c496e0a7c498c6d1e9e5e0f8730f79bf16b2b30483dfcc771d430918f27e3ce8b546d068017302109c5c76ca75b0944	common_voice_fi_23391473.mp3	“Äh, ei mitää tommosii”, Harish lyttäsi Jonin ehdotuksen ja huitaisi ilmaa kädellään.	2	0	thirties	male			fi	
4eeeb22a3bbb52e5215593a09a845f0f8c496e0a7c498c6d1e9e5e0f8730f79bf16b2b30483dfcc771d430918f27e3ce8b546d068017302109c5c76ca75b0944	common_voice_fi_23391483.mp3	Äänestin renkaiden polttoainetehokuutta koskevaa merkintää koskevan asetuksen puolesta.	2	0	thirties	male			fi	
4eeeb22a3bbb52e5215593a09a845f0f8c496e0a7c498c6d1e9e5e0f8730f79bf16b2b30483dfcc771d430918f27e3ce8b546d068017302109c5c76ca75b0944	common_voice_fi_23391485.mp3	Pyysin Uffea ja Finiania viemään otuksen laboratorioon mennessäni itse hakemaan astetta turvallisempia näytteitä.	2	0	thirties	male			fi	
4eeeb22a3bbb52e5215593a09a845f0f8c496e0a7c498c6d1e9e5e0f8730f79bf16b2b30483dfcc771d430918f27e3ce8b546d068017302109c5c76ca75b0944	common_voice_fi_23391486.mp3	Hän aivan varmasti valitsi rohkeimmat mukaan.	2	0	thirties	male			fi	
4eeeb22a3bbb52e5215593a09a845f0f8c496e0a7c498c6d1e9e5e0f8730f79bf16b2b30483dfcc771d430918f27e3ce8b546d068017302109c5c76ca75b0944	common_voice_fi_23391487.mp3	Hydruksen ensimmäinen tutkimusretki oli lopuillaan.	2	0	thirties	male			fi	
4eeeb22a3bbb52e5215593a09a845f0f8c496e0a7c498c6d1e9e5e0f8730f79bf16b2b30483dfcc771d430918f27e3ce8b546d068017302109c5c76ca75b0944	common_voice_fi_23391488.mp3	Ulla oli tyyni ja rauhoitti heitä.	2	0	thirties	male			fi	
4eeeb22a3bbb52e5215593a09a845f0f8c496e0a7c498c6d1e9e5e0f8730f79bf16b2b30483dfcc771d430918f27e3ce8b546d068017302109c5c76ca75b0944	common_voice_fi_23391490.mp3	Äänestin siis mietinnön puolesta, jottei vaarallisuuskriteerejä sovellettaisi vaatteisiin.	2	0	thirties	male			fi	
4eeeb22a3bbb52e5215593a09a845f0f8c496e0a7c498c6d1e9e5e0f8730f79bf16b2b30483dfcc771d430918f27e3ce8b546d068017302109c5c76ca75b0944	common_voice_fi_23391492.mp3	Finian oli luopua toivosta ja hän lysähti nojaamaan patsasta vasten.	2	0	thirties	male			fi	
4eeeb22a3bbb52e5215593a09a845f0f8c496e0a7c498c6d1e9e5e0f8730f79bf16b2b30483dfcc771d430918f27e3ce8b546d068017302109c5c76ca75b0944	common_voice_fi_23391493.mp3	Pertta heitä vähän ärsytti.	2	0	thirties	male			fi	
4eeeb22a3bbb52e5215593a09a845f0f8c496e0a7c498c6d1e9e5e0f8730f79bf16b2b30483dfcc771d430918f27e3ce8b546d068017302109c5c76ca75b0944	common_voice_fi_23391494.mp3	Se oli jokin uusi mies.	2	0	thirties	male			fi	
4eeeb22a3bbb52e5215593a09a845f0f8c496e0a7c498c6d1e9e5e0f8730f79bf16b2b30483dfcc771d430918f27e3ce8b546d068017302109c5c76ca75b0944	common_voice_fi_23391511.mp3	Illan hämärryttyä Tukuk lähti johtamaan ihmisiä ja tappiaisia Polohaa kohti.	2	0	thirties	male			fi	
4eeeb22a3bbb52e5215593a09a845f0f8c496e0a7c498c6d1e9e5e0f8730f79bf16b2b30483dfcc771d430918f27e3ce8b546d068017302109c5c76ca75b0944	common_voice_fi_23391512.mp3	Saattaa toki olla, että meidän kasvimme ovat liian vaaleita saadakseen tarpeeksi aurinkoa.	2	0	thirties	male			fi	
4eeeb22a3bbb52e5215593a09a845f0f8c496e0a7c498c6d1e9e5e0f8730f79bf16b2b30483dfcc771d430918f27e3ce8b546d068017302109c5c76ca75b0944	common_voice_fi_23391513.mp3	Kenellä vanha sauna, siitä kyhää.	2	0	thirties	male			fi	
4eeeb22a3bbb52e5215593a09a845f0f8c496e0a7c498c6d1e9e5e0f8730f79bf16b2b30483dfcc771d430918f27e3ce8b546d068017302109c5c76ca75b0944	common_voice_fi_23391514.mp3	Malik oli innoissaan sorkkimassa syvennyksiä saadakseen näytölle ilmestyneet palikat liikkumaan.	2	0	thirties	male			fi	
4eeeb22a3bbb52e5215593a09a845f0f8c496e0a7c498c6d1e9e5e0f8730f79bf16b2b30483dfcc771d430918f27e3ce8b546d068017302109c5c76ca75b0944	common_voice_fi_23391515.mp3	Ensin näytti niin ruskealta ja pieneltä.	2	0	thirties	male			fi	
4eeeb22a3bbb52e5215593a09a845f0f8c496e0a7c498c6d1e9e5e0f8730f79bf16b2b30483dfcc771d430918f27e3ce8b546d068017302109c5c76ca75b0944	common_voice_fi_23391518.mp3	Ei puhunut silloin mitään.	2	0	thirties	male			fi	
4eeeb22a3bbb52e5215593a09a845f0f8c496e0a7c498c6d1e9e5e0f8730f79bf16b2b30483dfcc771d430918f27e3ce8b546d068017302109c5c76ca75b0944	common_voice_fi_23391520.mp3	Meille niin tutuksi tulleet tappiaiset näyttäytyivät nyt minulle aivan uudessa valossa.	2	0	thirties	male			fi	
4eeeb22a3bbb52e5215593a09a845f0f8c496e0a7c498c6d1e9e5e0f8730f79bf16b2b30483dfcc771d430918f27e3ce8b546d068017302109c5c76ca75b0944	common_voice_fi_23391524.mp3	Kaikkihan tietävät, että Vanutu hallitsee tuulta!"	2	0	thirties	male			fi	
4eeeb22a3bbb52e5215593a09a845f0f8c496e0a7c498c6d1e9e5e0f8730f79bf16b2b30483dfcc771d430918f27e3ce8b546d068017302109c5c76ca75b0944	common_voice_fi_23391526.mp3	Se ei kerro.	2	0	thirties	male			fi	
4eeeb22a3bbb52e5215593a09a845f0f8c496e0a7c498c6d1e9e5e0f8730f79bf16b2b30483dfcc771d430918f27e3ce8b546d068017302109c5c76ca75b0944	common_voice_fi_23391530.mp3	Sukupolvia sitten punottu salajuoni kantoi vihdoin hedelmää.	2	0	thirties	male			fi	
4eeeb22a3bbb52e5215593a09a845f0f8c496e0a7c498c6d1e9e5e0f8730f79bf16b2b30483dfcc771d430918f27e3ce8b546d068017302109c5c76ca75b0944	common_voice_fi_23391531.mp3	Äänestän tätä mietintöä vastaan useasta syystä.	2	0	thirties	male			fi	
4eeeb22a3bbb52e5215593a09a845f0f8c496e0a7c498c6d1e9e5e0f8730f79bf16b2b30483dfcc771d430918f27e3ce8b546d068017302109c5c76ca75b0944	common_voice_fi_23391532.mp3	kaikki oli samanväristä.	2	0	thirties	male			fi	
4eeeb22a3bbb52e5215593a09a845f0f8c496e0a7c498c6d1e9e5e0f8730f79bf16b2b30483dfcc771d430918f27e3ce8b546d068017302109c5c76ca75b0944	common_voice_fi_23391537.mp3	Maapallo oli kestokykynsä äärirajoilla.	2	0	thirties	male			fi	
4eeeb22a3bbb52e5215593a09a845f0f8c496e0a7c498c6d1e9e5e0f8730f79bf16b2b30483dfcc771d430918f27e3ce8b546d068017302109c5c76ca75b0944	common_voice_fi_23391538.mp3	Olisivatko ne tosiaan niityllä?	2	0	thirties	male			fi	
4eeeb22a3bbb52e5215593a09a845f0f8c496e0a7c498c6d1e9e5e0f8730f79bf16b2b30483dfcc771d430918f27e3ce8b546d068017302109c5c76ca75b0944	common_voice_fi_23391539.mp3	Ehkä se ei ollutkaan mitään.	2	1	thirties	male			fi	
4eeeb22a3bbb52e5215593a09a845f0f8c496e0a7c498c6d1e9e5e0f8730f79bf16b2b30483dfcc771d430918f27e3ce8b546d068017302109c5c76ca75b0944	common_voice_fi_23391540.mp3	Diskurssianalyysi tarkoittaa analyysiä, joka kohdistuu kirjoitettuun, puhuttuun tai merkein viestittyyn kielen käyttöön	2	0	thirties	male			fi	
4eeeb22a3bbb52e5215593a09a845f0f8c496e0a7c498c6d1e9e5e0f8730f79bf16b2b30483dfcc771d430918f27e3ce8b546d068017302109c5c76ca75b0944	common_voice_fi_23391547.mp3	Äänestimme yhdestä kohdasta, nimittäin maataloushintoja koskevasta keskustelusta.	2	0	thirties	male			fi	
4eeeb22a3bbb52e5215593a09a845f0f8c496e0a7c498c6d1e9e5e0f8730f79bf16b2b30483dfcc771d430918f27e3ce8b546d068017302109c5c76ca75b0944	common_voice_fi_23391548.mp3	Tänään valloitan kiistatta tämän planeetan, ja huomenna muserran Mysteerimiehen.	2	0	thirties	male			fi	
4eeeb22a3bbb52e5215593a09a845f0f8c496e0a7c498c6d1e9e5e0f8730f79bf16b2b30483dfcc771d430918f27e3ce8b546d068017302109c5c76ca75b0944	common_voice_fi_23391549.mp3	Mutta minun olisi pidettävä tämä salassa perheeltäni.	2	0	thirties	male			fi	
4eeeb22a3bbb52e5215593a09a845f0f8c496e0a7c498c6d1e9e5e0f8730f79bf16b2b30483dfcc771d430918f27e3ce8b546d068017302109c5c76ca75b0944	common_voice_fi_23391551.mp3	Entä sisämaa?	2	0	thirties	male			fi	
4eeeb22a3bbb52e5215593a09a845f0f8c496e0a7c498c6d1e9e5e0f8730f79bf16b2b30483dfcc771d430918f27e3ce8b546d068017302109c5c76ca75b0944	common_voice_fi_23391552.mp3	Hän katoaa sisälle kodan ovesta.	2	0	thirties	male			fi	
4eeeb22a3bbb52e5215593a09a845f0f8c496e0a7c498c6d1e9e5e0f8730f79bf16b2b30483dfcc771d430918f27e3ce8b546d068017302109c5c76ca75b0944	common_voice_fi_23391553.mp3	Niinkuin karhu se mormottaa.	2	0	thirties	male			fi	
4eeeb22a3bbb52e5215593a09a845f0f8c496e0a7c498c6d1e9e5e0f8730f79bf16b2b30483dfcc771d430918f27e3ce8b546d068017302109c5c76ca75b0944	common_voice_fi_23391554.mp3	Käkriäinen pujahti kohta takaisin kotaan.	2	0	thirties	male			fi	
4eeeb22a3bbb52e5215593a09a845f0f8c496e0a7c498c6d1e9e5e0f8730f79bf16b2b30483dfcc771d430918f27e3ce8b546d068017302109c5c76ca75b0944	common_voice_fi_23391561.mp3	Äänestin siksi hänen ehdottamansa komission valitsemista vastaan.	2	0	thirties	male			fi	
4eeeb22a3bbb52e5215593a09a845f0f8c496e0a7c498c6d1e9e5e0f8730f79bf16b2b30483dfcc771d430918f27e3ce8b546d068017302109c5c76ca75b0944	common_voice_fi_23391562.mp3	Äänestämme huomenna tämänpäiväisten pitkien, uuvuttavien ja järkevien keskustelujen päätteeksi.	2	0	thirties	male			fi	
4eeeb22a3bbb52e5215593a09a845f0f8c496e0a7c498c6d1e9e5e0f8730f79bf16b2b30483dfcc771d430918f27e3ce8b546d068017302109c5c76ca75b0944	common_voice_fi_23391564.mp3	"Ei muute", Joni aloitti kertomaan juorua Knutista ja äidistään ilme kirkastuen.	2	0	thirties	male			fi	
4eeeb22a3bbb52e5215593a09a845f0f8c496e0a7c498c6d1e9e5e0f8730f79bf16b2b30483dfcc771d430918f27e3ce8b546d068017302109c5c76ca75b0944	common_voice_fi_23391565.mp3	Liekit olivat jo sammuneet poltettuaan kaiken hapen, ja ruumiita oli siellä täällä.	2	0	thirties	male			fi	
4eeeb22a3bbb52e5215593a09a845f0f8c496e0a7c498c6d1e9e5e0f8730f79bf16b2b30483dfcc771d430918f27e3ce8b546d068017302109c5c76ca75b0944	common_voice_fi_23391566.mp3	Kiran kääntyi vartijoiden puoleen:	2	0	thirties	male			fi	
4eeeb22a3bbb52e5215593a09a845f0f8c496e0a7c498c6d1e9e5e0f8730f79bf16b2b30483dfcc771d430918f27e3ce8b546d068017302109c5c76ca75b0944	common_voice_fi_23391569.mp3	Onneksi niitä ei tarvitse enää pitkään katsella.	2	0	thirties	male			fi	
4eeeb22a3bbb52e5215593a09a845f0f8c496e0a7c498c6d1e9e5e0f8730f79bf16b2b30483dfcc771d430918f27e3ce8b546d068017302109c5c76ca75b0944	common_voice_fi_23391571.mp3	Antaa sen kehittyä luonnollisesti, vähitellen.	2	0	thirties	male			fi	
4eeeb22a3bbb52e5215593a09a845f0f8c496e0a7c498c6d1e9e5e0f8730f79bf16b2b30483dfcc771d430918f27e3ce8b546d068017302109c5c76ca75b0944	common_voice_fi_23391573.mp3	Pitääks mun kuolla epätietoisena siitä, kuka lastani hoitaa?	2	0	thirties	male			fi	
4eeeb22a3bbb52e5215593a09a845f0f8c496e0a7c498c6d1e9e5e0f8730f79bf16b2b30483dfcc771d430918f27e3ce8b546d068017302109c5c76ca75b0944	common_voice_fi_23391574.mp3	Muutamien välissä on melkoinen rako.	2	1	thirties	male			fi	
4eeeb22a3bbb52e5215593a09a845f0f8c496e0a7c498c6d1e9e5e0f8730f79bf16b2b30483dfcc771d430918f27e3ce8b546d068017302109c5c76ca75b0944	common_voice_fi_23391575.mp3	Äänestämmekö nykyisestä tekstistä vai odotammeko uutta tekstiä?	2	0	thirties	male			fi	
4eeeb22a3bbb52e5215593a09a845f0f8c496e0a7c498c6d1e9e5e0f8730f79bf16b2b30483dfcc771d430918f27e3ce8b546d068017302109c5c76ca75b0944	common_voice_fi_23391576.mp3	On selvää, että sisällä olemme turvassa, mutta emme me täälläkään voi loputtomiin istua.	2	0	thirties	male			fi	
4eeeb22a3bbb52e5215593a09a845f0f8c496e0a7c498c6d1e9e5e0f8730f79bf16b2b30483dfcc771d430918f27e3ce8b546d068017302109c5c76ca75b0944	common_voice_fi_23391577.mp3	Tämä tuli kuin puun takaa yllättäen.	2	0	thirties	male			fi	
4eeeb22a3bbb52e5215593a09a845f0f8c496e0a7c498c6d1e9e5e0f8730f79bf16b2b30483dfcc771d430918f27e3ce8b546d068017302109c5c76ca75b0944	common_voice_fi_23391578.mp3	Mutta sen äänen hän pian tukahdutti.	2	0	thirties	male			fi	
4eeeb22a3bbb52e5215593a09a845f0f8c496e0a7c498c6d1e9e5e0f8730f79bf16b2b30483dfcc771d430918f27e3ce8b546d068017302109c5c76ca75b0944	common_voice_fi_23391579.mp3	Ja hänen akkansa.	2	0	thirties	male			fi	
4eeeb22a3bbb52e5215593a09a845f0f8c496e0a7c498c6d1e9e5e0f8730f79bf16b2b30483dfcc771d430918f27e3ce8b546d068017302109c5c76ca75b0944	common_voice_fi_23391580.mp3	Tosin, kun käännyin katsomaan olkani yli, uudet tulokkaat näyttivät olevan hetkellisesti tajuttomina.	2	0	thirties	male			fi	
4eeeb22a3bbb52e5215593a09a845f0f8c496e0a7c498c6d1e9e5e0f8730f79bf16b2b30483dfcc771d430918f27e3ce8b546d068017302109c5c76ca75b0944	common_voice_fi_23420106.mp3	Luola oli täysin autio.	2	0	thirties	male			fi	
4eeeb22a3bbb52e5215593a09a845f0f8c496e0a7c498c6d1e9e5e0f8730f79bf16b2b30483dfcc771d430918f27e3ce8b546d068017302109c5c76ca75b0944	common_voice_fi_23420107.mp3	Mitä sitä oikein ostaisi, kun ei jaksaisi syödä?	2	0	thirties	male			fi	
4eeeb22a3bbb52e5215593a09a845f0f8c496e0a7c498c6d1e9e5e0f8730f79bf16b2b30483dfcc771d430918f27e3ce8b546d068017302109c5c76ca75b0944	common_voice_fi_23420108.mp3	Kuinka paljon muistoja paikkaan liittyikään!	2	0	thirties	male			fi	
4eeeb22a3bbb52e5215593a09a845f0f8c496e0a7c498c6d1e9e5e0f8730f79bf16b2b30483dfcc771d430918f27e3ce8b546d068017302109c5c76ca75b0944	common_voice_fi_23420110.mp3	Äänestän tämän vuoksi pelkästään kansallisesta näkökulmasta, jotta kotimaani kalastusalaa tuetaan.	2	0	thirties	male			fi	
4eeeb22a3bbb52e5215593a09a845f0f8c496e0a7c498c6d1e9e5e0f8730f79bf16b2b30483dfcc771d430918f27e3ce8b546d068017302109c5c76ca75b0944	common_voice_fi_23439530.mp3	Rosina on sekaantunut ja loukkaantunut.	2	0	thirties	male			fi	
4eeeb22a3bbb52e5215593a09a845f0f8c496e0a7c498c6d1e9e5e0f8730f79bf16b2b30483dfcc771d430918f27e3ce8b546d068017302109c5c76ca75b0944	common_voice_fi_23439531.mp3	Hän katsoi alas jalkoihinsa nojaten poskensa kämmeniään vasten.	2	0	thirties	male			fi	
4eeeb22a3bbb52e5215593a09a845f0f8c496e0a7c498c6d1e9e5e0f8730f79bf16b2b30483dfcc771d430918f27e3ce8b546d068017302109c5c76ca75b0944	common_voice_fi_23439533.mp3	Niillä ei enää tehnyt mitään.	2	0	thirties	male			fi	
4eeeb22a3bbb52e5215593a09a845f0f8c496e0a7c498c6d1e9e5e0f8730f79bf16b2b30483dfcc771d430918f27e3ce8b546d068017302109c5c76ca75b0944	common_voice_fi_23439535.mp3	Äänestimme mietintöä vastaan edellä esitettyjen voimakkaiden mielipiteidemme vuoksi.	2	0	thirties	male			fi	
4eeeb22a3bbb52e5215593a09a845f0f8c496e0a7c498c6d1e9e5e0f8730f79bf16b2b30483dfcc771d430918f27e3ce8b546d068017302109c5c76ca75b0944	common_voice_fi_23439539.mp3	Oma se pitäisi paikka olla.	2	0	thirties	male			fi	
4eeeb22a3bbb52e5215593a09a845f0f8c496e0a7c498c6d1e9e5e0f8730f79bf16b2b30483dfcc771d430918f27e3ce8b546d068017302109c5c76ca75b0944	common_voice_fi_23439546.mp3	Miltä tuntuisikaan olla moisen vietävänä?	2	0	thirties	male			fi	
4eeeb22a3bbb52e5215593a09a845f0f8c496e0a7c498c6d1e9e5e0f8730f79bf16b2b30483dfcc771d430918f27e3ce8b546d068017302109c5c76ca75b0944	common_voice_fi_23439548.mp3	Äänestin puolesta, koska minusta tämä komission röyhkeys menee yksinkertaisesti liian pitkälle.	2	0	thirties	male			fi	
4eeeb22a3bbb52e5215593a09a845f0f8c496e0a7c498c6d1e9e5e0f8730f79bf16b2b30483dfcc771d430918f27e3ce8b546d068017302109c5c76ca75b0944	common_voice_fi_23439549.mp3	He menivät sisään.	2	0	thirties	male			fi	
4eeeb22a3bbb52e5215593a09a845f0f8c496e0a7c498c6d1e9e5e0f8730f79bf16b2b30483dfcc771d430918f27e3ce8b546d068017302109c5c76ca75b0944	common_voice_fi_23439551.mp3	Tee pian minkä teet.	2	0	thirties	male			fi	
