client_id	path	sentence	up_votes	down_votes	age	gender	accents	variant	locale	segment
050b6ad709ba7088ae0c8b93d5218e43882c08bfb86d5d8baa97fd2d72efe97e070e167c8eaeb1610b6b84296f283b5929bfb9d830be0bbc19b1adf49ef1d8bd	common_voice_mr_31841901.mp3	ही लोकसंख्यासुद्धा देशाच्या पश्चिम भागातच एकवटली आहे.	1	0	teens	female			mr	
050b6ad709ba7088ae0c8b93d5218e43882c08bfb86d5d8baa97fd2d72efe97e070e167c8eaeb1610b6b84296f283b5929bfb9d830be0bbc19b1adf49ef1d8bd	common_voice_mr_31841903.mp3	त्यांनी ते अंडे पाहिले व लागलेच आपल्या तीक्ष्ण चोचींनी फोडिले.	0	0	teens	female			mr	
050b6ad709ba7088ae0c8b93d5218e43882c08bfb86d5d8baa97fd2d72efe97e070e167c8eaeb1610b6b84296f283b5929bfb9d830be0bbc19b1adf49ef1d8bd	common_voice_mr_31841906.mp3	संपूर्ण महाभारत विश्वास भिडे	1	1	teens	female			mr	
050b6ad709ba7088ae0c8b93d5218e43882c08bfb86d5d8baa97fd2d72efe97e070e167c8eaeb1610b6b84296f283b5929bfb9d830be0bbc19b1adf49ef1d8bd	common_voice_mr_31841909.mp3	ते चारोळी लेखनासाठी अधिक प्रसिद्ध आहेत.	1	0	teens	female			mr	
050b6ad709ba7088ae0c8b93d5218e43882c08bfb86d5d8baa97fd2d72efe97e070e167c8eaeb1610b6b84296f283b5929bfb9d830be0bbc19b1adf49ef1d8bd	common_voice_mr_31841910.mp3	हिंदू समाज हा पुरातन काळापासूनच अनेक वर्ण, जाती, पंथ यांत विभागला गेला आहे.	0	0	teens	female			mr	
050b6ad709ba7088ae0c8b93d5218e43882c08bfb86d5d8baa97fd2d72efe97e070e167c8eaeb1610b6b84296f283b5929bfb9d830be0bbc19b1adf49ef1d8bd	common_voice_mr_31841922.mp3	म्हणून ते त्यांचा बालपणीचा मित्र द्रुपद पांचाल देशाचा राजा ह्याच्याकडे साहाय्याकरिता गेले.	1	0	teens	female			mr	
050b6ad709ba7088ae0c8b93d5218e43882c08bfb86d5d8baa97fd2d72efe97e070e167c8eaeb1610b6b84296f283b5929bfb9d830be0bbc19b1adf49ef1d8bd	common_voice_mr_31841923.mp3	कृष्णाच्या अवतारसमाप्तीनंतर द्वापरयुग संपून कलियुगाची सुरुवात झाल्याचे सांगितले जाते.	1	0	teens	female			mr	
050b6ad709ba7088ae0c8b93d5218e43882c08bfb86d5d8baa97fd2d72efe97e070e167c8eaeb1610b6b84296f283b5929bfb9d830be0bbc19b1adf49ef1d8bd	common_voice_mr_31841924.mp3	किष्किंधा कांड सीतेच्या शोधातील राम किष्किंधेच्या वानर साम्राज्यात दाखल होतो.	1	0	teens	female			mr	
050b6ad709ba7088ae0c8b93d5218e43882c08bfb86d5d8baa97fd2d72efe97e070e167c8eaeb1610b6b84296f283b5929bfb9d830be0bbc19b1adf49ef1d8bd	common_voice_mr_31841925.mp3	लावणी म्हणजे गीत, नृत्य आणि अदाकारी यांचा त्रिवेणी संगम.	0	0	teens	female			mr	
050b6ad709ba7088ae0c8b93d5218e43882c08bfb86d5d8baa97fd2d72efe97e070e167c8eaeb1610b6b84296f283b5929bfb9d830be0bbc19b1adf49ef1d8bd	common_voice_mr_31841937.mp3	चेन्नईमधील भुजलाचे साठे दिवसेंदिवस खारे होत आहेत.	1	0	teens	female			mr	
050b6ad709ba7088ae0c8b93d5218e43882c08bfb86d5d8baa97fd2d72efe97e070e167c8eaeb1610b6b84296f283b5929bfb9d830be0bbc19b1adf49ef1d8bd	common_voice_mr_31841940.mp3	अरुणाचल प्रदेश हे भारताच्या ईशान्य भागातील एक प्रमुख राज्य आहे.	1	0	teens	female			mr	
050b6ad709ba7088ae0c8b93d5218e43882c08bfb86d5d8baa97fd2d72efe97e070e167c8eaeb1610b6b84296f283b5929bfb9d830be0bbc19b1adf49ef1d8bd	common_voice_mr_31841941.mp3	लहानपणी त्याला सूर्याला पकडण्याची इच्छा झाली.	1	0	teens	female			mr	
050b6ad709ba7088ae0c8b93d5218e43882c08bfb86d5d8baa97fd2d72efe97e070e167c8eaeb1610b6b84296f283b5929bfb9d830be0bbc19b1adf49ef1d8bd	common_voice_mr_31841967.mp3	अत्यंत शुद्ध असा भस्ममय आकार तेथे होता.	0	0	teens	female			mr	
050b6ad709ba7088ae0c8b93d5218e43882c08bfb86d5d8baa97fd2d72efe97e070e167c8eaeb1610b6b84296f283b5929bfb9d830be0bbc19b1adf49ef1d8bd	common_voice_mr_31841968.mp3	मजल दरमजल करीत त्यांनी कर्नाटकचे मुख्यमंत्रीपद व ओडिशाचे राज्यपालपद मिळवले.	0	0	teens	female			mr	
050b6ad709ba7088ae0c8b93d5218e43882c08bfb86d5d8baa97fd2d72efe97e070e167c8eaeb1610b6b84296f283b5929bfb9d830be0bbc19b1adf49ef1d8bd	common_voice_mr_31841971.mp3	याच गावी हिंद सेवक संघाची शाखा होती.	0	0	teens	female			mr	
050b6ad709ba7088ae0c8b93d5218e43882c08bfb86d5d8baa97fd2d72efe97e070e167c8eaeb1610b6b84296f283b5929bfb9d830be0bbc19b1adf49ef1d8bd	common_voice_mr_31841972.mp3	आनंद पुणेकर खरे नाव मुकुंद टाकसाळे	1	0	teens	female			mr	
050b6ad709ba7088ae0c8b93d5218e43882c08bfb86d5d8baa97fd2d72efe97e070e167c8eaeb1610b6b84296f283b5929bfb9d830be0bbc19b1adf49ef1d8bd	common_voice_mr_31842051.mp3	एके दिवशी गोरक्षनाथ संजीवनीमंत्र पाठ करीत बसला होता.	1	1	teens	female			mr	
050b6ad709ba7088ae0c8b93d5218e43882c08bfb86d5d8baa97fd2d72efe97e070e167c8eaeb1610b6b84296f283b5929bfb9d830be0bbc19b1adf49ef1d8bd	common_voice_mr_31842052.mp3	त्याच्याच शेजारी तसाच एक मोठा पाण्याचा साठा असलेला तलाव आहे.	1	0	teens	female			mr	
050b6ad709ba7088ae0c8b93d5218e43882c08bfb86d5d8baa97fd2d72efe97e070e167c8eaeb1610b6b84296f283b5929bfb9d830be0bbc19b1adf49ef1d8bd	common_voice_mr_31842054.mp3	प्रत्यक्षात या ‘स्वेच्छे’ची सक्तीच केली जाते आणि तिला कायद्याची जोड असल्याने ती.	1	0	teens	female			mr	
050b6ad709ba7088ae0c8b93d5218e43882c08bfb86d5d8baa97fd2d72efe97e070e167c8eaeb1610b6b84296f283b5929bfb9d830be0bbc19b1adf49ef1d8bd	common_voice_mr_31842057.mp3	द्विपक्षीय आणि अनेकपक्षी करारांमुळे ती संस्था जागतिक देशसमू्हांशी सहकार्य करत असते.	1	0	teens	female			mr	
050b6ad709ba7088ae0c8b93d5218e43882c08bfb86d5d8baa97fd2d72efe97e070e167c8eaeb1610b6b84296f283b5929bfb9d830be0bbc19b1adf49ef1d8bd	common_voice_mr_31842064.mp3	त्यावर तिने घडलेले सर्व कथन केले.	0	0	teens	female			mr	
050b6ad709ba7088ae0c8b93d5218e43882c08bfb86d5d8baa97fd2d72efe97e070e167c8eaeb1610b6b84296f283b5929bfb9d830be0bbc19b1adf49ef1d8bd	common_voice_mr_31842065.mp3	फक्त एक चूक रावणाकडून झाली.	0	0	teens	female			mr	
050b6ad709ba7088ae0c8b93d5218e43882c08bfb86d5d8baa97fd2d72efe97e070e167c8eaeb1610b6b84296f283b5929bfb9d830be0bbc19b1adf49ef1d8bd	common_voice_mr_31842067.mp3	पामीर पर्वतरांग ताजिकिस्तान, चीन, अफगाणिस्तान, पाकिस्तान, भारत; सर्वोच्च शिखर इस्माइल सोमोनी शिखर.	1	0	teens	female			mr	
050b6ad709ba7088ae0c8b93d5218e43882c08bfb86d5d8baa97fd2d72efe97e070e167c8eaeb1610b6b84296f283b5929bfb9d830be0bbc19b1adf49ef1d8bd	common_voice_mr_31842068.mp3	राधिका हे ज्याचे उपासना कृष्णा सर्व शक्तिशाली आहे ती अर्थ, सर्वात सामान्य ख्यातनाम आहे.	1	0	teens	female			mr	
050b6ad709ba7088ae0c8b93d5218e43882c08bfb86d5d8baa97fd2d72efe97e070e167c8eaeb1610b6b84296f283b5929bfb9d830be0bbc19b1adf49ef1d8bd	common_voice_mr_31842092.mp3	एकनाथ खडसे महाराष्ट्र राज्य माजी महसूलमंत्री, भाजपचे ज्येष्ठ नेते.	1	0	teens	female			mr	
050b6ad709ba7088ae0c8b93d5218e43882c08bfb86d5d8baa97fd2d72efe97e070e167c8eaeb1610b6b84296f283b5929bfb9d830be0bbc19b1adf49ef1d8bd	common_voice_mr_31842127.mp3	हवामान ग्रीसचे हवामान मुख्यत्वे भूमध्य हवामान प्रकारात गणण्यात येते.	1	1	teens	female			mr	
050b6ad709ba7088ae0c8b93d5218e43882c08bfb86d5d8baa97fd2d72efe97e070e167c8eaeb1610b6b84296f283b5929bfb9d830be0bbc19b1adf49ef1d8bd	common_voice_mr_31842128.mp3	त्याने आणि त्याची पत् नी राधा यांनी त्या मुलाचे पालन केले.	1	0	teens	female			mr	
050b6ad709ba7088ae0c8b93d5218e43882c08bfb86d5d8baa97fd2d72efe97e070e167c8eaeb1610b6b84296f283b5929bfb9d830be0bbc19b1adf49ef1d8bd	common_voice_mr_31842129.mp3	हे वाढीव व्यवस्थापक किंवा पर्यवेक्षक त्या कारखान्यात पूर्वीपासून काम करणारे कर्मचारीच असत.	1	0	teens	female			mr	
050b6ad709ba7088ae0c8b93d5218e43882c08bfb86d5d8baa97fd2d72efe97e070e167c8eaeb1610b6b84296f283b5929bfb9d830be0bbc19b1adf49ef1d8bd	common_voice_mr_31842131.mp3	मला माझं स्वप्न पूर्ण करायचंय.	0	0	teens	female			mr	
050b6ad709ba7088ae0c8b93d5218e43882c08bfb86d5d8baa97fd2d72efe97e070e167c8eaeb1610b6b84296f283b5929bfb9d830be0bbc19b1adf49ef1d8bd	common_voice_mr_31842137.mp3	सूर्याच्या बहुतांश आयुष्यात सौरऊर्जा अणूमीलनातून तयार होते.	1	0	teens	female			mr	
050b6ad709ba7088ae0c8b93d5218e43882c08bfb86d5d8baa97fd2d72efe97e070e167c8eaeb1610b6b84296f283b5929bfb9d830be0bbc19b1adf49ef1d8bd	common_voice_mr_31842138.mp3	अहवाल अनुकूल असलेल्या आंध्र व कर्नाटक प्रांतांना हायसे वाटले.	1	1	teens	female			mr	
050b6ad709ba7088ae0c8b93d5218e43882c08bfb86d5d8baa97fd2d72efe97e070e167c8eaeb1610b6b84296f283b5929bfb9d830be0bbc19b1adf49ef1d8bd	common_voice_mr_31842139.mp3	पण जिनव्रती असल्याने परलोकप्राप्तीची साधना करण्याचे तिने ठरविले.	1	0	teens	female			mr	
050b6ad709ba7088ae0c8b93d5218e43882c08bfb86d5d8baa97fd2d72efe97e070e167c8eaeb1610b6b84296f283b5929bfb9d830be0bbc19b1adf49ef1d8bd	common_voice_mr_31842140.mp3	आत्मचरित्र, चार नगरांतले माझे विश्व.	0	0	teens	female			mr	
050b6ad709ba7088ae0c8b93d5218e43882c08bfb86d5d8baa97fd2d72efe97e070e167c8eaeb1610b6b84296f283b5929bfb9d830be0bbc19b1adf49ef1d8bd	common_voice_mr_31842141.mp3	तपासून झाल्यावर शीर्षक तिथून कापून विषय इथे चिकटवा.	1	0	teens	female			mr	
050b6ad709ba7088ae0c8b93d5218e43882c08bfb86d5d8baa97fd2d72efe97e070e167c8eaeb1610b6b84296f283b5929bfb9d830be0bbc19b1adf49ef1d8bd	common_voice_mr_31842142.mp3	या शिक्षणामुळे तिला तिचे ध्येय आध्यात्मिक मार्गावर नेण्यासाठी, दृढ राखण्यासाठी उपयुक्त झाले.	1	0	teens	female			mr	
050b6ad709ba7088ae0c8b93d5218e43882c08bfb86d5d8baa97fd2d72efe97e070e167c8eaeb1610b6b84296f283b5929bfb9d830be0bbc19b1adf49ef1d8bd	common_voice_mr_31842143.mp3	पूर्वेला नागालँड व मणिपूर ही राज्य आहेत.	0	0	teens	female			mr	
050b6ad709ba7088ae0c8b93d5218e43882c08bfb86d5d8baa97fd2d72efe97e070e167c8eaeb1610b6b84296f283b5929bfb9d830be0bbc19b1adf49ef1d8bd	common_voice_mr_31842145.mp3	आस्की, आस्की ही एक संगणकात वापरण्यासाठी टंक बनविण्याची पद्धत आहे.	0	0	teens	female			mr	
050b6ad709ba7088ae0c8b93d5218e43882c08bfb86d5d8baa97fd2d72efe97e070e167c8eaeb1610b6b84296f283b5929bfb9d830be0bbc19b1adf49ef1d8bd	common_voice_mr_31842146.mp3	कौरव द्रोणाचार्यांना आपला गुरु मानून धनुर्विद्या शिकणारा एक विद्यार्थी होता.	0	0	teens	female			mr	
050b6ad709ba7088ae0c8b93d5218e43882c08bfb86d5d8baa97fd2d72efe97e070e167c8eaeb1610b6b84296f283b5929bfb9d830be0bbc19b1adf49ef1d8bd	common_voice_mr_31842165.mp3	राम भरत भेटीच्या प्रसंगात पादुका देताना रामचंद्र भरताला उपदेश करतात	0	0	teens	female			mr	
050b6ad709ba7088ae0c8b93d5218e43882c08bfb86d5d8baa97fd2d72efe97e070e167c8eaeb1610b6b84296f283b5929bfb9d830be0bbc19b1adf49ef1d8bd	common_voice_mr_31842197.mp3	पारंपारीक दृष्ट्या ज्वारी बाजरी नाचणीपासून बनवलेली भाकरी हे महाराष्ट्रातील प्रमुख अन्न घटक आहे.	0	0	teens	female			mr	
050b6ad709ba7088ae0c8b93d5218e43882c08bfb86d5d8baa97fd2d72efe97e070e167c8eaeb1610b6b84296f283b5929bfb9d830be0bbc19b1adf49ef1d8bd	common_voice_mr_31842198.mp3	पांचालीचे महाभारत मयसभा मूळ द्रौपदी की महाभारत, हिंदी लेखिका चित्रा बॅनर्जी	1	1	teens	female			mr	
050b6ad709ba7088ae0c8b93d5218e43882c08bfb86d5d8baa97fd2d72efe97e070e167c8eaeb1610b6b84296f283b5929bfb9d830be0bbc19b1adf49ef1d8bd	common_voice_mr_31842199.mp3	महंमदवाडीतील एका जागेच्या वादातूनही गुन्हा दाखल.	0	0	teens	female			mr	
050b6ad709ba7088ae0c8b93d5218e43882c08bfb86d5d8baa97fd2d72efe97e070e167c8eaeb1610b6b84296f283b5929bfb9d830be0bbc19b1adf49ef1d8bd	common_voice_mr_31842200.mp3	सर्वानी इथेच अभ्यास करायचा आहे.	1	0	teens	female			mr	
0c2e8b9c0de2b081f08fb95d511663418478f55b8a461fe00649e4aad848e7380e6023a096f4aa4a140e964c78f7c32baca6b6f5ff783110f0a86a34304886ea	common_voice_mr_31844203.mp3	हिंदू फल ज्योतिष्य शास्त्र ह्या विषयांत तो तज्ज्ञ होता.	1	0	twenties	male			mr	
0c2e8b9c0de2b081f08fb95d511663418478f55b8a461fe00649e4aad848e7380e6023a096f4aa4a140e964c78f7c32baca6b6f5ff783110f0a86a34304886ea	common_voice_mr_31844205.mp3	याच काळात त्याने बरेच लहान लहान व्यवसाय करण्याचे अयशस्वी प्रयत्नदेखील केले.	0	0	twenties	male			mr	
0c2e8b9c0de2b081f08fb95d511663418478f55b8a461fe00649e4aad848e7380e6023a096f4aa4a140e964c78f7c32baca6b6f5ff783110f0a86a34304886ea	common_voice_mr_31844206.mp3	या महाकाव्याचे सुन् वुकांग् पात्र हनुमानाच्या पात्रावर आधारित आहे.	1	1	twenties	male			mr	
0c2e8b9c0de2b081f08fb95d511663418478f55b8a461fe00649e4aad848e7380e6023a096f4aa4a140e964c78f7c32baca6b6f5ff783110f0a86a34304886ea	common_voice_mr_31844208.mp3	ओज पर्व तुळसी परब	1	1	twenties	male			mr	
3c0883cf1695253b9d3fd853ded4bfc5abfa012a3ead38499b85c2241c36ee80951bb9b78310bfb9e131ec4360b02521c6e6797ab24bebba45e652b17b79969d	common_voice_mr_31861498.mp3	त्याची संतती आणि पिढ्या आज मानव किंवा मनुष्य म्हणून ओळखल्या जातात.	1	0	teens	female			mr	
3c0883cf1695253b9d3fd853ded4bfc5abfa012a3ead38499b85c2241c36ee80951bb9b78310bfb9e131ec4360b02521c6e6797ab24bebba45e652b17b79969d	common_voice_mr_31861499.mp3	अँगमी व चँग ह्या येथील प्रमुख भाषा आहेत.	0	0	teens	female			mr	
3c0883cf1695253b9d3fd853ded4bfc5abfa012a3ead38499b85c2241c36ee80951bb9b78310bfb9e131ec4360b02521c6e6797ab24bebba45e652b17b79969d	common_voice_mr_31861500.mp3	तेव्हा इराकमधील शहरे खूपच समृद्ध आणि आधुनिक असून उर्वरित जगाने आदर्श मानली होती.	0	0	teens	female			mr	
3c0883cf1695253b9d3fd853ded4bfc5abfa012a3ead38499b85c2241c36ee80951bb9b78310bfb9e131ec4360b02521c6e6797ab24bebba45e652b17b79969d	common_voice_mr_31861501.mp3	मात्र युधिष्ठिरामुळे त्याला जीवदान मिळाले.	0	0	teens	female			mr	
3c0883cf1695253b9d3fd853ded4bfc5abfa012a3ead38499b85c2241c36ee80951bb9b78310bfb9e131ec4360b02521c6e6797ab24bebba45e652b17b79969d	common_voice_mr_31861547.mp3	संस्थाने खालसा करण्याच्या धोरणांमुळे इंग्रजांविरुद्ध अनेक उठाव झाले.	1	0	teens	female			mr	
3c0883cf1695253b9d3fd853ded4bfc5abfa012a3ead38499b85c2241c36ee80951bb9b78310bfb9e131ec4360b02521c6e6797ab24bebba45e652b17b79969d	common_voice_mr_31861549.mp3	जोधपूर, बिकानेर, उदयपूर व जयपूर ही प्रमुख रजपूत राज्ये होती.	0	1	teens	female			mr	
3c0883cf1695253b9d3fd853ded4bfc5abfa012a3ead38499b85c2241c36ee80951bb9b78310bfb9e131ec4360b02521c6e6797ab24bebba45e652b17b79969d	common_voice_mr_31861550.mp3	पूर्णा नदीच्या खोऱ्यायाचा बहुतेक भाग सपाट मैदानाचा आहे.	0	0	teens	female			mr	
3c0883cf1695253b9d3fd853ded4bfc5abfa012a3ead38499b85c2241c36ee80951bb9b78310bfb9e131ec4360b02521c6e6797ab24bebba45e652b17b79969d	common_voice_mr_31861579.mp3	जिथे जीवन आहे, अशी पूर्ण विश्वात ही एकमेव ज्ञात जागा आहे.	1	0	teens	female			mr	
3c0883cf1695253b9d3fd853ded4bfc5abfa012a3ead38499b85c2241c36ee80951bb9b78310bfb9e131ec4360b02521c6e6797ab24bebba45e652b17b79969d	common_voice_mr_31861581.mp3	ही कथा महाभारतातील महत्त्वाचे पात्र असलेल्या कृष्णाच्या लीलांचे वर्णन करते.	0	0	teens	female			mr	
0c2e8b9c0de2b081f08fb95d511663418478f55b8a461fe00649e4aad848e7380e6023a096f4aa4a140e964c78f7c32baca6b6f5ff783110f0a86a34304886ea	common_voice_mr_31877230.mp3	बारामती शहराला पिण्याचे पाणी याच कालव्यामधून शुद्ध करून दिले जाते.	0	1	twenties	male			mr	
0c2e8b9c0de2b081f08fb95d511663418478f55b8a461fe00649e4aad848e7380e6023a096f4aa4a140e964c78f7c32baca6b6f5ff783110f0a86a34304886ea	common_voice_mr_31877236.mp3	त्याच विश्वासाने ब्रह्मदेवाचे वरदान त्यास सांगितले.	0	0	twenties	male			mr	
0c2e8b9c0de2b081f08fb95d511663418478f55b8a461fe00649e4aad848e7380e6023a096f4aa4a140e964c78f7c32baca6b6f5ff783110f0a86a34304886ea	common_voice_mr_31877237.mp3	मग तो एक एक मासा उदकात टाकू लागला.	0	0	twenties	male			mr	
0c2e8b9c0de2b081f08fb95d511663418478f55b8a461fe00649e4aad848e7380e6023a096f4aa4a140e964c78f7c32baca6b6f5ff783110f0a86a34304886ea	common_voice_mr_31877332.mp3	ते पाणी अतिशय चवदार व गोड आहे.	1	0	twenties	male			mr	
0c2e8b9c0de2b081f08fb95d511663418478f55b8a461fe00649e4aad848e7380e6023a096f4aa4a140e964c78f7c32baca6b6f5ff783110f0a86a34304886ea	common_voice_mr_31877333.mp3	यामुळे ते स्थान त्यांनी पसंत केले व तेथे ती उभयता बसली.	0	1	twenties	male			mr	
0c2e8b9c0de2b081f08fb95d511663418478f55b8a461fe00649e4aad848e7380e6023a096f4aa4a140e964c78f7c32baca6b6f5ff783110f0a86a34304886ea	common_voice_mr_31877334.mp3	कुबेर याला देवांचा धन खजाना बाळगणारा समजले गेले.	1	0	twenties	male			mr	
0c2e8b9c0de2b081f08fb95d511663418478f55b8a461fe00649e4aad848e7380e6023a096f4aa4a140e964c78f7c32baca6b6f5ff783110f0a86a34304886ea	common_voice_mr_31877335.mp3	बाळाच्या गालावर काजळाची तीट खूप शोभते.	0	0	twenties	male			mr	
0c2e8b9c0de2b081f08fb95d511663418478f55b8a461fe00649e4aad848e7380e6023a096f4aa4a140e964c78f7c32baca6b6f5ff783110f0a86a34304886ea	common_voice_mr_31877336.mp3	हडप्पाचे लोक सुमेरियन लोकांशी व्यापार करण्यास उत्सुक असत.	1	1	twenties	male			mr	
ff075c23b8d18d504c58b70ed1bd1ec050546206f38516b6f06469037cd77e5c734656c4de050f12cee7ca51e4e33fbcdd4072c5004649c36cff892b870a765a	common_voice_mr_31877743.mp3	ताई तू कधी येनार?	1	1	twenties	female			mr	
ff075c23b8d18d504c58b70ed1bd1ec050546206f38516b6f06469037cd77e5c734656c4de050f12cee7ca51e4e33fbcdd4072c5004649c36cff892b870a765a	common_voice_mr_31877746.mp3	त्यांपैकी अमरावती उपविभागामध्ये अकोला, अमरावती, यवतमाळ, बुलढाणा व वाशीम हे जिल्हे येतात.	0	0	twenties	female			mr	
ff075c23b8d18d504c58b70ed1bd1ec050546206f38516b6f06469037cd77e5c734656c4de050f12cee7ca51e4e33fbcdd4072c5004649c36cff892b870a765a	common_voice_mr_31877803.mp3	मात्र विवाहानंतर मूल होण्याच्या आधीच क्षय रोगाने विचित्रवीर्याचा मृत्यू होतो.	0	0	twenties	female			mr	
ff075c23b8d18d504c58b70ed1bd1ec050546206f38516b6f06469037cd77e5c734656c4de050f12cee7ca51e4e33fbcdd4072c5004649c36cff892b870a765a	common_voice_mr_31877804.mp3	कृष्ण हा यदुवंशात जन्मला.	0	0	twenties	female			mr	
ff075c23b8d18d504c58b70ed1bd1ec050546206f38516b6f06469037cd77e5c734656c4de050f12cee7ca51e4e33fbcdd4072c5004649c36cff892b870a765a	common_voice_mr_31877805.mp3	अनेक प्रांत या साम्राज्यात असले तरी या साम्राज्याची ख्रिस्ती धर्म म्हणून ओळख होती.	0	0	twenties	female			mr	
ff075c23b8d18d504c58b70ed1bd1ec050546206f38516b6f06469037cd77e5c734656c4de050f12cee7ca51e4e33fbcdd4072c5004649c36cff892b870a765a	common_voice_mr_31877806.mp3	औपचारिक ठरलेल्या पाकिस्तानच्या दुसऱ्या डावात किरमाणी यांनी हातातले ग्लोव्हज काढत गोलंदाजी केली.	0	0	twenties	female			mr	
ff075c23b8d18d504c58b70ed1bd1ec050546206f38516b6f06469037cd77e5c734656c4de050f12cee7ca51e4e33fbcdd4072c5004649c36cff892b870a765a	common_voice_mr_31877847.mp3	कर्नाटक, किंवा कर्णाटक कन्नड भाषेत उच्चार हे भारताच्या दक्षिणेकडील चार राज्यांपैकी एक राज्य आहे.	0	0	twenties	female			mr	
ff075c23b8d18d504c58b70ed1bd1ec050546206f38516b6f06469037cd77e5c734656c4de050f12cee7ca51e4e33fbcdd4072c5004649c36cff892b870a765a	common_voice_mr_31877848.mp3	नेहमीच बाळासाहेबांच्या नावावर मते मागणे हेच राजकारण करताना सध्याचे चित्र आहे.	1	0	twenties	female			mr	
ff075c23b8d18d504c58b70ed1bd1ec050546206f38516b6f06469037cd77e5c734656c4de050f12cee7ca51e4e33fbcdd4072c5004649c36cff892b870a765a	common_voice_mr_31877849.mp3	हा लेख रोहिणी या महाभारतातील व्यक्तिरेखेविषयी आहे.	1	1	twenties	female			mr	
ff075c23b8d18d504c58b70ed1bd1ec050546206f38516b6f06469037cd77e5c734656c4de050f12cee7ca51e4e33fbcdd4072c5004649c36cff892b870a765a	common_voice_mr_31877850.mp3	ते राष्ट्रपतींनी निवडलेले असे राज्यसभेचे खासदार झाले.	0	0	twenties	female			mr	
ff075c23b8d18d504c58b70ed1bd1ec050546206f38516b6f06469037cd77e5c734656c4de050f12cee7ca51e4e33fbcdd4072c5004649c36cff892b870a765a	common_voice_mr_31877851.mp3	दुसरया एका प्रसंगात हेमंतकुमार यांनी हे गीत गायिले आहे.	1	1	twenties	female			mr	
