client_id	path	sentence	up_votes	down_votes	age	gender	accents	variant	locale	segment
563ca5d4d885cfc380072f8c8c62dceb933d1364fa258d74acab0376b1ef157986f4b459b2d031e45572dadaaeb5dada3d62bfec27fd082b0e3f8d290490c092	common_voice_mr_32069827.mp3	भारतातील राजकीय पक्षसमाजवादी पक्ष किंवा तत्सम नाव असलेले अनेक राजकीय पक्ष भारतात आहेत.	1	0	twenties	female			mr	
563ca5d4d885cfc380072f8c8c62dceb933d1364fa258d74acab0376b1ef157986f4b459b2d031e45572dadaaeb5dada3d62bfec27fd082b0e3f8d290490c092	common_voice_mr_32069853.mp3	मला कंटाळा आलाय.	1	0	twenties	female			mr	
563ca5d4d885cfc380072f8c8c62dceb933d1364fa258d74acab0376b1ef157986f4b459b2d031e45572dadaaeb5dada3d62bfec27fd082b0e3f8d290490c092	common_voice_mr_32069854.mp3	महाभारतीय युद्धात याने सेनापती म्हणून कौरवपक्षाच्या सैन्याचे नेतृत्व केले.	0	0	twenties	female			mr	
563ca5d4d885cfc380072f8c8c62dceb933d1364fa258d74acab0376b1ef157986f4b459b2d031e45572dadaaeb5dada3d62bfec27fd082b0e3f8d290490c092	common_voice_mr_32069855.mp3	सूर्याची सर्वसाधारण माहिती सूर्य हा या वर्णपटीय विभागात मोडतो.	0	0	twenties	female			mr	
563ca5d4d885cfc380072f8c8c62dceb933d1364fa258d74acab0376b1ef157986f4b459b2d031e45572dadaaeb5dada3d62bfec27fd082b0e3f8d290490c092	common_voice_mr_32069856.mp3	त्यांची समजूत काढायला वाजपेयींना कधी जसवंतसिंग तर कधी जॉर्ज फर्नान्डिस यांना चेन्नाईला पाठवावे लागले.	0	0	twenties	female			mr	
563ca5d4d885cfc380072f8c8c62dceb933d1364fa258d74acab0376b1ef157986f4b459b2d031e45572dadaaeb5dada3d62bfec27fd082b0e3f8d290490c092	common_voice_mr_32069857.mp3	सागरावर्त नावाच्या धनुष्यावर प्रत्यंचा चढवून लक्ष्मणानेही आपला पराक्रम सिद्ध केला.	0	0	twenties	female			mr	
563ca5d4d885cfc380072f8c8c62dceb933d1364fa258d74acab0376b1ef157986f4b459b2d031e45572dadaaeb5dada3d62bfec27fd082b0e3f8d290490c092	common_voice_mr_32069901.mp3	त्यांचे युनियन, दैवी अभूतपूर्व आणि अविरत आवश्यक संपादन होते.	0	0	twenties	female			mr	
563ca5d4d885cfc380072f8c8c62dceb933d1364fa258d74acab0376b1ef157986f4b459b2d031e45572dadaaeb5dada3d62bfec27fd082b0e3f8d290490c092	common_voice_mr_32069902.mp3	यानुसार चंद्र हा पृथ्वीपासूनच निर्माण झाला आहे, असे म्हणता येईल.	0	0	twenties	female			mr	
563ca5d4d885cfc380072f8c8c62dceb933d1364fa258d74acab0376b1ef157986f4b459b2d031e45572dadaaeb5dada3d62bfec27fd082b0e3f8d290490c092	common_voice_mr_32069903.mp3	हा सुगंध अनेक योजने दूरपर्यंत येत असे, यामुळे तिला योजगंधा असेदेखील संबोधले जाऊ लागते.	0	0	twenties	female			mr	
563ca5d4d885cfc380072f8c8c62dceb933d1364fa258d74acab0376b1ef157986f4b459b2d031e45572dadaaeb5dada3d62bfec27fd082b0e3f8d290490c092	common_voice_mr_32069904.mp3	त्यावेळी त्याने आपले एक एक शिर कापून ब्रह्मदेवाला समर्पण केले.	1	0	twenties	female			mr	
563ca5d4d885cfc380072f8c8c62dceb933d1364fa258d74acab0376b1ef157986f4b459b2d031e45572dadaaeb5dada3d62bfec27fd082b0e3f8d290490c092	common_voice_mr_32069905.mp3	त्यांनी अनेक विद्यार्थी घडवले.	1	0	twenties	female			mr	
563ca5d4d885cfc380072f8c8c62dceb933d1364fa258d74acab0376b1ef157986f4b459b2d031e45572dadaaeb5dada3d62bfec27fd082b0e3f8d290490c092	common_voice_mr_32075420.mp3	निदेशक, वैज्ञानिक व औद्योगिक संशोधन मंडळ	0	0	twenties	female			mr	
563ca5d4d885cfc380072f8c8c62dceb933d1364fa258d74acab0376b1ef157986f4b459b2d031e45572dadaaeb5dada3d62bfec27fd082b0e3f8d290490c092	common_voice_mr_32075421.mp3	बायझेन्टाईन सेनापती ऍस्पारने बसवलेल्या सम्राटांपैकी हा शेवटचा होय.	0	0	twenties	female			mr	
563ca5d4d885cfc380072f8c8c62dceb933d1364fa258d74acab0376b1ef157986f4b459b2d031e45572dadaaeb5dada3d62bfec27fd082b0e3f8d290490c092	common_voice_mr_32075422.mp3	महागडे मद्य किंवा खाद्य आपण घेत नाहीत असं दाखविणं.	0	0	twenties	female			mr	
563ca5d4d885cfc380072f8c8c62dceb933d1364fa258d74acab0376b1ef157986f4b459b2d031e45572dadaaeb5dada3d62bfec27fd082b0e3f8d290490c092	common_voice_mr_32075423.mp3	परंतु, अजिंक्य रहाणेच्या नेतृत्त्वातील भारतीय संघाने ऑस्ट्रेलियाचं गर्वहरण केलं.	0	0	twenties	female			mr	
563ca5d4d885cfc380072f8c8c62dceb933d1364fa258d74acab0376b1ef157986f4b459b2d031e45572dadaaeb5dada3d62bfec27fd082b0e3f8d290490c092	common_voice_mr_32075424.mp3	या सर्व अवतारांत श्री हरी आपल्या पूर्ण सच्चिदानंद स्वरुपांत प्रकट झाला आहे.	0	0	twenties	female			mr	
563ca5d4d885cfc380072f8c8c62dceb933d1364fa258d74acab0376b1ef157986f4b459b2d031e45572dadaaeb5dada3d62bfec27fd082b0e3f8d290490c092	common_voice_mr_32075430.mp3	विविध नगरांमधून प्रवास करीत असताना वाटेवर आड आलेल्या शत्रूंचा नाश राम लक्ष्मणाने केला.	0	0	twenties	female			mr	
563ca5d4d885cfc380072f8c8c62dceb933d1364fa258d74acab0376b1ef157986f4b459b2d031e45572dadaaeb5dada3d62bfec27fd082b0e3f8d290490c092	common_voice_mr_32075431.mp3	रावणामधील रा म्हणजे सूर्य दर्शवितो आणि वणा म्हणजे पिढी	0	0	twenties	female			mr	
563ca5d4d885cfc380072f8c8c62dceb933d1364fa258d74acab0376b1ef157986f4b459b2d031e45572dadaaeb5dada3d62bfec27fd082b0e3f8d290490c092	common_voice_mr_32075432.mp3	त्यांनी लहानपणापासूनच श्रीविठ्ठलाची अनन्यसाधारण भक्ती केली.	0	0	twenties	female			mr	
563ca5d4d885cfc380072f8c8c62dceb933d1364fa258d74acab0376b1ef157986f4b459b2d031e45572dadaaeb5dada3d62bfec27fd082b0e3f8d290490c092	common_voice_mr_32075433.mp3	हा भारतीय जेवणातला महत्त्वाचा पदार्थ आहे.	0	0	twenties	female			mr	
563ca5d4d885cfc380072f8c8c62dceb933d1364fa258d74acab0376b1ef157986f4b459b2d031e45572dadaaeb5dada3d62bfec27fd082b0e3f8d290490c092	common_voice_mr_32075434.mp3	सह्याद्रीच्या कुशीत वसल्यामुळे गोव्यामध्ये भरपूर जैवविविधता आहे.	1	0	twenties	female			mr	
563ca5d4d885cfc380072f8c8c62dceb933d1364fa258d74acab0376b1ef157986f4b459b2d031e45572dadaaeb5dada3d62bfec27fd082b0e3f8d290490c092	common_voice_mr_32075474.mp3	माझे कसे होणार?	0	0	twenties	female			mr	
563ca5d4d885cfc380072f8c8c62dceb933d1364fa258d74acab0376b1ef157986f4b459b2d031e45572dadaaeb5dada3d62bfec27fd082b0e3f8d290490c092	common_voice_mr_32075475.mp3	हिंदू पौराणिक व्यक्तीराधा ही महाभारतात उल्लेखिलेली गोलोक वृंदावनातील भगवान श्रीकृष्णांची दिव्य नित्य सहचारिणी आहे.	1	0	twenties	female			mr	
563ca5d4d885cfc380072f8c8c62dceb933d1364fa258d74acab0376b1ef157986f4b459b2d031e45572dadaaeb5dada3d62bfec27fd082b0e3f8d290490c092	common_voice_mr_32075476.mp3	रामचंद्रन यांची प्रकृतीत चढउतार होत राहिले.	1	0	twenties	female			mr	
563ca5d4d885cfc380072f8c8c62dceb933d1364fa258d74acab0376b1ef157986f4b459b2d031e45572dadaaeb5dada3d62bfec27fd082b0e3f8d290490c092	common_voice_mr_32075477.mp3	वाहतूक सिडनी विमानतळ हा सिडनीमधील प्रमुख विमानतळ असून क्वांटासचे मुख्यालय येथेच स्थित आहे.	0	0	twenties	female			mr	
563ca5d4d885cfc380072f8c8c62dceb933d1364fa258d74acab0376b1ef157986f4b459b2d031e45572dadaaeb5dada3d62bfec27fd082b0e3f8d290490c092	common_voice_mr_32075478.mp3	त्यानंतरच्या वर्षांत व्यवस्थापन व शैक्षणिक रणनीत्यांमध्ये बरेच परिवर्तन घडून आलेले दिसते.	1	0	twenties	female			mr	
751dba0888864a13226be0dc3de4b4cbfced0ea0293909935eb4b5840c2b84ff92264580df1aa7df29048edbffd950ce64ce11125f5a493a2a1e17438448212a	common_voice_mr_32086109.mp3	भरताने विरक्त होवून वडिलांसह तपस्येसाठी जाण्याची इच्छा व्यक्त केली.	0	0					mr	
751dba0888864a13226be0dc3de4b4cbfced0ea0293909935eb4b5840c2b84ff92264580df1aa7df29048edbffd950ce64ce11125f5a493a2a1e17438448212a	common_voice_mr_32086121.mp3	हैद्राबादसाठी एक भाषिकाच तत्त्व तर मुंबईसाठी द्वैभाषिकाचं.	0	0					mr	
751dba0888864a13226be0dc3de4b4cbfced0ea0293909935eb4b5840c2b84ff92264580df1aa7df29048edbffd950ce64ce11125f5a493a2a1e17438448212a	common_voice_mr_32086122.mp3	हलक्या ट्रकचा वापर प्रामुख्याने शहरात व जिल्ह्यापुरता केला जातो.	1	0					mr	
751dba0888864a13226be0dc3de4b4cbfced0ea0293909935eb4b5840c2b84ff92264580df1aa7df29048edbffd950ce64ce11125f5a493a2a1e17438448212a	common_voice_mr_32086123.mp3	अहमदनगर येथे निजाम शाही, विजापूर येथील अदिलशाही व गोळकोंडा येथील कुतुबशाही.	0	0					mr	
751dba0888864a13226be0dc3de4b4cbfced0ea0293909935eb4b5840c2b84ff92264580df1aa7df29048edbffd950ce64ce11125f5a493a2a1e17438448212a	common_voice_mr_32086139.mp3	वाहतूक कर्नाटकातील हवाई वाहतूक फारशी विकसित झालेली नाही.	1	0					mr	
751dba0888864a13226be0dc3de4b4cbfced0ea0293909935eb4b5840c2b84ff92264580df1aa7df29048edbffd950ce64ce11125f5a493a2a1e17438448212a	common_voice_mr_32086140.mp3	महाराष्ट्रातील डाव्या पक्षांनी सुरुवातीपासूनच मुंबईसह महाराष्ट्राला पाठिंबा दिला.	1	0					mr	
751dba0888864a13226be0dc3de4b4cbfced0ea0293909935eb4b5840c2b84ff92264580df1aa7df29048edbffd950ce64ce11125f5a493a2a1e17438448212a	common_voice_mr_32086141.mp3	सरकारी सरकारी शाळा या शासन केन्द्रित असतात.	0	0					mr	
751dba0888864a13226be0dc3de4b4cbfced0ea0293909935eb4b5840c2b84ff92264580df1aa7df29048edbffd950ce64ce11125f5a493a2a1e17438448212a	common_voice_mr_32086142.mp3	वार्धक्यात मेंदूचा ऱ्हास होत जातो व मेंदूच्या पेशी नवीन तयार होत नाहीत.	0	0					mr	
751dba0888864a13226be0dc3de4b4cbfced0ea0293909935eb4b5840c2b84ff92264580df1aa7df29048edbffd950ce64ce11125f5a493a2a1e17438448212a	common_voice_mr_32086143.mp3	दुर्दैवाने ग्रंथाची हस्तलिखित प्रत इंग्रजांनी जप्त केली.	1	0					mr	
751dba0888864a13226be0dc3de4b4cbfced0ea0293909935eb4b5840c2b84ff92264580df1aa7df29048edbffd950ce64ce11125f5a493a2a1e17438448212a	common_voice_mr_32086154.mp3	महाराष्ट्रातील यवतमाळ जिल्ह्यात राळेगावनजीक रामाविना असलेल्या सीतेचे मंदिर आहे.	0	0					mr	
751dba0888864a13226be0dc3de4b4cbfced0ea0293909935eb4b5840c2b84ff92264580df1aa7df29048edbffd950ce64ce11125f5a493a2a1e17438448212a	common_voice_mr_32086155.mp3	हा उत्तम सारथी होता.	0	0					mr	
751dba0888864a13226be0dc3de4b4cbfced0ea0293909935eb4b5840c2b84ff92264580df1aa7df29048edbffd950ce64ce11125f5a493a2a1e17438448212a	common_voice_mr_32086156.mp3	पांडू राजाच्या या पाच पुत्रांनाच पांडव असे म्हणतात.	0	0					mr	
751dba0888864a13226be0dc3de4b4cbfced0ea0293909935eb4b5840c2b84ff92264580df1aa7df29048edbffd950ce64ce11125f5a493a2a1e17438448212a	common_voice_mr_32086157.mp3	या चक्राच्या परीणामाने चंद्र हळूहळू पृथ्वीपासून दूर जात आहे.	1	0					mr	
751dba0888864a13226be0dc3de4b4cbfced0ea0293909935eb4b5840c2b84ff92264580df1aa7df29048edbffd950ce64ce11125f5a493a2a1e17438448212a	common_voice_mr_32086158.mp3	संत नामदेव प्रत्यक्ष श्रीविठ्ठलाच्या निकटवर्ती असलेला सखा होता, असे मानले जाते.	1	0					mr	
751dba0888864a13226be0dc3de4b4cbfced0ea0293909935eb4b5840c2b84ff92264580df1aa7df29048edbffd950ce64ce11125f5a493a2a1e17438448212a	common_voice_mr_32086174.mp3	मूळ भागवत बारा स्कंदांचे आहे.	0	0					mr	
751dba0888864a13226be0dc3de4b4cbfced0ea0293909935eb4b5840c2b84ff92264580df1aa7df29048edbffd950ce64ce11125f5a493a2a1e17438448212a	common_voice_mr_32086175.mp3	हा तुलेनेने कमी खर्चाचा व सोपे तंत्रज्ञान असलेला उपाय आहे.	0	0					mr	
751dba0888864a13226be0dc3de4b4cbfced0ea0293909935eb4b5840c2b84ff92264580df1aa7df29048edbffd950ce64ce11125f5a493a2a1e17438448212a	common_voice_mr_32086176.mp3	उमा, काटेपूर्णा, मोर्णा व मन ह्या नद्या दक्षिणेकडून येऊन मिळतात.	1	0					mr	
751dba0888864a13226be0dc3de4b4cbfced0ea0293909935eb4b5840c2b84ff92264580df1aa7df29048edbffd950ce64ce11125f5a493a2a1e17438448212a	common_voice_mr_32086177.mp3	खायला देताना त्यावर बारीक चिरलेली कोथिंबीर व कांदा घालून देतात.	1	0					mr	
751dba0888864a13226be0dc3de4b4cbfced0ea0293909935eb4b5840c2b84ff92264580df1aa7df29048edbffd950ce64ce11125f5a493a2a1e17438448212a	common_voice_mr_32086178.mp3	आपला निर्वंश झाला हे पाहून संतप्त पांडव अश्वत्थाम्याला शोधत आले.	0	0					mr	
8e1ee1ad7b7966387d2989982a1944b715779da133b58d8a3022d8ae5c2cdf97430509f72f813891debd17d1610028e91c2a3ee29d114b072e721846d37666bb	common_voice_mr_32100028.mp3	पहिल्या सहा लघु अक्षरांची मजा लुटायची असेल तर यासारखे दुसरे वृत्त नाही.	1	0	teens	female			mr	
8e1ee1ad7b7966387d2989982a1944b715779da133b58d8a3022d8ae5c2cdf97430509f72f813891debd17d1610028e91c2a3ee29d114b072e721846d37666bb	common_voice_mr_32100029.mp3	लोहमार्गे रेल्वे औरंगाबादकडून मुंबई, आग्रा, दिल्ली, भोपाळ, हैदराबाद ह्या शहरांकडे थेट लोहमार्ग आहेत.	0	0	teens	female			mr	
8e1ee1ad7b7966387d2989982a1944b715779da133b58d8a3022d8ae5c2cdf97430509f72f813891debd17d1610028e91c2a3ee29d114b072e721846d37666bb	common_voice_mr_32100030.mp3	अठराव्या शतकामध्ये भूगोलाच्या अभ्यासाकरिता अनेक भौगोलिक संस्था स्थापन करण्यात आल्या.	0	0	teens	female			mr	
8e1ee1ad7b7966387d2989982a1944b715779da133b58d8a3022d8ae5c2cdf97430509f72f813891debd17d1610028e91c2a3ee29d114b072e721846d37666bb	common_voice_mr_32100032.mp3	त्यांना पक्षाच्या दुसर् या नेत्या जयललिता यांनी आव्हान दिले.	0	0	teens	female			mr	
8e1ee1ad7b7966387d2989982a1944b715779da133b58d8a3022d8ae5c2cdf97430509f72f813891debd17d1610028e91c2a3ee29d114b072e721846d37666bb	common_voice_mr_32100042.mp3	परिणामी ग्रीस हे ख्रिस्ती राहिले.	1	0	teens	female			mr	
8e1ee1ad7b7966387d2989982a1944b715779da133b58d8a3022d8ae5c2cdf97430509f72f813891debd17d1610028e91c2a3ee29d114b072e721846d37666bb	common_voice_mr_32100043.mp3	पण चंद्र मात्र थोडासा तिरका फिरतो.	0	0	teens	female			mr	
8e1ee1ad7b7966387d2989982a1944b715779da133b58d8a3022d8ae5c2cdf97430509f72f813891debd17d1610028e91c2a3ee29d114b072e721846d37666bb	common_voice_mr_32100044.mp3	सिद्धपरंपरांमध्ये मच्छिंद्रनाथांचे स्थान आदरणीय मानले जाते.	1	0	teens	female			mr	
8e1ee1ad7b7966387d2989982a1944b715779da133b58d8a3022d8ae5c2cdf97430509f72f813891debd17d1610028e91c2a3ee29d114b072e721846d37666bb	common_voice_mr_32100045.mp3	विजापूरचा गोलघुमट हा दख्खनी सल्तनतींच्या स्थापत्याचा उत्कृष्ट नमुना आहे.	0	0	teens	female			mr	
8e1ee1ad7b7966387d2989982a1944b715779da133b58d8a3022d8ae5c2cdf97430509f72f813891debd17d1610028e91c2a3ee29d114b072e721846d37666bb	common_voice_mr_32100057.mp3	पुरण पोळी सारखा गोड पदार्थ कसा बनवतात ते पाहू	1	0	teens	female			mr	
8e1ee1ad7b7966387d2989982a1944b715779da133b58d8a3022d8ae5c2cdf97430509f72f813891debd17d1610028e91c2a3ee29d114b072e721846d37666bb	common_voice_mr_32100058.mp3	आग्नेय आशियातील रूपांतरे आशियाच्या अनेक संस्कृतींवर रामायणाचा प्रभाव पडला आहे.	0	0	teens	female			mr	
8e1ee1ad7b7966387d2989982a1944b715779da133b58d8a3022d8ae5c2cdf97430509f72f813891debd17d1610028e91c2a3ee29d114b072e721846d37666bb	common_voice_mr_32100059.mp3	मग पाण्याने कणीक अशा प्रकारे भिजवावी की त्याचा तव्यावर गोळा थापता आला पाहिजे.	1	0	teens	female			mr	
8e1ee1ad7b7966387d2989982a1944b715779da133b58d8a3022d8ae5c2cdf97430509f72f813891debd17d1610028e91c2a3ee29d114b072e721846d37666bb	common_voice_mr_32100060.mp3	हळूहळू उन्नत होत आहे, ही ज्याला जाणीव आहे, तो मोठाच होत आहे.	0	0	teens	female			mr	
8e1ee1ad7b7966387d2989982a1944b715779da133b58d8a3022d8ae5c2cdf97430509f72f813891debd17d1610028e91c2a3ee29d114b072e721846d37666bb	common_voice_mr_32100061.mp3	वज्र हे देवांचा राजा इंद्र याचे शस्त्र होते.	0	0	teens	female			mr	
8e1ee1ad7b7966387d2989982a1944b715779da133b58d8a3022d8ae5c2cdf97430509f72f813891debd17d1610028e91c2a3ee29d114b072e721846d37666bb	common_voice_mr_32100072.mp3	भर्तरी भर्तृहरि पाताळीं राहिला.	0	0	teens	female			mr	
8e1ee1ad7b7966387d2989982a1944b715779da133b58d8a3022d8ae5c2cdf97430509f72f813891debd17d1610028e91c2a3ee29d114b072e721846d37666bb	common_voice_mr_32100074.mp3	काही महाविद्यालयांमध्ये स्नातक अभ्यासक्रमही असतो.	0	0	teens	female			mr	
8e1ee1ad7b7966387d2989982a1944b715779da133b58d8a3022d8ae5c2cdf97430509f72f813891debd17d1610028e91c2a3ee29d114b072e721846d37666bb	common_voice_mr_32100075.mp3	पश्चिम भाग हा प्रामुख्याने थर वाळवंटात मोडतो.	1	0	teens	female			mr	
8e1ee1ad7b7966387d2989982a1944b715779da133b58d8a3022d8ae5c2cdf97430509f72f813891debd17d1610028e91c2a3ee29d114b072e721846d37666bb	common_voice_mr_32100076.mp3	झोंबी या कादंबरीवर लवकरच मराठी चित्रपट बनेल, अशी बातमी आहे.	0	0	teens	female			mr	
222bc0ffe4e6c2be5ed73ec2578759db73d78ca0be68cf2bd72401aeb51940393ef21f5b475a9e90061bf0e3d4a554e05d35be6757bebcd0489eda056aff94ae	common_voice_mr_32121610.mp3	अशा रीतीने त्यांनी कुरुवंशातील चार पिढ्यांची काळजी वाहिली.	0	0	teens	male			mr	
222bc0ffe4e6c2be5ed73ec2578759db73d78ca0be68cf2bd72401aeb51940393ef21f5b475a9e90061bf0e3d4a554e05d35be6757bebcd0489eda056aff94ae	common_voice_mr_32121611.mp3	ख्रिश्चन आणि हिंदू परंपरांची सरमिसळ विशेष जाणवते.	1	0	teens	male			mr	
222bc0ffe4e6c2be5ed73ec2578759db73d78ca0be68cf2bd72401aeb51940393ef21f5b475a9e90061bf0e3d4a554e05d35be6757bebcd0489eda056aff94ae	common_voice_mr_32121613.mp3	पहिले, पूर्णावतार आणि अंशावतार यांची एकत्रित संख्या.	0	1	teens	male			mr	
222bc0ffe4e6c2be5ed73ec2578759db73d78ca0be68cf2bd72401aeb51940393ef21f5b475a9e90061bf0e3d4a554e05d35be6757bebcd0489eda056aff94ae	common_voice_mr_32121614.mp3	भारतीय अणुऊर्जा खात्याने अवकाश संशोधनासाठी पैसा पुरविणे सुरू केले.	0	0	teens	male			mr	
222bc0ffe4e6c2be5ed73ec2578759db73d78ca0be68cf2bd72401aeb51940393ef21f5b475a9e90061bf0e3d4a554e05d35be6757bebcd0489eda056aff94ae	common_voice_mr_32121616.mp3	किंवा बनकर फाटा या ठिकाणी उतरून जुन्नरला जाण्यासाठी बस उपलब्ध आहेत.	0	0	teens	male			mr	
222bc0ffe4e6c2be5ed73ec2578759db73d78ca0be68cf2bd72401aeb51940393ef21f5b475a9e90061bf0e3d4a554e05d35be6757bebcd0489eda056aff94ae	common_voice_mr_32121617.mp3	हनुमान हे चिरंजीव आहेत म्हणजे ते अजूनही जिवंत आहेत.	0	0	teens	male			mr	
222bc0ffe4e6c2be5ed73ec2578759db73d78ca0be68cf2bd72401aeb51940393ef21f5b475a9e90061bf0e3d4a554e05d35be6757bebcd0489eda056aff94ae	common_voice_mr_32121618.mp3	भारतभरचे अनेक राजपुत्र त्यांच्याकडून शिक्षण घेत असत.	0	0	teens	male			mr	
222bc0ffe4e6c2be5ed73ec2578759db73d78ca0be68cf2bd72401aeb51940393ef21f5b475a9e90061bf0e3d4a554e05d35be6757bebcd0489eda056aff94ae	common_voice_mr_32121619.mp3	या टप्प्यानंतर यानाने आपल्या प्रवासातील अर्धा भाग पूर्ण केला.	0	1	teens	male			mr	
222bc0ffe4e6c2be5ed73ec2578759db73d78ca0be68cf2bd72401aeb51940393ef21f5b475a9e90061bf0e3d4a554e05d35be6757bebcd0489eda056aff94ae	common_voice_mr_32121620.mp3	पुढील कारवाई प्रलंबित आहे.	0	0	teens	male			mr	
222bc0ffe4e6c2be5ed73ec2578759db73d78ca0be68cf2bd72401aeb51940393ef21f5b475a9e90061bf0e3d4a554e05d35be6757bebcd0489eda056aff94ae	common_voice_mr_32121621.mp3	उदा. मराठी विकिपीडिया लिखाण पुरे करून नेहमीप्रमाणे सुपूर्त करा.	0	0	teens	male			mr	
222bc0ffe4e6c2be5ed73ec2578759db73d78ca0be68cf2bd72401aeb51940393ef21f5b475a9e90061bf0e3d4a554e05d35be6757bebcd0489eda056aff94ae	common_voice_mr_32121624.mp3	ते बालक हळूहळू पुढे जात रथनुपूर चक्रवालपूरच्या महाराज इंदुगती यांना मिळाले.	0	0	teens	male			mr	
222bc0ffe4e6c2be5ed73ec2578759db73d78ca0be68cf2bd72401aeb51940393ef21f5b475a9e90061bf0e3d4a554e05d35be6757bebcd0489eda056aff94ae	common_voice_mr_32121625.mp3	शके सत्राशे दहापर्यंत ते प्रकटरूपाने फिरत होते.	1	0	teens	male			mr	
222bc0ffe4e6c2be5ed73ec2578759db73d78ca0be68cf2bd72401aeb51940393ef21f5b475a9e90061bf0e3d4a554e05d35be6757bebcd0489eda056aff94ae	common_voice_mr_32121626.mp3	दामाशेटी हे संत नामदेवांचे वडील व गोणाई त्यांची माता होती.	0	0	teens	male			mr	
