client_id	path	sentence	up_votes	down_votes	age	gender	accents	variant	locale	segment
af49abdbf0dcd6ee5e8e5a9b822801853970c52202f69002b6007552febc167584c2e49fec6e058b80ce023b8db5fbcd59e21eb5234003475566f2db064d704b	common_voice_mr_31483983.mp3	पैशाच्या भ्रष्टाचाराचा सर्वमान्य मार्ग म्हणजे कंपनीसाठी मालाची खरेदी करताना.	0	1	twenties	female			mr	
af49abdbf0dcd6ee5e8e5a9b822801853970c52202f69002b6007552febc167584c2e49fec6e058b80ce023b8db5fbcd59e21eb5234003475566f2db064d704b	common_voice_mr_31483986.mp3	कदाचित त्यामुळेच नामदेवांनी आपल्या रचनांत असे स्वातंत्र्य घेतले असेल का?	1	0	twenties	female			mr	
af49abdbf0dcd6ee5e8e5a9b822801853970c52202f69002b6007552febc167584c2e49fec6e058b80ce023b8db5fbcd59e21eb5234003475566f2db064d704b	common_voice_mr_31483987.mp3	पोंड्र राजा श्रीकृष्ण द्वारकेत नसताना द्वारकेवर हल्ला करतो.	0	1	twenties	female			mr	
af49abdbf0dcd6ee5e8e5a9b822801853970c52202f69002b6007552febc167584c2e49fec6e058b80ce023b8db5fbcd59e21eb5234003475566f2db064d704b	common_voice_mr_31483988.mp3	येथे साडेसहा फूट उंच गणेशमूर्ती आहे.	1	0	twenties	female			mr	
7ac1c55237ab2dd163eaa32add9d812a01b605f2572bed5bbd7f46d0cdd9d88946dbac055cfd22494dc44ea2b8fe20878da8ed2175980e26a1cf33b9496b91b0	common_voice_mr_31483993.mp3	चंद्रयान एक हे मानवरहित अंतराळयान चंद्राभोवती प्रदक्षिणा मारेल.	0	0	teens	male			mr	
af49abdbf0dcd6ee5e8e5a9b822801853970c52202f69002b6007552febc167584c2e49fec6e058b80ce023b8db5fbcd59e21eb5234003475566f2db064d704b	common_voice_mr_31484014.mp3	त्याविरोधात मुंबईतील प्राधिकरणाकडे अपील.	0	0	twenties	female			mr	
af49abdbf0dcd6ee5e8e5a9b822801853970c52202f69002b6007552febc167584c2e49fec6e058b80ce023b8db5fbcd59e21eb5234003475566f2db064d704b	common_voice_mr_31484017.mp3	हे प्रत्येक व्यक्तिसाठी सक्तिचे शिक्षण असते.	0	0	twenties	female			mr	
af49abdbf0dcd6ee5e8e5a9b822801853970c52202f69002b6007552febc167584c2e49fec6e058b80ce023b8db5fbcd59e21eb5234003475566f2db064d704b	common_voice_mr_31484048.mp3	त्यांनी बालेघाटी लावणीला प्रतिष्ठा प्राप्त करून दिली.	1	0	twenties	female			mr	
af49abdbf0dcd6ee5e8e5a9b822801853970c52202f69002b6007552febc167584c2e49fec6e058b80ce023b8db5fbcd59e21eb5234003475566f2db064d704b	common_voice_mr_31484050.mp3	लोकसभा निवडणुकीत अभाअण्णाद्रमुक भाजप आघाडीचा धुव्वा उडाला.	0	1	twenties	female			mr	
af49abdbf0dcd6ee5e8e5a9b822801853970c52202f69002b6007552febc167584c2e49fec6e058b80ce023b8db5fbcd59e21eb5234003475566f2db064d704b	common_voice_mr_31484052.mp3	संत नामदेवांच्या जोडीने त्यांनी भागवत धर्म वारकरी संप्रदायाचा प्रसार केला.	1	0	twenties	female			mr	
af49abdbf0dcd6ee5e8e5a9b822801853970c52202f69002b6007552febc167584c2e49fec6e058b80ce023b8db5fbcd59e21eb5234003475566f2db064d704b	common_voice_mr_31484053.mp3	धाकटा पुरुषोत्तम शाळेतून आला होता.	1	0	twenties	female			mr	
af49abdbf0dcd6ee5e8e5a9b822801853970c52202f69002b6007552febc167584c2e49fec6e058b80ce023b8db5fbcd59e21eb5234003475566f2db064d704b	common_voice_mr_31484074.mp3	वाशीम जिल्ह्यात काटेपूर्णा नदीचा उगम आहे.	1	0	twenties	female			mr	
af49abdbf0dcd6ee5e8e5a9b822801853970c52202f69002b6007552febc167584c2e49fec6e058b80ce023b8db5fbcd59e21eb5234003475566f2db064d704b	common_voice_mr_31484077.mp3	सिंधुराजाच्या प्रदेशात जयद्रथाचे राज्य रेवतक पर्वत होता.	0	0	twenties	female			mr	
af49abdbf0dcd6ee5e8e5a9b822801853970c52202f69002b6007552febc167584c2e49fec6e058b80ce023b8db5fbcd59e21eb5234003475566f2db064d704b	common_voice_mr_31484081.mp3	यामध्ये मुख्यतः अतिसूक्ष्म कणांच्या वर्तणुकीचा अभ्यास केला जातो.	0	1	twenties	female			mr	
7ac1c55237ab2dd163eaa32add9d812a01b605f2572bed5bbd7f46d0cdd9d88946dbac055cfd22494dc44ea2b8fe20878da8ed2175980e26a1cf33b9496b91b0	common_voice_mr_31484084.mp3	त्या काळी प्रत्येकाकडे सोन्याची भांडी होती.	1	0	teens	male			mr	
7ac1c55237ab2dd163eaa32add9d812a01b605f2572bed5bbd7f46d0cdd9d88946dbac055cfd22494dc44ea2b8fe20878da8ed2175980e26a1cf33b9496b91b0	common_voice_mr_31484086.mp3	योम किप्पुर युद्धात इस्राएलास अमेरिकेने पाठिंबा दिल्यामुळे अरब राष्ट्रांनी अमेरिकेशी तेलव्यापार बंद केला.	0	1	teens	male			mr	
7ac1c55237ab2dd163eaa32add9d812a01b605f2572bed5bbd7f46d0cdd9d88946dbac055cfd22494dc44ea2b8fe20878da8ed2175980e26a1cf33b9496b91b0	common_voice_mr_31484087.mp3	गांधारी ही भगवान शंकराची परमभक्त होती.	0	0	teens	male			mr	
af49abdbf0dcd6ee5e8e5a9b822801853970c52202f69002b6007552febc167584c2e49fec6e058b80ce023b8db5fbcd59e21eb5234003475566f2db064d704b	common_voice_mr_31484092.mp3	त्यामुळे संतापाचा डोंब उसळला.	1	0	twenties	female			mr	
af49abdbf0dcd6ee5e8e5a9b822801853970c52202f69002b6007552febc167584c2e49fec6e058b80ce023b8db5fbcd59e21eb5234003475566f2db064d704b	common_voice_mr_31484093.mp3	वैराट हे येथील सर्वात उंच ठिकाण आहे.	0	1	twenties	female			mr	
af49abdbf0dcd6ee5e8e5a9b822801853970c52202f69002b6007552febc167584c2e49fec6e058b80ce023b8db5fbcd59e21eb5234003475566f2db064d704b	common_voice_mr_31484095.mp3	हा काळ रवींद्रनाथांचा साधना काळ म्हणून ओळखला जातो.	1	0	twenties	female			mr	
af49abdbf0dcd6ee5e8e5a9b822801853970c52202f69002b6007552febc167584c2e49fec6e058b80ce023b8db5fbcd59e21eb5234003475566f2db064d704b	common_voice_mr_31484126.mp3	सर्व आहे, ती परमेश्वराच्या सर्वात प्रिय आहे.	0	1	twenties	female			mr	
af49abdbf0dcd6ee5e8e5a9b822801853970c52202f69002b6007552febc167584c2e49fec6e058b80ce023b8db5fbcd59e21eb5234003475566f2db064d704b	common_voice_mr_31484136.mp3	तो उत्तम आयुर्वेदाचार्य होता.	1	0	twenties	female			mr	
af49abdbf0dcd6ee5e8e5a9b822801853970c52202f69002b6007552febc167584c2e49fec6e058b80ce023b8db5fbcd59e21eb5234003475566f2db064d704b	common_voice_mr_31484154.mp3	मांजर आलं बघ.	0	0	twenties	female			mr	
af49abdbf0dcd6ee5e8e5a9b822801853970c52202f69002b6007552febc167584c2e49fec6e058b80ce023b8db5fbcd59e21eb5234003475566f2db064d704b	common_voice_mr_31484155.mp3	परंतु प्रत्यक्षात त्यांनी राज्याचा कधीच केला नाही.	0	1	twenties	female			mr	
af49abdbf0dcd6ee5e8e5a9b822801853970c52202f69002b6007552febc167584c2e49fec6e058b80ce023b8db5fbcd59e21eb5234003475566f2db064d704b	common_voice_mr_31484156.mp3	मात्र या लेण्यांची मूळ रचना एखाद्या धार्मिक शिक्षणसंस्थेसारखी आहे.	1	0	twenties	female			mr	
af49abdbf0dcd6ee5e8e5a9b822801853970c52202f69002b6007552febc167584c2e49fec6e058b80ce023b8db5fbcd59e21eb5234003475566f2db064d704b	common_voice_mr_31484157.mp3	याचे उतारामुळे यातून बहुतेक ठिकाणी नदी वाहते.	1	0	twenties	female			mr	
af49abdbf0dcd6ee5e8e5a9b822801853970c52202f69002b6007552febc167584c2e49fec6e058b80ce023b8db5fbcd59e21eb5234003475566f2db064d704b	common_voice_mr_31484163.mp3	पण त्यासाठी आमच्या पगारात चांगली वाढ केली जावी.	1	1	twenties	female			mr	
af49abdbf0dcd6ee5e8e5a9b822801853970c52202f69002b6007552febc167584c2e49fec6e058b80ce023b8db5fbcd59e21eb5234003475566f2db064d704b	common_voice_mr_31484164.mp3	उदयपूर येथील तळ्यातील महाल जगप्रसिद्ध आहे.	1	0	twenties	female			mr	
af49abdbf0dcd6ee5e8e5a9b822801853970c52202f69002b6007552febc167584c2e49fec6e058b80ce023b8db5fbcd59e21eb5234003475566f2db064d704b	common_voice_mr_31484165.mp3	आज कैलास लेण्यातील शिवलिंगाची पूजा होत नाही.	1	0	twenties	female			mr	
af49abdbf0dcd6ee5e8e5a9b822801853970c52202f69002b6007552febc167584c2e49fec6e058b80ce023b8db5fbcd59e21eb5234003475566f2db064d704b	common_voice_mr_31484167.mp3	नारायण दाजी नारायण दाजी लाड	1	0	twenties	female			mr	
af49abdbf0dcd6ee5e8e5a9b822801853970c52202f69002b6007552febc167584c2e49fec6e058b80ce023b8db5fbcd59e21eb5234003475566f2db064d704b	common_voice_mr_31484183.mp3	सारिस्का हे अजून एक व्याघ्रप्रकल्प अल्वार जिल्ह्यात आहे.	1	1	twenties	female			mr	
af49abdbf0dcd6ee5e8e5a9b822801853970c52202f69002b6007552febc167584c2e49fec6e058b80ce023b8db5fbcd59e21eb5234003475566f2db064d704b	common_voice_mr_31484184.mp3	शिक्षणाचे माध्यम इंग्रजी आणि तमिळ असून इंग्रजी हे मुख्य माध्यम आहे.	1	0	twenties	female			mr	
af49abdbf0dcd6ee5e8e5a9b822801853970c52202f69002b6007552febc167584c2e49fec6e058b80ce023b8db5fbcd59e21eb5234003475566f2db064d704b	common_voice_mr_31484185.mp3	माझा सहनिवासी मूर्ख आहे.	0	1	twenties	female			mr	
af49abdbf0dcd6ee5e8e5a9b822801853970c52202f69002b6007552febc167584c2e49fec6e058b80ce023b8db5fbcd59e21eb5234003475566f2db064d704b	common_voice_mr_31484186.mp3	रोहिणी नक्षत्राबद्दलचा लेख येथे आहे.	1	0	twenties	female			mr	
af49abdbf0dcd6ee5e8e5a9b822801853970c52202f69002b6007552febc167584c2e49fec6e058b80ce023b8db5fbcd59e21eb5234003475566f2db064d704b	common_voice_mr_31484187.mp3	त्यास म्हातारदेव असें म्हणतात.	1	0	twenties	female			mr	
af49abdbf0dcd6ee5e8e5a9b822801853970c52202f69002b6007552febc167584c2e49fec6e058b80ce023b8db5fbcd59e21eb5234003475566f2db064d704b	common_voice_mr_31484197.mp3	ग्रंथालयाची पुस्तकसूची संगणकीकृत केलेली आहे.	1	0	twenties	female			mr	
af49abdbf0dcd6ee5e8e5a9b822801853970c52202f69002b6007552febc167584c2e49fec6e058b80ce023b8db5fbcd59e21eb5234003475566f2db064d704b	common_voice_mr_31484198.mp3	पिंडस पर्वत हा देशाचे हवामान ठरवण्यात मुख्य भूमिका बजावतो.	1	1	twenties	female			mr	
af49abdbf0dcd6ee5e8e5a9b822801853970c52202f69002b6007552febc167584c2e49fec6e058b80ce023b8db5fbcd59e21eb5234003475566f2db064d704b	common_voice_mr_31484200.mp3	त्याचे पर्यवसान कौटुंबिक कलहात होतंं.	0	0	twenties	female			mr	
af49abdbf0dcd6ee5e8e5a9b822801853970c52202f69002b6007552febc167584c2e49fec6e058b80ce023b8db5fbcd59e21eb5234003475566f2db064d704b	common_voice_mr_31484201.mp3	सध्याच्या स्पर्धेच्या युगात ही रचना महागडी ठरू लागली आहे.	1	0	twenties	female			mr	
af49abdbf0dcd6ee5e8e5a9b822801853970c52202f69002b6007552febc167584c2e49fec6e058b80ce023b8db5fbcd59e21eb5234003475566f2db064d704b	common_voice_mr_31484208.mp3	त्यांची आई सुमती विष्णू नारळीकर ह्या संस्कृत विदुषी होत्या.	1	0	twenties	female			mr	
af49abdbf0dcd6ee5e8e5a9b822801853970c52202f69002b6007552febc167584c2e49fec6e058b80ce023b8db5fbcd59e21eb5234003475566f2db064d704b	common_voice_mr_31484211.mp3	झांज टाळासारखे पण मोठ्या आणि पसरट तोंड असणारे वाद्य.	1	1	twenties	female			mr	
af49abdbf0dcd6ee5e8e5a9b822801853970c52202f69002b6007552febc167584c2e49fec6e058b80ce023b8db5fbcd59e21eb5234003475566f2db064d704b	common_voice_mr_31484215.mp3	तांदुळ, रागी, कापूस व ऊस ही येथील प्रमुख पिके आहेत.	1	0	twenties	female			mr	
af49abdbf0dcd6ee5e8e5a9b822801853970c52202f69002b6007552febc167584c2e49fec6e058b80ce023b8db5fbcd59e21eb5234003475566f2db064d704b	common_voice_mr_31484228.mp3	त्यांच्याजागी पक्षाचे ज्येष्ठ नेते ओ.	0	0	twenties	female			mr	
af49abdbf0dcd6ee5e8e5a9b822801853970c52202f69002b6007552febc167584c2e49fec6e058b80ce023b8db5fbcd59e21eb5234003475566f2db064d704b	common_voice_mr_31484229.mp3	त्याच बरोबर सतत पुस्तके लिहिण्याचा कार्यक्रमही चालू आहे.	1	0	twenties	female			mr	
af49abdbf0dcd6ee5e8e5a9b822801853970c52202f69002b6007552febc167584c2e49fec6e058b80ce023b8db5fbcd59e21eb5234003475566f2db064d704b	common_voice_mr_31484232.mp3	नंतर त्यास मधुब्राह्मणांकडे पाठवून दिलें.	1	0	twenties	female			mr	
af49abdbf0dcd6ee5e8e5a9b822801853970c52202f69002b6007552febc167584c2e49fec6e058b80ce023b8db5fbcd59e21eb5234003475566f2db064d704b	common_voice_mr_31484234.mp3	भर्तरी भर्तृहरि पाताळी राहिला.	1	0	twenties	female			mr	
af49abdbf0dcd6ee5e8e5a9b822801853970c52202f69002b6007552febc167584c2e49fec6e058b80ce023b8db5fbcd59e21eb5234003475566f2db064d704b	common_voice_mr_31484242.mp3	या गावात राहून त्यांनी अनेकांना शास्त्रीय संगीताची तालीम दिली.	1	0	twenties	female			mr	
af49abdbf0dcd6ee5e8e5a9b822801853970c52202f69002b6007552febc167584c2e49fec6e058b80ce023b8db5fbcd59e21eb5234003475566f2db064d704b	common_voice_mr_31484247.mp3	ताक हे दही किंवा सायीपासून बनवता येते.	1	1	twenties	female			mr	
af49abdbf0dcd6ee5e8e5a9b822801853970c52202f69002b6007552febc167584c2e49fec6e058b80ce023b8db5fbcd59e21eb5234003475566f2db064d704b	common_voice_mr_31484249.mp3	तरच भ्रष्टाचाराचा भस्मासुर रोखणे शक्य होईल.	0	0	twenties	female			mr	
af49abdbf0dcd6ee5e8e5a9b822801853970c52202f69002b6007552febc167584c2e49fec6e058b80ce023b8db5fbcd59e21eb5234003475566f2db064d704b	common_voice_mr_31484403.mp3	या व्यवहारात कुठेही काळ्या पैशाचं अस्तित्व नाही.	0	0	twenties	female			mr	
af49abdbf0dcd6ee5e8e5a9b822801853970c52202f69002b6007552febc167584c2e49fec6e058b80ce023b8db5fbcd59e21eb5234003475566f2db064d704b	common_voice_mr_31484404.mp3	याला अश्रूंची वाट हे नाव दिले गेले.	0	0	twenties	female			mr	
7ac1c55237ab2dd163eaa32add9d812a01b605f2572bed5bbd7f46d0cdd9d88946dbac055cfd22494dc44ea2b8fe20878da8ed2175980e26a1cf33b9496b91b0	common_voice_mr_31485042.mp3	जयकुमार रावल महाराष्ट्र राज्याचे पर्यटन मंत्री	1	0	teens	male			mr	
7ac1c55237ab2dd163eaa32add9d812a01b605f2572bed5bbd7f46d0cdd9d88946dbac055cfd22494dc44ea2b8fe20878da8ed2175980e26a1cf33b9496b91b0	common_voice_mr_31485045.mp3	म्हणजे सूर्य हा बहुतेक इतर तार् यांसारखा मेन सिक्वेन्स मधील तारा आहे.	0	1	teens	male			mr	
7ac1c55237ab2dd163eaa32add9d812a01b605f2572bed5bbd7f46d0cdd9d88946dbac055cfd22494dc44ea2b8fe20878da8ed2175980e26a1cf33b9496b91b0	common_voice_mr_31485054.mp3	तो सृष्टिरूप भासतो ते मायेमुळेच.	1	0	teens	male			mr	
7ac1c55237ab2dd163eaa32add9d812a01b605f2572bed5bbd7f46d0cdd9d88946dbac055cfd22494dc44ea2b8fe20878da8ed2175980e26a1cf33b9496b91b0	common_voice_mr_31485055.mp3	काही काळानंतर भाकरी तव्यावरून काढून चुलीच्या जाळावर भाजली जाते.	1	1	teens	male			mr	
7ac1c55237ab2dd163eaa32add9d812a01b605f2572bed5bbd7f46d0cdd9d88946dbac055cfd22494dc44ea2b8fe20878da8ed2175980e26a1cf33b9496b91b0	common_voice_mr_31485056.mp3	बेल्जियम हा पश्चिम युरोपातील एक देश आहे.	0	0	teens	male			mr	
7ac1c55237ab2dd163eaa32add9d812a01b605f2572bed5bbd7f46d0cdd9d88946dbac055cfd22494dc44ea2b8fe20878da8ed2175980e26a1cf33b9496b91b0	common_voice_mr_31485067.mp3	त्यांच्या आयुष्याचे शेवटचे वर्ष हे अंथरूणालाच खिळून गेले.	1	0	teens	male			mr	
7ac1c55237ab2dd163eaa32add9d812a01b605f2572bed5bbd7f46d0cdd9d88946dbac055cfd22494dc44ea2b8fe20878da8ed2175980e26a1cf33b9496b91b0	common_voice_mr_31485068.mp3	त्यात बहुसंख्या हिंदी भाषिकांची होती.	0	0	teens	male			mr	
7ac1c55237ab2dd163eaa32add9d812a01b605f2572bed5bbd7f46d0cdd9d88946dbac055cfd22494dc44ea2b8fe20878da8ed2175980e26a1cf33b9496b91b0	common_voice_mr_31485072.mp3	महाभारतातील युद्धातात धृष्टद्युम्न पांडवसेनेचा सरसेनापती होता.	0	0	teens	male			mr	
7ac1c55237ab2dd163eaa32add9d812a01b605f2572bed5bbd7f46d0cdd9d88946dbac055cfd22494dc44ea2b8fe20878da8ed2175980e26a1cf33b9496b91b0	common_voice_mr_31485073.mp3	बाबराने मशीद बांधण्याआधी त्या ठिकाणचे मंदिर तोडले होते.	1	0	teens	male			mr	
7ac1c55237ab2dd163eaa32add9d812a01b605f2572bed5bbd7f46d0cdd9d88946dbac055cfd22494dc44ea2b8fe20878da8ed2175980e26a1cf33b9496b91b0	common_voice_mr_31485090.mp3	त्याचे पुनरुज्जीवन सुनीता खाडिलकर यांच्याकडून होणे अपेक्षित आहे.	0	1	teens	male			mr	
7ac1c55237ab2dd163eaa32add9d812a01b605f2572bed5bbd7f46d0cdd9d88946dbac055cfd22494dc44ea2b8fe20878da8ed2175980e26a1cf33b9496b91b0	common_voice_mr_31485092.mp3	हा गीत प्रकार अलीकडील काळातील अगदी नजरेसमोरील आहे.	1	0	teens	male			mr	
7ac1c55237ab2dd163eaa32add9d812a01b605f2572bed5bbd7f46d0cdd9d88946dbac055cfd22494dc44ea2b8fe20878da8ed2175980e26a1cf33b9496b91b0	common_voice_mr_31485093.mp3	सीताशोधार्ध हिंडणाऱ्या रामाला याने शोधकार्यात, तसेच सीतेस हरून नेणाऱ्यारावणाशी लढण्याच्या कामी मदत केली.	1	0	teens	male			mr	
7ac1c55237ab2dd163eaa32add9d812a01b605f2572bed5bbd7f46d0cdd9d88946dbac055cfd22494dc44ea2b8fe20878da8ed2175980e26a1cf33b9496b91b0	common_voice_mr_31485110.mp3	संगम साहित्यांमध्ये रोमन साम्राज्यातील सोन्यांनी भरून येणाऱ्या जहाजांचे वर्णन आहे.	0	0	teens	male			mr	
7ac1c55237ab2dd163eaa32add9d812a01b605f2572bed5bbd7f46d0cdd9d88946dbac055cfd22494dc44ea2b8fe20878da8ed2175980e26a1cf33b9496b91b0	common_voice_mr_31485111.mp3	पुढे जरासंधाशी श्रीकृष्ण बलरामाचे गोमंत पर्वतावर एक युध्द झाल्याचा उल्लेखही हरिवंशात आहे.	1	1	teens	male			mr	
7ac1c55237ab2dd163eaa32add9d812a01b605f2572bed5bbd7f46d0cdd9d88946dbac055cfd22494dc44ea2b8fe20878da8ed2175980e26a1cf33b9496b91b0	common_voice_mr_31485112.mp3	ब्रह्मदेवाने तिला स्वतःच्या कमंडलूत धारण केले.	0	0	teens	male			mr	
7ac1c55237ab2dd163eaa32add9d812a01b605f2572bed5bbd7f46d0cdd9d88946dbac055cfd22494dc44ea2b8fe20878da8ed2175980e26a1cf33b9496b91b0	common_voice_mr_31485113.mp3	डॉ. काकोडकर हे मुंबईच्या रूपारेल कॉलेज मध्ये बारावीपर्यंत होते.	0	0	teens	male			mr	
7ac1c55237ab2dd163eaa32add9d812a01b605f2572bed5bbd7f46d0cdd9d88946dbac055cfd22494dc44ea2b8fe20878da8ed2175980e26a1cf33b9496b91b0	common_voice_mr_31485330.mp3	लावणीचे मूळ संतांच्या विराण्या, गौळणी, बाळक्रीडेचे अभंग यात दिसते.	1	1	teens	male			mr	
7ac1c55237ab2dd163eaa32add9d812a01b605f2572bed5bbd7f46d0cdd9d88946dbac055cfd22494dc44ea2b8fe20878da8ed2175980e26a1cf33b9496b91b0	common_voice_mr_31485331.mp3	बराच काळपर्यंत ती केवळ निम्नस्तरीय कामगारांपर्यंत मर्यादित होती.	1	0	teens	male			mr	
7ac1c55237ab2dd163eaa32add9d812a01b605f2572bed5bbd7f46d0cdd9d88946dbac055cfd22494dc44ea2b8fe20878da8ed2175980e26a1cf33b9496b91b0	common_voice_mr_31485592.mp3	सर्वत्र त्याचा निषेध झाला.	1	0	teens	male			mr	
7ac1c55237ab2dd163eaa32add9d812a01b605f2572bed5bbd7f46d0cdd9d88946dbac055cfd22494dc44ea2b8fe20878da8ed2175980e26a1cf33b9496b91b0	common_voice_mr_31485596.mp3	गिरिनारपर्वतीं श्रीदत्तात्रेयाच्या आश्रमांत गोरक्षनाथ राहिला.	1	1	teens	male			mr	
7ac1c55237ab2dd163eaa32add9d812a01b605f2572bed5bbd7f46d0cdd9d88946dbac055cfd22494dc44ea2b8fe20878da8ed2175980e26a1cf33b9496b91b0	common_voice_mr_31485613.mp3	ते काव्य प्रथम विनायक लक्ष्मण भावे यांनी प्रकाशात आणले.	0	0	teens	male			mr	
7ac1c55237ab2dd163eaa32add9d812a01b605f2572bed5bbd7f46d0cdd9d88946dbac055cfd22494dc44ea2b8fe20878da8ed2175980e26a1cf33b9496b91b0	common_voice_mr_31485674.mp3	वडा पावाच्या गाडीवर महाराष्ट्रातील अनेक कुटुंबाचा रोजगार चालतो.	1	0	teens	male			mr	
7ac1c55237ab2dd163eaa32add9d812a01b605f2572bed5bbd7f46d0cdd9d88946dbac055cfd22494dc44ea2b8fe20878da8ed2175980e26a1cf33b9496b91b0	common_voice_mr_31485675.mp3	दोघांचाही त्यांच्या कुटूंबाने त्याग केला होता.	1	0	teens	male			mr	
7ac1c55237ab2dd163eaa32add9d812a01b605f2572bed5bbd7f46d0cdd9d88946dbac055cfd22494dc44ea2b8fe20878da8ed2175980e26a1cf33b9496b91b0	common_voice_mr_31485677.mp3	आईला हीच एक चिंता होती.	1	0	teens	male			mr	
7ac1c55237ab2dd163eaa32add9d812a01b605f2572bed5bbd7f46d0cdd9d88946dbac055cfd22494dc44ea2b8fe20878da8ed2175980e26a1cf33b9496b91b0	common_voice_mr_31485714.mp3	कर्णाला अर्जुनापेक्षा वरचढ व्हायचे होते.	0	0	teens	male			mr	
7ac1c55237ab2dd163eaa32add9d812a01b605f2572bed5bbd7f46d0cdd9d88946dbac055cfd22494dc44ea2b8fe20878da8ed2175980e26a1cf33b9496b91b0	common_voice_mr_31485715.mp3	रामायणात शबरी कथा काय आहे?	0	0	teens	male			mr	
7ac1c55237ab2dd163eaa32add9d812a01b605f2572bed5bbd7f46d0cdd9d88946dbac055cfd22494dc44ea2b8fe20878da8ed2175980e26a1cf33b9496b91b0	common_voice_mr_31485716.mp3	पांडव पांडव महाभारतातील प्रमुख व्यक्तिरेखा आहेत.	1	1	teens	male			mr	
7ac1c55237ab2dd163eaa32add9d812a01b605f2572bed5bbd7f46d0cdd9d88946dbac055cfd22494dc44ea2b8fe20878da8ed2175980e26a1cf33b9496b91b0	common_voice_mr_31487016.mp3	शेवटी शकुनी मामाच्या साहाय्याने युधिष्ठिरास द्यूतात हरवून दुर्योधनाने पांडवांचे राज्य हिरावून घेतले.	1	1	teens	male			mr	
7ac1c55237ab2dd163eaa32add9d812a01b605f2572bed5bbd7f46d0cdd9d88946dbac055cfd22494dc44ea2b8fe20878da8ed2175980e26a1cf33b9496b91b0	common_voice_mr_31487022.mp3	केरळ मध्ये वर्षभर विषुववृत्तीय दमट हवामान असते.	0	0	teens	male			mr	
