client_id	path	sentence	up_votes	down_votes	age	gender	accents	variant	locale	segment
18cdeccf4a1f0e17a5681d48ec98ba2e125cd3158efada737ea6ba18d0e8d70f3bed4b1eed3388586228700bd282cd48e44bed85373f42ccb6e7f14f4e74286e	common_voice_sc_32439999.mp3	Sos cungressos a pustis de sas derrotas eletorales sunt sos prus malos.	0	2					sc	
7128067889d000aa9db11cb02f223522094f98bd346cb086057a66a97803f9618c087cd07260ec7a69b942eec7013ea96139fa30978a523d4490d6b1b070b3b5	common_voice_sc_32440835.mp3	Su testu est in parte in italianu e in parte in sardu.	0	2					sc	
7128067889d000aa9db11cb02f223522094f98bd346cb086057a66a97803f9618c087cd07260ec7a69b942eec7013ea96139fa30978a523d4490d6b1b070b3b5	common_voice_sc_32440836.mp3	Fiant tres frades e una sorre, òrfanos dae pipios.	0	2					sc	
7128067889d000aa9db11cb02f223522094f98bd346cb086057a66a97803f9618c087cd07260ec7a69b942eec7013ea96139fa30978a523d4490d6b1b070b3b5	common_voice_sc_32440837.mp3	E calicunu fit a raunzu.	0	2					sc	
7128067889d000aa9db11cb02f223522094f98bd346cb086057a66a97803f9618c087cd07260ec7a69b942eec7013ea96139fa30978a523d4490d6b1b070b3b5	common_voice_sc_32440838.mp3	Ite est mancadu?	0	2					sc	
7128067889d000aa9db11cb02f223522094f98bd346cb086057a66a97803f9618c087cd07260ec7a69b942eec7013ea96139fa30978a523d4490d6b1b070b3b5	common_voice_sc_32440839.mp3	Un’ispera galana.	0	2					sc	
d7c016410ac207f2e71f0f6c45c27a3da1ed214078bab3020aaaca38b8041f85e9893106a2f3a828166697dcb9d301c3107cb7f96245886f7ae9ab6996913314	common_voice_sc_32612172.mp3	Posca ant addobiadu Giapone e Ìndia pro arresonare de seguresa.	2	2			Campidanesu		sc	
d7c016410ac207f2e71f0f6c45c27a3da1ed214078bab3020aaaca38b8041f85e9893106a2f3a828166697dcb9d301c3107cb7f96245886f7ae9ab6996913314	common_voice_sc_32613357.mp3	Ma chie isseberat cale pronùntzia de cada paràula intrat in sa norma?	2	4	thirties	female	Campidanesu		sc	
d7c016410ac207f2e71f0f6c45c27a3da1ed214078bab3020aaaca38b8041f85e9893106a2f3a828166697dcb9d301c3107cb7f96245886f7ae9ab6996913314	common_voice_sc_32615604.mp3	Est s’istandard ufitziale e literàriu de Croàtzia.	2	2	thirties	female	Campidanesu		sc	
d7c016410ac207f2e71f0f6c45c27a3da1ed214078bab3020aaaca38b8041f85e9893106a2f3a828166697dcb9d301c3107cb7f96245886f7ae9ab6996913314	common_voice_sc_32631362.mp3	Una est sa costante narrativa de sos sardos chi t’apo naradu prima.	2	2	thirties	female	Campidanesu		sc	
d7c016410ac207f2e71f0f6c45c27a3da1ed214078bab3020aaaca38b8041f85e9893106a2f3a828166697dcb9d301c3107cb7f96245886f7ae9ab6996913314	common_voice_sc_32642099.mp3	S’assimìgiat meda a àteras faeddadas de sa regione.	2	4	thirties	female	Campidanesu		sc	
83fe60e31a9fef3c4e27bcd4da9fff1ea275bd9b435086aae8a1bdff041248d62f8574af7d4f2d9a4bcd96ca3d3cd192c922f63bade83225fe9fb3ddd6ed12e7	common_voice_sc_32808582.mp3	S’identidade est sorta, e si mantenet petzi in su fumetu prus meda cummertziale.	3	3			imparende, dae àteras limbas,meridionale		sc	
83fe60e31a9fef3c4e27bcd4da9fff1ea275bd9b435086aae8a1bdff041248d62f8574af7d4f2d9a4bcd96ca3d3cd192c922f63bade83225fe9fb3ddd6ed12e7	common_voice_sc_32853502.mp3	Como traballat in s’Ufìtziu Regionale, chi est abarradu sena su diretore istòricu.	0	3			imparende, dae àteras limbas,meridionale		sc	
83fe60e31a9fef3c4e27bcd4da9fff1ea275bd9b435086aae8a1bdff041248d62f8574af7d4f2d9a4bcd96ca3d3cd192c922f63bade83225fe9fb3ddd6ed12e7	common_voice_sc_32853521.mp3	Eventos istòricos fundamentales, pustis, ant dadu a s’inglesu sa fortza chi tenet como.	0	6			imparende, dae àteras limbas,meridionale		sc	
83fe60e31a9fef3c4e27bcd4da9fff1ea275bd9b435086aae8a1bdff041248d62f8574af7d4f2d9a4bcd96ca3d3cd192c922f63bade83225fe9fb3ddd6ed12e7	common_voice_sc_32853523.mp3	Cun carchi problema.	3	6			imparende, dae àteras limbas,meridionale		sc	
d7c016410ac207f2e71f0f6c45c27a3da1ed214078bab3020aaaca38b8041f85e9893106a2f3a828166697dcb9d301c3107cb7f96245886f7ae9ab6996913314	common_voice_sc_32869511.mp3	Eja, no l’at a agradare, l’isco giai.	0	4	thirties	female	Campidanesu		sc	
d7c016410ac207f2e71f0f6c45c27a3da1ed214078bab3020aaaca38b8041f85e9893106a2f3a828166697dcb9d301c3107cb7f96245886f7ae9ab6996913314	common_voice_sc_32869515.mp3	Non benit mègius a lasciare totu comente est?	0	4	thirties	female	Campidanesu		sc	
d7c016410ac207f2e71f0f6c45c27a3da1ed214078bab3020aaaca38b8041f85e9893106a2f3a828166697dcb9d301c3107cb7f96245886f7ae9ab6996913314	common_voice_sc_32869625.mp3	S’arrestu issoro aiat iscadenadu sa rebellia.	2	2	thirties	female	Campidanesu		sc	
d7c016410ac207f2e71f0f6c45c27a3da1ed214078bab3020aaaca38b8041f85e9893106a2f3a828166697dcb9d301c3107cb7f96245886f7ae9ab6996913314	common_voice_sc_32890421.mp3	Apo intesu e unu pagu mi dolet custa cosa.	2	4	thirties	female	Campidanesu		sc	
d7c016410ac207f2e71f0f6c45c27a3da1ed214078bab3020aaaca38b8041f85e9893106a2f3a828166697dcb9d301c3107cb7f96245886f7ae9ab6996913314	common_voice_sc_32890592.mp3	Eja cheret dare boghe a totus.	2	2	thirties	female	Campidanesu		sc	
83fe60e31a9fef3c4e27bcd4da9fff1ea275bd9b435086aae8a1bdff041248d62f8574af7d4f2d9a4bcd96ca3d3cd192c922f63bade83225fe9fb3ddd6ed12e7	common_voice_sc_33130743.mp3	Ma ite cheret nàrrere custa definitzione e chie sunt?	0	6			imparende, dae àteras limbas,meridionale		sc	
0d213d883377337743f93fc8f451d6b68d14753dae0ca57bae8459b92197da0f385bfabfa2ae09a4810dd0e2e4a6e0714f1567701ef746a49c8046305898e4f5	common_voice_sc_33351209.mp3	Progetualidade contra a disisperu.	0	2					sc	
83fe60e31a9fef3c4e27bcd4da9fff1ea275bd9b435086aae8a1bdff041248d62f8574af7d4f2d9a4bcd96ca3d3cd192c922f63bade83225fe9fb3ddd6ed12e7	common_voice_sc_34266605.mp3	In carrera de Roma a sas chimbe e mesu de sero.	3	3			imparende, dae àteras limbas,meridionale		sc	
83fe60e31a9fef3c4e27bcd4da9fff1ea275bd9b435086aae8a1bdff041248d62f8574af7d4f2d9a4bcd96ca3d3cd192c922f63bade83225fe9fb3ddd6ed12e7	common_voice_sc_34266721.mp3	Non ti nd’ammentas?	0	3			imparende, dae àteras limbas,meridionale		sc	
83fe60e31a9fef3c4e27bcd4da9fff1ea275bd9b435086aae8a1bdff041248d62f8574af7d4f2d9a4bcd96ca3d3cd192c922f63bade83225fe9fb3ddd6ed12e7	common_voice_sc_34974156.mp3	Calicuna borta sas istòrias de isport sunt cosa de ispantu meda.	0	3			imparende, dae àteras limbas,meridionale		sc	
83fe60e31a9fef3c4e27bcd4da9fff1ea275bd9b435086aae8a1bdff041248d62f8574af7d4f2d9a4bcd96ca3d3cd192c922f63bade83225fe9fb3ddd6ed12e7	common_voice_sc_35192942.mp3	No est fàula a lu nàrrere.	0	3			imparende, dae àteras limbas,meridionale		sc	
