client_id	path	sentence	up_votes	down_votes	age	gender	accents	variant	locale	segment
1c4d7da401427ec276d5c812cb0f44712605f9b18cbd11e6ceae0e9a9ef89198a8cd698cdddcb7525b01671f16408917d5fec867104c54ac240723ee9cb20c9c	common_voice_sc_37882534.mp3	Est un’indùstria importante meda de su mercadu asiàticu de is veturas elètricas.	1	0					sc	
1c4d7da401427ec276d5c812cb0f44712605f9b18cbd11e6ceae0e9a9ef89198a8cd698cdddcb7525b01671f16408917d5fec867104c54ac240723ee9cb20c9c	common_voice_sc_37882536.mp3	Sos abrutzesos, ocannu, no ant bìnchidu mai in s'istàdiu de domo.	1	0					sc	
1d6eba8abb32f4d141ce15e5cbec2f69987c72deb5e67b97df7a59cc4c2183cd9ba736c2efaa40ad25adfaa1ea820ad1ca0d1745049cc656d392cec0bf12e009	common_voice_sc_38586727.mp3	In ue nch'est su criu?	1	0	thirties	male			sc	
1d6eba8abb32f4d141ce15e5cbec2f69987c72deb5e67b97df7a59cc4c2183cd9ba736c2efaa40ad25adfaa1ea820ad1ca0d1745049cc656d392cec0bf12e009	common_voice_sc_38586733.mp3	Nos auguramus de nche pòdere acabbare su traballu intro de su mese de làmpadas.	1	0	thirties	male			sc	
1d6eba8abb32f4d141ce15e5cbec2f69987c72deb5e67b97df7a59cc4c2183cd9ba736c2efaa40ad25adfaa1ea820ad1ca0d1745049cc656d392cec0bf12e009	common_voice_sc_38586739.mp3	A pustis de bint’annos e dibatas chi sighint, ite tenes de nàrrere?	1	0	thirties	male			sc	
1d6eba8abb32f4d141ce15e5cbec2f69987c72deb5e67b97df7a59cc4c2183cd9ba736c2efaa40ad25adfaa1ea820ad1ca0d1745049cc656d392cec0bf12e009	common_voice_sc_38586740.mp3	Sa vitòria munitzipalista de su beranu.	0	0	thirties	male			sc	
1d6eba8abb32f4d141ce15e5cbec2f69987c72deb5e67b97df7a59cc4c2183cd9ba736c2efaa40ad25adfaa1ea820ad1ca0d1745049cc656d392cec0bf12e009	common_voice_sc_38586746.mp3	Maestràntzias e impresas ocupadas duncas.	1	0	thirties	male			sc	
1d6eba8abb32f4d141ce15e5cbec2f69987c72deb5e67b97df7a59cc4c2183cd9ba736c2efaa40ad25adfaa1ea820ad1ca0d1745049cc656d392cec0bf12e009	common_voice_sc_38586747.mp3	Fiat cunsideradu unu terrorista de livellu internatzionale.	1	0	thirties	male			sc	
1d6eba8abb32f4d141ce15e5cbec2f69987c72deb5e67b97df7a59cc4c2183cd9ba736c2efaa40ad25adfaa1ea820ad1ca0d1745049cc656d392cec0bf12e009	common_voice_sc_38586748.mp3	E sa soledade de s’òmine.	0	0	thirties	male			sc	
1d6eba8abb32f4d141ce15e5cbec2f69987c72deb5e67b97df7a59cc4c2183cd9ba736c2efaa40ad25adfaa1ea820ad1ca0d1745049cc656d392cec0bf12e009	common_voice_sc_38586749.mp3	A pustis de ses minutos arribat fintzas su vantàgiu de is istràngios.	1	0	thirties	male			sc	
1d6eba8abb32f4d141ce15e5cbec2f69987c72deb5e67b97df7a59cc4c2183cd9ba736c2efaa40ad25adfaa1ea820ad1ca0d1745049cc656d392cec0bf12e009	common_voice_sc_38586765.mp3	A pustis de sete giorronadas rapresentant unu resurtadu discretu.	0	0	thirties	male			sc	
1d6eba8abb32f4d141ce15e5cbec2f69987c72deb5e67b97df7a59cc4c2183cd9ba736c2efaa40ad25adfaa1ea820ad1ca0d1745049cc656d392cec0bf12e009	common_voice_sc_38586766.mp3	Ma sa memòria nono.	1	0	thirties	male			sc	
1d6eba8abb32f4d141ce15e5cbec2f69987c72deb5e67b97df7a59cc4c2183cd9ba736c2efaa40ad25adfaa1ea820ad1ca0d1745049cc656d392cec0bf12e009	common_voice_sc_38586767.mp3	E pròpiu in bestimenta persiana fiant ritratos in s’antigòriu.	0	0	thirties	male			sc	
1d6eba8abb32f4d141ce15e5cbec2f69987c72deb5e67b97df7a59cc4c2183cd9ba736c2efaa40ad25adfaa1ea820ad1ca0d1745049cc656d392cec0bf12e009	common_voice_sc_38586768.mp3	S'abbigeit deretu chi sa derrota fiat arribende.	1	0	thirties	male			sc	
1d6eba8abb32f4d141ce15e5cbec2f69987c72deb5e67b97df7a59cc4c2183cd9ba736c2efaa40ad25adfaa1ea820ad1ca0d1745049cc656d392cec0bf12e009	common_voice_sc_38586774.mp3	Letziones de solidariedade a s'Europa intrea.	1	0	thirties	male			sc	
1d6eba8abb32f4d141ce15e5cbec2f69987c72deb5e67b97df7a59cc4c2183cd9ba736c2efaa40ad25adfaa1ea820ad1ca0d1745049cc656d392cec0bf12e009	common_voice_sc_38586780.mp3	Nche colant àteros tres minutos e s'Empoli torrat a abèrrere sa partida.	1	0	thirties	male			sc	
1d6eba8abb32f4d141ce15e5cbec2f69987c72deb5e67b97df7a59cc4c2183cd9ba736c2efaa40ad25adfaa1ea820ad1ca0d1745049cc656d392cec0bf12e009	common_voice_sc_38586781.mp3	Annùntziu de una temporada mala.	1	0	thirties	male			sc	
1d6eba8abb32f4d141ce15e5cbec2f69987c72deb5e67b97df7a59cc4c2183cd9ba736c2efaa40ad25adfaa1ea820ad1ca0d1745049cc656d392cec0bf12e009	common_voice_sc_38586783.mp3	Corfos infertos in cada manera e cun cada aina tennerent a disponimentu.	1	0	thirties	male			sc	
1d6eba8abb32f4d141ce15e5cbec2f69987c72deb5e67b97df7a59cc4c2183cd9ba736c2efaa40ad25adfaa1ea820ad1ca0d1745049cc656d392cec0bf12e009	common_voice_sc_38586788.mp3	Su musitzista in unu murale de Noa York.	1	0	thirties	male			sc	
1d6eba8abb32f4d141ce15e5cbec2f69987c72deb5e67b97df7a59cc4c2183cd9ba736c2efaa40ad25adfaa1ea820ad1ca0d1745049cc656d392cec0bf12e009	common_voice_sc_38586789.mp3	Ascurtade·lu!	1	0	thirties	male			sc	
1d6eba8abb32f4d141ce15e5cbec2f69987c72deb5e67b97df7a59cc4c2183cd9ba736c2efaa40ad25adfaa1ea820ad1ca0d1745049cc656d392cec0bf12e009	common_voice_sc_38586795.mp3	Las connoschimus.	0	0	thirties	male			sc	
1d6eba8abb32f4d141ce15e5cbec2f69987c72deb5e67b97df7a59cc4c2183cd9ba736c2efaa40ad25adfaa1ea820ad1ca0d1745049cc656d392cec0bf12e009	common_voice_sc_38586796.mp3	Dae oe su Casteddu at a dèvere renuntziare a Melchiorri.	1	0	thirties	male			sc	
1d6eba8abb32f4d141ce15e5cbec2f69987c72deb5e67b97df7a59cc4c2183cd9ba736c2efaa40ad25adfaa1ea820ad1ca0d1745049cc656d392cec0bf12e009	common_voice_sc_38586797.mp3	Sunt sos prus ativos.	1	0	thirties	male			sc	
1d6eba8abb32f4d141ce15e5cbec2f69987c72deb5e67b97df7a59cc4c2183cd9ba736c2efaa40ad25adfaa1ea820ad1ca0d1745049cc656d392cec0bf12e009	common_voice_sc_38586803.mp3	Ca su rapper de ratza messicana non b'at a èssere.	0	0	thirties	male			sc	
1d6eba8abb32f4d141ce15e5cbec2f69987c72deb5e67b97df7a59cc4c2183cd9ba736c2efaa40ad25adfaa1ea820ad1ca0d1745049cc656d392cec0bf12e009	common_voice_sc_38586814.mp3	Su programma rilevat in manera automàtica is firmas dòpias e nde cantzellat is ripetitziones.	0	0	thirties	male			sc	
1d6eba8abb32f4d141ce15e5cbec2f69987c72deb5e67b97df7a59cc4c2183cd9ba736c2efaa40ad25adfaa1ea820ad1ca0d1745049cc656d392cec0bf12e009	common_voice_sc_38586820.mp3	Mìgias de tonnelladas de mertze e milliones de chilòmetros cada die.	1	0	thirties	male			sc	
1d6eba8abb32f4d141ce15e5cbec2f69987c72deb5e67b97df7a59cc4c2183cd9ba736c2efaa40ad25adfaa1ea820ad1ca0d1745049cc656d392cec0bf12e009	common_voice_sc_38586821.mp3	Nòmine	1	0	thirties	male			sc	
1d6eba8abb32f4d141ce15e5cbec2f69987c72deb5e67b97df7a59cc4c2183cd9ba736c2efaa40ad25adfaa1ea820ad1ca0d1745049cc656d392cec0bf12e009	common_voice_sc_38586822.mp3	Su gol est de Isla.	1	0	thirties	male			sc	
1d6eba8abb32f4d141ce15e5cbec2f69987c72deb5e67b97df7a59cc4c2183cd9ba736c2efaa40ad25adfaa1ea820ad1ca0d1745049cc656d392cec0bf12e009	common_voice_sc_38586823.mp3	Ma no est cosa chi at a fàghere.	1	0	thirties	male			sc	
1d6eba8abb32f4d141ce15e5cbec2f69987c72deb5e67b97df7a59cc4c2183cd9ba736c2efaa40ad25adfaa1ea820ad1ca0d1745049cc656d392cec0bf12e009	common_voice_sc_38586824.mp3	Stefania Giannini, «b'at ite meledare».	0	0	thirties	male			sc	
1d6eba8abb32f4d141ce15e5cbec2f69987c72deb5e67b97df7a59cc4c2183cd9ba736c2efaa40ad25adfaa1ea820ad1ca0d1745049cc656d392cec0bf12e009	common_voice_sc_38586825.mp3	Àtera trasferta de importu pro su Casteddu.	1	0	thirties	male			sc	
83fe60e31a9fef3c4e27bcd4da9fff1ea275bd9b435086aae8a1bdff041248d62f8574af7d4f2d9a4bcd96ca3d3cd192c922f63bade83225fe9fb3ddd6ed12e7	common_voice_sc_38856806.mp3	Difìtzile sa cunditzione fintzas de sos funtzionàrios giurìdicu pedagògicos, petzi duos in servìtziu.	0	0			imparende, dae àteras limbas,meridionale		sc	
83fe60e31a9fef3c4e27bcd4da9fff1ea275bd9b435086aae8a1bdff041248d62f8574af7d4f2d9a4bcd96ca3d3cd192c922f63bade83225fe9fb3ddd6ed12e7	common_voice_sc_38856807.mp3	Indicare is annos de riferimentu.	0	0			imparende, dae àteras limbas,meridionale		sc	
83fe60e31a9fef3c4e27bcd4da9fff1ea275bd9b435086aae8a1bdff041248d62f8574af7d4f2d9a4bcd96ca3d3cd192c922f63bade83225fe9fb3ddd6ed12e7	common_voice_sc_38856808.mp3	Prus nudda.	0	0			imparende, dae àteras limbas,meridionale		sc	
83fe60e31a9fef3c4e27bcd4da9fff1ea275bd9b435086aae8a1bdff041248d62f8574af7d4f2d9a4bcd96ca3d3cd192c922f63bade83225fe9fb3ddd6ed12e7	common_voice_sc_38856809.mp3	Gente su prus fuende dae logu de fàmene e de trùbulos bèllicos.	0	0			imparende, dae àteras limbas,meridionale		sc	
83fe60e31a9fef3c4e27bcd4da9fff1ea275bd9b435086aae8a1bdff041248d62f8574af7d4f2d9a4bcd96ca3d3cd192c922f63bade83225fe9fb3ddd6ed12e7	common_voice_sc_38856810.mp3	S'àrbitru però annullat su gol pro positzione irregulare.	0	0			imparende, dae àteras limbas,meridionale		sc	
83fe60e31a9fef3c4e27bcd4da9fff1ea275bd9b435086aae8a1bdff041248d62f8574af7d4f2d9a4bcd96ca3d3cd192c922f63bade83225fe9fb3ddd6ed12e7	common_voice_sc_38856816.mp3	E isetant.	0	0	thirties	male	imparende, dae àteras limbas,meridionale		sc	
83fe60e31a9fef3c4e27bcd4da9fff1ea275bd9b435086aae8a1bdff041248d62f8574af7d4f2d9a4bcd96ca3d3cd192c922f63bade83225fe9fb3ddd6ed12e7	common_voice_sc_38856817.mp3	Comente a nàrrere chi sa manca italiana aiat antitzipadu totu deghe annos a immoe.	0	0	thirties	male	imparende, dae àteras limbas,meridionale		sc	
83fe60e31a9fef3c4e27bcd4da9fff1ea275bd9b435086aae8a1bdff041248d62f8574af7d4f2d9a4bcd96ca3d3cd192c922f63bade83225fe9fb3ddd6ed12e7	common_voice_sc_38856818.mp3	Sa chistione est istada ispiegada in un’artìculu de Progres.	0	0	thirties	male	imparende, dae àteras limbas,meridionale		sc	
83fe60e31a9fef3c4e27bcd4da9fff1ea275bd9b435086aae8a1bdff041248d62f8574af7d4f2d9a4bcd96ca3d3cd192c922f63bade83225fe9fb3ddd6ed12e7	common_voice_sc_38856819.mp3	Su chi cunsigheit ddu connoschimus totus cantos.	0	0	thirties	male	imparende, dae àteras limbas,meridionale		sc	
83fe60e31a9fef3c4e27bcd4da9fff1ea275bd9b435086aae8a1bdff041248d62f8574af7d4f2d9a4bcd96ca3d3cd192c922f63bade83225fe9fb3ddd6ed12e7	common_voice_sc_38856820.mp3	Laretu in pare a Ciciu Piga, Barore Sassu e Remundu Piras.	0	0	thirties	male	imparende, dae àteras limbas,meridionale		sc	
83fe60e31a9fef3c4e27bcd4da9fff1ea275bd9b435086aae8a1bdff041248d62f8574af7d4f2d9a4bcd96ca3d3cd192c922f63bade83225fe9fb3ddd6ed12e7	common_voice_sc_38856821.mp3	Su segundu tempus cumintzat cun su matessi ritmu de sos ùrtimos deghe minutos.	0	0	thirties	male	imparende, dae àteras limbas,meridionale		sc	
83fe60e31a9fef3c4e27bcd4da9fff1ea275bd9b435086aae8a1bdff041248d62f8574af7d4f2d9a4bcd96ca3d3cd192c922f63bade83225fe9fb3ddd6ed12e7	common_voice_sc_38856822.mp3	Peri totu su mundu.	0	0	thirties	male	imparende, dae àteras limbas,meridionale		sc	
83fe60e31a9fef3c4e27bcd4da9fff1ea275bd9b435086aae8a1bdff041248d62f8574af7d4f2d9a4bcd96ca3d3cd192c922f63bade83225fe9fb3ddd6ed12e7	common_voice_sc_38856823.mp3	Ant a chistionare cun s’autore Chiara Cabras e Carlo Mura.	0	0	thirties	male	imparende, dae àteras limbas,meridionale		sc	
83fe60e31a9fef3c4e27bcd4da9fff1ea275bd9b435086aae8a1bdff041248d62f8574af7d4f2d9a4bcd96ca3d3cd192c922f63bade83225fe9fb3ddd6ed12e7	common_voice_sc_38856824.mp3	A su nessi a sa prima impressione.	0	0	thirties	male	imparende, dae àteras limbas,meridionale		sc	
83fe60e31a9fef3c4e27bcd4da9fff1ea275bd9b435086aae8a1bdff041248d62f8574af7d4f2d9a4bcd96ca3d3cd192c922f63bade83225fe9fb3ddd6ed12e7	common_voice_sc_38856825.mp3	A èssere animosos no est unu delitu.	0	0	thirties	male	imparende, dae àteras limbas,meridionale		sc	
83fe60e31a9fef3c4e27bcd4da9fff1ea275bd9b435086aae8a1bdff041248d62f8574af7d4f2d9a4bcd96ca3d3cd192c922f63bade83225fe9fb3ddd6ed12e7	common_voice_sc_38856826.mp3	Sa cantzone currispondet a su re-adatamentu de «Deus ti sarvet Maria».	0	0	thirties	male	imparende, dae àteras limbas,meridionale		sc	
83fe60e31a9fef3c4e27bcd4da9fff1ea275bd9b435086aae8a1bdff041248d62f8574af7d4f2d9a4bcd96ca3d3cd192c922f63bade83225fe9fb3ddd6ed12e7	common_voice_sc_38856827.mp3	Pro cussas b'at tempus.	0	0	thirties	male	imparende, dae àteras limbas,meridionale		sc	
83fe60e31a9fef3c4e27bcd4da9fff1ea275bd9b435086aae8a1bdff041248d62f8574af7d4f2d9a4bcd96ca3d3cd192c922f63bade83225fe9fb3ddd6ed12e7	common_voice_sc_38856828.mp3	Como sas cundennas ufitziales e sas ammissiones de curpa sunt medas.	0	0	thirties	male	imparende, dae àteras limbas,meridionale		sc	
83fe60e31a9fef3c4e27bcd4da9fff1ea275bd9b435086aae8a1bdff041248d62f8574af7d4f2d9a4bcd96ca3d3cd192c922f63bade83225fe9fb3ddd6ed12e7	common_voice_sc_38856829.mp3	Zanetti in contu de moda otzidentale e de messàgios cumpartzidos.	0	0	thirties	male	imparende, dae àteras limbas,meridionale		sc	
83fe60e31a9fef3c4e27bcd4da9fff1ea275bd9b435086aae8a1bdff041248d62f8574af7d4f2d9a4bcd96ca3d3cd192c922f63bade83225fe9fb3ddd6ed12e7	common_voice_sc_38856831.mp3	Sas cosas ant a mudare, e giai lu semus bidende.	0	0	thirties	male	imparende, dae àteras limbas,meridionale		sc	
83fe60e31a9fef3c4e27bcd4da9fff1ea275bd9b435086aae8a1bdff041248d62f8574af7d4f2d9a4bcd96ca3d3cd192c922f63bade83225fe9fb3ddd6ed12e7	common_voice_sc_38856832.mp3	Custa est puru una terra de casu e fintzas inoghe ddoe at produtos bonos.	0	0	thirties	male	imparende, dae àteras limbas,meridionale		sc	
83fe60e31a9fef3c4e27bcd4da9fff1ea275bd9b435086aae8a1bdff041248d62f8574af7d4f2d9a4bcd96ca3d3cd192c922f63bade83225fe9fb3ddd6ed12e7	common_voice_sc_38856833.mp3	Damus borta e tzucamus dae su cumintzu.	0	0	thirties	male	imparende, dae àteras limbas,meridionale		sc	
83fe60e31a9fef3c4e27bcd4da9fff1ea275bd9b435086aae8a1bdff041248d62f8574af7d4f2d9a4bcd96ca3d3cd192c922f63bade83225fe9fb3ddd6ed12e7	common_voice_sc_38856834.mp3	Dae tando ddoe curret petzi sàmbene.	0	0	thirties	male	imparende, dae àteras limbas,meridionale		sc	
83fe60e31a9fef3c4e27bcd4da9fff1ea275bd9b435086aae8a1bdff041248d62f8574af7d4f2d9a4bcd96ca3d3cd192c922f63bade83225fe9fb3ddd6ed12e7	common_voice_sc_38856835.mp3	Alesse pro arringare sa norma chi at cussigiadu.	0	0	thirties	male	imparende, dae àteras limbas,meridionale		sc	
83fe60e31a9fef3c4e27bcd4da9fff1ea275bd9b435086aae8a1bdff041248d62f8574af7d4f2d9a4bcd96ca3d3cd192c922f63bade83225fe9fb3ddd6ed12e7	common_voice_sc_38856907.mp3	Ma non fuit s'acabbu de sa gherra.	0	0	thirties	male	imparende, dae àteras limbas,meridionale		sc	
83fe60e31a9fef3c4e27bcd4da9fff1ea275bd9b435086aae8a1bdff041248d62f8574af7d4f2d9a4bcd96ca3d3cd192c922f63bade83225fe9fb3ddd6ed12e7	common_voice_sc_38856908.mp3	"Semus traballende in paris cun is commerciantes", at agiuntu.	0	0	thirties	male	imparende, dae àteras limbas,meridionale		sc	
83fe60e31a9fef3c4e27bcd4da9fff1ea275bd9b435086aae8a1bdff041248d62f8574af7d4f2d9a4bcd96ca3d3cd192c922f63bade83225fe9fb3ddd6ed12e7	common_voice_sc_38856909.mp3	Su marchesu de Arborea però nche fiat giai in Macumere.	0	0	thirties	male	imparende, dae àteras limbas,meridionale		sc	
83fe60e31a9fef3c4e27bcd4da9fff1ea275bd9b435086aae8a1bdff041248d62f8574af7d4f2d9a4bcd96ca3d3cd192c922f63bade83225fe9fb3ddd6ed12e7	common_voice_sc_38856910.mp3	Cales sunt sas muridinas a impèigu chi galu nche devimus barigare?	0	0	thirties	male	imparende, dae àteras limbas,meridionale		sc	
83fe60e31a9fef3c4e27bcd4da9fff1ea275bd9b435086aae8a1bdff041248d62f8574af7d4f2d9a4bcd96ca3d3cd192c922f63bade83225fe9fb3ddd6ed12e7	common_voice_sc_39154586.mp3	Nche colat mesora, ma nemos resesset a pigare in manos su giogu.	0	0	thirties	male	imparende, dae àteras limbas,meridionale		sc	
83fe60e31a9fef3c4e27bcd4da9fff1ea275bd9b435086aae8a1bdff041248d62f8574af7d4f2d9a4bcd96ca3d3cd192c922f63bade83225fe9fb3ddd6ed12e7	common_voice_sc_39154587.mp3	S'idea est nàschida in intro a su grupu Sardware.	0	0	thirties	male	imparende, dae àteras limbas,meridionale		sc	
83fe60e31a9fef3c4e27bcd4da9fff1ea275bd9b435086aae8a1bdff041248d62f8574af7d4f2d9a4bcd96ca3d3cd192c922f63bade83225fe9fb3ddd6ed12e7	common_voice_sc_39154588.mp3	Sa resistèntzia de sos casteddajos non durat meda.	0	0	thirties	male	imparende, dae àteras limbas,meridionale		sc	
83fe60e31a9fef3c4e27bcd4da9fff1ea275bd9b435086aae8a1bdff041248d62f8574af7d4f2d9a4bcd96ca3d3cd192c922f63bade83225fe9fb3ddd6ed12e7	common_voice_sc_39154589.mp3	Forsis ùnica.	0	0	thirties	male	imparende, dae àteras limbas,meridionale		sc	
83fe60e31a9fef3c4e27bcd4da9fff1ea275bd9b435086aae8a1bdff041248d62f8574af7d4f2d9a4bcd96ca3d3cd192c922f63bade83225fe9fb3ddd6ed12e7	common_voice_sc_39154590.mp3	Non si diat dèvere rèndere a sa propaganda guvernativa sena s’informare.	0	0	thirties	male	imparende, dae àteras limbas,meridionale		sc	
83fe60e31a9fef3c4e27bcd4da9fff1ea275bd9b435086aae8a1bdff041248d62f8574af7d4f2d9a4bcd96ca3d3cd192c922f63bade83225fe9fb3ddd6ed12e7	common_voice_sc_39154591.mp3	sa determinatzione de s'Ufìtziu Tècnicu Comunale.	0	0	thirties	male	imparende, dae àteras limbas,meridionale		sc	
83fe60e31a9fef3c4e27bcd4da9fff1ea275bd9b435086aae8a1bdff041248d62f8574af7d4f2d9a4bcd96ca3d3cd192c922f63bade83225fe9fb3ddd6ed12e7	common_voice_sc_39154592.mp3	Custas e àteras esperièntzias sunt s’ùnicu caminu pro otènnere resurtados.	0	0	thirties	male	imparende, dae àteras limbas,meridionale		sc	
83fe60e31a9fef3c4e27bcd4da9fff1ea275bd9b435086aae8a1bdff041248d62f8574af7d4f2d9a4bcd96ca3d3cd192c922f63bade83225fe9fb3ddd6ed12e7	common_voice_sc_39154594.mp3	Ma como, a ue nch’at a pòdere tzucare?	0	0	thirties	male	imparende, dae àteras limbas,meridionale		sc	
83fe60e31a9fef3c4e27bcd4da9fff1ea275bd9b435086aae8a1bdff041248d62f8574af7d4f2d9a4bcd96ca3d3cd192c922f63bade83225fe9fb3ddd6ed12e7	common_voice_sc_39154595.mp3	E sa lege paret faeddare craru: bisòngiant o su Greenpass o su tampone.	0	0	thirties	male	imparende, dae àteras limbas,meridionale		sc	
bfe16243636e7f8ef4d06c5efda72da0e6adf97162c73623b106c7e021a8595675d6508a206aa622bf17d70275bc2996b32301ecd1a57e5c90884f70ddf9f229	common_voice_sc_39541279.mp3	Protetzionismu.	0	0	twenties	female			sc	
bfe16243636e7f8ef4d06c5efda72da0e6adf97162c73623b106c7e021a8595675d6508a206aa622bf17d70275bc2996b32301ecd1a57e5c90884f70ddf9f229	common_voice_sc_39541280.mp3	Non bi nd'at.	0	0	twenties	female			sc	
bfe16243636e7f8ef4d06c5efda72da0e6adf97162c73623b106c7e021a8595675d6508a206aa622bf17d70275bc2996b32301ecd1a57e5c90884f70ddf9f229	common_voice_sc_39541281.mp3	Sos Consìgios regionales ant a ratificare su sèberu.	0	0	twenties	female			sc	
bfe16243636e7f8ef4d06c5efda72da0e6adf97162c73623b106c7e021a8595675d6508a206aa622bf17d70275bc2996b32301ecd1a57e5c90884f70ddf9f229	common_voice_sc_39541282.mp3	Casteddu, Tàtari e Nùgoro.	0	0	twenties	female			sc	
bfe16243636e7f8ef4d06c5efda72da0e6adf97162c73623b106c7e021a8595675d6508a206aa622bf17d70275bc2996b32301ecd1a57e5c90884f70ddf9f229	common_voice_sc_39541283.mp3	Intre sos fertos, imbetzes, b'at ses tedescos, unu norvegesu e unu peruvianu.	0	0	twenties	female			sc	
bfe16243636e7f8ef4d06c5efda72da0e6adf97162c73623b106c7e021a8595675d6508a206aa622bf17d70275bc2996b32301ecd1a57e5c90884f70ddf9f229	common_voice_sc_39541299.mp3	In càmbiu de carchi cuntzessione.	0	0	twenties	female			sc	
bfe16243636e7f8ef4d06c5efda72da0e6adf97162c73623b106c7e021a8595675d6508a206aa622bf17d70275bc2996b32301ecd1a57e5c90884f70ddf9f229	common_voice_sc_39541300.mp3	Est una de sas pagas bortas chi sa porta ruju-biaita est abarrada neta.	0	0	twenties	female			sc	
bfe16243636e7f8ef4d06c5efda72da0e6adf97162c73623b106c7e021a8595675d6508a206aa622bf17d70275bc2996b32301ecd1a57e5c90884f70ddf9f229	common_voice_sc_39541301.mp3	S'at a mòvere semper conca a cussa diretzione.	0	0	twenties	female			sc	
bfe16243636e7f8ef4d06c5efda72da0e6adf97162c73623b106c7e021a8595675d6508a206aa622bf17d70275bc2996b32301ecd1a57e5c90884f70ddf9f229	common_voice_sc_39541302.mp3	A pustis de su naufràgiu acontèssidu erisero a banda de merie.	0	0	twenties	female			sc	
bfe16243636e7f8ef4d06c5efda72da0e6adf97162c73623b106c7e021a8595675d6508a206aa622bf17d70275bc2996b32301ecd1a57e5c90884f70ddf9f229	common_voice_sc_39541303.mp3	Cales sunt is clientes chi tenides?	0	0	twenties	female			sc	
bfe16243636e7f8ef4d06c5efda72da0e6adf97162c73623b106c7e021a8595675d6508a206aa622bf17d70275bc2996b32301ecd1a57e5c90884f70ddf9f229	common_voice_sc_39541309.mp3	Non sunt pagos sos intzidentes e sos disàgios chi ant istorbadu sos automobilistas.	0	0	twenties	female			sc	
bfe16243636e7f8ef4d06c5efda72da0e6adf97162c73623b106c7e021a8595675d6508a206aa622bf17d70275bc2996b32301ecd1a57e5c90884f70ddf9f229	common_voice_sc_39541310.mp3	Movamus cun òrdine.	0	0	twenties	female			sc	
bfe16243636e7f8ef4d06c5efda72da0e6adf97162c73623b106c7e021a8595675d6508a206aa622bf17d70275bc2996b32301ecd1a57e5c90884f70ddf9f229	common_voice_sc_39541311.mp3	Sunt sos fatos e sa crònaca chi allegant.	0	0	twenties	female			sc	
bfe16243636e7f8ef4d06c5efda72da0e6adf97162c73623b106c7e021a8595675d6508a206aa622bf17d70275bc2996b32301ecd1a57e5c90884f70ddf9f229	common_voice_sc_39541312.mp3	E apo pigadu s'initziativa de ddu fàghere cun tonnina, chibudda, curcuriga.	0	0	twenties	female			sc	
bfe16243636e7f8ef4d06c5efda72da0e6adf97162c73623b106c7e021a8595675d6508a206aa622bf17d70275bc2996b32301ecd1a57e5c90884f70ddf9f229	common_voice_sc_39541313.mp3	E crompende petzi a unu de sos obietivos prefissados, sa Costitutzione europea.	0	0	twenties	female			sc	
bfe16243636e7f8ef4d06c5efda72da0e6adf97162c73623b106c7e021a8595675d6508a206aa622bf17d70275bc2996b32301ecd1a57e5c90884f70ddf9f229	common_voice_sc_39541334.mp3	E tando?	0	0	twenties	female			sc	
bfe16243636e7f8ef4d06c5efda72da0e6adf97162c73623b106c7e021a8595675d6508a206aa622bf17d70275bc2996b32301ecd1a57e5c90884f70ddf9f229	common_voice_sc_39541335.mp3	Su Crotone imbetzes at paregiadu, perdende duos puntos de importu.	0	0	twenties	female			sc	
bfe16243636e7f8ef4d06c5efda72da0e6adf97162c73623b106c7e021a8595675d6508a206aa622bf17d70275bc2996b32301ecd1a57e5c90884f70ddf9f229	common_voice_sc_39541336.mp3	Fiat su cabu de s'Istadu islàmicu de s'Iraq e de levante.	0	0	twenties	female			sc	
bfe16243636e7f8ef4d06c5efda72da0e6adf97162c73623b106c7e021a8595675d6508a206aa622bf17d70275bc2996b32301ecd1a57e5c90884f70ddf9f229	common_voice_sc_39541337.mp3	Ma in su segundu minutu de recùperu arribat su parègiu firmadu dae su portughesu.	0	0	twenties	female			sc	
bfe16243636e7f8ef4d06c5efda72da0e6adf97162c73623b106c7e021a8595675d6508a206aa622bf17d70275bc2996b32301ecd1a57e5c90884f70ddf9f229	common_voice_sc_39541338.mp3	Pro pòdere perpetuare sa connoschèntzia.	0	0	twenties	female			sc	
bfe16243636e7f8ef4d06c5efda72da0e6adf97162c73623b106c7e021a8595675d6508a206aa622bf17d70275bc2996b32301ecd1a57e5c90884f70ddf9f229	common_voice_sc_39541339.mp3	In custa manera, a su chi narant, ant a menguare sas possibilidades de contrafatzione.	0	0	twenties	female			sc	
bfe16243636e7f8ef4d06c5efda72da0e6adf97162c73623b106c7e021a8595675d6508a206aa622bf17d70275bc2996b32301ecd1a57e5c90884f70ddf9f229	common_voice_sc_39541340.mp3	Un'iscummissa coditziosa.	0	0	twenties	female			sc	
bfe16243636e7f8ef4d06c5efda72da0e6adf97162c73623b106c7e021a8595675d6508a206aa622bf17d70275bc2996b32301ecd1a57e5c90884f70ddf9f229	common_voice_sc_39541341.mp3	Est unu paradossu chi no at a règhere.	0	0	twenties	female			sc	
bfe16243636e7f8ef4d06c5efda72da0e6adf97162c73623b106c7e021a8595675d6508a206aa622bf17d70275bc2996b32301ecd1a57e5c90884f70ddf9f229	common_voice_sc_39541342.mp3	In una tzitade manna, mancari in Casteddu etotu.	0	0	twenties	female			sc	
bfe16243636e7f8ef4d06c5efda72da0e6adf97162c73623b106c7e021a8595675d6508a206aa622bf17d70275bc2996b32301ecd1a57e5c90884f70ddf9f229	common_voice_sc_39541343.mp3	Pro su giogadore, ocannu, est su primu gol.	0	0	twenties	female			sc	
bfe16243636e7f8ef4d06c5efda72da0e6adf97162c73623b106c7e021a8595675d6508a206aa622bf17d70275bc2996b32301ecd1a57e5c90884f70ddf9f229	common_voice_sc_39541349.mp3	A pustis chistionamus de is abusos in Germània.	0	0	twenties	female			sc	
bfe16243636e7f8ef4d06c5efda72da0e6adf97162c73623b106c7e021a8595675d6508a206aa622bf17d70275bc2996b32301ecd1a57e5c90884f70ddf9f229	common_voice_sc_39541350.mp3	E ddu bidimus fintzas in su menù de is pratos chi preparades.	0	0	twenties	female			sc	
bfe16243636e7f8ef4d06c5efda72da0e6adf97162c73623b106c7e021a8595675d6508a206aa622bf17d70275bc2996b32301ecd1a57e5c90884f70ddf9f229	common_voice_sc_39541352.mp3	Custu pro ite, narant, in custos logos su contàgiu est istadu bàsciu meda.	0	0	twenties	female			sc	
bfe16243636e7f8ef4d06c5efda72da0e6adf97162c73623b106c7e021a8595675d6508a206aa622bf17d70275bc2996b32301ecd1a57e5c90884f70ddf9f229	common_voice_sc_39541354.mp3	Totu si nch'acabbat in su giru de tres chidas.	0	0	twenties	female			sc	
bfe16243636e7f8ef4d06c5efda72da0e6adf97162c73623b106c7e021a8595675d6508a206aa622bf17d70275bc2996b32301ecd1a57e5c90884f70ddf9f229	common_voice_sc_39541356.mp3	Podimus pònnere sa coghina a intro de sa categoria "traditzione"?	0	0	twenties	female			sc	
bfe16243636e7f8ef4d06c5efda72da0e6adf97162c73623b106c7e021a8595675d6508a206aa622bf17d70275bc2996b32301ecd1a57e5c90884f70ddf9f229	common_voice_sc_39541384.mp3	A sa morte.	0	0	twenties	female			sc	
bfe16243636e7f8ef4d06c5efda72da0e6adf97162c73623b106c7e021a8595675d6508a206aa622bf17d70275bc2996b32301ecd1a57e5c90884f70ddf9f229	common_voice_sc_39541388.mp3	Datas istòricas.	0	0	twenties	female			sc	
bfe16243636e7f8ef4d06c5efda72da0e6adf97162c73623b106c7e021a8595675d6508a206aa622bf17d70275bc2996b32301ecd1a57e5c90884f70ddf9f229	common_voice_sc_39541390.mp3	S'istàdiu est in sa Tzitade de su Mèssicu.	0	0	twenties	female			sc	
bfe16243636e7f8ef4d06c5efda72da0e6adf97162c73623b106c7e021a8595675d6508a206aa622bf17d70275bc2996b32301ecd1a57e5c90884f70ddf9f229	common_voice_sc_39541392.mp3	In Biddanoa Forru ant a èssere presentadas fintzas duas òperas musicales e literàrias.	0	0	twenties	female			sc	
bfe16243636e7f8ef4d06c5efda72da0e6adf97162c73623b106c7e021a8595675d6508a206aa622bf17d70275bc2996b32301ecd1a57e5c90884f70ddf9f229	common_voice_sc_39541393.mp3	Telèfonat a su coghineri nostru.	0	0	twenties	female			sc	
bfe16243636e7f8ef4d06c5efda72da0e6adf97162c73623b106c7e021a8595675d6508a206aa622bf17d70275bc2996b32301ecd1a57e5c90884f70ddf9f229	common_voice_sc_39541419.mp3	Torrende a is resurtados.	0	0	twenties	female			sc	
