client_id	path	sentence	up_votes	down_votes	age	gender	accents	variant	locale	segment
d671834f547759a302d675c1eb2b6e63537d08b11724620f6fbf74828dd2fbdc76b4a91d2ff634b5e3641699847cf7cdd0d8d36bff4a3a4158c11d46f0174b5a	common_voice_cv_37437929.mp3	Темиҫе пӳлӗмлӗ пӳртре тӗксӗмччӗ.	1	0					cv	
d671834f547759a302d675c1eb2b6e63537d08b11724620f6fbf74828dd2fbdc76b4a91d2ff634b5e3641699847cf7cdd0d8d36bff4a3a4158c11d46f0174b5a	common_voice_cv_37437930.mp3	Ҫырма ҫумӗнчи уҫӑ люк та ҫынсене шиклентерет.	1	0					cv	
d671834f547759a302d675c1eb2b6e63537d08b11724620f6fbf74828dd2fbdc76b4a91d2ff634b5e3641699847cf7cdd0d8d36bff4a3a4158c11d46f0174b5a	common_voice_cv_37437937.mp3	Тӗслӗхрен, стилист ҫӳҫ тӑкӑннӑ вӑхӑтра илемлӗ курӑнма вӗрентет.	1	0					cv	
d671834f547759a302d675c1eb2b6e63537d08b11724620f6fbf74828dd2fbdc76b4a91d2ff634b5e3641699847cf7cdd0d8d36bff4a3a4158c11d46f0174b5a	common_voice_cv_37437939.mp3	Вӑл тыткаласа пӑхрӗ те сурана ҫутӑпа сиплеме ячӗ.	0	1					cv	
d671834f547759a302d675c1eb2b6e63537d08b11724620f6fbf74828dd2fbdc76b4a91d2ff634b5e3641699847cf7cdd0d8d36bff4a3a4158c11d46f0174b5a	common_voice_cv_37534059.mp3	«Сӑмахпа каласа кӑтартайми туйӑмсем хуҫаланаҫҫӗ чунра.	0	1					cv	
d671834f547759a302d675c1eb2b6e63537d08b11724620f6fbf74828dd2fbdc76b4a91d2ff634b5e3641699847cf7cdd0d8d36bff4a3a4158c11d46f0174b5a	common_voice_cv_37534060.mp3	Полицейскисенчен пӗри кӑшт маларах цирк шапитора пулнӑ-мӗн.	0	0					cv	
d671834f547759a302d675c1eb2b6e63537d08b11724620f6fbf74828dd2fbdc76b4a91d2ff634b5e3641699847cf7cdd0d8d36bff4a3a4158c11d46f0174b5a	common_voice_cv_37534061.mp3	Афган вӑрҫин ветеранӗсен тӗл пулӑвӗсене сиктермест.	1	0					cv	
d671834f547759a302d675c1eb2b6e63537d08b11724620f6fbf74828dd2fbdc76b4a91d2ff634b5e3641699847cf7cdd0d8d36bff4a3a4158c11d46f0174b5a	common_voice_cv_37534062.mp3	Кун иртнĕçем урамра Ӳсĕр çынсем нумайрах, Каç пулнăçем вăрмана Сасă каять хытăрах.	1	0					cv	
d671834f547759a302d675c1eb2b6e63537d08b11724620f6fbf74828dd2fbdc76b4a91d2ff634b5e3641699847cf7cdd0d8d36bff4a3a4158c11d46f0174b5a	common_voice_cv_37534063.mp3	Куçĕ те, чĕлхи те çивĕч Кушкă çыннисен.	1	0					cv	
d671834f547759a302d675c1eb2b6e63537d08b11724620f6fbf74828dd2fbdc76b4a91d2ff634b5e3641699847cf7cdd0d8d36bff4a3a4158c11d46f0174b5a	common_voice_cv_37534081.mp3	Ҫавсене каччӑ Интернетра пӗлтерӳ парса сутма хӑтланнӑ.	1	0					cv	
d671834f547759a302d675c1eb2b6e63537d08b11724620f6fbf74828dd2fbdc76b4a91d2ff634b5e3641699847cf7cdd0d8d36bff4a3a4158c11d46f0174b5a	common_voice_cv_37534082.mp3	Пӗчӗк ял пулин те Шуркасси малаллах талпӑнать…	1	0					cv	
d671834f547759a302d675c1eb2b6e63537d08b11724620f6fbf74828dd2fbdc76b4a91d2ff634b5e3641699847cf7cdd0d8d36bff4a3a4158c11d46f0174b5a	common_voice_cv_37534083.mp3	Унччен вӑл кӑштах аяккарах ларнӑ.	1	0					cv	
d671834f547759a302d675c1eb2b6e63537d08b11724620f6fbf74828dd2fbdc76b4a91d2ff634b5e3641699847cf7cdd0d8d36bff4a3a4158c11d46f0174b5a	common_voice_cv_37534084.mp3	Анчах Михаил Николаевичăн ывăна пĕлмен чун-чĕри çĕнĕрен те çĕнĕ ĕç ыйтрĕ.	1	0					cv	
d671834f547759a302d675c1eb2b6e63537d08b11724620f6fbf74828dd2fbdc76b4a91d2ff634b5e3641699847cf7cdd0d8d36bff4a3a4158c11d46f0174b5a	common_voice_cv_37534085.mp3	Ачасем те хӑйсен пултарулӑхӗпе халӑха савӑнтарнӑ.	1	0					cv	
d671834f547759a302d675c1eb2b6e63537d08b11724620f6fbf74828dd2fbdc76b4a91d2ff634b5e3641699847cf7cdd0d8d36bff4a3a4158c11d46f0174b5a	common_voice_cv_37534103.mp3	Мана вăй кĕнĕ пекех пулчĕ.	1	0					cv	
d671834f547759a302d675c1eb2b6e63537d08b11724620f6fbf74828dd2fbdc76b4a91d2ff634b5e3641699847cf7cdd0d8d36bff4a3a4158c11d46f0174b5a	common_voice_cv_37534104.mp3	Çĕçĕ çине пăхса тăрса ашшĕ килсе кĕнине те сисмен.	0	0					cv	
d671834f547759a302d675c1eb2b6e63537d08b11724620f6fbf74828dd2fbdc76b4a91d2ff634b5e3641699847cf7cdd0d8d36bff4a3a4158c11d46f0174b5a	common_voice_cv_37534105.mp3	Вӗсемпе пӗрле асламӑшӗ пулнӑ.	0	0					cv	
d671834f547759a302d675c1eb2b6e63537d08b11724620f6fbf74828dd2fbdc76b4a91d2ff634b5e3641699847cf7cdd0d8d36bff4a3a4158c11d46f0174b5a	common_voice_cv_37534106.mp3	«Шеф-поварсен тупӑшӑвӗ» номинацире Сергей Абрамов виҫҫӗмӗш пулнӑ.	1	0					cv	
d671834f547759a302d675c1eb2b6e63537d08b11724620f6fbf74828dd2fbdc76b4a91d2ff634b5e3641699847cf7cdd0d8d36bff4a3a4158c11d46f0174b5a	common_voice_cv_37534107.mp3	Анне Акриппин кинемей чирленĕшĕн кулянчĕ.	1	0					cv	
d671834f547759a302d675c1eb2b6e63537d08b11724620f6fbf74828dd2fbdc76b4a91d2ff634b5e3641699847cf7cdd0d8d36bff4a3a4158c11d46f0174b5a	common_voice_cv_37534132.mp3	Ӑна хастарсем хӑйсем пӗҫереҫҫӗ.	0	0					cv	
d671834f547759a302d675c1eb2b6e63537d08b11724620f6fbf74828dd2fbdc76b4a91d2ff634b5e3641699847cf7cdd0d8d36bff4a3a4158c11d46f0174b5a	common_voice_cv_37534133.mp3	Çитмен пурнăç пирки-çке çын куçĕнчен пăхатпăр, çиме çăкăр çитмесен, пăтавкка йăтса каятпăр.	1	0					cv	
d671834f547759a302d675c1eb2b6e63537d08b11724620f6fbf74828dd2fbdc76b4a91d2ff634b5e3641699847cf7cdd0d8d36bff4a3a4158c11d46f0174b5a	common_voice_cv_37534135.mp3	Ытла та яка тумпа, ху чăнкине кăтартма долларсене те витĕр курăнакан пакетра чиксе çӳретĕн.	0	0					cv	
d671834f547759a302d675c1eb2b6e63537d08b11724620f6fbf74828dd2fbdc76b4a91d2ff634b5e3641699847cf7cdd0d8d36bff4a3a4158c11d46f0174b5a	common_voice_cv_37534136.mp3	Васкасах утрĕ, ăшша пиçнĕрен фуфайкин тӳмисене те вĕçертрĕ.	0	1					cv	
d671834f547759a302d675c1eb2b6e63537d08b11724620f6fbf74828dd2fbdc76b4a91d2ff634b5e3641699847cf7cdd0d8d36bff4a3a4158c11d46f0174b5a	common_voice_cv_37534137.mp3	Мӗнех калӑн: апат питӗ тутлӑ!	0	0					cv	
d671834f547759a302d675c1eb2b6e63537d08b11724620f6fbf74828dd2fbdc76b4a91d2ff634b5e3641699847cf7cdd0d8d36bff4a3a4158c11d46f0174b5a	common_voice_cv_37534174.mp3	«Трактор савучӗсем» концернӑн ӗҫченӗсем каҫхи троллейбуссене ҫӳреттерменнине хирӗҫ иккен.	0	0					cv	
d671834f547759a302d675c1eb2b6e63537d08b11724620f6fbf74828dd2fbdc76b4a91d2ff634b5e3641699847cf7cdd0d8d36bff4a3a4158c11d46f0174b5a	common_voice_cv_37534175.mp3	Унта Кӑшарнинче, ытти уявра шыва кӗретпӗр.	1	0					cv	
d671834f547759a302d675c1eb2b6e63537d08b11724620f6fbf74828dd2fbdc76b4a91d2ff634b5e3641699847cf7cdd0d8d36bff4a3a4158c11d46f0174b5a	common_voice_cv_37534176.mp3	Ҫӗр улмие шуратса пӗтертӗмӗр.	1	0					cv	
d671834f547759a302d675c1eb2b6e63537d08b11724620f6fbf74828dd2fbdc76b4a91d2ff634b5e3641699847cf7cdd0d8d36bff4a3a4158c11d46f0174b5a	common_voice_cv_37534177.mp3	Этем кайăк мар, çĕр çинче утса çӳрет, хай хыççăн йĕр хăварать.	0	0					cv	
d671834f547759a302d675c1eb2b6e63537d08b11724620f6fbf74828dd2fbdc76b4a91d2ff634b5e3641699847cf7cdd0d8d36bff4a3a4158c11d46f0174b5a	common_voice_cv_37534194.mp3	Тӳлемех тивет…	0	0					cv	
d671834f547759a302d675c1eb2b6e63537d08b11724620f6fbf74828dd2fbdc76b4a91d2ff634b5e3641699847cf7cdd0d8d36bff4a3a4158c11d46f0174b5a	common_voice_cv_37534195.mp3	Ӳсĕрскерсем кăвайт чĕртсе ятăмăр.	0	0					cv	
d671834f547759a302d675c1eb2b6e63537d08b11724620f6fbf74828dd2fbdc76b4a91d2ff634b5e3641699847cf7cdd0d8d36bff4a3a4158c11d46f0174b5a	common_voice_cv_37534196.mp3	Вӑл вӗсене православи ушкӑнӗ пирки каласа кӑтартать.	1	0					cv	
d671834f547759a302d675c1eb2b6e63537d08b11724620f6fbf74828dd2fbdc76b4a91d2ff634b5e3641699847cf7cdd0d8d36bff4a3a4158c11d46f0174b5a	common_voice_cv_37534197.mp3	Телефонисткăсем калаçăва çĕнĕрен йĕркеличчен, сăмах май, Аркашпа паллашар-ха.	0	0					cv	
d671834f547759a302d675c1eb2b6e63537d08b11724620f6fbf74828dd2fbdc76b4a91d2ff634b5e3641699847cf7cdd0d8d36bff4a3a4158c11d46f0174b5a	common_voice_cv_37534198.mp3	Унта ачасемпе ҫамрӑксем валли лартнӑ спектакльсене кӑтартнӑ.	0	0					cv	
d671834f547759a302d675c1eb2b6e63537d08b11724620f6fbf74828dd2fbdc76b4a91d2ff634b5e3641699847cf7cdd0d8d36bff4a3a4158c11d46f0174b5a	common_voice_cv_37534297.mp3	Ҫитес ытлари кун миҫе волонтер пуласса пӗлме ҫук.	1	0					cv	
d671834f547759a302d675c1eb2b6e63537d08b11724620f6fbf74828dd2fbdc76b4a91d2ff634b5e3641699847cf7cdd0d8d36bff4a3a4158c11d46f0174b5a	common_voice_cv_37534299.mp3	Епархи шухашӗпе, ку фильм провокациллӗ тата мӑшкӑлласа кулни.	1	0					cv	
d671834f547759a302d675c1eb2b6e63537d08b11724620f6fbf74828dd2fbdc76b4a91d2ff634b5e3641699847cf7cdd0d8d36bff4a3a4158c11d46f0174b5a	common_voice_cv_37534303.mp3	Анчах ырӑ кӑмӑлпа усӑ куракансен кулли пулас килмест...	0	0					cv	
d671834f547759a302d675c1eb2b6e63537d08b11724620f6fbf74828dd2fbdc76b4a91d2ff634b5e3641699847cf7cdd0d8d36bff4a3a4158c11d46f0174b5a	common_voice_cv_37534304.mp3	Ҫавӑнпа хӑш-пӗр пахча-ҫимӗҫе теркӑласа шӑнтса хурҫҫӗ.	1	0					cv	
d671834f547759a302d675c1eb2b6e63537d08b11724620f6fbf74828dd2fbdc76b4a91d2ff634b5e3641699847cf7cdd0d8d36bff4a3a4158c11d46f0174b5a	common_voice_cv_37534313.mp3	Анчах леш арҫынӗсем — пурте авланнӑскерсем.	0	0					cv	
d671834f547759a302d675c1eb2b6e63537d08b11724620f6fbf74828dd2fbdc76b4a91d2ff634b5e3641699847cf7cdd0d8d36bff4a3a4158c11d46f0174b5a	common_voice_cv_37534315.mp3	Вероника вĕсене тытма хăтланчĕ, пĕри те алла лекмерĕ.	1	0					cv	
d671834f547759a302d675c1eb2b6e63537d08b11724620f6fbf74828dd2fbdc76b4a91d2ff634b5e3641699847cf7cdd0d8d36bff4a3a4158c11d46f0174b5a	common_voice_cv_37534316.mp3	Ҫӑвар шыҫҫинчен сывалсанах сунас ернӗ...	0	0					cv	
d671834f547759a302d675c1eb2b6e63537d08b11724620f6fbf74828dd2fbdc76b4a91d2ff634b5e3641699847cf7cdd0d8d36bff4a3a4158c11d46f0174b5a	common_voice_cv_37534317.mp3	Вӑл тусӗсемпе ҫыхӑнать те пулӑшмалли май шыраса тупатех.	1	0					cv	
d671834f547759a302d675c1eb2b6e63537d08b11724620f6fbf74828dd2fbdc76b4a91d2ff634b5e3641699847cf7cdd0d8d36bff4a3a4158c11d46f0174b5a	common_voice_cv_37534335.mp3	Усал шыҫҫа ҫӗнтереҫҫӗ, сывалаҫҫӗ.	0	0					cv	
d671834f547759a302d675c1eb2b6e63537d08b11724620f6fbf74828dd2fbdc76b4a91d2ff634b5e3641699847cf7cdd0d8d36bff4a3a4158c11d46f0174b5a	common_voice_cv_37534340.mp3	Ӑна инспекторсем ахальтен чарман.	0	0					cv	
d671834f547759a302d675c1eb2b6e63537d08b11724620f6fbf74828dd2fbdc76b4a91d2ff634b5e3641699847cf7cdd0d8d36bff4a3a4158c11d46f0174b5a	common_voice_cv_37534343.mp3	Йӗрке хуралҫисем ҫынна тартнӑ тӑрӑх халӗ служба тӗрӗслевӗ ирттереҫҫӗ.	0	0					cv	
d671834f547759a302d675c1eb2b6e63537d08b11724620f6fbf74828dd2fbdc76b4a91d2ff634b5e3641699847cf7cdd0d8d36bff4a3a4158c11d46f0174b5a	common_voice_cv_37534347.mp3	Эпĕ вĕсемпе пĕрре çеç выляса пăхассишĕнех тата тепĕр курпун хушма та хатĕрччĕ.	1	0					cv	
d671834f547759a302d675c1eb2b6e63537d08b11724620f6fbf74828dd2fbdc76b4a91d2ff634b5e3641699847cf7cdd0d8d36bff4a3a4158c11d46f0174b5a	common_voice_cv_37534361.mp3	Ҫар службине вӗҫлекенскер тавралӑха сӑнанӑ.	0	0					cv	
d671834f547759a302d675c1eb2b6e63537d08b11724620f6fbf74828dd2fbdc76b4a91d2ff634b5e3641699847cf7cdd0d8d36bff4a3a4158c11d46f0174b5a	common_voice_cv_37534362.mp3	Ҫак чӑваш каччи ҫинчен ахаль те нумай тӑрӑхра пӗлеҫҫӗ.	1	0					cv	
d671834f547759a302d675c1eb2b6e63537d08b11724620f6fbf74828dd2fbdc76b4a91d2ff634b5e3641699847cf7cdd0d8d36bff4a3a4158c11d46f0174b5a	common_voice_cv_37534364.mp3	Пӗр-икӗ кун иртсенех канӑҫне ҫухатать, пӑшӑрханать.	0	0					cv	
d671834f547759a302d675c1eb2b6e63537d08b11724620f6fbf74828dd2fbdc76b4a91d2ff634b5e3641699847cf7cdd0d8d36bff4a3a4158c11d46f0174b5a	common_voice_cv_37534366.mp3	Пӗрремӗшӗнчен, виҫӗ ҫулта пӗрре диспансеризаци тухмалла.	0	0					cv	
d671834f547759a302d675c1eb2b6e63537d08b11724620f6fbf74828dd2fbdc76b4a91d2ff634b5e3641699847cf7cdd0d8d36bff4a3a4158c11d46f0174b5a	common_voice_cv_37536409.mp3	Правасене чухламанскерсене юрист кирлех.	1	0					cv	
d671834f547759a302d675c1eb2b6e63537d08b11724620f6fbf74828dd2fbdc76b4a91d2ff634b5e3641699847cf7cdd0d8d36bff4a3a4158c11d46f0174b5a	common_voice_cv_37536410.mp3	Никамах та çук пуль тенĕччĕ — кунта пĕр пӳрт çын килсе тулнă иккен!	0	0					cv	
d671834f547759a302d675c1eb2b6e63537d08b11724620f6fbf74828dd2fbdc76b4a91d2ff634b5e3641699847cf7cdd0d8d36bff4a3a4158c11d46f0174b5a	common_voice_cv_37536411.mp3	Тепӗр тӗслӗхпе паллаштармасӑр чун чӑтмасть.	1	0					cv	
d671834f547759a302d675c1eb2b6e63537d08b11724620f6fbf74828dd2fbdc76b4a91d2ff634b5e3641699847cf7cdd0d8d36bff4a3a4158c11d46f0174b5a	common_voice_cv_37536412.mp3	Лавкка-кафе патне ҫывхараймӑн, хуралҫӑсем хӑвӑртах хӑвалаҫҫӗ.	0	0					cv	
d671834f547759a302d675c1eb2b6e63537d08b11724620f6fbf74828dd2fbdc76b4a91d2ff634b5e3641699847cf7cdd0d8d36bff4a3a4158c11d46f0174b5a	common_voice_cv_37536413.mp3	Шел те, унăн савнă мăшăрĕн, чăваш-хасар пике-еликĕн ятне те халлĕхе пĕлейместпĕр-ха.	1	0					cv	
d671834f547759a302d675c1eb2b6e63537d08b11724620f6fbf74828dd2fbdc76b4a91d2ff634b5e3641699847cf7cdd0d8d36bff4a3a4158c11d46f0174b5a	common_voice_cv_37536434.mp3	Вӗсем ӑна чирлӗ ҫын вырӑнне йышӑнман.	0	0					cv	
d671834f547759a302d675c1eb2b6e63537d08b11724620f6fbf74828dd2fbdc76b4a91d2ff634b5e3641699847cf7cdd0d8d36bff4a3a4158c11d46f0174b5a	common_voice_cv_37536435.mp3	Хальхи вӑхӑтра объектра ҫуртӑн ҫивӗттине витеҫҫӗ, электричество тытӑмне тӗпрен улӑштараҫҫӗ.	1	0					cv	
d671834f547759a302d675c1eb2b6e63537d08b11724620f6fbf74828dd2fbdc76b4a91d2ff634b5e3641699847cf7cdd0d8d36bff4a3a4158c11d46f0174b5a	common_voice_cv_37536436.mp3	Эпĕ ăна çăкăр сăмсине хуçса патăм.	0	0					cv	
d671834f547759a302d675c1eb2b6e63537d08b11724620f6fbf74828dd2fbdc76b4a91d2ff634b5e3641699847cf7cdd0d8d36bff4a3a4158c11d46f0174b5a	common_voice_cv_37536437.mp3	Унтан сасартăк пуçне питĕ лайăх шухăш, çĕнĕ шухăш пырса кĕчĕ.	0	0					cv	
d671834f547759a302d675c1eb2b6e63537d08b11724620f6fbf74828dd2fbdc76b4a91d2ff634b5e3641699847cf7cdd0d8d36bff4a3a4158c11d46f0174b5a	common_voice_cv_37536438.mp3	Ҫӗнӗ термин йышӑнасси хӑвӑрт пулакан япала мар, анчах та вӑл чӗлхе сывланине кӑтартать.	1	0					cv	
