client_id	path	sentence	up_votes	down_votes	age	gender	accents	variant	locale	segment
dcf2fb9555f721459c8271073c4b650e8f8bfcbdef90b751b671989a87aa46bdc19d99b18012dff50acb712300f1cbf3bdd1e50510e0adfe5e1bb26c8c763ba6	common_voice_cv_23902313.mp3	Юнашар пулмарĕ унпа ашшĕ: йывăр чух килсе пулăшмарĕ, савăннă вăхăтра пĕрле хĕпĕртемерĕ.	0	0					cv	
dcf2fb9555f721459c8271073c4b650e8f8bfcbdef90b751b671989a87aa46bdc19d99b18012dff50acb712300f1cbf3bdd1e50510e0adfe5e1bb26c8c763ba6	common_voice_cv_23902377.mp3	Унтан ĕçне те тупрĕ темелле — пурăнмалли çукки аптăратрĕ.	0	0					cv	
dcf2fb9555f721459c8271073c4b650e8f8bfcbdef90b751b671989a87aa46bdc19d99b18012dff50acb712300f1cbf3bdd1e50510e0adfe5e1bb26c8c763ba6	common_voice_cv_23902410.mp3	Вĕсем питĕ туслă пурăннă, мĕн кирлĕ — йăлтах пулнă.	0	0					cv	
dcf2fb9555f721459c8271073c4b650e8f8bfcbdef90b751b671989a87aa46bdc19d99b18012dff50acb712300f1cbf3bdd1e50510e0adfe5e1bb26c8c763ba6	common_voice_cv_23906758.mp3	Мĕн тăвăн ĕнтĕ çав çынна: ниепле те манаймасть ашшĕсĕр ӱснĕ хур пурнăçа.	0	0					cv	
df9cc54fe31e1a1a4265f2a4766879bc412b104c44dfbe12f6bf1be5870efeef44c81eadfb0a749216bd553361e600ff0ae44622b24d610f29ab591b3a32a418	common_voice_cv_34684082.mp3	Кун пирки концернӑн пресс-служби ҫак йӗркесен авторне паян хыпарланӑ.	1	1	twenties	male			cv	
d671834f547759a302d675c1eb2b6e63537d08b11724620f6fbf74828dd2fbdc76b4a91d2ff634b5e3641699847cf7cdd0d8d36bff4a3a4158c11d46f0174b5a	common_voice_cv_35582664.mp3	Халӗ донорсен юхӑмӗнче тӑракансем юн памашкӑн тӗрӗс хатӗрленнессипе ӗҫлетӗп.	1	1	fourties	male			cv	
d671834f547759a302d675c1eb2b6e63537d08b11724620f6fbf74828dd2fbdc76b4a91d2ff634b5e3641699847cf7cdd0d8d36bff4a3a4158c11d46f0174b5a	common_voice_cv_35583693.mp3	Шкулта, ача садӗнче апатланнӑшӑн парӑм ӳсет.	1	1	fourties	male			cv	
d671834f547759a302d675c1eb2b6e63537d08b11724620f6fbf74828dd2fbdc76b4a91d2ff634b5e3641699847cf7cdd0d8d36bff4a3a4158c11d46f0174b5a	common_voice_cv_35642037.mp3	Малашне вара тата ытларах пӗлӗҫ — халӗ ун пирки фильм ӳкереҫҫӗ.	1	1					cv	
d671834f547759a302d675c1eb2b6e63537d08b11724620f6fbf74828dd2fbdc76b4a91d2ff634b5e3641699847cf7cdd0d8d36bff4a3a4158c11d46f0174b5a	common_voice_cv_35642038.mp3	Пӗр уйӑхран ывӑлӑм канӑҫсӑрланма пуҫларӗ, урамра йӗрмӗшрӗ.	1	1					cv	
d671834f547759a302d675c1eb2b6e63537d08b11724620f6fbf74828dd2fbdc76b4a91d2ff634b5e3641699847cf7cdd0d8d36bff4a3a4158c11d46f0174b5a	common_voice_cv_35642039.mp3	Ҫӑм касмашӑкн Николаевсене тӑванӗсем пулӑшаҫҫӗ.	1	1					cv	
d671834f547759a302d675c1eb2b6e63537d08b11724620f6fbf74828dd2fbdc76b4a91d2ff634b5e3641699847cf7cdd0d8d36bff4a3a4158c11d46f0174b5a	common_voice_cv_35642076.mp3	Аякра пуртă-пăчкă сасси илтĕнет.	1	1					cv	
d671834f547759a302d675c1eb2b6e63537d08b11724620f6fbf74828dd2fbdc76b4a91d2ff634b5e3641699847cf7cdd0d8d36bff4a3a4158c11d46f0174b5a	common_voice_cv_35666011.mp3	Унăн мухтавĕ çинчен пĕтĕм тĕнче пĕлсе çитнĕ.	1	1					cv	
d671834f547759a302d675c1eb2b6e63537d08b11724620f6fbf74828dd2fbdc76b4a91d2ff634b5e3641699847cf7cdd0d8d36bff4a3a4158c11d46f0174b5a	common_voice_cv_35783460.mp3	Фарук ашшĕ суту-илӳ енĕпе пулăшрĕ, амăшĕ ватă Зохерпа ялта пурăнчĕ.	1	1					cv	
d671834f547759a302d675c1eb2b6e63537d08b11724620f6fbf74828dd2fbdc76b4a91d2ff634b5e3641699847cf7cdd0d8d36bff4a3a4158c11d46f0174b5a	common_voice_cv_35783591.mp3	Каçпулттипе сиккипе ыраш пусси хĕррипе çавраçил пек пынă чух вăрманта чĕлĕм чĕртме тапратнă.	1	1					cv	
d671834f547759a302d675c1eb2b6e63537d08b11724620f6fbf74828dd2fbdc76b4a91d2ff634b5e3641699847cf7cdd0d8d36bff4a3a4158c11d46f0174b5a	common_voice_cv_35783696.mp3	Сережа çĕççине илсе кĕсьене чикрĕ те малалла кайрĕ.	1	1					cv	
d671834f547759a302d675c1eb2b6e63537d08b11724620f6fbf74828dd2fbdc76b4a91d2ff634b5e3641699847cf7cdd0d8d36bff4a3a4158c11d46f0174b5a	common_voice_cv_35783749.mp3	Ҫак кунсенче тепӗр пепке ҫапла майпа ҫут тӗнчене килнӗ.	1	1					cv	
d671834f547759a302d675c1eb2b6e63537d08b11724620f6fbf74828dd2fbdc76b4a91d2ff634b5e3641699847cf7cdd0d8d36bff4a3a4158c11d46f0174b5a	common_voice_cv_35783874.mp3	Хӗр-хӗрарӑмсенчен чылайӑшӗ гардероба ҫӗнетмешкӗн лавккана ҫул тытӗ.	1	1					cv	
d671834f547759a302d675c1eb2b6e63537d08b11724620f6fbf74828dd2fbdc76b4a91d2ff634b5e3641699847cf7cdd0d8d36bff4a3a4158c11d46f0174b5a	common_voice_cv_35840746.mp3	Марье аппа тем хăрушă тĕлĕксемпе аташса выртса хăранăран-ши тăруках вăранса кайрĕ.	1	1					cv	
d671834f547759a302d675c1eb2b6e63537d08b11724620f6fbf74828dd2fbdc76b4a91d2ff634b5e3641699847cf7cdd0d8d36bff4a3a4158c11d46f0174b5a	common_voice_cv_35880132.mp3	Унта мӗн тӗллевпе каяҫҫӗ-ха вӗсем?	1	1					cv	
d671834f547759a302d675c1eb2b6e63537d08b11724620f6fbf74828dd2fbdc76b4a91d2ff634b5e3641699847cf7cdd0d8d36bff4a3a4158c11d46f0174b5a	common_voice_cv_35880469.mp3	Малашлӑха палӑртмалли, карьерӑра аталанмалли вӑхӑт.	1	1					cv	
d671834f547759a302d675c1eb2b6e63537d08b11724620f6fbf74828dd2fbdc76b4a91d2ff634b5e3641699847cf7cdd0d8d36bff4a3a4158c11d46f0174b5a	common_voice_cv_35881743.mp3	Пӗлтӗр вара купель ӑсталарӑмӑр.	1	1					cv	
d671834f547759a302d675c1eb2b6e63537d08b11724620f6fbf74828dd2fbdc76b4a91d2ff634b5e3641699847cf7cdd0d8d36bff4a3a4158c11d46f0174b5a	common_voice_cv_35881908.mp3	Декрета тухиччен интернетри лавккасемпе пачах кӑсӑкланмастӑм.	1	1					cv	
d671834f547759a302d675c1eb2b6e63537d08b11724620f6fbf74828dd2fbdc76b4a91d2ff634b5e3641699847cf7cdd0d8d36bff4a3a4158c11d46f0174b5a	common_voice_cv_35882223.mp3	Ача шӑрпӑкпа вылянине пула, хуҫалӑхри хуралтӑ чутах ҫунса кӗлленмен.	1	1					cv	
cab6ec5f9daf58fadd2b178d6f75f4a150a2465cb0157ddd699b2bf2b964871c8ae7dc0fc8e01f32573a0a9f5e0361c17cc13e81b9772e3c39ae5990afe5620f	common_voice_cv_37436603.mp3	ҫапла	0	0					cv	Benchmark
cab6ec5f9daf58fadd2b178d6f75f4a150a2465cb0157ddd699b2bf2b964871c8ae7dc0fc8e01f32573a0a9f5e0361c17cc13e81b9772e3c39ae5990afe5620f	common_voice_cv_37436604.mp3	ҫук	0	0					cv	Benchmark
cab6ec5f9daf58fadd2b178d6f75f4a150a2465cb0157ddd699b2bf2b964871c8ae7dc0fc8e01f32573a0a9f5e0361c17cc13e81b9772e3c39ae5990afe5620f	common_voice_cv_37436605.mp3	пиллӗк	0	0					cv	Benchmark
cab6ec5f9daf58fadd2b178d6f75f4a150a2465cb0157ddd699b2bf2b964871c8ae7dc0fc8e01f32573a0a9f5e0361c17cc13e81b9772e3c39ae5990afe5620f	common_voice_cv_37436606.mp3	ҫиччӗ	0	0					cv	Benchmark
cab6ec5f9daf58fadd2b178d6f75f4a150a2465cb0157ddd699b2bf2b964871c8ae7dc0fc8e01f32573a0a9f5e0361c17cc13e81b9772e3c39ae5990afe5620f	common_voice_cv_37436607.mp3	саккӑр	0	0					cv	Benchmark
f5a79f1d50a2964b6ba18dfa6265bad72e584139e81ce0371501a0920d7c03e3dfe8555ec06af4c8cd15f4c5ac4893a5c8a841a1fa47a5063e66f3198e06e5f4	common_voice_cv_37436727.mp3	ҫук	0	0	twenties	male	Верхний 		cv	Benchmark
f5a79f1d50a2964b6ba18dfa6265bad72e584139e81ce0371501a0920d7c03e3dfe8555ec06af4c8cd15f4c5ac4893a5c8a841a1fa47a5063e66f3198e06e5f4	common_voice_cv_37436728.mp3	пӗрре	0	0	twenties	male	Верхний 		cv	Benchmark
f5a79f1d50a2964b6ba18dfa6265bad72e584139e81ce0371501a0920d7c03e3dfe8555ec06af4c8cd15f4c5ac4893a5c8a841a1fa47a5063e66f3198e06e5f4	common_voice_cv_37436729.mp3	тӑххӑр	0	0	twenties	male	Верхний 		cv	Benchmark
f5a79f1d50a2964b6ba18dfa6265bad72e584139e81ce0371501a0920d7c03e3dfe8555ec06af4c8cd15f4c5ac4893a5c8a841a1fa47a5063e66f3198e06e5f4	common_voice_cv_37436731.mp3	пиллӗк	0	0	twenties	male	Верхний 		cv	Benchmark
f5a79f1d50a2964b6ba18dfa6265bad72e584139e81ce0371501a0920d7c03e3dfe8555ec06af4c8cd15f4c5ac4893a5c8a841a1fa47a5063e66f3198e06e5f4	common_voice_cv_37436733.mp3	тӑваттӑ	0	0	twenties	male	Верхний 		cv	Benchmark
f5a79f1d50a2964b6ba18dfa6265bad72e584139e81ce0371501a0920d7c03e3dfe8555ec06af4c8cd15f4c5ac4893a5c8a841a1fa47a5063e66f3198e06e5f4	common_voice_cv_37436777.mp3	ҫапла	0	0	twenties	male	Верхний 		cv	Benchmark
f5a79f1d50a2964b6ba18dfa6265bad72e584139e81ce0371501a0920d7c03e3dfe8555ec06af4c8cd15f4c5ac4893a5c8a841a1fa47a5063e66f3198e06e5f4	common_voice_cv_37436778.mp3	виҫҫӗ	0	0	twenties	male	Верхний 		cv	Benchmark
f5a79f1d50a2964b6ba18dfa6265bad72e584139e81ce0371501a0920d7c03e3dfe8555ec06af4c8cd15f4c5ac4893a5c8a841a1fa47a5063e66f3198e06e5f4	common_voice_cv_37436779.mp3	Пуринчен те ытларах шăллĕне Серафима Николаевнăран лекетчĕ.	0	0	twenties	male	Верхний 		cv	
f5a79f1d50a2964b6ba18dfa6265bad72e584139e81ce0371501a0920d7c03e3dfe8555ec06af4c8cd15f4c5ac4893a5c8a841a1fa47a5063e66f3198e06e5f4	common_voice_cv_37436781.mp3	Ют ҫӗршывсем, наци республикисем хӑйсен лингвохӑтлавӗпе паллаштарӗҫ.	0	0	twenties	male	Верхний 		cv	
f5a79f1d50a2964b6ba18dfa6265bad72e584139e81ce0371501a0920d7c03e3dfe8555ec06af4c8cd15f4c5ac4893a5c8a841a1fa47a5063e66f3198e06e5f4	common_voice_cv_37436812.mp3	Аса илтерер, ку истори пӗлтӗрхи раштав уйӑхӗнченпех тӑсӑлать.	0	0	twenties	male	Верхний 		cv	
f5a79f1d50a2964b6ba18dfa6265bad72e584139e81ce0371501a0920d7c03e3dfe8555ec06af4c8cd15f4c5ac4893a5c8a841a1fa47a5063e66f3198e06e5f4	common_voice_cv_37436813.mp3	Кукамӑшӗ пӗлтернӗ тӑрӑх, мӑнукӗ республикӑри наркологи диспансерне кайнӑ.	0	0	twenties	male	Верхний 		cv	
f5a79f1d50a2964b6ba18dfa6265bad72e584139e81ce0371501a0920d7c03e3dfe8555ec06af4c8cd15f4c5ac4893a5c8a841a1fa47a5063e66f3198e06e5f4	common_voice_cv_37436814.mp3	Ытти паллӑ ентеше те асрах тытать ял халӑхӗ.	0	0	twenties	male	Верхний 		cv	
f5a79f1d50a2964b6ba18dfa6265bad72e584139e81ce0371501a0920d7c03e3dfe8555ec06af4c8cd15f4c5ac4893a5c8a841a1fa47a5063e66f3198e06e5f4	common_voice_cv_37436815.mp3	Посылкӑна уҫсан йӑл кулӑ ҫухалчӗ.	0	0	twenties	male	Верхний 		cv	
f5a79f1d50a2964b6ba18dfa6265bad72e584139e81ce0371501a0920d7c03e3dfe8555ec06af4c8cd15f4c5ac4893a5c8a841a1fa47a5063e66f3198e06e5f4	common_voice_cv_37436816.mp3	Анчах арҫынна икӗ уйӑх шалу тӳлемен.	0	0	twenties	male	Верхний 		cv	
f5a79f1d50a2964b6ba18dfa6265bad72e584139e81ce0371501a0920d7c03e3dfe8555ec06af4c8cd15f4c5ac4893a5c8a841a1fa47a5063e66f3198e06e5f4	common_voice_cv_37436871.mp3	Ишӗлчӗк айӗнче миҫе ҫын пулма пултарассине хальлӗхе пӗлтермен.	0	0	twenties	male	Верхний 		cv	
f5a79f1d50a2964b6ba18dfa6265bad72e584139e81ce0371501a0920d7c03e3dfe8555ec06af4c8cd15f4c5ac4893a5c8a841a1fa47a5063e66f3198e06e5f4	common_voice_cv_37436939.mp3	Эрехĕ пирки те манмарĕ, меллĕ самант тупăнсанах хĕре черкке тыттарчĕ.	0	0	twenties	male	Верхний 		cv	
f5a79f1d50a2964b6ba18dfa6265bad72e584139e81ce0371501a0920d7c03e3dfe8555ec06af4c8cd15f4c5ac4893a5c8a841a1fa47a5063e66f3198e06e5f4	common_voice_cv_37436941.mp3	Нушаллӑ пурӑнакан ҫын ҫӑкӑра йышӑнатех, тав тӑвать.	0	0	twenties	male	Верхний 		cv	
f5a79f1d50a2964b6ba18dfa6265bad72e584139e81ce0371501a0920d7c03e3dfe8555ec06af4c8cd15f4c5ac4893a5c8a841a1fa47a5063e66f3198e06e5f4	common_voice_cv_37436943.mp3	Кунсӑр пуҫне вӗсене ҫитермешкӗн сӗлӗ, урпа туянаҫҫӗ.	0	0	twenties	male	Верхний 		cv	
f5a79f1d50a2964b6ba18dfa6265bad72e584139e81ce0371501a0920d7c03e3dfe8555ec06af4c8cd15f4c5ac4893a5c8a841a1fa47a5063e66f3198e06e5f4	common_voice_cv_37436959.mp3	Хуралтӑсене, дачӑна ҫӗнетме те юрать.	0	0	twenties	male	Верхний 		cv	
f5a79f1d50a2964b6ba18dfa6265bad72e584139e81ce0371501a0920d7c03e3dfe8555ec06af4c8cd15f4c5ac4893a5c8a841a1fa47a5063e66f3198e06e5f4	common_voice_cv_37436960.mp3	Предприятире панкрутлӑха кӑларнине министр трактор савутне сыватма кирлӗ тесе ӑнлантарнӑ.	0	0	twenties	male	Верхний 		cv	
f5a79f1d50a2964b6ba18dfa6265bad72e584139e81ce0371501a0920d7c03e3dfe8555ec06af4c8cd15f4c5ac4893a5c8a841a1fa47a5063e66f3198e06e5f4	common_voice_cv_37436961.mp3	Хайхискер лекци вуланӑ хыҫҫӑн килелле утнӑ.	0	0	twenties	male	Верхний 		cv	
f5a79f1d50a2964b6ba18dfa6265bad72e584139e81ce0371501a0920d7c03e3dfe8555ec06af4c8cd15f4c5ac4893a5c8a841a1fa47a5063e66f3198e06e5f4	common_voice_cv_37436962.mp3	Арҫынна ҫирӗп айӑплама сӑлтав пулнӑ-мӗн.	0	0	twenties	male	Верхний 		cv	
f5a79f1d50a2964b6ba18dfa6265bad72e584139e81ce0371501a0920d7c03e3dfe8555ec06af4c8cd15f4c5ac4893a5c8a841a1fa47a5063e66f3198e06e5f4	common_voice_cv_37436963.mp3	Ачи аптрамасть-ха, кăштах вăтанасси-именесси пур хăйĕн.	0	0	twenties	male	Верхний 		cv	
f5a79f1d50a2964b6ba18dfa6265bad72e584139e81ce0371501a0920d7c03e3dfe8555ec06af4c8cd15f4c5ac4893a5c8a841a1fa47a5063e66f3198e06e5f4	common_voice_cv_37436971.mp3	Ҫурӑмӗ тӗлӗнчи бронижилета пульӑсем шӑйӑрттарнӑ, пӗри хӗсӗнсе ларнӑ.	0	0	twenties	male	Верхний 		cv	
f5a79f1d50a2964b6ba18dfa6265bad72e584139e81ce0371501a0920d7c03e3dfe8555ec06af4c8cd15f4c5ac4893a5c8a841a1fa47a5063e66f3198e06e5f4	common_voice_cv_37436973.mp3	Ку вӑл — пуҫиле пӗрремӗш ӗҫ.	0	0	twenties	male	Верхний 		cv	
f5a79f1d50a2964b6ba18dfa6265bad72e584139e81ce0371501a0920d7c03e3dfe8555ec06af4c8cd15f4c5ac4893a5c8a841a1fa47a5063e66f3198e06e5f4	common_voice_cv_37436974.mp3	Анчах унăн ывăлĕ те мăнукĕ те пулман, тетчĕç пулас.	0	0	twenties	male	Верхний 		cv	
f5a79f1d50a2964b6ba18dfa6265bad72e584139e81ce0371501a0920d7c03e3dfe8555ec06af4c8cd15f4c5ac4893a5c8a841a1fa47a5063e66f3198e06e5f4	common_voice_cv_37436975.mp3	Ҫӑлавҫӑсем тупиччен хӗрарӑмӑн телефонӗ сӳнсе ларнӑ.	0	0	twenties	male	Верхний 		cv	
f5a79f1d50a2964b6ba18dfa6265bad72e584139e81ce0371501a0920d7c03e3dfe8555ec06af4c8cd15f4c5ac4893a5c8a841a1fa47a5063e66f3198e06e5f4	common_voice_cv_37436976.mp3	Ҫӗнӗ функцисемпе пуян гаджета чӑтӑмсӑррӑн кӗтнӗ.	0	0	twenties	male	Верхний 		cv	
d671834f547759a302d675c1eb2b6e63537d08b11724620f6fbf74828dd2fbdc76b4a91d2ff634b5e3641699847cf7cdd0d8d36bff4a3a4158c11d46f0174b5a	common_voice_cv_37437823.mp3	Чӑтаймасӑр Шупашкарти кӑнтӑр хӗвел анӑҫӗнчи ача-пӑча поликлиникине ҫитрӗм.	1	0					cv	
d671834f547759a302d675c1eb2b6e63537d08b11724620f6fbf74828dd2fbdc76b4a91d2ff634b5e3641699847cf7cdd0d8d36bff4a3a4158c11d46f0174b5a	common_voice_cv_37437824.mp3	Мускавпа Питӗр хулисем политикӑран уйрӑмах аякра тӑнине ҫиеле тухнӑ.	1	0					cv	
d671834f547759a302d675c1eb2b6e63537d08b11724620f6fbf74828dd2fbdc76b4a91d2ff634b5e3641699847cf7cdd0d8d36bff4a3a4158c11d46f0174b5a	common_voice_cv_37437825.mp3	Те Турă пулăшрĕ, те шăпи çапларах килсе тухрĕ, вĕсем тĕл пулчĕç.	1	0					cv	
d671834f547759a302d675c1eb2b6e63537d08b11724620f6fbf74828dd2fbdc76b4a91d2ff634b5e3641699847cf7cdd0d8d36bff4a3a4158c11d46f0174b5a	common_voice_cv_37437826.mp3	Якур пичче кăна мар, пĕтĕм ял эп юрăç пуласса кĕтетчĕ.	1	0					cv	
d671834f547759a302d675c1eb2b6e63537d08b11724620f6fbf74828dd2fbdc76b4a91d2ff634b5e3641699847cf7cdd0d8d36bff4a3a4158c11d46f0174b5a	common_voice_cv_37437827.mp3	Светăн ирхине кăмăл пăтранасси эрнене яхăн тăсăлчĕ, пурпĕрех иртсе каймарĕ.	1	0					cv	
d671834f547759a302d675c1eb2b6e63537d08b11724620f6fbf74828dd2fbdc76b4a91d2ff634b5e3641699847cf7cdd0d8d36bff4a3a4158c11d46f0174b5a	common_voice_cv_37437833.mp3	Вăл хăй фермăра дояркăра ĕçлет.	1	0					cv	
d671834f547759a302d675c1eb2b6e63537d08b11724620f6fbf74828dd2fbdc76b4a91d2ff634b5e3641699847cf7cdd0d8d36bff4a3a4158c11d46f0174b5a	common_voice_cv_37437834.mp3	Ҫулла кӗтӳ каймалли черет ҫитнӗ.	1	0					cv	
d671834f547759a302d675c1eb2b6e63537d08b11724620f6fbf74828dd2fbdc76b4a91d2ff634b5e3641699847cf7cdd0d8d36bff4a3a4158c11d46f0174b5a	common_voice_cv_37437835.mp3	Ҫамрӑксене хӗрхеннипе спортзал уҫнӑ	1	0					cv	
d671834f547759a302d675c1eb2b6e63537d08b11724620f6fbf74828dd2fbdc76b4a91d2ff634b5e3641699847cf7cdd0d8d36bff4a3a4158c11d46f0174b5a	common_voice_cv_37437837.mp3	Кулянса табло патне ҫитрӗм.	1	0					cv	
d671834f547759a302d675c1eb2b6e63537d08b11724620f6fbf74828dd2fbdc76b4a91d2ff634b5e3641699847cf7cdd0d8d36bff4a3a4158c11d46f0174b5a	common_voice_cv_37437867.mp3	Ҫапла хамӑртан тӗртсе тӑшман тӑвасшӑн тапаҫланнине сивлетӗп эпӗ.	1	0					cv	
d671834f547759a302d675c1eb2b6e63537d08b11724620f6fbf74828dd2fbdc76b4a91d2ff634b5e3641699847cf7cdd0d8d36bff4a3a4158c11d46f0174b5a	common_voice_cv_37437868.mp3	Анчах яланах хăратни мана çырлахтарми пулчĕ.	1	0					cv	
d671834f547759a302d675c1eb2b6e63537d08b11724620f6fbf74828dd2fbdc76b4a91d2ff634b5e3641699847cf7cdd0d8d36bff4a3a4158c11d46f0174b5a	common_voice_cv_37437869.mp3	Ҫепӗҫ туйӑмсем ҫӗнӗрен вӑй илӗҫ.	1	0					cv	
d671834f547759a302d675c1eb2b6e63537d08b11724620f6fbf74828dd2fbdc76b4a91d2ff634b5e3641699847cf7cdd0d8d36bff4a3a4158c11d46f0174b5a	common_voice_cv_37437870.mp3	Пӗрремӗш пулӑшу пама вӗрентеҫҫӗ	1	0					cv	
d671834f547759a302d675c1eb2b6e63537d08b11724620f6fbf74828dd2fbdc76b4a91d2ff634b5e3641699847cf7cdd0d8d36bff4a3a4158c11d46f0174b5a	common_voice_cv_37437871.mp3	Анчах вĕсем хытă таратчĕç.	1	0					cv	
d671834f547759a302d675c1eb2b6e63537d08b11724620f6fbf74828dd2fbdc76b4a91d2ff634b5e3641699847cf7cdd0d8d36bff4a3a4158c11d46f0174b5a	common_voice_cv_37437872.mp3	Чĕкеç чĕппи тесе чĕнетчĕç Уринене пĕчĕк чух.	1	0					cv	
d671834f547759a302d675c1eb2b6e63537d08b11724620f6fbf74828dd2fbdc76b4a91d2ff634b5e3641699847cf7cdd0d8d36bff4a3a4158c11d46f0174b5a	common_voice_cv_37437873.mp3	Телефонпа е тӗл пулура сӳтсе явмалли тупӑнсах тӑрӗ.	1	0					cv	
d671834f547759a302d675c1eb2b6e63537d08b11724620f6fbf74828dd2fbdc76b4a91d2ff634b5e3641699847cf7cdd0d8d36bff4a3a4158c11d46f0174b5a	common_voice_cv_37437874.mp3	Нумаях пулмасть вырӑнти влаҫ нумай ачаллӑ ҫемьене ҫурт туса панӑ.	1	0					cv	
d671834f547759a302d675c1eb2b6e63537d08b11724620f6fbf74828dd2fbdc76b4a91d2ff634b5e3641699847cf7cdd0d8d36bff4a3a4158c11d46f0174b5a	common_voice_cv_37437875.mp3	Анчах сап-сарӑ куҫӗ тӳрех шиклӗх туйӑмӗ ҫуратрӗ.	1	0					cv	
d671834f547759a302d675c1eb2b6e63537d08b11724620f6fbf74828dd2fbdc76b4a91d2ff634b5e3641699847cf7cdd0d8d36bff4a3a4158c11d46f0174b5a	common_voice_cv_37437882.mp3	Эпир унӑн халалне ялан асра тытатпӑр.	1	0					cv	
d671834f547759a302d675c1eb2b6e63537d08b11724620f6fbf74828dd2fbdc76b4a91d2ff634b5e3641699847cf7cdd0d8d36bff4a3a4158c11d46f0174b5a	common_voice_cv_37437883.mp3	Паттӑррӑн ҫапӑҫнӑ Сергея граната ванчӑкӗ лекнӗ, вилмеллех амантнӑ.	1	0					cv	
d671834f547759a302d675c1eb2b6e63537d08b11724620f6fbf74828dd2fbdc76b4a91d2ff634b5e3641699847cf7cdd0d8d36bff4a3a4158c11d46f0174b5a	common_voice_cv_37437884.mp3	Ыттисене те ун патӗнче тавар туянассинчен хӑтарать.	1	0					cv	
d671834f547759a302d675c1eb2b6e63537d08b11724620f6fbf74828dd2fbdc76b4a91d2ff634b5e3641699847cf7cdd0d8d36bff4a3a4158c11d46f0174b5a	common_voice_cv_37437885.mp3	Тухтӑр палламан ҫын нушине ӑнланни тӗлӗнтерчӗ, ачана тӗрӗслерӗ.	1	0					cv	
d671834f547759a302d675c1eb2b6e63537d08b11724620f6fbf74828dd2fbdc76b4a91d2ff634b5e3641699847cf7cdd0d8d36bff4a3a4158c11d46f0174b5a	common_voice_cv_37437886.mp3	Препаратсен витӗмне пула чылайӑшӗ вырӑн ҫинчен тӑраймасть.	1	0					cv	
d671834f547759a302d675c1eb2b6e63537d08b11724620f6fbf74828dd2fbdc76b4a91d2ff634b5e3641699847cf7cdd0d8d36bff4a3a4158c11d46f0174b5a	common_voice_cv_37437897.mp3	Иккĕмĕш каç тĕлне çеç тĕпсĕр те тарăн Шуйттан çырмине пырса тухрĕç шыракансем.	1	0					cv	
d671834f547759a302d675c1eb2b6e63537d08b11724620f6fbf74828dd2fbdc76b4a91d2ff634b5e3641699847cf7cdd0d8d36bff4a3a4158c11d46f0174b5a	common_voice_cv_37437898.mp3	Шур пӳрт тунине курсан виле пуласса пĕлтерет тесе калатчĕ те анне.	1	0					cv	
d671834f547759a302d675c1eb2b6e63537d08b11724620f6fbf74828dd2fbdc76b4a91d2ff634b5e3641699847cf7cdd0d8d36bff4a3a4158c11d46f0174b5a	common_voice_cv_37437899.mp3	Троллейбусӑн линине тӑсмашкӑн йывӑр, автобус бензинӗ вара тавралӑха варалать.	0	1					cv	
d671834f547759a302d675c1eb2b6e63537d08b11724620f6fbf74828dd2fbdc76b4a91d2ff634b5e3641699847cf7cdd0d8d36bff4a3a4158c11d46f0174b5a	common_voice_cv_37437900.mp3	Каярахпа Византи тепĕр императорĕ Филиппик те çак çулпах кайнă.	1	0					cv	
d671834f547759a302d675c1eb2b6e63537d08b11724620f6fbf74828dd2fbdc76b4a91d2ff634b5e3641699847cf7cdd0d8d36bff4a3a4158c11d46f0174b5a	common_voice_cv_37437901.mp3	Спорт хатӗрӗсем те яланах кирлисен йышӗнче.	1	0					cv	
d671834f547759a302d675c1eb2b6e63537d08b11724620f6fbf74828dd2fbdc76b4a91d2ff634b5e3641699847cf7cdd0d8d36bff4a3a4158c11d46f0174b5a	common_voice_cv_37437907.mp3	Кашни кунах ĕç тупăнсах пымасть, кăшт-кăшт пăхкаласа илет те каçченех пушă.	1	0					cv	
d671834f547759a302d675c1eb2b6e63537d08b11724620f6fbf74828dd2fbdc76b4a91d2ff634b5e3641699847cf7cdd0d8d36bff4a3a4158c11d46f0174b5a	common_voice_cv_37437908.mp3	Вăл тетĕшĕнчен чылай çӳллĕрех, яштака кĕлеткеллĕ, тăн-тăн çирĕп хул-çурăмлă.	1	0					cv	
d671834f547759a302d675c1eb2b6e63537d08b11724620f6fbf74828dd2fbdc76b4a91d2ff634b5e3641699847cf7cdd0d8d36bff4a3a4158c11d46f0174b5a	common_voice_cv_37437909.mp3	Йӗпреҫ районӗнчи «Заря» агрофирмӑра пӑру вити уҫӑлнӑ.	1	0					cv	
d671834f547759a302d675c1eb2b6e63537d08b11724620f6fbf74828dd2fbdc76b4a91d2ff634b5e3641699847cf7cdd0d8d36bff4a3a4158c11d46f0174b5a	common_voice_cv_37437911.mp3	Юпа унран юлмарĕ, малтах пычĕ.	1	0					cv	
d671834f547759a302d675c1eb2b6e63537d08b11724620f6fbf74828dd2fbdc76b4a91d2ff634b5e3641699847cf7cdd0d8d36bff4a3a4158c11d46f0174b5a	common_voice_cv_37437917.mp3	Ҫавна пула транспорт ҫӳресси ҫур сехетлӗхе чарӑннине пӗлтереҫҫӗ.	1	0					cv	
d671834f547759a302d675c1eb2b6e63537d08b11724620f6fbf74828dd2fbdc76b4a91d2ff634b5e3641699847cf7cdd0d8d36bff4a3a4158c11d46f0174b5a	common_voice_cv_37437918.mp3	Йӗкӗрешсем канмалли кунсерен ашшӗ-амӑшӗ патне ҫитсе килме тӑрӑшаҫҫӗ.	1	0					cv	
d671834f547759a302d675c1eb2b6e63537d08b11724620f6fbf74828dd2fbdc76b4a91d2ff634b5e3641699847cf7cdd0d8d36bff4a3a4158c11d46f0174b5a	common_voice_cv_37437920.mp3	Ача аптӑрасан та тӑхтаса тӑмасӑр тухтӑра кӑтартмалла.	1	0					cv	
d671834f547759a302d675c1eb2b6e63537d08b11724620f6fbf74828dd2fbdc76b4a91d2ff634b5e3641699847cf7cdd0d8d36bff4a3a4158c11d46f0174b5a	common_voice_cv_37437921.mp3	Ванюк хăйĕнпе пулса иртнĕ мыскарана каласа парсан пурте ахăлтатса кулса ячĕç.	1	0					cv	
d671834f547759a302d675c1eb2b6e63537d08b11724620f6fbf74828dd2fbdc76b4a91d2ff634b5e3641699847cf7cdd0d8d36bff4a3a4158c11d46f0174b5a	common_voice_cv_37437926.mp3	Пепке ашшӗ-амӑшӗн юратӑвне туйтӑр.	1	0					cv	
d671834f547759a302d675c1eb2b6e63537d08b11724620f6fbf74828dd2fbdc76b4a91d2ff634b5e3641699847cf7cdd0d8d36bff4a3a4158c11d46f0174b5a	common_voice_cv_37437927.mp3	Калаçкаласа пырса Акриппин кинемей пурăнакан пӳрт умне çитнине сиссе те юлаймарăмăр.	0	1					cv	
d671834f547759a302d675c1eb2b6e63537d08b11724620f6fbf74828dd2fbdc76b4a91d2ff634b5e3641699847cf7cdd0d8d36bff4a3a4158c11d46f0174b5a	common_voice_cv_37437928.mp3	Ун чухне куракансем йӗркелӳҫӗсене сӗнӳ панӑ: фильмсене канмалли кунсенче кӑтартмалла.	1	0					cv	
