client_id	path	sentence	up_votes	down_votes	age	gender	accents	variant	locale	segment
fcbf0ad71bbc820e22feb3fac5a02f983f074a839f6e335ce3d7680fc06c699fdf97c68cb69176cbfe1f3b100515053ff2688cc690b2adbe1bdae734fa62eff5	common_voice_hsb_20376681.mp3	Wobě jězdźence móža sej zajimcy jako abonement na znajmjeńša dwanaće měsacow kupić.	2	0	fourties	male			hsb	
fcbf0ad71bbc820e22feb3fac5a02f983f074a839f6e335ce3d7680fc06c699fdf97c68cb69176cbfe1f3b100515053ff2688cc690b2adbe1bdae734fa62eff5	common_voice_hsb_20376682.mp3	Prěnja internetna strona wuhlada swětło elektroniskeho swěta.	2	0	fourties	male			hsb	
fcbf0ad71bbc820e22feb3fac5a02f983f074a839f6e335ce3d7680fc06c699fdf97c68cb69176cbfe1f3b100515053ff2688cc690b2adbe1bdae734fa62eff5	common_voice_hsb_20376683.mp3	Kak dołho trjebam ja z awtom hač tam?	2	0	fourties	male			hsb	
fcbf0ad71bbc820e22feb3fac5a02f983f074a839f6e335ce3d7680fc06c699fdf97c68cb69176cbfe1f3b100515053ff2688cc690b2adbe1bdae734fa62eff5	common_voice_hsb_20376684.mp3	Wój stej jeho hubjene na tutón podawk přihotowałoj.	2	0	fourties	male			hsb	
fcbf0ad71bbc820e22feb3fac5a02f983f074a839f6e335ce3d7680fc06c699fdf97c68cb69176cbfe1f3b100515053ff2688cc690b2adbe1bdae734fa62eff5	common_voice_hsb_20376685.mp3	Strowotniski zarjad Zhorjelskeho wokrjesa pruwuje w kupanskej sezonje prawidłownje kwalitu wody a přibrjohow.	2	0	fourties	male			hsb	
fcbf0ad71bbc820e22feb3fac5a02f983f074a839f6e335ce3d7680fc06c699fdf97c68cb69176cbfe1f3b100515053ff2688cc690b2adbe1bdae734fa62eff5	common_voice_hsb_20376686.mp3	A te w Němskej nimamy, ale w Africe, Argentinskej, Boliwiskej a Chile.	2	0	fourties	male			hsb	
fcbf0ad71bbc820e22feb3fac5a02f983f074a839f6e335ce3d7680fc06c699fdf97c68cb69176cbfe1f3b100515053ff2688cc690b2adbe1bdae734fa62eff5	common_voice_hsb_20376687.mp3	Wone dyrbja w serbskim sydlenskim rumje Braniborskeje aktiwni być.	2	0	fourties	male			hsb	
fcbf0ad71bbc820e22feb3fac5a02f983f074a839f6e335ce3d7680fc06c699fdf97c68cb69176cbfe1f3b100515053ff2688cc690b2adbe1bdae734fa62eff5	common_voice_hsb_20376688.mp3	To dotal hišće njebě.	2	1	fourties	male			hsb	
fcbf0ad71bbc820e22feb3fac5a02f983f074a839f6e335ce3d7680fc06c699fdf97c68cb69176cbfe1f3b100515053ff2688cc690b2adbe1bdae734fa62eff5	common_voice_hsb_20376694.mp3	Přejemy sej serbske rěčne znajomosće abo zwólniwosć, sej tute přiswojić.	2	0	fourties	male			hsb	
fcbf0ad71bbc820e22feb3fac5a02f983f074a839f6e335ce3d7680fc06c699fdf97c68cb69176cbfe1f3b100515053ff2688cc690b2adbe1bdae734fa62eff5	common_voice_hsb_20376695.mp3	Smy wuhibki w swobodnym staće znowa nastajili.	2	0	fourties	male			hsb	
fcbf0ad71bbc820e22feb3fac5a02f983f074a839f6e335ce3d7680fc06c699fdf97c68cb69176cbfe1f3b100515053ff2688cc690b2adbe1bdae734fa62eff5	common_voice_hsb_20376696.mp3	Wonaj połožištaj zymske drasty do wačoka a podaštaj so do horow.	2	0	fourties	male			hsb	
fcbf0ad71bbc820e22feb3fac5a02f983f074a839f6e335ce3d7680fc06c699fdf97c68cb69176cbfe1f3b100515053ff2688cc690b2adbe1bdae734fa62eff5	common_voice_hsb_20376697.mp3	Wonej stej přez dźěłowe kondicije pola dźěłarnistwa skoržiłoj.	2	0	fourties	male			hsb	
fcbf0ad71bbc820e22feb3fac5a02f983f074a839f6e335ce3d7680fc06c699fdf97c68cb69176cbfe1f3b100515053ff2688cc690b2adbe1bdae734fa62eff5	common_voice_hsb_20376708.mp3	Tydźeń zašo hač hewak je so w Radworju domchowanka swjećiła.	2	0	fourties	male			hsb	
fcbf0ad71bbc820e22feb3fac5a02f983f074a839f6e335ce3d7680fc06c699fdf97c68cb69176cbfe1f3b100515053ff2688cc690b2adbe1bdae734fa62eff5	common_voice_hsb_20376709.mp3	Što ma to wšo z ptačim kwasom činić?	2	0	fourties	male			hsb	
fcbf0ad71bbc820e22feb3fac5a02f983f074a839f6e335ce3d7680fc06c699fdf97c68cb69176cbfe1f3b100515053ff2688cc690b2adbe1bdae734fa62eff5	common_voice_hsb_20376710.mp3	Ja sej myslu, zo je to pola Tomaša chutne.	2	0	fourties	male			hsb	
fcbf0ad71bbc820e22feb3fac5a02f983f074a839f6e335ce3d7680fc06c699fdf97c68cb69176cbfe1f3b100515053ff2688cc690b2adbe1bdae734fa62eff5	common_voice_hsb_20376711.mp3	Dokumentacija wuslědkow lońšeho naprašowanja Domowiny je digitalnje přistupna.	2	0	fourties	male			hsb	
fcbf0ad71bbc820e22feb3fac5a02f983f074a839f6e335ce3d7680fc06c699fdf97c68cb69176cbfe1f3b100515053ff2688cc690b2adbe1bdae734fa62eff5	common_voice_hsb_20376712.mp3	W Italskej znaja tři wariacije woneje poliwki.	2	0	fourties	male			hsb	
fcbf0ad71bbc820e22feb3fac5a02f983f074a839f6e335ce3d7680fc06c699fdf97c68cb69176cbfe1f3b100515053ff2688cc690b2adbe1bdae734fa62eff5	common_voice_hsb_20376718.mp3	Zdruha smy paralelnje dalše wupisanje za přidružnikow zahajili.	2	0	fourties	male			hsb	
fcbf0ad71bbc820e22feb3fac5a02f983f074a839f6e335ce3d7680fc06c699fdf97c68cb69176cbfe1f3b100515053ff2688cc690b2adbe1bdae734fa62eff5	common_voice_hsb_20376719.mp3	Tam bu tež naša třěšna organizacija Domowina załožena.	2	0	fourties	male			hsb	
fcbf0ad71bbc820e22feb3fac5a02f983f074a839f6e335ce3d7680fc06c699fdf97c68cb69176cbfe1f3b100515053ff2688cc690b2adbe1bdae734fa62eff5	common_voice_hsb_20376725.mp3	Sćěhuj wšědnje Betlehemsku hwězdu a pytaj Boha, namołwja awtor zawodneho nastawka.	2	0	fourties	male			hsb	
fcbf0ad71bbc820e22feb3fac5a02f983f074a839f6e335ce3d7680fc06c699fdf97c68cb69176cbfe1f3b100515053ff2688cc690b2adbe1bdae734fa62eff5	common_voice_hsb_20376726.mp3	Spjećujmy so tomule duchej časa, kotryž chcył wšitko zničić.	2	1	fourties	male			hsb	
fcbf0ad71bbc820e22feb3fac5a02f983f074a839f6e335ce3d7680fc06c699fdf97c68cb69176cbfe1f3b100515053ff2688cc690b2adbe1bdae734fa62eff5	common_voice_hsb_20376727.mp3	Wobsahowje ma so wosebite rěčne połoženje w Delnjej Łužicy wobkedźbować.	2	0	fourties	male			hsb	
fcbf0ad71bbc820e22feb3fac5a02f983f074a839f6e335ce3d7680fc06c699fdf97c68cb69176cbfe1f3b100515053ff2688cc690b2adbe1bdae734fa62eff5	common_voice_hsb_20376728.mp3	Předawarjow běše mjenje hač hewak, kupcow hišće mjenje.	2	0	fourties	male			hsb	
fcbf0ad71bbc820e22feb3fac5a02f983f074a839f6e335ce3d7680fc06c699fdf97c68cb69176cbfe1f3b100515053ff2688cc690b2adbe1bdae734fa62eff5	common_voice_hsb_20376729.mp3	Wšitke dźěći w sakskich šulach dyrbjeli něšto wo druhej oficialnej rěči Sakskeje zhonić.	2	0	fourties	male			hsb	
fcbf0ad71bbc820e22feb3fac5a02f983f074a839f6e335ce3d7680fc06c699fdf97c68cb69176cbfe1f3b100515053ff2688cc690b2adbe1bdae734fa62eff5	common_voice_hsb_20399737.mp3	Za to su pjenjezy trěbne.	2	0	fourties	male			hsb	
fcbf0ad71bbc820e22feb3fac5a02f983f074a839f6e335ce3d7680fc06c699fdf97c68cb69176cbfe1f3b100515053ff2688cc690b2adbe1bdae734fa62eff5	common_voice_hsb_20399738.mp3	Připóznawamy tež prócowanja serbskeju radow a dalšich gremijow wo polěpšenje situacije serbskeho ludu.	2	0	fourties	male			hsb	
fcbf0ad71bbc820e22feb3fac5a02f983f074a839f6e335ce3d7680fc06c699fdf97c68cb69176cbfe1f3b100515053ff2688cc690b2adbe1bdae734fa62eff5	common_voice_hsb_20399739.mp3	Hdyž wón potom za někotre tydźenje domoj přińdźe, ležeše wón jenož we łožu.	2	0	fourties	male			hsb	
fcbf0ad71bbc820e22feb3fac5a02f983f074a839f6e335ce3d7680fc06c699fdf97c68cb69176cbfe1f3b100515053ff2688cc690b2adbe1bdae734fa62eff5	common_voice_hsb_20399740.mp3	Kubłarka informuje staršeju wo ewentualnych napadnosćach w zadźerženju jeju dźěsća napřećo serbšćinje.	2	0	fourties	male			hsb	
fcbf0ad71bbc820e22feb3fac5a02f983f074a839f6e335ce3d7680fc06c699fdf97c68cb69176cbfe1f3b100515053ff2688cc690b2adbe1bdae734fa62eff5	common_voice_hsb_20399741.mp3	Pokazać ma so w tutym zwisku tež na prócowanja Sakskeje.	2	0	fourties	male			hsb	
fcbf0ad71bbc820e22feb3fac5a02f983f074a839f6e335ce3d7680fc06c699fdf97c68cb69176cbfe1f3b100515053ff2688cc690b2adbe1bdae734fa62eff5	common_voice_hsb_20404435.mp3	Dźěła so tež na online-wersiji, kotraž stajne rozšěrjenje dowoli.	2	0	fourties	male			hsb	
fcbf0ad71bbc820e22feb3fac5a02f983f074a839f6e335ce3d7680fc06c699fdf97c68cb69176cbfe1f3b100515053ff2688cc690b2adbe1bdae734fa62eff5	common_voice_hsb_20404436.mp3	Wosobinske narěčenje přez čłonow serbskeho dźěłoweho kruha bu wot šulskich wjednikow pozitiwnje přijate.	2	0	fourties	male			hsb	
fcbf0ad71bbc820e22feb3fac5a02f983f074a839f6e335ce3d7680fc06c699fdf97c68cb69176cbfe1f3b100515053ff2688cc690b2adbe1bdae734fa62eff5	common_voice_hsb_20404437.mp3	Zarjadej biosferoweho rezerwata dźe wosebje wo to, zo so koncept dynamisce nałožuje.	2	0	fourties	male			hsb	
fcbf0ad71bbc820e22feb3fac5a02f983f074a839f6e335ce3d7680fc06c699fdf97c68cb69176cbfe1f3b100515053ff2688cc690b2adbe1bdae734fa62eff5	common_voice_hsb_20404438.mp3	Tohodla su wěste kónčiny a z tym rostliny a zwěrjata wosebje škitane.	2	0	fourties	male			hsb	
fcbf0ad71bbc820e22feb3fac5a02f983f074a839f6e335ce3d7680fc06c699fdf97c68cb69176cbfe1f3b100515053ff2688cc690b2adbe1bdae734fa62eff5	common_voice_hsb_20404439.mp3	Prošu njemjetaj črije do róžka.	2	0	fourties	male			hsb	
fcbf0ad71bbc820e22feb3fac5a02f983f074a839f6e335ce3d7680fc06c699fdf97c68cb69176cbfe1f3b100515053ff2688cc690b2adbe1bdae734fa62eff5	common_voice_hsb_20404450.mp3	Za alternatiwu měješe Grólmusec tysac lět staru katolsku tradiciju.	2	1	fourties	male			hsb	
fcbf0ad71bbc820e22feb3fac5a02f983f074a839f6e335ce3d7680fc06c699fdf97c68cb69176cbfe1f3b100515053ff2688cc690b2adbe1bdae734fa62eff5	common_voice_hsb_20404451.mp3	K hłownym wuslědkam komisije słuša namjet, spěchowanje zwjazka po jednotliwych potrěbnosćach wusměrić.	2	0	fourties	male			hsb	
fcbf0ad71bbc820e22feb3fac5a02f983f074a839f6e335ce3d7680fc06c699fdf97c68cb69176cbfe1f3b100515053ff2688cc690b2adbe1bdae734fa62eff5	common_voice_hsb_20404452.mp3	Snano su tudy w prastarych časach pohanscy Serbja woprowali.	2	0	fourties	male			hsb	
fcbf0ad71bbc820e22feb3fac5a02f983f074a839f6e335ce3d7680fc06c699fdf97c68cb69176cbfe1f3b100515053ff2688cc690b2adbe1bdae734fa62eff5	common_voice_hsb_20404453.mp3	K tomu předleži Wam jako delegaća naćisk rezolucije hłowneje zhromadźizny.	2	0	fourties	male			hsb	
fcbf0ad71bbc820e22feb3fac5a02f983f074a839f6e335ce3d7680fc06c699fdf97c68cb69176cbfe1f3b100515053ff2688cc690b2adbe1bdae734fa62eff5	common_voice_hsb_20404454.mp3	W Choćebuskim cyrkwinskim wokrjesu je mnoho přećiwkow.	2	0	fourties	male			hsb	
fcbf0ad71bbc820e22feb3fac5a02f983f074a839f6e335ce3d7680fc06c699fdf97c68cb69176cbfe1f3b100515053ff2688cc690b2adbe1bdae734fa62eff5	common_voice_hsb_20404460.mp3	Wój daritej sej lětsa k hodam kartki za koncert.	2	0	fourties	male			hsb	
fcbf0ad71bbc820e22feb3fac5a02f983f074a839f6e335ce3d7680fc06c699fdf97c68cb69176cbfe1f3b100515053ff2688cc690b2adbe1bdae734fa62eff5	common_voice_hsb_20404461.mp3	We woběmaj městomaj namakaja so slědy z antiki.	2	0	fourties	male			hsb	
fcbf0ad71bbc820e22feb3fac5a02f983f074a839f6e335ce3d7680fc06c699fdf97c68cb69176cbfe1f3b100515053ff2688cc690b2adbe1bdae734fa62eff5	common_voice_hsb_20404462.mp3	Za dźěło tajkeje milinarnje trjebaš tójšto wody, kotruž we Łužicy nimamy.	2	0	fourties	male			hsb	
fcbf0ad71bbc820e22feb3fac5a02f983f074a839f6e335ce3d7680fc06c699fdf97c68cb69176cbfe1f3b100515053ff2688cc690b2adbe1bdae734fa62eff5	common_voice_hsb_20404463.mp3	Nětko so wone lětnje na zakładźe tam zapisanych starych sumow podlěši.	2	0	fourties	male			hsb	
fcbf0ad71bbc820e22feb3fac5a02f983f074a839f6e335ce3d7680fc06c699fdf97c68cb69176cbfe1f3b100515053ff2688cc690b2adbe1bdae734fa62eff5	common_voice_hsb_20404464.mp3	Zwjazkowe předsydstwo faworizuje model skrućenja Domowiny w dotalnej prawniskej formje.	2	0	fourties	male			hsb	
fcbf0ad71bbc820e22feb3fac5a02f983f074a839f6e335ce3d7680fc06c699fdf97c68cb69176cbfe1f3b100515053ff2688cc690b2adbe1bdae734fa62eff5	common_voice_hsb_20404470.mp3	Po přewróće steješe busta wjele lět na łubi Radworskeju šulow.	2	0	fourties	male			hsb	
fcbf0ad71bbc820e22feb3fac5a02f983f074a839f6e335ce3d7680fc06c699fdf97c68cb69176cbfe1f3b100515053ff2688cc690b2adbe1bdae734fa62eff5	common_voice_hsb_20404471.mp3	Mjez Choćebuzom a Budyšinom nastawa tuchwilu najwjetša kumštna jězorina.	2	0	fourties	male			hsb	
fcbf0ad71bbc820e22feb3fac5a02f983f074a839f6e335ce3d7680fc06c699fdf97c68cb69176cbfe1f3b100515053ff2688cc690b2adbe1bdae734fa62eff5	common_voice_hsb_20404472.mp3	Hdźežkuli su Serbja, tam měła Domowina za nich a z nimi hromadźe dźěłać.	2	0	fourties	male			hsb	
fcbf0ad71bbc820e22feb3fac5a02f983f074a839f6e335ce3d7680fc06c699fdf97c68cb69176cbfe1f3b100515053ff2688cc690b2adbe1bdae734fa62eff5	common_voice_hsb_20404473.mp3	Tute znate a wjacorym awtoram připisane wuprajenje hodźi so za planowane přesydlenje Miłoraza.	2	0	fourties	male			hsb	
fcbf0ad71bbc820e22feb3fac5a02f983f074a839f6e335ce3d7680fc06c699fdf97c68cb69176cbfe1f3b100515053ff2688cc690b2adbe1bdae734fa62eff5	common_voice_hsb_20404474.mp3	Mjez Budyšinkom a Plusnikecami pozběhuja so hórki, kiž maja zapadne wětry zadźeržeć.	2	0	fourties	male			hsb	
fcbf0ad71bbc820e22feb3fac5a02f983f074a839f6e335ce3d7680fc06c699fdf97c68cb69176cbfe1f3b100515053ff2688cc690b2adbe1bdae734fa62eff5	common_voice_hsb_20404480.mp3	Wot toho časa dawaše zaso stare towarstwo Serbow.	2	0	fourties	male			hsb	
fcbf0ad71bbc820e22feb3fac5a02f983f074a839f6e335ce3d7680fc06c699fdf97c68cb69176cbfe1f3b100515053ff2688cc690b2adbe1bdae734fa62eff5	common_voice_hsb_20404481.mp3	Wój stej dźědowe a wowcyne mazane potajnstwa wšěm prajiłoj.	2	0	fourties	male			hsb	
fcbf0ad71bbc820e22feb3fac5a02f983f074a839f6e335ce3d7680fc06c699fdf97c68cb69176cbfe1f3b100515053ff2688cc690b2adbe1bdae734fa62eff5	common_voice_hsb_20404483.mp3	We Worklecach swjećachu dźěći w parku rjany nyšpor.	2	1	fourties	male			hsb	
fcbf0ad71bbc820e22feb3fac5a02f983f074a839f6e335ce3d7680fc06c699fdf97c68cb69176cbfe1f3b100515053ff2688cc690b2adbe1bdae734fa62eff5	common_voice_hsb_20404484.mp3	Nimo toho bu narunanska pawšala za zarjadniske wudawki konkretizowana.	2	0	fourties	male			hsb	
fcbf0ad71bbc820e22feb3fac5a02f983f074a839f6e335ce3d7680fc06c699fdf97c68cb69176cbfe1f3b100515053ff2688cc690b2adbe1bdae734fa62eff5	common_voice_hsb_20404499.mp3	Město toho chcyše je wobydlerjam a wopytowarjam Ochranowa spřistupnić.	2	0	fourties	male			hsb	
fcbf0ad71bbc820e22feb3fac5a02f983f074a839f6e335ce3d7680fc06c699fdf97c68cb69176cbfe1f3b100515053ff2688cc690b2adbe1bdae734fa62eff5	common_voice_hsb_20404501.mp3	Ja sym přeprošeny na test pola Čerwjenych čertow.	2	0	fourties	male			hsb	
fcbf0ad71bbc820e22feb3fac5a02f983f074a839f6e335ce3d7680fc06c699fdf97c68cb69176cbfe1f3b100515053ff2688cc690b2adbe1bdae734fa62eff5	common_voice_hsb_20404502.mp3	Šula ma nadawk kubłanja.	2	0	fourties	male			hsb	
fcbf0ad71bbc820e22feb3fac5a02f983f074a839f6e335ce3d7680fc06c699fdf97c68cb69176cbfe1f3b100515053ff2688cc690b2adbe1bdae734fa62eff5	common_voice_hsb_20404504.mp3	Informaciski material je sakske ministerstwo za kultus wudało.	2	0	fourties	male			hsb	
fcbf0ad71bbc820e22feb3fac5a02f983f074a839f6e335ce3d7680fc06c699fdf97c68cb69176cbfe1f3b100515053ff2688cc690b2adbe1bdae734fa62eff5	common_voice_hsb_20404515.mp3	Serbsce drje tu lědma hišće rěča.	2	0	fourties	male			hsb	
fcbf0ad71bbc820e22feb3fac5a02f983f074a839f6e335ce3d7680fc06c699fdf97c68cb69176cbfe1f3b100515053ff2688cc690b2adbe1bdae734fa62eff5	common_voice_hsb_20404516.mp3	Wobknježenje tu zakótwjeneje serbšćiny za kóždežkuli zastojnstwo ma wuměnjenje a narok rěčneje akceptancy być.	2	0	fourties	male			hsb	
fcbf0ad71bbc820e22feb3fac5a02f983f074a839f6e335ce3d7680fc06c699fdf97c68cb69176cbfe1f3b100515053ff2688cc690b2adbe1bdae734fa62eff5	common_voice_hsb_20404517.mp3	Nawuknu po planje wobkedźbować a wopisować, analyzować, rjadować a syntetizować.	2	0	fourties	male			hsb	
fcbf0ad71bbc820e22feb3fac5a02f983f074a839f6e335ce3d7680fc06c699fdf97c68cb69176cbfe1f3b100515053ff2688cc690b2adbe1bdae734fa62eff5	common_voice_hsb_20404518.mp3	Dalša tema posedźenja su mjez druhim stasiakty.	2	0	fourties	male			hsb	
fcbf0ad71bbc820e22feb3fac5a02f983f074a839f6e335ce3d7680fc06c699fdf97c68cb69176cbfe1f3b100515053ff2688cc690b2adbe1bdae734fa62eff5	common_voice_hsb_20404519.mp3	Jedna naprawa k wuwiću kwality je wobdźělenje internatneje wjednicy na posedźenjach wjednistwa nošerja.	2	0	fourties	male			hsb	
fcbf0ad71bbc820e22feb3fac5a02f983f074a839f6e335ce3d7680fc06c699fdf97c68cb69176cbfe1f3b100515053ff2688cc690b2adbe1bdae734fa62eff5	common_voice_hsb_20404535.mp3	Na lěsnym haće kołpa z młodymi a dźiwje kački wobkedźbujemy.	2	0	fourties	male			hsb	
fcbf0ad71bbc820e22feb3fac5a02f983f074a839f6e335ce3d7680fc06c699fdf97c68cb69176cbfe1f3b100515053ff2688cc690b2adbe1bdae734fa62eff5	common_voice_hsb_20404536.mp3	Budyšin je při tym politiski a duchowno-kulturny centrum Serbow.	2	0	fourties	male			hsb	
fcbf0ad71bbc820e22feb3fac5a02f983f074a839f6e335ce3d7680fc06c699fdf97c68cb69176cbfe1f3b100515053ff2688cc690b2adbe1bdae734fa62eff5	common_voice_hsb_20404537.mp3	Na zaběru ze serbskej narodnej drastu so wažnosć kładźe.	2	0	fourties	male			hsb	
fcbf0ad71bbc820e22feb3fac5a02f983f074a839f6e335ce3d7680fc06c699fdf97c68cb69176cbfe1f3b100515053ff2688cc690b2adbe1bdae734fa62eff5	common_voice_hsb_20404538.mp3	Serbja wobohaćeja towaršnostne žiwjenje w Němskej.	2	0	fourties	male			hsb	
fcbf0ad71bbc820e22feb3fac5a02f983f074a839f6e335ce3d7680fc06c699fdf97c68cb69176cbfe1f3b100515053ff2688cc690b2adbe1bdae734fa62eff5	common_voice_hsb_20404539.mp3	Dobyćer přesadźowanja wužiwa meju jako ławku před swojim domskim.	2	0	fourties	male			hsb	
fcbf0ad71bbc820e22feb3fac5a02f983f074a839f6e335ce3d7680fc06c699fdf97c68cb69176cbfe1f3b100515053ff2688cc690b2adbe1bdae734fa62eff5	common_voice_hsb_20404552.mp3	Ty sy bow pod wulijawu stajiła, dokelž je z roły kapało.	2	0	fourties	male			hsb	
fcbf0ad71bbc820e22feb3fac5a02f983f074a839f6e335ce3d7680fc06c699fdf97c68cb69176cbfe1f3b100515053ff2688cc690b2adbe1bdae734fa62eff5	common_voice_hsb_20404553.mp3	Wosebje program junior-rangerow je tule wažny stołp kubłanja dźěćiny a młodźiny.	2	0	fourties	male			hsb	
fcbf0ad71bbc820e22feb3fac5a02f983f074a839f6e335ce3d7680fc06c699fdf97c68cb69176cbfe1f3b100515053ff2688cc690b2adbe1bdae734fa62eff5	common_voice_hsb_20404555.mp3	Často pochadźeja woni z wjetšich městow a dźěłaja w kreatiwnych abo wuměłskich powołanjach.	2	0	fourties	male			hsb	
fcbf0ad71bbc820e22feb3fac5a02f983f074a839f6e335ce3d7680fc06c699fdf97c68cb69176cbfe1f3b100515053ff2688cc690b2adbe1bdae734fa62eff5	common_voice_hsb_20404556.mp3	Naše nowe zwony a naša nowa wěža su so zańdźenu srjedu poswjećili.	2	0	fourties	male			hsb	
fcbf0ad71bbc820e22feb3fac5a02f983f074a839f6e335ce3d7680fc06c699fdf97c68cb69176cbfe1f3b100515053ff2688cc690b2adbe1bdae734fa62eff5	common_voice_hsb_20404558.mp3	Prěnje župy su so w poslednim lětstotku wutworili.	2	1	fourties	male			hsb	
fcbf0ad71bbc820e22feb3fac5a02f983f074a839f6e335ce3d7680fc06c699fdf97c68cb69176cbfe1f3b100515053ff2688cc690b2adbe1bdae734fa62eff5	common_voice_hsb_20404570.mp3	Tak ma so hišće wuši kontakt ke komunam nawjazać.	2	0	fourties	male			hsb	
fcbf0ad71bbc820e22feb3fac5a02f983f074a839f6e335ce3d7680fc06c699fdf97c68cb69176cbfe1f3b100515053ff2688cc690b2adbe1bdae734fa62eff5	common_voice_hsb_20404571.mp3	Wona pohladny na wobraz a rjekny.	2	0	fourties	male			hsb	
fcbf0ad71bbc820e22feb3fac5a02f983f074a839f6e335ce3d7680fc06c699fdf97c68cb69176cbfe1f3b100515053ff2688cc690b2adbe1bdae734fa62eff5	common_voice_hsb_20404572.mp3	To njesylni jenož socialne kompetency, ale spěchuje tež rěčne wuwiće.	2	1	fourties	male			hsb	
fcbf0ad71bbc820e22feb3fac5a02f983f074a839f6e335ce3d7680fc06c699fdf97c68cb69176cbfe1f3b100515053ff2688cc690b2adbe1bdae734fa62eff5	common_voice_hsb_20404573.mp3	Wosebje rjana je jězba po aleji w nalěću abo nazymje.	2	0	fourties	male			hsb	
fcbf0ad71bbc820e22feb3fac5a02f983f074a839f6e335ce3d7680fc06c699fdf97c68cb69176cbfe1f3b100515053ff2688cc690b2adbe1bdae734fa62eff5	common_voice_hsb_20404574.mp3	Tak je so radźiło, znowa jednoho zastupjerja do wokrjesneho sejma wokrjesa Budyšin wolić.	2	0	fourties	male			hsb	
fcbf0ad71bbc820e22feb3fac5a02f983f074a839f6e335ce3d7680fc06c699fdf97c68cb69176cbfe1f3b100515053ff2688cc690b2adbe1bdae734fa62eff5	common_voice_hsb_20404580.mp3	Ty dźeš do šule a ja du na dźěło.	2	0	fourties	male			hsb	
fcbf0ad71bbc820e22feb3fac5a02f983f074a839f6e335ce3d7680fc06c699fdf97c68cb69176cbfe1f3b100515053ff2688cc690b2adbe1bdae734fa62eff5	common_voice_hsb_20404581.mp3	Třepotajo wróćichu so domoj a wostachu chorowaći na čas žiwjenja.	2	0	fourties	male			hsb	
fcbf0ad71bbc820e22feb3fac5a02f983f074a839f6e335ce3d7680fc06c699fdf97c68cb69176cbfe1f3b100515053ff2688cc690b2adbe1bdae734fa62eff5	common_voice_hsb_20404582.mp3	Zdobom posrědkujemy wědu wo zamołwitym wobchadźe a škiće swójskich datow.	2	0	fourties	male			hsb	
fcbf0ad71bbc820e22feb3fac5a02f983f074a839f6e335ce3d7680fc06c699fdf97c68cb69176cbfe1f3b100515053ff2688cc690b2adbe1bdae734fa62eff5	common_voice_hsb_20404583.mp3	Mjez wobdźělnikami su tež Serbja.	2	0	fourties	male			hsb	
fcbf0ad71bbc820e22feb3fac5a02f983f074a839f6e335ce3d7680fc06c699fdf97c68cb69176cbfe1f3b100515053ff2688cc690b2adbe1bdae734fa62eff5	common_voice_hsb_20404584.mp3	Nowe naprawy maja so na hospodarske lěto wusměrjene nadźěłać abo wudospołnić.	2	0	fourties	male			hsb	
fcbf0ad71bbc820e22feb3fac5a02f983f074a839f6e335ce3d7680fc06c699fdf97c68cb69176cbfe1f3b100515053ff2688cc690b2adbe1bdae734fa62eff5	common_voice_hsb_20404596.mp3	Při zažnym přiswojenju druheje rěče přiswoja sej dźěćo najprjedy raz jenož jednu rěč.	2	0	fourties	male			hsb	
fcbf0ad71bbc820e22feb3fac5a02f983f074a839f6e335ce3d7680fc06c699fdf97c68cb69176cbfe1f3b100515053ff2688cc690b2adbe1bdae734fa62eff5	common_voice_hsb_20404598.mp3	Z hajenjom tutoho herbstwa su wšelake móžnosće za pokročowanje dwurěčnych tradicijow zwjazane.	2	0	fourties	male			hsb	
fcbf0ad71bbc820e22feb3fac5a02f983f074a839f6e335ce3d7680fc06c699fdf97c68cb69176cbfe1f3b100515053ff2688cc690b2adbe1bdae734fa62eff5	common_voice_hsb_20404599.mp3	Hibanje na dobro programatiskeho wobnowjenja ležeše w rukach Serbskeje ludoweje zhromadźizny.	2	0	fourties	male			hsb	
fcbf0ad71bbc820e22feb3fac5a02f983f074a839f6e335ce3d7680fc06c699fdf97c68cb69176cbfe1f3b100515053ff2688cc690b2adbe1bdae734fa62eff5	common_voice_hsb_20404601.mp3	Manfred Laduš wotrosće w Hermanecach a wopyta tam šulu.	2	0	fourties	male			hsb	
fcbf0ad71bbc820e22feb3fac5a02f983f074a839f6e335ce3d7680fc06c699fdf97c68cb69176cbfe1f3b100515053ff2688cc690b2adbe1bdae734fa62eff5	common_voice_hsb_20404610.mp3	To je jara k jich sebjewědomju přinošowało.	2	0	fourties	male			hsb	
fcbf0ad71bbc820e22feb3fac5a02f983f074a839f6e335ce3d7680fc06c699fdf97c68cb69176cbfe1f3b100515053ff2688cc690b2adbe1bdae734fa62eff5	common_voice_hsb_20404611.mp3	Ćmowe městna na zemi pokazaja na něhdyše jamy.	2	0	fourties	male			hsb	
fcbf0ad71bbc820e22feb3fac5a02f983f074a839f6e335ce3d7680fc06c699fdf97c68cb69176cbfe1f3b100515053ff2688cc690b2adbe1bdae734fa62eff5	common_voice_hsb_20404612.mp3	Njewšědny wopyt měješe popołdnju Serbska wyša šula „Michał Hórnik“ Worklecy.	2	0	fourties	male			hsb	
fcbf0ad71bbc820e22feb3fac5a02f983f074a839f6e335ce3d7680fc06c699fdf97c68cb69176cbfe1f3b100515053ff2688cc690b2adbe1bdae734fa62eff5	common_voice_hsb_20404613.mp3	Tući pak, kiž wostanu dlěje we wosadźe, nawuknu tež serbsce.	2	1	fourties	male			hsb	
fcbf0ad71bbc820e22feb3fac5a02f983f074a839f6e335ce3d7680fc06c699fdf97c68cb69176cbfe1f3b100515053ff2688cc690b2adbe1bdae734fa62eff5	common_voice_hsb_20404614.mp3	Zhromadnje z mnohimi akterami a institucijemi zastupujemy serbske naležnosće.	2	0	fourties	male			hsb	
fcbf0ad71bbc820e22feb3fac5a02f983f074a839f6e335ce3d7680fc06c699fdf97c68cb69176cbfe1f3b100515053ff2688cc690b2adbe1bdae734fa62eff5	common_voice_hsb_20404630.mp3	Wona wrjesny jeje šulsku tošu do róžka a staji kóčce jeje žratwu.	2	0	fourties	male			hsb	
fcbf0ad71bbc820e22feb3fac5a02f983f074a839f6e335ce3d7680fc06c699fdf97c68cb69176cbfe1f3b100515053ff2688cc690b2adbe1bdae734fa62eff5	common_voice_hsb_20404631.mp3	Zajimče zetkaja so štyri króć wob lěto, a to stajnje kónc tydźenja.	2	0	fourties	male			hsb	
fcbf0ad71bbc820e22feb3fac5a02f983f074a839f6e335ce3d7680fc06c699fdf97c68cb69176cbfe1f3b100515053ff2688cc690b2adbe1bdae734fa62eff5	common_voice_hsb_20404632.mp3	Za to dźakuju so Wam w mjenje zwjazkoweho předsydstwa jara wutrobnje.	2	0	fourties	male			hsb	
fcbf0ad71bbc820e22feb3fac5a02f983f074a839f6e335ce3d7680fc06c699fdf97c68cb69176cbfe1f3b100515053ff2688cc690b2adbe1bdae734fa62eff5	common_voice_hsb_20404633.mp3	Zemrěła je njedźelu, njedźela je dźeń Knjeza.	2	0	fourties	male			hsb	
fcbf0ad71bbc820e22feb3fac5a02f983f074a839f6e335ce3d7680fc06c699fdf97c68cb69176cbfe1f3b100515053ff2688cc690b2adbe1bdae734fa62eff5	common_voice_hsb_20404634.mp3	We wuběrkomaj dźěłaja wotnětka třo Brězowčenjo a runje tak wjele Dźěwinjenjow sobu.	2	0	fourties	male			hsb	
fcbf0ad71bbc820e22feb3fac5a02f983f074a839f6e335ce3d7680fc06c699fdf97c68cb69176cbfe1f3b100515053ff2688cc690b2adbe1bdae734fa62eff5	common_voice_hsb_20404660.mp3	Diana Šołćina je fachowa wučerka za stawizny a sport.	2	0	fourties	male			hsb	
fcbf0ad71bbc820e22feb3fac5a02f983f074a839f6e335ce3d7680fc06c699fdf97c68cb69176cbfe1f3b100515053ff2688cc690b2adbe1bdae734fa62eff5	common_voice_hsb_20404661.mp3	Mnohe dźěći w serbskim sydlenskim rumje wužiwaja tónle rěčny poskitk.	2	0	fourties	male			hsb	
fcbf0ad71bbc820e22feb3fac5a02f983f074a839f6e335ce3d7680fc06c699fdf97c68cb69176cbfe1f3b100515053ff2688cc690b2adbe1bdae734fa62eff5	common_voice_hsb_20404662.mp3	Štóž so za serbskeho kuzłarja zajimuje, je we wsy blisko Wojerec runje prawje.	2	0	fourties	male			hsb	
fcbf0ad71bbc820e22feb3fac5a02f983f074a839f6e335ce3d7680fc06c699fdf97c68cb69176cbfe1f3b100515053ff2688cc690b2adbe1bdae734fa62eff5	common_voice_hsb_20404663.mp3	Hišće słónčko swěći, na wobzoru pak bliža so ćmowe mróčele z błyskami a hrimanjom.	2	0	fourties	male			hsb	
fcbf0ad71bbc820e22feb3fac5a02f983f074a839f6e335ce3d7680fc06c699fdf97c68cb69176cbfe1f3b100515053ff2688cc690b2adbe1bdae734fa62eff5	common_voice_hsb_20404664.mp3	Tak by móhło drohotne eksponaty trajnje wustajeć.	2	0	fourties	male			hsb	
