client_id	path	sentence	up_votes	down_votes	age	gender	accents	variant	locale	segment
fcbf0ad71bbc820e22feb3fac5a02f983f074a839f6e335ce3d7680fc06c699fdf97c68cb69176cbfe1f3b100515053ff2688cc690b2adbe1bdae734fa62eff5	common_voice_hsb_20430935.mp3	Hakle pozdźe so poněčim poradźi, negatiwne sćěhi wurunać.	2	0	fourties	male			hsb	
fcbf0ad71bbc820e22feb3fac5a02f983f074a839f6e335ce3d7680fc06c699fdf97c68cb69176cbfe1f3b100515053ff2688cc690b2adbe1bdae734fa62eff5	common_voice_hsb_20430936.mp3	Z tym ma so generacije přesahowaca zhromadnosć spěchować.	2	0	fourties	male			hsb	
fcbf0ad71bbc820e22feb3fac5a02f983f074a839f6e335ce3d7680fc06c699fdf97c68cb69176cbfe1f3b100515053ff2688cc690b2adbe1bdae734fa62eff5	common_voice_hsb_20430937.mp3	Tón ma přichodny pjatk postajić, z kajkimi naprawami chce Němska swětowu klimu wuchować.	2	0	fourties	male			hsb	
fcbf0ad71bbc820e22feb3fac5a02f983f074a839f6e335ce3d7680fc06c699fdf97c68cb69176cbfe1f3b100515053ff2688cc690b2adbe1bdae734fa62eff5	common_voice_hsb_20430938.mp3	Liberalni žadaja sej statne zrěčenje wo spušćomnym financowanju.	2	0	fourties	male			hsb	
fcbf0ad71bbc820e22feb3fac5a02f983f074a839f6e335ce3d7680fc06c699fdf97c68cb69176cbfe1f3b100515053ff2688cc690b2adbe1bdae734fa62eff5	common_voice_hsb_20430959.mp3	Ale ludźo wědźachu sej pomhać – a wóslikej tež.	2	0	fourties	male			hsb	
fcbf0ad71bbc820e22feb3fac5a02f983f074a839f6e335ce3d7680fc06c699fdf97c68cb69176cbfe1f3b100515053ff2688cc690b2adbe1bdae734fa62eff5	common_voice_hsb_20430960.mp3	Z nazhonjenjow we wšědnym šulskim wotběhu wuchadźa, zo delnjoserbšćina na dobro druhich předmjetow wupadnje.	2	0	fourties	male			hsb	
fcbf0ad71bbc820e22feb3fac5a02f983f074a839f6e335ce3d7680fc06c699fdf97c68cb69176cbfe1f3b100515053ff2688cc690b2adbe1bdae734fa62eff5	common_voice_hsb_20430961.mp3	Tute prezentuje z modernymi zwukami w nowym šaće.	2	0	fourties	male			hsb	
fcbf0ad71bbc820e22feb3fac5a02f983f074a839f6e335ce3d7680fc06c699fdf97c68cb69176cbfe1f3b100515053ff2688cc690b2adbe1bdae734fa62eff5	common_voice_hsb_20430962.mp3	Wobdźěleni su wšitcy zahorjeni.	2	0	fourties	male			hsb	
fcbf0ad71bbc820e22feb3fac5a02f983f074a839f6e335ce3d7680fc06c699fdf97c68cb69176cbfe1f3b100515053ff2688cc690b2adbe1bdae734fa62eff5	common_voice_hsb_20430963.mp3	Zhromadnje su woni minjeny tydźeń w Berlinje na přehladce dźěłali.	2	0	fourties	male			hsb	
fcbf0ad71bbc820e22feb3fac5a02f983f074a839f6e335ce3d7680fc06c699fdf97c68cb69176cbfe1f3b100515053ff2688cc690b2adbe1bdae734fa62eff5	common_voice_hsb_20430975.mp3	Waše daty njesposrědkujemy nikomu dalšemu, chibazo mamy w jednotliwym padźe wotpowědnu prawnisku winowatosć.	2	0	fourties	male			hsb	
fcbf0ad71bbc820e22feb3fac5a02f983f074a839f6e335ce3d7680fc06c699fdf97c68cb69176cbfe1f3b100515053ff2688cc690b2adbe1bdae734fa62eff5	common_voice_hsb_20430977.mp3	Znaješ tu cyrkwinu wěžu, kotraž najdale do serbskeho kraja widźi?	2	0	fourties	male			hsb	
fcbf0ad71bbc820e22feb3fac5a02f983f074a839f6e335ce3d7680fc06c699fdf97c68cb69176cbfe1f3b100515053ff2688cc690b2adbe1bdae734fa62eff5	common_voice_hsb_20430980.mp3	Wy přińdźešće z awtom, ja přińdźech z kolesom a wón přińdźe pěši.	2	0	fourties	male			hsb	
fcbf0ad71bbc820e22feb3fac5a02f983f074a839f6e335ce3d7680fc06c699fdf97c68cb69176cbfe1f3b100515053ff2688cc690b2adbe1bdae734fa62eff5	common_voice_hsb_20430982.mp3	Chcemy hišće raz přepruwować, kak je k tomu dóšło.	2	0	fourties	male			hsb	
fcbf0ad71bbc820e22feb3fac5a02f983f074a839f6e335ce3d7680fc06c699fdf97c68cb69176cbfe1f3b100515053ff2688cc690b2adbe1bdae734fa62eff5	common_voice_hsb_20430983.mp3	Hač do kónca septembra ma jasne być, hač wokrjes Budyšin nošerstwo šule přewozmje.	2	0	fourties	male			hsb	
fcbf0ad71bbc820e22feb3fac5a02f983f074a839f6e335ce3d7680fc06c699fdf97c68cb69176cbfe1f3b100515053ff2688cc690b2adbe1bdae734fa62eff5	common_voice_hsb_20431014.mp3	Dohromady sym w třoch serbskich inscenacijach sobu skutkowała.	2	0	fourties	male			hsb	
fcbf0ad71bbc820e22feb3fac5a02f983f074a839f6e335ce3d7680fc06c699fdf97c68cb69176cbfe1f3b100515053ff2688cc690b2adbe1bdae734fa62eff5	common_voice_hsb_20431015.mp3	Sy ty čornu tonu widźała?	2	0	fourties	male			hsb	
fcbf0ad71bbc820e22feb3fac5a02f983f074a839f6e335ce3d7680fc06c699fdf97c68cb69176cbfe1f3b100515053ff2688cc690b2adbe1bdae734fa62eff5	common_voice_hsb_20431016.mp3	App „Serbsce lochko“ je so z přidatnymaj poskitkomaj rozšěriła.	2	0	fourties	male			hsb	
fcbf0ad71bbc820e22feb3fac5a02f983f074a839f6e335ce3d7680fc06c699fdf97c68cb69176cbfe1f3b100515053ff2688cc690b2adbe1bdae734fa62eff5	common_voice_hsb_20431017.mp3	Naprawy běchu dla masiwnych zasahow do sakskeje škitaneje kónčiny trěbne.	2	0	fourties	male			hsb	
fcbf0ad71bbc820e22feb3fac5a02f983f074a839f6e335ce3d7680fc06c699fdf97c68cb69176cbfe1f3b100515053ff2688cc690b2adbe1bdae734fa62eff5	common_voice_hsb_20431018.mp3	To dźěćom w serbskej rěči prajene čini pčołarka tež staršim zrozumliwe.	2	0	fourties	male			hsb	
fcbf0ad71bbc820e22feb3fac5a02f983f074a839f6e335ce3d7680fc06c699fdf97c68cb69176cbfe1f3b100515053ff2688cc690b2adbe1bdae734fa62eff5	common_voice_hsb_20431048.mp3	Wjednistwo Domowiny poskići serbskim zastupjerjam katolskeje a ewangelskeje cyrkwje narodny dialog.	2	0	fourties	male			hsb	
fcbf0ad71bbc820e22feb3fac5a02f983f074a839f6e335ce3d7680fc06c699fdf97c68cb69176cbfe1f3b100515053ff2688cc690b2adbe1bdae734fa62eff5	common_voice_hsb_20431050.mp3	Interdisciplinarny projekt Serbskeho instituta „Serbske městnosće wopominanja w modernje“ tomu wotpowěduje.	2	0	fourties	male			hsb	
fcbf0ad71bbc820e22feb3fac5a02f983f074a839f6e335ce3d7680fc06c699fdf97c68cb69176cbfe1f3b100515053ff2688cc690b2adbe1bdae734fa62eff5	common_voice_hsb_20431051.mp3	Z tym bě za nas lochko, so do serbšćiny zanurić.	2	0	fourties	male			hsb	
fcbf0ad71bbc820e22feb3fac5a02f983f074a839f6e335ce3d7680fc06c699fdf97c68cb69176cbfe1f3b100515053ff2688cc690b2adbe1bdae734fa62eff5	common_voice_hsb_20431053.mp3	Zwosadźane žiwe płoty, hajki a jednotliwe štomy su agrarnu krajinu dale rozčłonkowali.	2	0	fourties	male			hsb	
fcbf0ad71bbc820e22feb3fac5a02f983f074a839f6e335ce3d7680fc06c699fdf97c68cb69176cbfe1f3b100515053ff2688cc690b2adbe1bdae734fa62eff5	common_voice_hsb_20431054.mp3	Škitarka njeje bul prawje widźała, tohodla je so bul do wrotow kulił.	2	0	fourties	male			hsb	
fcbf0ad71bbc820e22feb3fac5a02f983f074a839f6e335ce3d7680fc06c699fdf97c68cb69176cbfe1f3b100515053ff2688cc690b2adbe1bdae734fa62eff5	common_voice_hsb_20431076.mp3	Při lekturje je mje najbóle to zajimowało, štož tam njenamakaš.	2	0	fourties	male			hsb	
fcbf0ad71bbc820e22feb3fac5a02f983f074a839f6e335ce3d7680fc06c699fdf97c68cb69176cbfe1f3b100515053ff2688cc690b2adbe1bdae734fa62eff5	common_voice_hsb_20431080.mp3	Zdobom chce sensibilizaciju a wukmanjenje chłostanskich zarjadow za delikty přećiwo serbskim wobydlerjam docpěć.	2	0	fourties	male			hsb	
fcbf0ad71bbc820e22feb3fac5a02f983f074a839f6e335ce3d7680fc06c699fdf97c68cb69176cbfe1f3b100515053ff2688cc690b2adbe1bdae734fa62eff5	common_voice_hsb_20431081.mp3	Chcychmy mjenujcy na schadźenje słónca čakać a potom po jutrownu wodu hić.	2	0	fourties	male			hsb	
fcbf0ad71bbc820e22feb3fac5a02f983f074a839f6e335ce3d7680fc06c699fdf97c68cb69176cbfe1f3b100515053ff2688cc690b2adbe1bdae734fa62eff5	common_voice_hsb_20431082.mp3	Ty sam ničo njejsy, naš serbski cyłk je naša móc.	2	0	fourties	male			hsb	
fcbf0ad71bbc820e22feb3fac5a02f983f074a839f6e335ce3d7680fc06c699fdf97c68cb69176cbfe1f3b100515053ff2688cc690b2adbe1bdae734fa62eff5	common_voice_hsb_20431083.mp3	Na scenach a mjez scenami zaklinčachu lóštne spěwy.	2	0	fourties	male			hsb	
fcbf0ad71bbc820e22feb3fac5a02f983f074a839f6e335ce3d7680fc06c699fdf97c68cb69176cbfe1f3b100515053ff2688cc690b2adbe1bdae734fa62eff5	common_voice_hsb_20431094.mp3	Potom přiwótřichu so směrowe wojowanja před pozadkom towaršnostnych změnow.	2	0	fourties	male			hsb	
fcbf0ad71bbc820e22feb3fac5a02f983f074a839f6e335ce3d7680fc06c699fdf97c68cb69176cbfe1f3b100515053ff2688cc690b2adbe1bdae734fa62eff5	common_voice_hsb_20431095.mp3	Wone nošachu mjena měšćanskich dźělow.	2	0	fourties	male			hsb	
fcbf0ad71bbc820e22feb3fac5a02f983f074a839f6e335ce3d7680fc06c699fdf97c68cb69176cbfe1f3b100515053ff2688cc690b2adbe1bdae734fa62eff5	common_voice_hsb_20431096.mp3	Zwjazk ma tohorunja za spomóžne, mjezykomunalne dźěło lěpje poradźować a podpěrać.	2	0	fourties	male			hsb	
fcbf0ad71bbc820e22feb3fac5a02f983f074a839f6e335ce3d7680fc06c699fdf97c68cb69176cbfe1f3b100515053ff2688cc690b2adbe1bdae734fa62eff5	common_voice_hsb_20431097.mp3	Zajimcy njetrjebachu žane wosebite akademiske wuměnjenja spjelnić.	2	0	fourties	male			hsb	
fcbf0ad71bbc820e22feb3fac5a02f983f074a839f6e335ce3d7680fc06c699fdf97c68cb69176cbfe1f3b100515053ff2688cc690b2adbe1bdae734fa62eff5	common_voice_hsb_20431098.mp3	Hnydom wokoło róžka pola Zahrodnikec swójby stejachu běrny w srjedźišću.	2	0	fourties	male			hsb	
fcbf0ad71bbc820e22feb3fac5a02f983f074a839f6e335ce3d7680fc06c699fdf97c68cb69176cbfe1f3b100515053ff2688cc690b2adbe1bdae734fa62eff5	common_voice_hsb_20431124.mp3	Woni su w mužacym wotdźělu a wuspytaja cholowy a košle.	2	0	fourties	male			hsb	
fcbf0ad71bbc820e22feb3fac5a02f983f074a839f6e335ce3d7680fc06c699fdf97c68cb69176cbfe1f3b100515053ff2688cc690b2adbe1bdae734fa62eff5	common_voice_hsb_20431125.mp3	W tutym zwisku ma so potrjeba hromadźe z čłonskimi towarstwami zwěsćić.	2	0	fourties	male			hsb	
fcbf0ad71bbc820e22feb3fac5a02f983f074a839f6e335ce3d7680fc06c699fdf97c68cb69176cbfe1f3b100515053ff2688cc690b2adbe1bdae734fa62eff5	common_voice_hsb_20431126.mp3	Wo přiwzaću nachwilneho złoženja funkcije na zakładźe swójskeje wole rozsudźi wotpowědny organ.	2	0	fourties	male			hsb	
fcbf0ad71bbc820e22feb3fac5a02f983f074a839f6e335ce3d7680fc06c699fdf97c68cb69176cbfe1f3b100515053ff2688cc690b2adbe1bdae734fa62eff5	common_voice_hsb_20431128.mp3	Slědźenski seminar je interdisciplinarnje wusměrjeny, ale fokusuje so na ćežišći literaturowěda a rěčewěda.	2	0	fourties	male			hsb	
fcbf0ad71bbc820e22feb3fac5a02f983f074a839f6e335ce3d7680fc06c699fdf97c68cb69176cbfe1f3b100515053ff2688cc690b2adbe1bdae734fa62eff5	common_voice_hsb_20431159.mp3	Zdobom zhubi pak so tón cuzy a při tym šumješe we jstwě.	2	0	fourties	male			hsb	
fcbf0ad71bbc820e22feb3fac5a02f983f074a839f6e335ce3d7680fc06c699fdf97c68cb69176cbfe1f3b100515053ff2688cc690b2adbe1bdae734fa62eff5	common_voice_hsb_20431160.mp3	Njedawno bu w Delnjej Łužicy Serbske towarstwo swójbow "Gromaźe" załožene.	2	0	fourties	male			hsb	
fcbf0ad71bbc820e22feb3fac5a02f983f074a839f6e335ce3d7680fc06c699fdf97c68cb69176cbfe1f3b100515053ff2688cc690b2adbe1bdae734fa62eff5	common_voice_hsb_20431161.mp3	Nam bě wažne, zo je za kóždy słód a kóždu starobu něšto pódla.	2	0	fourties	male			hsb	
fcbf0ad71bbc820e22feb3fac5a02f983f074a839f6e335ce3d7680fc06c699fdf97c68cb69176cbfe1f3b100515053ff2688cc690b2adbe1bdae734fa62eff5	common_voice_hsb_20431163.mp3	Tak wuměnjeja so ewangelscy Serbja z Hornjeje a Delnjeje Łužicy.	2	0	fourties	male			hsb	
fcbf0ad71bbc820e22feb3fac5a02f983f074a839f6e335ce3d7680fc06c699fdf97c68cb69176cbfe1f3b100515053ff2688cc690b2adbe1bdae734fa62eff5	common_voice_hsb_20431188.mp3	Wona je sej kompletnu nowu garderobu sama dariła.	2	0	fourties	male			hsb	
fcbf0ad71bbc820e22feb3fac5a02f983f074a839f6e335ce3d7680fc06c699fdf97c68cb69176cbfe1f3b100515053ff2688cc690b2adbe1bdae734fa62eff5	common_voice_hsb_20431190.mp3	Wón přińdźe dźensa wječor, do toho dyrbimy wšitko spakowane měć.	2	0	fourties	male			hsb	
fcbf0ad71bbc820e22feb3fac5a02f983f074a839f6e335ce3d7680fc06c699fdf97c68cb69176cbfe1f3b100515053ff2688cc690b2adbe1bdae734fa62eff5	common_voice_hsb_20431191.mp3	Jedna cyrkej prawje, hdyž wěstych ludźi wot lubosće Božeje wuzamknje?	2	0	fourties	male			hsb	
fcbf0ad71bbc820e22feb3fac5a02f983f074a839f6e335ce3d7680fc06c699fdf97c68cb69176cbfe1f3b100515053ff2688cc690b2adbe1bdae734fa62eff5	common_voice_hsb_20431192.mp3	Tak by so tež móhła symbioza mjez projektami docpěc.	2	0	fourties	male			hsb	
fcbf0ad71bbc820e22feb3fac5a02f983f074a839f6e335ce3d7680fc06c699fdf97c68cb69176cbfe1f3b100515053ff2688cc690b2adbe1bdae734fa62eff5	common_voice_hsb_20431193.mp3	Towarstwo skića najwšelakoriše kubłanske zarjadowanja wosebje šulam a dalšim kubłanišćam.	2	0	fourties	male			hsb	
fcbf0ad71bbc820e22feb3fac5a02f983f074a839f6e335ce3d7680fc06c699fdf97c68cb69176cbfe1f3b100515053ff2688cc690b2adbe1bdae734fa62eff5	common_voice_hsb_20431219.mp3	Při tym steji čestnohamtski angažement młodostnych w srjedźisću zjawnosće.	2	0	fourties	male			hsb	
fcbf0ad71bbc820e22feb3fac5a02f983f074a839f6e335ce3d7680fc06c699fdf97c68cb69176cbfe1f3b100515053ff2688cc690b2adbe1bdae734fa62eff5	common_voice_hsb_20431220.mp3	Měto Nowak je diskusiju wo zestajenju masterskeho plana za rewitalizaciju delnjoserbšćiny nastorčił.	2	0	fourties	male			hsb	
fcbf0ad71bbc820e22feb3fac5a02f983f074a839f6e335ce3d7680fc06c699fdf97c68cb69176cbfe1f3b100515053ff2688cc690b2adbe1bdae734fa62eff5	common_voice_hsb_20431221.mp3	Mi je wažne wědźeć, štó a što za poskitkom tči.	2	0	fourties	male			hsb	
fcbf0ad71bbc820e22feb3fac5a02f983f074a839f6e335ce3d7680fc06c699fdf97c68cb69176cbfe1f3b100515053ff2688cc690b2adbe1bdae734fa62eff5	common_voice_hsb_20431222.mp3	Woheń bě při žnjenskich dźěłach ratarskeho předewzaća nastał.	2	0	fourties	male			hsb	
fcbf0ad71bbc820e22feb3fac5a02f983f074a839f6e335ce3d7680fc06c699fdf97c68cb69176cbfe1f3b100515053ff2688cc690b2adbe1bdae734fa62eff5	common_voice_hsb_20431223.mp3	Termin zetkanja w tutym lěće běše spočatk nowembra.	2	0	fourties	male			hsb	
fcbf0ad71bbc820e22feb3fac5a02f983f074a839f6e335ce3d7680fc06c699fdf97c68cb69176cbfe1f3b100515053ff2688cc690b2adbe1bdae734fa62eff5	common_voice_hsb_20431243.mp3	Mi so šaty Štefi Hanušoweje najbóle lubja.	2	0	fourties	male			hsb	
fcbf0ad71bbc820e22feb3fac5a02f983f074a839f6e335ce3d7680fc06c699fdf97c68cb69176cbfe1f3b100515053ff2688cc690b2adbe1bdae734fa62eff5	common_voice_hsb_20431245.mp3	Wosebite myto, darjene wot Wokrjesneje nalutowarnje Budyšin, wuznamjenja dale wosebje rjane ideje.	2	0	fourties	male			hsb	
fcbf0ad71bbc820e22feb3fac5a02f983f074a839f6e335ce3d7680fc06c699fdf97c68cb69176cbfe1f3b100515053ff2688cc690b2adbe1bdae734fa62eff5	common_voice_hsb_20431246.mp3	Jako hosći směmy Serbski kwasny ćah z Janšojc witać.	2	0	fourties	male			hsb	
fcbf0ad71bbc820e22feb3fac5a02f983f074a839f6e335ce3d7680fc06c699fdf97c68cb69176cbfe1f3b100515053ff2688cc690b2adbe1bdae734fa62eff5	common_voice_hsb_20431247.mp3	Škórcy wołaja z třěchi, zo je lěćo bórze nimo.	2	0	fourties	male			hsb	
fcbf0ad71bbc820e22feb3fac5a02f983f074a839f6e335ce3d7680fc06c699fdf97c68cb69176cbfe1f3b100515053ff2688cc690b2adbe1bdae734fa62eff5	common_voice_hsb_20431248.mp3	A kak wupada ze serbšćinu we wsy?	2	0	fourties	male			hsb	
fcbf0ad71bbc820e22feb3fac5a02f983f074a839f6e335ce3d7680fc06c699fdf97c68cb69176cbfe1f3b100515053ff2688cc690b2adbe1bdae734fa62eff5	common_voice_hsb_20431254.mp3	Dotal móžeše so tendenca serbšćiny we Wojerecach jenož jako negatiwna wopisać.	2	0	fourties	male			hsb	
fcbf0ad71bbc820e22feb3fac5a02f983f074a839f6e335ce3d7680fc06c699fdf97c68cb69176cbfe1f3b100515053ff2688cc690b2adbe1bdae734fa62eff5	common_voice_hsb_20431255.mp3	Pućowanske šćežki a rěčki wjedu w přenjesenym zmysle k hwězdam.	2	0	fourties	male			hsb	
fcbf0ad71bbc820e22feb3fac5a02f983f074a839f6e335ce3d7680fc06c699fdf97c68cb69176cbfe1f3b100515053ff2688cc690b2adbe1bdae734fa62eff5	common_voice_hsb_20431256.mp3	Zwjetša pochadźeja woni z Radworja a Chrósćic.	2	0	fourties	male			hsb	
fcbf0ad71bbc820e22feb3fac5a02f983f074a839f6e335ce3d7680fc06c699fdf97c68cb69176cbfe1f3b100515053ff2688cc690b2adbe1bdae734fa62eff5	common_voice_hsb_20431257.mp3	Wot statneje strony wudźěłane wustawki wotpokaza wjetšina zastupjerjow towarstwow.	2	0	fourties	male			hsb	
fcbf0ad71bbc820e22feb3fac5a02f983f074a839f6e335ce3d7680fc06c699fdf97c68cb69176cbfe1f3b100515053ff2688cc690b2adbe1bdae734fa62eff5	common_voice_hsb_20431258.mp3	Wój stej móhłoj wulkotnje dźiwadło hrać, ale docyła nic spěwać.	2	0	fourties	male			hsb	
fcbf0ad71bbc820e22feb3fac5a02f983f074a839f6e335ce3d7680fc06c699fdf97c68cb69176cbfe1f3b100515053ff2688cc690b2adbe1bdae734fa62eff5	common_voice_hsb_20431274.mp3	Hižo jako pachoł horješe so za hudźbu a započa na gitarje hrać.	2	0	fourties	male			hsb	
fcbf0ad71bbc820e22feb3fac5a02f983f074a839f6e335ce3d7680fc06c699fdf97c68cb69176cbfe1f3b100515053ff2688cc690b2adbe1bdae734fa62eff5	common_voice_hsb_20431275.mp3	Po přeću wuknjacych a wuwučowacych chcyli nowemu šulskemu kompleksej mjeno Kita Lorenca spožčić.	2	0	fourties	male			hsb	
fcbf0ad71bbc820e22feb3fac5a02f983f074a839f6e335ce3d7680fc06c699fdf97c68cb69176cbfe1f3b100515053ff2688cc690b2adbe1bdae734fa62eff5	common_voice_hsb_20431276.mp3	Haty tež wobstatk wody Sprjewje za Braniborsku stabilizuja.	2	0	fourties	male			hsb	
fcbf0ad71bbc820e22feb3fac5a02f983f074a839f6e335ce3d7680fc06c699fdf97c68cb69176cbfe1f3b100515053ff2688cc690b2adbe1bdae734fa62eff5	common_voice_hsb_20431277.mp3	Swjaty wótc swjećeše tam Božu mšu z wěriwymi z něhdźe sto narodnosćow.	2	0	fourties	male			hsb	
fcbf0ad71bbc820e22feb3fac5a02f983f074a839f6e335ce3d7680fc06c699fdf97c68cb69176cbfe1f3b100515053ff2688cc690b2adbe1bdae734fa62eff5	common_voice_hsb_20431278.mp3	Konkretne naprawy maja so podkłasć, zo by so tu předležacy dokument zwoprawdźił.	2	0	fourties	male			hsb	
fcbf0ad71bbc820e22feb3fac5a02f983f074a839f6e335ce3d7680fc06c699fdf97c68cb69176cbfe1f3b100515053ff2688cc690b2adbe1bdae734fa62eff5	common_voice_hsb_20431311.mp3	Jako centralne stejnišćo měł twarski kompleks při Berlinskej, Dwórnišćowej a Salomonowej hasy słužić.	2	0	fourties	male			hsb	
fcbf0ad71bbc820e22feb3fac5a02f983f074a839f6e335ce3d7680fc06c699fdf97c68cb69176cbfe1f3b100515053ff2688cc690b2adbe1bdae734fa62eff5	common_voice_hsb_20431312.mp3	Słyšiš ty žabu abo je to hinaše zwěrjo?	2	0	fourties	male			hsb	
fcbf0ad71bbc820e22feb3fac5a02f983f074a839f6e335ce3d7680fc06c699fdf97c68cb69176cbfe1f3b100515053ff2688cc690b2adbe1bdae734fa62eff5	common_voice_hsb_20431313.mp3	Do gmejny słušeja wjeski kaž Chelno, Bronjo a Kamjenjej.	2	0	fourties	male			hsb	
fcbf0ad71bbc820e22feb3fac5a02f983f074a839f6e335ce3d7680fc06c699fdf97c68cb69176cbfe1f3b100515053ff2688cc690b2adbe1bdae734fa62eff5	common_voice_hsb_20431314.mp3	Tutón zarjadniski předpis nabudźe dźeń po swojim wozjewjenju płaćiwosć.	2	0	fourties	male			hsb	
fcbf0ad71bbc820e22feb3fac5a02f983f074a839f6e335ce3d7680fc06c699fdf97c68cb69176cbfe1f3b100515053ff2688cc690b2adbe1bdae734fa62eff5	common_voice_hsb_20431315.mp3	Tež dźensa so často wo prawym a wopačnym zežiwjenju rěči a diskutuje.	2	0	fourties	male			hsb	
fcbf0ad71bbc820e22feb3fac5a02f983f074a839f6e335ce3d7680fc06c699fdf97c68cb69176cbfe1f3b100515053ff2688cc690b2adbe1bdae734fa62eff5	common_voice_hsb_20431326.mp3	Hač do toho wobchowa potrjecheny swoje čłonske prawa.	2	0	fourties	male			hsb	
fcbf0ad71bbc820e22feb3fac5a02f983f074a839f6e335ce3d7680fc06c699fdf97c68cb69176cbfe1f3b100515053ff2688cc690b2adbe1bdae734fa62eff5	common_voice_hsb_20431327.mp3	Što so stanje, hdyž so wšědna serbska drasta přeco bóle ze žiwjenja pozhubja?	2	0	fourties	male			hsb	
fcbf0ad71bbc820e22feb3fac5a02f983f074a839f6e335ce3d7680fc06c699fdf97c68cb69176cbfe1f3b100515053ff2688cc690b2adbe1bdae734fa62eff5	common_voice_hsb_20431328.mp3	Potom skutkowaše jako nowowučer we Borkowach w Błótach.	2	0	fourties	male			hsb	
fcbf0ad71bbc820e22feb3fac5a02f983f074a839f6e335ce3d7680fc06c699fdf97c68cb69176cbfe1f3b100515053ff2688cc690b2adbe1bdae734fa62eff5	common_voice_hsb_20431329.mp3	Runočasnje chcemy rozmołwy na fachowych runinach wjesć.	2	0	fourties	male			hsb	
fcbf0ad71bbc820e22feb3fac5a02f983f074a839f6e335ce3d7680fc06c699fdf97c68cb69176cbfe1f3b100515053ff2688cc690b2adbe1bdae734fa62eff5	common_voice_hsb_20431330.mp3	Z wjeselom dožiwich na cyrkwinskim dnju přitomne dźěći.	2	0	fourties	male			hsb	
fcbf0ad71bbc820e22feb3fac5a02f983f074a839f6e335ce3d7680fc06c699fdf97c68cb69176cbfe1f3b100515053ff2688cc690b2adbe1bdae734fa62eff5	common_voice_hsb_20492648.mp3	Wona chce ludźom w nuzy k dispoziciji stać.	2	0	fourties	male			hsb	
fcbf0ad71bbc820e22feb3fac5a02f983f074a839f6e335ce3d7680fc06c699fdf97c68cb69176cbfe1f3b100515053ff2688cc690b2adbe1bdae734fa62eff5	common_voice_hsb_20492649.mp3	Wobjed wobsteješe z kisałeho kała, hrocha, howjazeho mjasa a chlěba.	2	0	fourties	male			hsb	
fcbf0ad71bbc820e22feb3fac5a02f983f074a839f6e335ce3d7680fc06c699fdf97c68cb69176cbfe1f3b100515053ff2688cc690b2adbe1bdae734fa62eff5	common_voice_hsb_20492650.mp3	Wona je serbske narodne hibanje wědomje sćěhowała.	2	0	fourties	male			hsb	
fcbf0ad71bbc820e22feb3fac5a02f983f074a839f6e335ce3d7680fc06c699fdf97c68cb69176cbfe1f3b100515053ff2688cc690b2adbe1bdae734fa62eff5	common_voice_hsb_20492651.mp3	Tež dźěćace přebywanišća steja w fokusu noweje agendy.	2	0	fourties	male			hsb	
fcbf0ad71bbc820e22feb3fac5a02f983f074a839f6e335ce3d7680fc06c699fdf97c68cb69176cbfe1f3b100515053ff2688cc690b2adbe1bdae734fa62eff5	common_voice_hsb_20492652.mp3	Ale njepraj to twojej maćeri, wona so jenož rozhori.	2	0	fourties	male			hsb	
fcbf0ad71bbc820e22feb3fac5a02f983f074a839f6e335ce3d7680fc06c699fdf97c68cb69176cbfe1f3b100515053ff2688cc690b2adbe1bdae734fa62eff5	common_voice_hsb_20492678.mp3	Čehodla nasta w Budyšinje hida přećiwo serbskej mjeńšinje a namóc přećiwo ćěkancam?	2	0	fourties	male			hsb	
fcbf0ad71bbc820e22feb3fac5a02f983f074a839f6e335ce3d7680fc06c699fdf97c68cb69176cbfe1f3b100515053ff2688cc690b2adbe1bdae734fa62eff5	common_voice_hsb_20492679.mp3	Njereakcija Domowiny pak zda so k jeje zadźerženju w minjenych pjeć lětach hodźeć.	2	0	fourties	male			hsb	
fcbf0ad71bbc820e22feb3fac5a02f983f074a839f6e335ce3d7680fc06c699fdf97c68cb69176cbfe1f3b100515053ff2688cc690b2adbe1bdae734fa62eff5	common_voice_hsb_20492680.mp3	Symboliske kamjenje zwobraznichu Berlinsku murju, ale tež nadźiju, wjeselo, zmužitosć a wěru.	2	0	fourties	male			hsb	
fcbf0ad71bbc820e22feb3fac5a02f983f074a839f6e335ce3d7680fc06c699fdf97c68cb69176cbfe1f3b100515053ff2688cc690b2adbe1bdae734fa62eff5	common_voice_hsb_20492681.mp3	Přiwšěm je internat samostatna institucija ze swójskim narokom a swójskimi nadawkami.	2	0	fourties	male			hsb	
fcbf0ad71bbc820e22feb3fac5a02f983f074a839f6e335ce3d7680fc06c699fdf97c68cb69176cbfe1f3b100515053ff2688cc690b2adbe1bdae734fa62eff5	common_voice_hsb_20492682.mp3	Wšudźe tam, hdźež njemóžemy so na serbski konsens dojednać, wohrožamy našu jednansku poziciju.	2	0	fourties	male			hsb	
fcbf0ad71bbc820e22feb3fac5a02f983f074a839f6e335ce3d7680fc06c699fdf97c68cb69176cbfe1f3b100515053ff2688cc690b2adbe1bdae734fa62eff5	common_voice_hsb_20492693.mp3	A pokaza na jednoho z dweju wučerjow na foće.	2	0	fourties	male			hsb	
fcbf0ad71bbc820e22feb3fac5a02f983f074a839f6e335ce3d7680fc06c699fdf97c68cb69176cbfe1f3b100515053ff2688cc690b2adbe1bdae734fa62eff5	common_voice_hsb_20492694.mp3	Přičinu za přidatne wudawki widźi Dietmar Wolf w napjatym połoženju na twarskich wikach.	2	0	fourties	male			hsb	
fcbf0ad71bbc820e22feb3fac5a02f983f074a839f6e335ce3d7680fc06c699fdf97c68cb69176cbfe1f3b100515053ff2688cc690b2adbe1bdae734fa62eff5	common_voice_hsb_20492695.mp3	Za wšitkich dalšich šulerjow posrědkuje so wučba w tutych předmjetach bilingualnje.	2	0	fourties	male			hsb	
fcbf0ad71bbc820e22feb3fac5a02f983f074a839f6e335ce3d7680fc06c699fdf97c68cb69176cbfe1f3b100515053ff2688cc690b2adbe1bdae734fa62eff5	common_voice_hsb_20492696.mp3	Wotpowědny namjet je na wčerawšej konferency wobswětowych ministrow w Hamburgu zapodała.	2	0	fourties	male			hsb	
fcbf0ad71bbc820e22feb3fac5a02f983f074a839f6e335ce3d7680fc06c699fdf97c68cb69176cbfe1f3b100515053ff2688cc690b2adbe1bdae734fa62eff5	common_voice_hsb_20492697.mp3	Jednaćel Domowiny je so z wulkim angažementom za radźenje tutoho wjerška zasadźił.	2	0	fourties	male			hsb	
fcbf0ad71bbc820e22feb3fac5a02f983f074a839f6e335ce3d7680fc06c699fdf97c68cb69176cbfe1f3b100515053ff2688cc690b2adbe1bdae734fa62eff5	common_voice_hsb_20492713.mp3	Snadź sej potom tón abo tamny serbske mjeno wsy spomjatkuje.	2	0	fourties	male			hsb	
fcbf0ad71bbc820e22feb3fac5a02f983f074a839f6e335ce3d7680fc06c699fdf97c68cb69176cbfe1f3b100515053ff2688cc690b2adbe1bdae734fa62eff5	common_voice_hsb_20492714.mp3	We wotměnjawych zwučowanjach so leksika zwučuje a skruća.	2	0	fourties	male			hsb	
fcbf0ad71bbc820e22feb3fac5a02f983f074a839f6e335ce3d7680fc06c699fdf97c68cb69176cbfe1f3b100515053ff2688cc690b2adbe1bdae734fa62eff5	common_voice_hsb_20492715.mp3	Skoržićelej Němska pomoc přirody a Zelena liga witatej wukaz braniborskeho krajneho zarjada za hórnistwo.	2	0	fourties	male			hsb	
fcbf0ad71bbc820e22feb3fac5a02f983f074a839f6e335ce3d7680fc06c699fdf97c68cb69176cbfe1f3b100515053ff2688cc690b2adbe1bdae734fa62eff5	common_voice_hsb_20492716.mp3	K tomu liči tež zwólniwosć, so prawidłownje dale kubłać a sej nazhonjenja wuměnjeć.	2	0	fourties	male			hsb	
fcbf0ad71bbc820e22feb3fac5a02f983f074a839f6e335ce3d7680fc06c699fdf97c68cb69176cbfe1f3b100515053ff2688cc690b2adbe1bdae734fa62eff5	common_voice_hsb_20492717.mp3	Předsydka napisa w mjenje rady list na šefa Sakskeje statneje kenclije.	2	0	fourties	male			hsb	
fcbf0ad71bbc820e22feb3fac5a02f983f074a839f6e335ce3d7680fc06c699fdf97c68cb69176cbfe1f3b100515053ff2688cc690b2adbe1bdae734fa62eff5	common_voice_hsb_20492733.mp3	Spěchujemy a podpěramy zhromadne dźěło organow třěšneho zwjazka.	2	0	fourties	male			hsb	
fcbf0ad71bbc820e22feb3fac5a02f983f074a839f6e335ce3d7680fc06c699fdf97c68cb69176cbfe1f3b100515053ff2688cc690b2adbe1bdae734fa62eff5	common_voice_hsb_20492734.mp3	Nochcyše, zo by Jasnička stajnje wokoło njeho frinkoliła.	2	1	fourties	male			hsb	
fcbf0ad71bbc820e22feb3fac5a02f983f074a839f6e335ce3d7680fc06c699fdf97c68cb69176cbfe1f3b100515053ff2688cc690b2adbe1bdae734fa62eff5	common_voice_hsb_20492735.mp3	Sobudźěłaćerjo Njepilic statoka zastarachu wšitkich z napojemi.	2	0	fourties	male			hsb	
