client_id	path	sentence	up_votes	down_votes	age	gender	accents	variant	locale	segment
06a9482035f05b25e8611a81fdedd868b3b28259b3f1952824713419a571159d526efb63d650b5b8766639d488b16ea9f77d04967ab43062ffa0b1a65135bf55	common_voice_rm-vallader_21650529.mp3	Ün dazier cun unifuorma e tuot staiva süll’aula.	2	0	fourties	male			rm-vallader	
06a9482035f05b25e8611a81fdedd868b3b28259b3f1952824713419a571159d526efb63d650b5b8766639d488b16ea9f77d04967ab43062ffa0b1a65135bf55	common_voice_rm-vallader_21650550.mp3	I’s tratta da l’ultima lavur da la sesavla etappa da quist proget.	2	0	fourties	male			rm-vallader	
06a9482035f05b25e8611a81fdedd868b3b28259b3f1952824713419a571159d526efb63d650b5b8766639d488b16ea9f77d04967ab43062ffa0b1a65135bf55	common_voice_rm-vallader_21650551.mp3	Perchè ha üna persuna chi stà oura Cuoira surtut il presidi da la società?	2	0	fourties	male			rm-vallader	
06a9482035f05b25e8611a81fdedd868b3b28259b3f1952824713419a571159d526efb63d650b5b8766639d488b16ea9f77d04967ab43062ffa0b1a65135bf55	common_voice_rm-vallader_21650552.mp3	«La lingua rumauntscha m’ha sgüra manà avantags», ha’la declerà.	2	0	fourties	male			rm-vallader	
06a9482035f05b25e8611a81fdedd868b3b28259b3f1952824713419a571159d526efb63d650b5b8766639d488b16ea9f77d04967ab43062ffa0b1a65135bf55	common_voice_rm-vallader_21650553.mp3	A la fin ha’l senti la terra suot ils peis.	2	0	fourties	male			rm-vallader	
06a9482035f05b25e8611a81fdedd868b3b28259b3f1952824713419a571159d526efb63d650b5b8766639d488b16ea9f77d04967ab43062ffa0b1a65135bf55	common_voice_rm-vallader_21650575.mp3	«Quist at darà ün’insalada!»	2	0	fourties	male			rm-vallader	
06a9482035f05b25e8611a81fdedd868b3b28259b3f1952824713419a571159d526efb63d650b5b8766639d488b16ea9f77d04967ab43062ffa0b1a65135bf55	common_voice_rm-vallader_21650577.mp3	Üna fuorma nouva ha tschüf la cronica.	2	0	fourties	male			rm-vallader	
06a9482035f05b25e8611a81fdedd868b3b28259b3f1952824713419a571159d526efb63d650b5b8766639d488b16ea9f77d04967ab43062ffa0b1a65135bf55	common_voice_rm-vallader_21650578.mp3	«Ils delegats s’han intimats da tour tuot las masüras da spargn pussiblas.»	2	0	fourties	male			rm-vallader	
06a9482035f05b25e8611a81fdedd868b3b28259b3f1952824713419a571159d526efb63d650b5b8766639d488b16ea9f77d04967ab43062ffa0b1a65135bf55	common_voice_rm-vallader_21650632.mp3	Ellas sun dürant tuot l’on plü inquiettas sco fingià normalmaing.	2	1	fourties	male			rm-vallader	
06a9482035f05b25e8611a81fdedd868b3b28259b3f1952824713419a571159d526efb63d650b5b8766639d488b16ea9f77d04967ab43062ffa0b1a65135bf55	common_voice_rm-vallader_21650655.mp3	Là ha el lura simplamaing spettà sün agüd.	2	1	fourties	male			rm-vallader	
06a9482035f05b25e8611a81fdedd868b3b28259b3f1952824713419a571159d526efb63d650b5b8766639d488b16ea9f77d04967ab43062ffa0b1a65135bf55	common_voice_rm-vallader_21650657.mp3	«Il plü sul füssa sch’eu nu pudess plü mouver mias chommas.	2	0	fourties	male			rm-vallader	
06a9482035f05b25e8611a81fdedd868b3b28259b3f1952824713419a571159d526efb63d650b5b8766639d488b16ea9f77d04967ab43062ffa0b1a65135bf55	common_voice_rm-vallader_21650659.mp3	Momo pissera ch’ella possa murir in sia abitaziun sül settavel plan.	2	0	fourties	male			rm-vallader	
06a9482035f05b25e8611a81fdedd868b3b28259b3f1952824713419a571159d526efb63d650b5b8766639d488b16ea9f77d04967ab43062ffa0b1a65135bf55	common_voice_rm-vallader_21650664.mp3	Darcheu ün on plü tard pona ingaschar cun Alois Solinger lur prüm lavuraint.	2	1	fourties	male			rm-vallader	
06a9482035f05b25e8611a81fdedd868b3b28259b3f1952824713419a571159d526efb63d650b5b8766639d488b16ea9f77d04967ab43062ffa0b1a65135bf55	common_voice_rm-vallader_21650711.mp3	Eir pro las junioras es üna grischuna dvantada champiunessa, Sereina Mischol da Tavo.	2	0	fourties	male			rm-vallader	
06a9482035f05b25e8611a81fdedd868b3b28259b3f1952824713419a571159d526efb63d650b5b8766639d488b16ea9f77d04967ab43062ffa0b1a65135bf55	common_voice_rm-vallader_21650713.mp3	La resposta ais statta «Latsch».	2	0	fourties	male			rm-vallader	
06a9482035f05b25e8611a81fdedd868b3b28259b3f1952824713419a571159d526efb63d650b5b8766639d488b16ea9f77d04967ab43062ffa0b1a65135bf55	common_voice_rm-vallader_21650714.mp3	Cul invid per quella es gnü publichà eir il rapport annual da la società.	2	0	fourties	male			rm-vallader	
06a9482035f05b25e8611a81fdedd868b3b28259b3f1952824713419a571159d526efb63d650b5b8766639d488b16ea9f77d04967ab43062ffa0b1a65135bf55	common_voice_rm-vallader_21650745.mp3	Marcel Gross fa il transport da schlitras e persunas.	2	0	fourties	male			rm-vallader	
06a9482035f05b25e8611a81fdedd868b3b28259b3f1952824713419a571159d526efb63d650b5b8766639d488b16ea9f77d04967ab43062ffa0b1a65135bf55	common_voice_rm-vallader_21650746.mp3	«Diplomazia».	2	1	fourties	male			rm-vallader	
06a9482035f05b25e8611a81fdedd868b3b28259b3f1952824713419a571159d526efb63d650b5b8766639d488b16ea9f77d04967ab43062ffa0b1a65135bf55	common_voice_rm-vallader_21650747.mp3	Il prüm s’haja bod ün pa cumpaschiun cun quels chi stan là.	2	0	fourties	male			rm-vallader	
06a9482035f05b25e8611a81fdedd868b3b28259b3f1952824713419a571159d526efb63d650b5b8766639d488b16ea9f77d04967ab43062ffa0b1a65135bf55	common_voice_rm-vallader_21650748.mp3	Forsa vaiva’l eir temma da perder la plazza.	2	0	fourties	male			rm-vallader	
06a9482035f05b25e8611a81fdedd868b3b28259b3f1952824713419a571159d526efb63d650b5b8766639d488b16ea9f77d04967ab43062ffa0b1a65135bf55	common_voice_rm-vallader_21650835.mp3	Quist’instanza pudess eleger dafatta «sia» suprastanza e seis agen post da controlla.	2	1	fourties	male			rm-vallader	
06a9482035f05b25e8611a81fdedd868b3b28259b3f1952824713419a571159d526efb63d650b5b8766639d488b16ea9f77d04967ab43062ffa0b1a65135bf55	common_voice_rm-vallader_21650836.mp3	Oters, ils concerns gronds, fabrichan a la periferia butias adüna plü grondas.	2	0	fourties	male			rm-vallader	
06a9482035f05b25e8611a81fdedd868b3b28259b3f1952824713419a571159d526efb63d650b5b8766639d488b16ea9f77d04967ab43062ffa0b1a65135bf55	common_voice_rm-vallader_21650837.mp3	Venderdi passà ha gnü lö il di da las portas avertas.	2	0	fourties	male			rm-vallader	
06a9482035f05b25e8611a81fdedd868b3b28259b3f1952824713419a571159d526efb63d650b5b8766639d488b16ea9f77d04967ab43062ffa0b1a65135bf55	common_voice_rm-vallader_21650838.mp3	Ün’anteriura stipendiata da Rahe es uossa la prüma violoncellista da la China.	2	1	fourties	male			rm-vallader	
06a9482035f05b25e8611a81fdedd868b3b28259b3f1952824713419a571159d526efb63d650b5b8766639d488b16ea9f77d04967ab43062ffa0b1a65135bf55	common_voice_rm-vallader_21650839.mp3	Pel mumaint es el leader da la coppa alpina.	2	0	fourties	male			rm-vallader	
06a9482035f05b25e8611a81fdedd868b3b28259b3f1952824713419a571159d526efb63d650b5b8766639d488b16ea9f77d04967ab43062ffa0b1a65135bf55	common_voice_rm-vallader_21650875.mp3	La proposta as basa sün ün’iniziativa inoltrada l’on passà.	2	0	fourties	male			rm-vallader	
06a9482035f05b25e8611a81fdedd868b3b28259b3f1952824713419a571159d526efb63d650b5b8766639d488b16ea9f77d04967ab43062ffa0b1a65135bf55	common_voice_rm-vallader_21650878.mp3	Eir pro quist proverbi latin constataina, quant latins cha nus Rumantschs eschan.	2	0	fourties	male			rm-vallader	
06a9482035f05b25e8611a81fdedd868b3b28259b3f1952824713419a571159d526efb63d650b5b8766639d488b16ea9f77d04967ab43062ffa0b1a65135bf55	common_voice_rm-vallader_21650879.mp3	La prognosa a reguard ils vadrets es alarmanta.	2	0	fourties	male			rm-vallader	
06a9482035f05b25e8611a81fdedd868b3b28259b3f1952824713419a571159d526efb63d650b5b8766639d488b16ea9f77d04967ab43062ffa0b1a65135bf55	common_voice_rm-vallader_21650930.mp3	Lapro as tratta quai d’ün Albanais e d’ün Palestinais.	2	0	fourties	male			rm-vallader	
06a9482035f05b25e8611a81fdedd868b3b28259b3f1952824713419a571159d526efb63d650b5b8766639d488b16ea9f77d04967ab43062ffa0b1a65135bf55	common_voice_rm-vallader_21650932.mp3	Quai es allegraivel, chaschuna però ün chalender d’arrandschamaints surchargià.	2	0	fourties	male			rm-vallader	
06a9482035f05b25e8611a81fdedd868b3b28259b3f1952824713419a571159d526efb63d650b5b8766639d488b16ea9f77d04967ab43062ffa0b1a65135bf55	common_voice_rm-vallader_21650934.mp3	Prossem venderdi han lö a Grenchen las maestranzas svizras da striunar.	2	0	fourties	male			rm-vallader	
06a9482035f05b25e8611a81fdedd868b3b28259b3f1952824713419a571159d526efb63d650b5b8766639d488b16ea9f77d04967ab43062ffa0b1a65135bf55	common_voice_rm-vallader_21650935.mp3	In mincha cas es uossa tscherchà ün nouv capo cumünal pel cumün da Tschlin.	2	0	fourties	male			rm-vallader	
06a9482035f05b25e8611a81fdedd868b3b28259b3f1952824713419a571159d526efb63d650b5b8766639d488b16ea9f77d04967ab43062ffa0b1a65135bf55	common_voice_rm-vallader_21650937.mp3	Fingià lönch avant d’eiran vendüdas oura las plazzas.	2	0	fourties	male			rm-vallader	
06a9482035f05b25e8611a81fdedd868b3b28259b3f1952824713419a571159d526efb63d650b5b8766639d488b16ea9f77d04967ab43062ffa0b1a65135bf55	common_voice_rm-vallader_21650995.mp3	Sainza dubi as tratta dad üna scolaziun chi pretenda bler ingaschamaint.	2	0	fourties	male			rm-vallader	
06a9482035f05b25e8611a81fdedd868b3b28259b3f1952824713419a571159d526efb63d650b5b8766639d488b16ea9f77d04967ab43062ffa0b1a65135bf55	common_voice_rm-vallader_21650996.mp3	Il resultat muossa però cha la skeptica nun es statta güstifichada.	2	0	fourties	male			rm-vallader	
06a9482035f05b25e8611a81fdedd868b3b28259b3f1952824713419a571159d526efb63d650b5b8766639d488b16ea9f77d04967ab43062ffa0b1a65135bf55	common_voice_rm-vallader_21650997.mp3	Eu pos lavurar tuotta di, ma quai sarà oramai mia sort.	2	1	fourties	male			rm-vallader	
06a9482035f05b25e8611a81fdedd868b3b28259b3f1952824713419a571159d526efb63d650b5b8766639d488b16ea9f77d04967ab43062ffa0b1a65135bf55	common_voice_rm-vallader_21650998.mp3	Schnöss nu vaiva’l mai cumportà.	2	0	fourties	male			rm-vallader	
06a9482035f05b25e8611a81fdedd868b3b28259b3f1952824713419a571159d526efb63d650b5b8766639d488b16ea9f77d04967ab43062ffa0b1a65135bf55	common_voice_rm-vallader_21650999.mp3	Donaziuns privatas e da sponsuors dessan fluir a favur dal sport svizzer d’impedits.	2	0	fourties	male			rm-vallader	
06a9482035f05b25e8611a81fdedd868b3b28259b3f1952824713419a571159d526efb63d650b5b8766639d488b16ea9f77d04967ab43062ffa0b1a65135bf55	common_voice_rm-vallader_21651075.mp3	Tanter oter stopcha quel mantgnair la cretta da möd integritar.	2	1	fourties	male			rm-vallader	
06a9482035f05b25e8611a81fdedd868b3b28259b3f1952824713419a571159d526efb63d650b5b8766639d488b16ea9f77d04967ab43062ffa0b1a65135bf55	common_voice_rm-vallader_21651077.mp3	Che far uossa?	2	0	fourties	male			rm-vallader	
06a9482035f05b25e8611a81fdedd868b3b28259b3f1952824713419a571159d526efb63d650b5b8766639d488b16ea9f77d04967ab43062ffa0b1a65135bf55	common_voice_rm-vallader_21651080.mp3	Per quai voula artists!	2	0	fourties	male			rm-vallader	
06a9482035f05b25e8611a81fdedd868b3b28259b3f1952824713419a571159d526efb63d650b5b8766639d488b16ea9f77d04967ab43062ffa0b1a65135bf55	common_voice_rm-vallader_21651082.mp3	Impustüt artists indigens suvegnan là üna pussibiltà dad expuoner e vender lur ovras.	2	0	fourties	male			rm-vallader	
06a9482035f05b25e8611a81fdedd868b3b28259b3f1952824713419a571159d526efb63d650b5b8766639d488b16ea9f77d04967ab43062ffa0b1a65135bf55	common_voice_rm-vallader_21651121.mp3	Eir seis amis sun mütschits.	2	0	fourties	male			rm-vallader	
06a9482035f05b25e8611a81fdedd868b3b28259b3f1952824713419a571159d526efb63d650b5b8766639d488b16ea9f77d04967ab43062ffa0b1a65135bf55	common_voice_rm-vallader_21651122.mp3	«In mincha cumün existivan bainschi pitschnas societats d’allevamaint», ha’l intunà.	2	1	fourties	male			rm-vallader	
06a9482035f05b25e8611a81fdedd868b3b28259b3f1952824713419a571159d526efb63d650b5b8766639d488b16ea9f77d04967ab43062ffa0b1a65135bf55	common_voice_rm-vallader_21651123.mp3	Ella instruischa però eir sco docenta privata a l’Università da Neuchâtel.	2	0	fourties	male			rm-vallader	
06a9482035f05b25e8611a81fdedd868b3b28259b3f1952824713419a571159d526efb63d650b5b8766639d488b16ea9f77d04967ab43062ffa0b1a65135bf55	common_voice_rm-vallader_21651124.mp3	Las nüvlas fan lur gös culla muntogna.	2	0	fourties	male			rm-vallader	
06a9482035f05b25e8611a81fdedd868b3b28259b3f1952824713419a571159d526efb63d650b5b8766639d488b16ea9f77d04967ab43062ffa0b1a65135bf55	common_voice_rm-vallader_21651178.mp3	Na, il motor sun uossa las regenzas.	2	0	fourties	male			rm-vallader	
06a9482035f05b25e8611a81fdedd868b3b28259b3f1952824713419a571159d526efb63d650b5b8766639d488b16ea9f77d04967ab43062ffa0b1a65135bf55	common_voice_rm-vallader_21651180.mp3	A Mals vegnan eir organisats trais workshops.	2	0	fourties	male			rm-vallader	
06a9482035f05b25e8611a81fdedd868b3b28259b3f1952824713419a571159d526efb63d650b5b8766639d488b16ea9f77d04967ab43062ffa0b1a65135bf55	common_voice_rm-vallader_21651182.mp3	Noms da persunas chi vegnan in dumonda sun tanter oter gnüts nomnats duos.	2	0	fourties	male			rm-vallader	
06a9482035f05b25e8611a81fdedd868b3b28259b3f1952824713419a571159d526efb63d650b5b8766639d488b16ea9f77d04967ab43062ffa0b1a65135bf55	common_voice_rm-vallader_21651183.mp3	Uossa renda quel implant accessibla la regiun impustüt eir pel sport d’inviern.	2	1	fourties	male			rm-vallader	
06a9482035f05b25e8611a81fdedd868b3b28259b3f1952824713419a571159d526efb63d650b5b8766639d488b16ea9f77d04967ab43062ffa0b1a65135bf55	common_voice_rm-vallader_21651233.mp3	Roberto Porroni es ün dals interprets ils plü renomnats da la guitarra classica.	2	0	fourties	male			rm-vallader	
06a9482035f05b25e8611a81fdedd868b3b28259b3f1952824713419a571159d526efb63d650b5b8766639d488b16ea9f77d04967ab43062ffa0b1a65135bf55	common_voice_rm-vallader_21651234.mp3	Vi d’üna paraid pendan ils trais ultims purtrets.	2	0	fourties	male			rm-vallader	
06a9482035f05b25e8611a81fdedd868b3b28259b3f1952824713419a571159d526efb63d650b5b8766639d488b16ea9f77d04967ab43062ffa0b1a65135bf55	common_voice_rm-vallader_21651236.mp3	Perquai sustegna il ps la proposta per supplemaints onests.	2	0	fourties	male			rm-vallader	
06a9482035f05b25e8611a81fdedd868b3b28259b3f1952824713419a571159d526efb63d650b5b8766639d488b16ea9f77d04967ab43062ffa0b1a65135bf55	common_voice_rm-vallader_21651432.mp3	«Ideas».	2	0	fourties	male			rm-vallader	
06a9482035f05b25e8611a81fdedd868b3b28259b3f1952824713419a571159d526efb63d650b5b8766639d488b16ea9f77d04967ab43062ffa0b1a65135bf55	common_voice_rm-vallader_21651433.mp3	Quatter dals vainch magisters da la scoula da musica han concertà a Sent.	2	0	fourties	male			rm-vallader	
06a9482035f05b25e8611a81fdedd868b3b28259b3f1952824713419a571159d526efb63d650b5b8766639d488b16ea9f77d04967ab43062ffa0b1a65135bf55	common_voice_rm-vallader_21651434.mp3	Pro las pernottaziuns muossa la statistica per l’on scuors üna diminuziun remarchabla.	2	0	fourties	male			rm-vallader	
06a9482035f05b25e8611a81fdedd868b3b28259b3f1952824713419a571159d526efb63d650b5b8766639d488b16ea9f77d04967ab43062ffa0b1a65135bf55	common_voice_rm-vallader_21651436.mp3	Uossa nun esa plü dad ir a tscherchar quistas istorgias da piz a chantun.	2	0	fourties	male			rm-vallader	
06a9482035f05b25e8611a81fdedd868b3b28259b3f1952824713419a571159d526efb63d650b5b8766639d488b16ea9f77d04967ab43062ffa0b1a65135bf55	common_voice_rm-vallader_21654100.mp3	Ed uossa, ha’l trafichà ün uman?	2	0	fourties	male			rm-vallader	
06a9482035f05b25e8611a81fdedd868b3b28259b3f1952824713419a571159d526efb63d650b5b8766639d488b16ea9f77d04967ab43062ffa0b1a65135bf55	common_voice_rm-vallader_21654101.mp3	Ingrid as tschainta, as tegna ün man sül frunt.	2	0	fourties	male			rm-vallader	
06a9482035f05b25e8611a81fdedd868b3b28259b3f1952824713419a571159d526efb63d650b5b8766639d488b16ea9f77d04967ab43062ffa0b1a65135bf55	common_voice_rm-vallader_21654102.mp3	La ruina dal Chastè Balcun At sur Müstair es gnüda sanada.	2	0	fourties	male			rm-vallader	
06a9482035f05b25e8611a81fdedd868b3b28259b3f1952824713419a571159d526efb63d650b5b8766639d488b16ea9f77d04967ab43062ffa0b1a65135bf55	common_voice_rm-vallader_21654103.mp3	Forsa d’eira quist proget propcha «ün nomer massa grond» per Tschlin.	2	0	fourties	male			rm-vallader	
06a9482035f05b25e8611a81fdedd868b3b28259b3f1952824713419a571159d526efb63d650b5b8766639d488b16ea9f77d04967ab43062ffa0b1a65135bf55	common_voice_rm-vallader_21654134.mp3	Coura dumonda’l pardun per la schleppa dad her, sül Linard.	2	0	fourties	male			rm-vallader	
06a9482035f05b25e8611a81fdedd868b3b28259b3f1952824713419a571159d526efb63d650b5b8766639d488b16ea9f77d04967ab43062ffa0b1a65135bf55	common_voice_rm-vallader_21654138.mp3	Be daspera as rechatta üna bella punt cuernada da lain.	2	0	fourties	male			rm-vallader	
06a9482035f05b25e8611a81fdedd868b3b28259b3f1952824713419a571159d526efb63d650b5b8766639d488b16ea9f77d04967ab43062ffa0b1a65135bf55	common_voice_rm-vallader_21654176.mp3	In quella fasa prodüan quellas bacterias la plü gronda quantità da bioplastic.	2	0	fourties	male			rm-vallader	
06a9482035f05b25e8611a81fdedd868b3b28259b3f1952824713419a571159d526efb63d650b5b8766639d488b16ea9f77d04967ab43062ffa0b1a65135bf55	common_voice_rm-vallader_21654177.mp3	Els prouvan da tils leger e da tils interpretar –insomma: i dvaintan pitschens detectivs.	2	0	fourties	male			rm-vallader	
06a9482035f05b25e8611a81fdedd868b3b28259b3f1952824713419a571159d526efb63d650b5b8766639d488b16ea9f77d04967ab43062ffa0b1a65135bf55	common_voice_rm-vallader_21654178.mp3	Pro la punt gronda s’haja stuvü rumper giò tuot fin sül vout.	2	0	fourties	male			rm-vallader	
06a9482035f05b25e8611a81fdedd868b3b28259b3f1952824713419a571159d526efb63d650b5b8766639d488b16ea9f77d04967ab43062ffa0b1a65135bf55	common_voice_rm-vallader_21654179.mp3	Là es nempe gnüda fundada la società Chüra d’uffants Engiadina Bassa.	2	0	fourties	male			rm-vallader	
06a9482035f05b25e8611a81fdedd868b3b28259b3f1952824713419a571159d526efb63d650b5b8766639d488b16ea9f77d04967ab43062ffa0b1a65135bf55	common_voice_rm-vallader_21654227.mp3	Per part sgüra per motivs da funcziunalità, disch Mengia Mathis.	2	0	fourties	male			rm-vallader	
06a9482035f05b25e8611a81fdedd868b3b28259b3f1952824713419a571159d526efb63d650b5b8766639d488b16ea9f77d04967ab43062ffa0b1a65135bf55	common_voice_rm-vallader_21654229.mp3	I vöglian far murir a mai! … Darcheu quist chan, quist banadi chan!	2	0	fourties	male			rm-vallader	
06a9482035f05b25e8611a81fdedd868b3b28259b3f1952824713419a571159d526efb63d650b5b8766639d488b16ea9f77d04967ab43062ffa0b1a65135bf55	common_voice_rm-vallader_21654230.mp3	Fos!	2	0	fourties	male			rm-vallader	
06a9482035f05b25e8611a81fdedd868b3b28259b3f1952824713419a571159d526efb63d650b5b8766639d488b16ea9f77d04967ab43062ffa0b1a65135bf55	common_voice_rm-vallader_21654233.mp3	«Tü am gnissast be a dret quista saira», ha bruntulà Küng.	2	0	fourties	male			rm-vallader	
06a9482035f05b25e8611a81fdedd868b3b28259b3f1952824713419a571159d526efb63d650b5b8766639d488b16ea9f77d04967ab43062ffa0b1a65135bf55	common_voice_rm-vallader_21654235.mp3	Oscar Peer va intuorn cun ögls averts ed attents, pertschaiva, metta a lö.	2	0	fourties	male			rm-vallader	
06a9482035f05b25e8611a81fdedd868b3b28259b3f1952824713419a571159d526efb63d650b5b8766639d488b16ea9f77d04967ab43062ffa0b1a65135bf55	common_voice_rm-vallader_21654287.mp3	Il resultat da tuot l’ingaschamaint ha fascinà, e quai na «be» als pitschens.	2	1	fourties	male			rm-vallader	
06a9482035f05b25e8611a81fdedd868b3b28259b3f1952824713419a571159d526efb63d650b5b8766639d488b16ea9f77d04967ab43062ffa0b1a65135bf55	common_voice_rm-vallader_21654290.mp3	El s’ha tschantà lasura ed es parti cun tuot vers la fabrica.	2	0	fourties	male			rm-vallader	
06a9482035f05b25e8611a81fdedd868b3b28259b3f1952824713419a571159d526efb63d650b5b8766639d488b16ea9f77d04967ab43062ffa0b1a65135bf55	common_voice_rm-vallader_21654291.mp3	Üna buna part da la populaziun viva da quel.	2	0	fourties	male			rm-vallader	
06a9482035f05b25e8611a81fdedd868b3b28259b3f1952824713419a571159d526efb63d650b5b8766639d488b16ea9f77d04967ab43062ffa0b1a65135bf55	common_voice_rm-vallader_21654292.mp3	Ils consorts Conrad-Selm han dat grond pais a la scolaziun da lur uffants.	2	1	fourties	male			rm-vallader	
06a9482035f05b25e8611a81fdedd868b3b28259b3f1952824713419a571159d526efb63d650b5b8766639d488b16ea9f77d04967ab43062ffa0b1a65135bf55	common_voice_rm-vallader_21654338.mp3	Els han passantà ils prüms plaschairs e dischillusiuns.	2	0	fourties	male			rm-vallader	
06a9482035f05b25e8611a81fdedd868b3b28259b3f1952824713419a571159d526efb63d650b5b8766639d488b16ea9f77d04967ab43062ffa0b1a65135bf55	common_voice_rm-vallader_21654340.mp3	Grandcusglier Bruno Claus ha preschantà la ledscha sur da la fuormaziun professiunala.	2	0	fourties	male			rm-vallader	
06a9482035f05b25e8611a81fdedd868b3b28259b3f1952824713419a571159d526efb63d650b5b8766639d488b16ea9f77d04967ab43062ffa0b1a65135bf55	common_voice_rm-vallader_21654341.mp3	La scoula da paurs ha pudü cumprar lura ün tablà da la famiglia Nolfi.	2	0	fourties	male			rm-vallader	
06a9482035f05b25e8611a81fdedd868b3b28259b3f1952824713419a571159d526efb63d650b5b8766639d488b16ea9f77d04967ab43062ffa0b1a65135bf55	common_voice_rm-vallader_21654342.mp3	Perche dess gnir revgni qua amo üna jada al cudesch?	2	0	fourties	male			rm-vallader	
06a9482035f05b25e8611a81fdedd868b3b28259b3f1952824713419a571159d526efb63d650b5b8766639d488b16ea9f77d04967ab43062ffa0b1a65135bf55	common_voice_rm-vallader_21654370.mp3	Il concept final sto gnir inoltrà pro las instanzas chantunalas e federalas.	2	0	fourties	male			rm-vallader	
06a9482035f05b25e8611a81fdedd868b3b28259b3f1952824713419a571159d526efb63d650b5b8766639d488b16ea9f77d04967ab43062ffa0b1a65135bf55	common_voice_rm-vallader_21654371.mp3	Arno Ritzmann vain propuonü dal pps sco candidat pel güdisch districtual dal district En.	2	0	fourties	male			rm-vallader	
06a9482035f05b25e8611a81fdedd868b3b28259b3f1952824713419a571159d526efb63d650b5b8766639d488b16ea9f77d04967ab43062ffa0b1a65135bf55	common_voice_rm-vallader_21654372.mp3	Els sun invidats ad üna tschaina da nozzas ingio chi vain mangià, bavü, discurrü.	2	0	fourties	male			rm-vallader	
06a9482035f05b25e8611a81fdedd868b3b28259b3f1952824713419a571159d526efb63d650b5b8766639d488b16ea9f77d04967ab43062ffa0b1a65135bf55	common_voice_rm-vallader_21654399.mp3	Sch’eu vezzess l’uors, stessa ün toc davent perquai ch’eu vess temma.	2	0	fourties	male			rm-vallader	
06a9482035f05b25e8611a81fdedd868b3b28259b3f1952824713419a571159d526efb63d650b5b8766639d488b16ea9f77d04967ab43062ffa0b1a65135bf55	common_voice_rm-vallader_21654404.mp3	Planets collectivs sun uranus, neptun e pluto.	2	1	fourties	male			rm-vallader	
06a9482035f05b25e8611a81fdedd868b3b28259b3f1952824713419a571159d526efb63d650b5b8766639d488b16ea9f77d04967ab43062ffa0b1a65135bf55	common_voice_rm-vallader_21654442.mp3	Daspö Falun s’haja construi eir ils skis our da materials artificials.	2	0	fourties	male			rm-vallader	
06a9482035f05b25e8611a81fdedd868b3b28259b3f1952824713419a571159d526efb63d650b5b8766639d488b16ea9f77d04967ab43062ffa0b1a65135bf55	common_voice_rm-vallader_21654443.mp3	Cur cha Sidonia Janett tilla riva vegna quietischem.	2	0	fourties	male			rm-vallader	
06a9482035f05b25e8611a81fdedd868b3b28259b3f1952824713419a571159d526efb63d650b5b8766639d488b16ea9f77d04967ab43062ffa0b1a65135bf55	common_voice_rm-vallader_21654444.mp3	Il motiv per la dispitta d’eiran las alps d’Ardez in Vermunt.	2	0	fourties	male			rm-vallader	
06a9482035f05b25e8611a81fdedd868b3b28259b3f1952824713419a571159d526efb63d650b5b8766639d488b16ea9f77d04967ab43062ffa0b1a65135bf55	common_voice_rm-vallader_21654445.mp3	Perche tematisescha Peer adüna darcheu quista constellaziun?	2	1	fourties	male			rm-vallader	
06a9482035f05b25e8611a81fdedd868b3b28259b3f1952824713419a571159d526efb63d650b5b8766639d488b16ea9f77d04967ab43062ffa0b1a65135bf55	common_voice_rm-vallader_21870744.mp3	«Scha Lavin disch da schi vaina surmuntà il prüm impedimaint.	2	0	fourties	male			rm-vallader	
06a9482035f05b25e8611a81fdedd868b3b28259b3f1952824713419a571159d526efb63d650b5b8766639d488b16ea9f77d04967ab43062ffa0b1a65135bf55	common_voice_rm-vallader_21870746.mp3	In sonda saira ha la Società da chatschaders Turettas salvà sia radunanza generala.	2	0	fourties	male			rm-vallader	
06a9482035f05b25e8611a81fdedd868b3b28259b3f1952824713419a571159d526efb63d650b5b8766639d488b16ea9f77d04967ab43062ffa0b1a65135bf55	common_voice_rm-vallader_21870752.mp3	Ulrich Knellwolf es renomnà sco autur dad istorgias criminalas sco «Tod in Sils Maria».	2	0	fourties	male			rm-vallader	
06a9482035f05b25e8611a81fdedd868b3b28259b3f1952824713419a571159d526efb63d650b5b8766639d488b16ea9f77d04967ab43062ffa0b1a65135bf55	common_voice_rm-vallader_21870753.mp3	Quel attira adüna darcheu ün grond public.	2	0	fourties	male			rm-vallader	
06a9482035f05b25e8611a81fdedd868b3b28259b3f1952824713419a571159d526efb63d650b5b8766639d488b16ea9f77d04967ab43062ffa0b1a65135bf55	common_voice_rm-vallader_21870754.mp3	Aint ils corps da pumpiers as dovra be glieud motivada e bain instruida.	2	0	fourties	male			rm-vallader	
06a9482035f05b25e8611a81fdedd868b3b28259b3f1952824713419a571159d526efb63d650b5b8766639d488b16ea9f77d04967ab43062ffa0b1a65135bf55	common_voice_rm-vallader_21870755.mp3	Davo il salüd dal president ha lura Luzi Arquint prelet seis fich bun protocol.	2	0	fourties	male			rm-vallader	
06a9482035f05b25e8611a81fdedd868b3b28259b3f1952824713419a571159d526efb63d650b5b8766639d488b16ea9f77d04967ab43062ffa0b1a65135bf55	common_voice_rm-vallader_21870756.mp3	La marca da meis ögliers es per la schimgiottaria.	2	0	fourties	male			rm-vallader	
06a9482035f05b25e8611a81fdedd868b3b28259b3f1952824713419a571159d526efb63d650b5b8766639d488b16ea9f77d04967ab43062ffa0b1a65135bf55	common_voice_rm-vallader_21870764.mp3	I nu’s po gnanca giovar ün mumaint, adüna as fa’la davent.	2	0	fourties	male			rm-vallader	
06a9482035f05b25e8611a81fdedd868b3b28259b3f1952824713419a571159d526efb63d650b5b8766639d488b16ea9f77d04967ab43062ffa0b1a65135bf55	common_voice_rm-vallader_21870765.mp3	Il prossem giast es l’autur sursilvan Theo Candinas.	2	1	fourties	male			rm-vallader	
