client_id	path	sentence	up_votes	down_votes	age	gender	accents	variant	locale	segment
06a9482035f05b25e8611a81fdedd868b3b28259b3f1952824713419a571159d526efb63d650b5b8766639d488b16ea9f77d04967ab43062ffa0b1a65135bf55	common_voice_rm-vallader_21873063.mp3	Il pilot d’eira stat ün chapitani da fregatta tudais-ch cul nom Engelbrecht.	2	0	fourties	male			rm-vallader	
06a9482035f05b25e8611a81fdedd868b3b28259b3f1952824713419a571159d526efb63d650b5b8766639d488b16ea9f77d04967ab43062ffa0b1a65135bf55	common_voice_rm-vallader_21873071.mp3	Quista prevezza da crear ün’associaziun dad abitar.	2	0	fourties	male			rm-vallader	
06a9482035f05b25e8611a81fdedd868b3b28259b3f1952824713419a571159d526efb63d650b5b8766639d488b16ea9f77d04967ab43062ffa0b1a65135bf55	common_voice_rm-vallader_21873073.mp3	Aint illa cumischiun sindicatorica tschaintan duos duonnas ed ün hom.	2	0	fourties	male			rm-vallader	
06a9482035f05b25e8611a81fdedd868b3b28259b3f1952824713419a571159d526efb63d650b5b8766639d488b16ea9f77d04967ab43062ffa0b1a65135bf55	common_voice_rm-vallader_21873076.mp3	Quai impustüt per planisar lur vacanzas.	2	0	fourties	male			rm-vallader	
06a9482035f05b25e8611a81fdedd868b3b28259b3f1952824713419a571159d526efb63d650b5b8766639d488b16ea9f77d04967ab43062ffa0b1a65135bf55	common_voice_rm-vallader_21873077.mp3	Aint in tuots!	2	0	fourties	male			rm-vallader	
06a9482035f05b25e8611a81fdedd868b3b28259b3f1952824713419a571159d526efb63d650b5b8766639d488b16ea9f77d04967ab43062ffa0b1a65135bf55	common_voice_rm-vallader_21873079.mp3	Simplamaing wow!»	2	0	fourties	male			rm-vallader	
06a9482035f05b25e8611a81fdedd868b3b28259b3f1952824713419a571159d526efb63d650b5b8766639d488b16ea9f77d04967ab43062ffa0b1a65135bf55	common_voice_rm-vallader_21873090.mp3	«Ma oramai es ella qua.	2	0	fourties	male			rm-vallader	
06a9482035f05b25e8611a81fdedd868b3b28259b3f1952824713419a571159d526efb63d650b5b8766639d488b16ea9f77d04967ab43062ffa0b1a65135bf55	common_voice_rm-vallader_21873092.mp3	Lina piglia sü e mira.	2	0	fourties	male			rm-vallader	
06a9482035f05b25e8611a81fdedd868b3b28259b3f1952824713419a571159d526efb63d650b5b8766639d488b16ea9f77d04967ab43062ffa0b1a65135bf55	common_voice_rm-vallader_21873094.mp3	Il recuors es uossa gnü refüsà plainamaing.	2	0	fourties	male			rm-vallader	
06a9482035f05b25e8611a81fdedd868b3b28259b3f1952824713419a571159d526efb63d650b5b8766639d488b16ea9f77d04967ab43062ffa0b1a65135bf55	common_voice_rm-vallader_21873146.mp3	Planin planin as haja lura invlidà.	2	0	fourties	male			rm-vallader	
06a9482035f05b25e8611a81fdedd868b3b28259b3f1952824713419a571159d526efb63d650b5b8766639d488b16ea9f77d04967ab43062ffa0b1a65135bf55	common_voice_rm-vallader_21873147.mp3	Ün oter votant percunter ha rinvià a l’importanza culturala da la halla.	2	0	fourties	male			rm-vallader	
06a9482035f05b25e8611a81fdedd868b3b28259b3f1952824713419a571159d526efb63d650b5b8766639d488b16ea9f77d04967ab43062ffa0b1a65135bf55	common_voice_rm-vallader_21873148.mp3	Cun spordscher activitats sportivas prouva la gruppa da s-chaffir il plaschair pel movimaint.	2	0	fourties	male			rm-vallader	
06a9482035f05b25e8611a81fdedd868b3b28259b3f1952824713419a571159d526efb63d650b5b8766639d488b16ea9f77d04967ab43062ffa0b1a65135bf55	common_voice_rm-vallader_21873149.mp3	Ed in dumengia haja dat üna lottaria, cun bels premis.	2	0	fourties	male			rm-vallader	
06a9482035f05b25e8611a81fdedd868b3b28259b3f1952824713419a571159d526efb63d650b5b8766639d488b16ea9f77d04967ab43062ffa0b1a65135bf55	common_voice_rm-vallader_21873161.mp3	Eir scenari per «Ben Hur» Davo seis stüdi es Vidal entrà ill’armada.	2	0	fourties	male			rm-vallader	
06a9482035f05b25e8611a81fdedd868b3b28259b3f1952824713419a571159d526efb63d650b5b8766639d488b16ea9f77d04967ab43062ffa0b1a65135bf55	common_voice_rm-vallader_21873164.mp3	Spargnar es statta la devisa a partir dal principi.	2	0	fourties	male			rm-vallader	
06a9482035f05b25e8611a81fdedd868b3b28259b3f1952824713419a571159d526efb63d650b5b8766639d488b16ea9f77d04967ab43062ffa0b1a65135bf55	common_voice_rm-vallader_21873167.mp3	E lura adüna darcheu: Articulaziun.	2	0	fourties	male			rm-vallader	
06a9482035f05b25e8611a81fdedd868b3b28259b3f1952824713419a571159d526efb63d650b5b8766639d488b16ea9f77d04967ab43062ffa0b1a65135bf55	common_voice_rm-vallader_21873168.mp3	Quai es bun, agreabel e san.	2	0	fourties	male			rm-vallader	
06a9482035f05b25e8611a81fdedd868b3b28259b3f1952824713419a571159d526efb63d650b5b8766639d488b16ea9f77d04967ab43062ffa0b1a65135bf55	common_voice_rm-vallader_21873180.mp3	Ün’idea veglia vain sdruagliada a nouva vita.	2	0	fourties	male			rm-vallader	
06a9482035f05b25e8611a81fdedd868b3b28259b3f1952824713419a571159d526efb63d650b5b8766639d488b16ea9f77d04967ab43062ffa0b1a65135bf55	common_voice_rm-vallader_21873181.mp3	Ils partecipants sunan cun lur agens instrumaints ed in differentas gruppas.	2	1	fourties	male			rm-vallader	
06a9482035f05b25e8611a81fdedd868b3b28259b3f1952824713419a571159d526efb63d650b5b8766639d488b16ea9f77d04967ab43062ffa0b1a65135bf55	common_voice_rm-vallader_21873182.mp3	Ella pratichescha ün manster chi’d es amo adüna rar per üna duonna.	2	0	fourties	male			rm-vallader	
06a9482035f05b25e8611a81fdedd868b3b28259b3f1952824713419a571159d526efb63d650b5b8766639d488b16ea9f77d04967ab43062ffa0b1a65135bf55	common_voice_rm-vallader_21873183.mp3	Quella halla es intant amo in possess privat.	2	0	fourties	male			rm-vallader	
06a9482035f05b25e8611a81fdedd868b3b28259b3f1952824713419a571159d526efb63d650b5b8766639d488b16ea9f77d04967ab43062ffa0b1a65135bf55	common_voice_rm-vallader_21873225.mp3	Uschea ha cumanzà l’istorgia dal Grischun illa confederaziun.	2	0	fourties	male			rm-vallader	
06a9482035f05b25e8611a81fdedd868b3b28259b3f1952824713419a571159d526efb63d650b5b8766639d488b16ea9f77d04967ab43062ffa0b1a65135bf55	common_voice_rm-vallader_21873228.mp3	Sia vasta lavur es implü gnüda onurifichada cul premi da cultura grischun.	2	0	fourties	male			rm-vallader	
06a9482035f05b25e8611a81fdedd868b3b28259b3f1952824713419a571159d526efb63d650b5b8766639d488b16ea9f77d04967ab43062ffa0b1a65135bf55	common_voice_rm-vallader_21873229.mp3	A partir da settant’ons ston automobilists far regularmaing üna controlla medicinica.	2	1	fourties	male			rm-vallader	
06a9482035f05b25e8611a81fdedd868b3b28259b3f1952824713419a571159d526efb63d650b5b8766639d488b16ea9f77d04967ab43062ffa0b1a65135bf55	common_voice_rm-vallader_21873231.mp3	Las scoulinas da Scuol e da Sent realiseschan insembel adüna darcheu progets plü gronds.	2	0	fourties	male			rm-vallader	
06a9482035f05b25e8611a81fdedd868b3b28259b3f1952824713419a571159d526efb63d650b5b8766639d488b16ea9f77d04967ab43062ffa0b1a65135bf55	common_voice_rm-vallader_21873280.mp3	Nouva commembra dal cussagl cumünal es dvantada Gretta Vulpi.	2	0	fourties	male			rm-vallader	
06a9482035f05b25e8611a81fdedd868b3b28259b3f1952824713419a571159d526efb63d650b5b8766639d488b16ea9f77d04967ab43062ffa0b1a65135bf55	common_voice_rm-vallader_21873282.mp3	Ir a lavurar sün montascha, quai clingiaiva stupend in mias uraglias.»	2	0	fourties	male			rm-vallader	
06a9482035f05b25e8611a81fdedd868b3b28259b3f1952824713419a571159d526efb63d650b5b8766639d488b16ea9f77d04967ab43062ffa0b1a65135bf55	common_voice_rm-vallader_21873285.mp3	Pro las ingredienzas vegnan fattas eir excepziuns.	2	0	fourties	male			rm-vallader	
06a9482035f05b25e8611a81fdedd868b3b28259b3f1952824713419a571159d526efb63d650b5b8766639d488b16ea9f77d04967ab43062ffa0b1a65135bf55	common_voice_rm-vallader_21873295.mp3	La comunicaziun na violenta po gnir dovrada sün mincha chomp da la vita.	2	0	fourties	male			rm-vallader	
06a9482035f05b25e8611a81fdedd868b3b28259b3f1952824713419a571159d526efb63d650b5b8766639d488b16ea9f77d04967ab43062ffa0b1a65135bf55	common_voice_rm-vallader_21873296.mp3	La cumischiun aua minerala ha previs per quist evenimaint ün’acziun speciala.	2	0	fourties	male			rm-vallader	
06a9482035f05b25e8611a81fdedd868b3b28259b3f1952824713419a571159d526efb63d650b5b8766639d488b16ea9f77d04967ab43062ffa0b1a65135bf55	common_voice_rm-vallader_21873297.mp3	Che sun las entradas principalas dal cumün?	2	1	fourties	male			rm-vallader	
06a9482035f05b25e8611a81fdedd868b3b28259b3f1952824713419a571159d526efb63d650b5b8766639d488b16ea9f77d04967ab43062ffa0b1a65135bf55	common_voice_rm-vallader_21873298.mp3	«La paschiun pel hip hop ans unischa», manaja Snook.	2	0	fourties	male			rm-vallader	
06a9482035f05b25e8611a81fdedd868b3b28259b3f1952824713419a571159d526efb63d650b5b8766639d488b16ea9f77d04967ab43062ffa0b1a65135bf55	common_voice_rm-vallader_21873299.mp3	Ma cha quai haja forsa da chefar cun la situaziun da la duonna.	2	0	fourties	male			rm-vallader	
06a9482035f05b25e8611a81fdedd868b3b28259b3f1952824713419a571159d526efb63d650b5b8766639d488b16ea9f77d04967ab43062ffa0b1a65135bf55	common_voice_rm-vallader_21873323.mp3	Ella es gnüda eletta unanimamaing.	2	0	fourties	male			rm-vallader	
06a9482035f05b25e8611a81fdedd868b3b28259b3f1952824713419a571159d526efb63d650b5b8766639d488b16ea9f77d04967ab43062ffa0b1a65135bf55	common_voice_rm-vallader_21873324.mp3	Chi nu saja solitari, chi s’haja divers cuntschaints qua, quinta ella.	2	0	fourties	male			rm-vallader	
06a9482035f05b25e8611a81fdedd868b3b28259b3f1952824713419a571159d526efb63d650b5b8766639d488b16ea9f77d04967ab43062ffa0b1a65135bf55	common_voice_rm-vallader_21873328.mp3	Las plövgiadas dals ultims dis han fat crescher l’En fermamaing.	2	0	fourties	male			rm-vallader	
06a9482035f05b25e8611a81fdedd868b3b28259b3f1952824713419a571159d526efb63d650b5b8766639d488b16ea9f77d04967ab43062ffa0b1a65135bf55	common_voice_rm-vallader_21873330.mp3	Fiduzcha e transparenza, quai sun meis gronds böts.	2	0	fourties	male			rm-vallader	
06a9482035f05b25e8611a81fdedd868b3b28259b3f1952824713419a571159d526efb63d650b5b8766639d488b16ea9f77d04967ab43062ffa0b1a65135bf55	common_voice_rm-vallader_21873431.mp3	Eir ella es dvantada commembra da la band.	2	1	fourties	male			rm-vallader	
06a9482035f05b25e8611a81fdedd868b3b28259b3f1952824713419a571159d526efb63d650b5b8766639d488b16ea9f77d04967ab43062ffa0b1a65135bf55	common_voice_rm-vallader_21873432.mp3	La società es proprietaria d’üna parcella da fabrica in Rachögna.	2	0	fourties	male			rm-vallader	
06a9482035f05b25e8611a81fdedd868b3b28259b3f1952824713419a571159d526efb63d650b5b8766639d488b16ea9f77d04967ab43062ffa0b1a65135bf55	common_voice_rm-vallader_21873433.mp3	Sco cha Peter Schudel declera daja bogns termals e da quels cun aua minerala.	2	0	fourties	male			rm-vallader	
06a9482035f05b25e8611a81fdedd868b3b28259b3f1952824713419a571159d526efb63d650b5b8766639d488b16ea9f77d04967ab43062ffa0b1a65135bf55	common_voice_rm-vallader_21873446.mp3	Duos chamonnas sun gnüdas schaniadas.	2	0	fourties	male			rm-vallader	
06a9482035f05b25e8611a81fdedd868b3b28259b3f1952824713419a571159d526efb63d650b5b8766639d488b16ea9f77d04967ab43062ffa0b1a65135bf55	common_voice_rm-vallader_21873447.mp3	Fin uossa s’haja però be ün computer chi vain dovrà da la bibliotecara.	2	0	fourties	male			rm-vallader	
06a9482035f05b25e8611a81fdedd868b3b28259b3f1952824713419a571159d526efb63d650b5b8766639d488b16ea9f77d04967ab43062ffa0b1a65135bf55	common_voice_rm-vallader_21873457.mp3	Cun nouvas masüras as prouva da tilla salvar.	2	0	fourties	male			rm-vallader	
06a9482035f05b25e8611a81fdedd868b3b28259b3f1952824713419a571159d526efb63d650b5b8766639d488b16ea9f77d04967ab43062ffa0b1a65135bf55	common_voice_rm-vallader_21880385.mp3	Il ravarenda ha in seguit dat scoula i’l Lyceum Alpinum a Zuoz.	2	0	fourties	male			rm-vallader	
06a9482035f05b25e8611a81fdedd868b3b28259b3f1952824713419a571159d526efb63d650b5b8766639d488b16ea9f77d04967ab43062ffa0b1a65135bf55	common_voice_rm-vallader_21880387.mp3	Davo quai suna in possess dals artists.	2	0	fourties	male			rm-vallader	
06a9482035f05b25e8611a81fdedd868b3b28259b3f1952824713419a571159d526efb63d650b5b8766639d488b16ea9f77d04967ab43062ffa0b1a65135bf55	common_voice_rm-vallader_21880388.mp3	Scha quist ultim es insomma giavüschà o brich resorta main cler da las respostas.	2	0	fourties	male			rm-vallader	
06a9482035f05b25e8611a81fdedd868b3b28259b3f1952824713419a571159d526efb63d650b5b8766639d488b16ea9f77d04967ab43062ffa0b1a65135bf55	common_voice_rm-vallader_21880389.mp3	Cha quai saja ün toc ter pretensius, per tuot ils instrumaints.	2	1	fourties	male			rm-vallader	
06a9482035f05b25e8611a81fdedd868b3b28259b3f1952824713419a571159d526efb63d650b5b8766639d488b16ea9f77d04967ab43062ffa0b1a65135bf55	common_voice_rm-vallader_21880398.mp3	Oramai eir cuntschaint in Engiadina es François Barro.	2	1	fourties	male			rm-vallader	
06a9482035f05b25e8611a81fdedd868b3b28259b3f1952824713419a571159d526efb63d650b5b8766639d488b16ea9f77d04967ab43062ffa0b1a65135bf55	common_voice_rm-vallader_21880421.mp3	Students.	2	0	fourties	male			rm-vallader	
06a9482035f05b25e8611a81fdedd868b3b28259b3f1952824713419a571159d526efb63d650b5b8766639d488b16ea9f77d04967ab43062ffa0b1a65135bf55	common_voice_rm-vallader_21880440.mp3	«Reveri signur meidi, ma co vaina da far il viadi?»	2	0	fourties	male			rm-vallader	
06a9482035f05b25e8611a81fdedd868b3b28259b3f1952824713419a571159d526efb63d650b5b8766639d488b16ea9f77d04967ab43062ffa0b1a65135bf55	common_voice_rm-vallader_21880441.mp3	Politicamaing es la dumonda dal marchà d’electricità be dvantada plü difficila.»	2	0	fourties	male			rm-vallader	
06a9482035f05b25e8611a81fdedd868b3b28259b3f1952824713419a571159d526efb63d650b5b8766639d488b16ea9f77d04967ab43062ffa0b1a65135bf55	common_voice_rm-vallader_21880443.mp3	Christian cugnuoschaiva sia Val prediletta.	2	0	fourties	male			rm-vallader	
06a9482035f05b25e8611a81fdedd868b3b28259b3f1952824713419a571159d526efb63d650b5b8766639d488b16ea9f77d04967ab43062ffa0b1a65135bf55	common_voice_rm-vallader_21880444.mp3	Grazcha ad üna facturaziun plü regulara pudaina preschantar uossa saldos allegraivels.	2	0	fourties	male			rm-vallader	
06a9482035f05b25e8611a81fdedd868b3b28259b3f1952824713419a571159d526efb63d650b5b8766639d488b16ea9f77d04967ab43062ffa0b1a65135bf55	common_voice_rm-vallader_21880450.mp3	Che cha quista data ha da chefar cun l’inscripziun nu’s saja.	2	0	fourties	male			rm-vallader	
06a9482035f05b25e8611a81fdedd868b3b28259b3f1952824713419a571159d526efb63d650b5b8766639d488b16ea9f77d04967ab43062ffa0b1a65135bf55	common_voice_rm-vallader_21880475.mp3	Eu nu craj cha alch simil es realisabel.	2	0	fourties	male			rm-vallader	
06a9482035f05b25e8611a81fdedd868b3b28259b3f1952824713419a571159d526efb63d650b5b8766639d488b16ea9f77d04967ab43062ffa0b1a65135bf55	common_voice_rm-vallader_21880477.mp3	Uossa sun tscherchadas soluziuns nouvas.	3	0	fourties	male			rm-vallader	
06a9482035f05b25e8611a81fdedd868b3b28259b3f1952824713419a571159d526efb63d650b5b8766639d488b16ea9f77d04967ab43062ffa0b1a65135bf55	common_voice_rm-vallader_21880479.mp3	El eira nos magister da rumantsch.	2	0	fourties	male			rm-vallader	
06a9482035f05b25e8611a81fdedd868b3b28259b3f1952824713419a571159d526efb63d650b5b8766639d488b16ea9f77d04967ab43062ffa0b1a65135bf55	common_voice_rm-vallader_21880491.mp3	Ir a festa as po be cul tren, per parcar autos nun esa plazza.	2	0	fourties	male			rm-vallader	
06a9482035f05b25e8611a81fdedd868b3b28259b3f1952824713419a571159d526efb63d650b5b8766639d488b16ea9f77d04967ab43062ffa0b1a65135bf55	common_voice_rm-vallader_21880492.mp3	Da quel avis eschan eir nus oters.	2	1	fourties	male			rm-vallader	
06a9482035f05b25e8611a81fdedd868b3b28259b3f1952824713419a571159d526efb63d650b5b8766639d488b16ea9f77d04967ab43062ffa0b1a65135bf55	common_voice_rm-vallader_21880493.mp3	Ün da quels es Rico Falett da Sent.	2	0	fourties	male			rm-vallader	
06a9482035f05b25e8611a81fdedd868b3b28259b3f1952824713419a571159d526efb63d650b5b8766639d488b16ea9f77d04967ab43062ffa0b1a65135bf55	common_voice_rm-vallader_21880510.mp3	Persunas chi nu vöglian svess manar la schlitra pon giodair las excursiuns da taxi.	2	0	fourties	male			rm-vallader	
06a9482035f05b25e8611a81fdedd868b3b28259b3f1952824713419a571159d526efb63d650b5b8766639d488b16ea9f77d04967ab43062ffa0b1a65135bf55	common_voice_rm-vallader_21880514.mp3	Eir la culur dals chavels, ils ögls, il nas.	2	1	fourties	male			rm-vallader	
06a9482035f05b25e8611a81fdedd868b3b28259b3f1952824713419a571159d526efb63d650b5b8766639d488b16ea9f77d04967ab43062ffa0b1a65135bf55	common_voice_rm-vallader_21880519.mp3	La famiglia sco la plü pitschna unità dal stadi guadogna darcheu importanza.	2	0	fourties	male			rm-vallader	
06a9482035f05b25e8611a81fdedd868b3b28259b3f1952824713419a571159d526efb63d650b5b8766639d488b16ea9f77d04967ab43062ffa0b1a65135bf55	common_voice_rm-vallader_21880525.mp3	Sias chanzuns nouvas sun otras, bler plü poppigas ed eir plü variadas.	2	0	fourties	male			rm-vallader	
06a9482035f05b25e8611a81fdedd868b3b28259b3f1952824713419a571159d526efb63d650b5b8766639d488b16ea9f77d04967ab43062ffa0b1a65135bf55	common_voice_rm-vallader_21880526.mp3	Seis büro as rechatta a Tarasp.	2	0	fourties	male			rm-vallader	
06a9482035f05b25e8611a81fdedd868b3b28259b3f1952824713419a571159d526efb63d650b5b8766639d488b16ea9f77d04967ab43062ffa0b1a65135bf55	common_voice_rm-vallader_21880527.mp3	I vain fatta ün’excursiun aint in temps passats.	2	0	fourties	male			rm-vallader	
06a9482035f05b25e8611a81fdedd868b3b28259b3f1952824713419a571159d526efb63d650b5b8766639d488b16ea9f77d04967ab43062ffa0b1a65135bf55	common_voice_rm-vallader_21880528.mp3	Da quella dumonda s’ha occupada Irene Küpfer in sia dissertaziun.	2	0	fourties	male			rm-vallader	
06a9482035f05b25e8611a81fdedd868b3b28259b3f1952824713419a571159d526efb63d650b5b8766639d488b16ea9f77d04967ab43062ffa0b1a65135bf55	common_voice_rm-vallader_21880535.mp3	Là pon exprimer las cusglieras e’ls cusgliers cumünals lur avis areguard il proget.	2	0	fourties	male			rm-vallader	
06a9482035f05b25e8611a81fdedd868b3b28259b3f1952824713419a571159d526efb63d650b5b8766639d488b16ea9f77d04967ab43062ffa0b1a65135bf55	common_voice_rm-vallader_21880537.mp3	Eir mia nona Cristina Pazeller derivaiva da Tarasp.	2	0	fourties	male			rm-vallader	
06a9482035f05b25e8611a81fdedd868b3b28259b3f1952824713419a571159d526efb63d650b5b8766639d488b16ea9f77d04967ab43062ffa0b1a65135bf55	common_voice_rm-vallader_21880540.mp3	La collecta da quel va a favur dal muglin vegl da Ftan.	2	0	fourties	male			rm-vallader	
529c11accc6b1306c119debe495694953e382917b5714d31f5dfcf613976b3bc4289b2ccbd3c02fd7cd8d168d8c7f5ba9c58d64b2bb141517479ef0b8e7acc96	common_voice_rm-vallader_20575562.mp3	E chi eschat vus, mattettas?»	2	0	fourties	male			rm-vallader	
529c11accc6b1306c119debe495694953e382917b5714d31f5dfcf613976b3bc4289b2ccbd3c02fd7cd8d168d8c7f5ba9c58d64b2bb141517479ef0b8e7acc96	common_voice_rm-vallader_20575563.mp3	El less ir inavant, mo el sta davant la barriera.	2	0	fourties	male			rm-vallader	
529c11accc6b1306c119debe495694953e382917b5714d31f5dfcf613976b3bc4289b2ccbd3c02fd7cd8d168d8c7f5ba9c58d64b2bb141517479ef0b8e7acc96	common_voice_rm-vallader_20575564.mp3	A scoula n’haja tut facultativmaing latin e talian.	2	0	fourties	male			rm-vallader	
529c11accc6b1306c119debe495694953e382917b5714d31f5dfcf613976b3bc4289b2ccbd3c02fd7cd8d168d8c7f5ba9c58d64b2bb141517479ef0b8e7acc96	common_voice_rm-vallader_20575565.mp3	Las prescripziuns e las pretaisas s’han intant müdadas.	2	0	fourties	male			rm-vallader	
529c11accc6b1306c119debe495694953e382917b5714d31f5dfcf613976b3bc4289b2ccbd3c02fd7cd8d168d8c7f5ba9c58d64b2bb141517479ef0b8e7acc96	common_voice_rm-vallader_20575566.mp3	Els stessan insè cugnuoscher la sporta ch’El ha manzunà avant?	2	0	fourties	male			rm-vallader	
529c11accc6b1306c119debe495694953e382917b5714d31f5dfcf613976b3bc4289b2ccbd3c02fd7cd8d168d8c7f5ba9c58d64b2bb141517479ef0b8e7acc96	common_voice_rm-vallader_20575572.mp3	Quella situaziun, chaschunada da manguels tecnics, possa però bainbod gnir amegldrada.	2	0	fourties	male			rm-vallader	
529c11accc6b1306c119debe495694953e382917b5714d31f5dfcf613976b3bc4289b2ccbd3c02fd7cd8d168d8c7f5ba9c58d64b2bb141517479ef0b8e7acc96	common_voice_rm-vallader_20575573.mp3	Il proget «scoula e turissem» po gnir elavurà in tuot las scoulas.	2	0	fourties	male			rm-vallader	
529c11accc6b1306c119debe495694953e382917b5714d31f5dfcf613976b3bc4289b2ccbd3c02fd7cd8d168d8c7f5ba9c58d64b2bb141517479ef0b8e7acc96	common_voice_rm-vallader_20575574.mp3	Intant svoulan Gildo e Diana Valais fingià dret bain.	2	0	fourties	male			rm-vallader	
529c11accc6b1306c119debe495694953e382917b5714d31f5dfcf613976b3bc4289b2ccbd3c02fd7cd8d168d8c7f5ba9c58d64b2bb141517479ef0b8e7acc96	common_voice_rm-vallader_20575575.mp3	Proponü vegna da mantegner flexibiltà per far in simils cas eir excepziuns.	2	0	fourties	male			rm-vallader	
529c11accc6b1306c119debe495694953e382917b5714d31f5dfcf613976b3bc4289b2ccbd3c02fd7cd8d168d8c7f5ba9c58d64b2bb141517479ef0b8e7acc96	common_voice_rm-vallader_20575576.mp3	Ils resultats dessan servir per realisar il proget a favur da l’intera regiun.	2	0	fourties	male			rm-vallader	
529c11accc6b1306c119debe495694953e382917b5714d31f5dfcf613976b3bc4289b2ccbd3c02fd7cd8d168d8c7f5ba9c58d64b2bb141517479ef0b8e7acc96	common_voice_rm-vallader_20575582.mp3	Es quai l’ultim böt?	2	0	fourties	male			rm-vallader	
529c11accc6b1306c119debe495694953e382917b5714d31f5dfcf613976b3bc4289b2ccbd3c02fd7cd8d168d8c7f5ba9c58d64b2bb141517479ef0b8e7acc96	common_voice_rm-vallader_20575583.mp3	L’inauguraziun vain imbellida cul chant dal cor da baselgia da Müstair.	2	0	fourties	male			rm-vallader	
529c11accc6b1306c119debe495694953e382917b5714d31f5dfcf613976b3bc4289b2ccbd3c02fd7cd8d168d8c7f5ba9c58d64b2bb141517479ef0b8e7acc96	common_voice_rm-vallader_20575584.mp3	Iniziants e respunsabels per l’exposiziun sun Renata e Jon Bott.	2	0	fourties	male			rm-vallader	
529c11accc6b1306c119debe495694953e382917b5714d31f5dfcf613976b3bc4289b2ccbd3c02fd7cd8d168d8c7f5ba9c58d64b2bb141517479ef0b8e7acc96	common_voice_rm-vallader_20575585.mp3	Però il cussagl da scoula ha stuvü gnir elet.	2	0	fourties	male			rm-vallader	
529c11accc6b1306c119debe495694953e382917b5714d31f5dfcf613976b3bc4289b2ccbd3c02fd7cd8d168d8c7f5ba9c58d64b2bb141517479ef0b8e7acc96	common_voice_rm-vallader_20575598.mp3	Fructus es l’uniun per promover veglias sorts da frütta.	2	0	fourties	male			rm-vallader	
529c11accc6b1306c119debe495694953e382917b5714d31f5dfcf613976b3bc4289b2ccbd3c02fd7cd8d168d8c7f5ba9c58d64b2bb141517479ef0b8e7acc96	common_voice_rm-vallader_20575599.mp3	Jon Martin dovra il vierv «lütschaider» per sajetta o sclerida vi dal tschêl.	2	0	fourties	male			rm-vallader	
529c11accc6b1306c119debe495694953e382917b5714d31f5dfcf613976b3bc4289b2ccbd3c02fd7cd8d168d8c7f5ba9c58d64b2bb141517479ef0b8e7acc96	common_voice_rm-vallader_20575600.mp3	Na be hobi-giardiniers, mabain eir giardiniers da professiun.	2	0	fourties	male			rm-vallader	
529c11accc6b1306c119debe495694953e382917b5714d31f5dfcf613976b3bc4289b2ccbd3c02fd7cd8d168d8c7f5ba9c58d64b2bb141517479ef0b8e7acc96	common_voice_rm-vallader_20575601.mp3	Sarà stat vaira, ma i gniva pro eir amo sia paschiun da scriver.	2	0	fourties	male			rm-vallader	
529c11accc6b1306c119debe495694953e382917b5714d31f5dfcf613976b3bc4289b2ccbd3c02fd7cd8d168d8c7f5ba9c58d64b2bb141517479ef0b8e7acc96	common_voice_rm-vallader_20575607.mp3	Tü hast bain vis ch’eu sun propi ün pruoder sulvadi!»	2	0	fourties	male			rm-vallader	
529c11accc6b1306c119debe495694953e382917b5714d31f5dfcf613976b3bc4289b2ccbd3c02fd7cd8d168d8c7f5ba9c58d64b2bb141517479ef0b8e7acc96	common_voice_rm-vallader_20575608.mp3	Tour part a quista sairada po minchün, eir glieud dad otras raspadas.	2	0	fourties	male			rm-vallader	
529c11accc6b1306c119debe495694953e382917b5714d31f5dfcf613976b3bc4289b2ccbd3c02fd7cd8d168d8c7f5ba9c58d64b2bb141517479ef0b8e7acc96	common_voice_rm-vallader_20575610.mp3	La via Ftan–Ardez nun es in ün bun stadi.	2	1	fourties	male			rm-vallader	
529c11accc6b1306c119debe495694953e382917b5714d31f5dfcf613976b3bc4289b2ccbd3c02fd7cd8d168d8c7f5ba9c58d64b2bb141517479ef0b8e7acc96	common_voice_rm-vallader_20575611.mp3	El lascha in pos sch’el svess vain laschà in pos.	2	0	fourties	male			rm-vallader	
529c11accc6b1306c119debe495694953e382917b5714d31f5dfcf613976b3bc4289b2ccbd3c02fd7cd8d168d8c7f5ba9c58d64b2bb141517479ef0b8e7acc96	common_voice_rm-vallader_20575617.mp3	Rico Zala percunter disch: «Eu nu sun chatschader, perquai suna quia.»	2	0	fourties	male			rm-vallader	
529c11accc6b1306c119debe495694953e382917b5714d31f5dfcf613976b3bc4289b2ccbd3c02fd7cd8d168d8c7f5ba9c58d64b2bb141517479ef0b8e7acc96	common_voice_rm-vallader_20575618.mp3	Scriver sco cha’l pical es creschü Meyer scriva in tudais-ch e rumantsch.	2	0	fourties	male			rm-vallader	
529c11accc6b1306c119debe495694953e382917b5714d31f5dfcf613976b3bc4289b2ccbd3c02fd7cd8d168d8c7f5ba9c58d64b2bb141517479ef0b8e7acc96	common_voice_rm-vallader_20575619.mp3	Sco mastral vain portà darcheu Gion Roner da Zernez.	2	0	fourties	male			rm-vallader	
529c11accc6b1306c119debe495694953e382917b5714d31f5dfcf613976b3bc4289b2ccbd3c02fd7cd8d168d8c7f5ba9c58d64b2bb141517479ef0b8e7acc96	common_voice_rm-vallader_20575620.mp3	Pel manader dals cuors d’eira l’occurrenza ün success.	2	0	fourties	male			rm-vallader	
529c11accc6b1306c119debe495694953e382917b5714d31f5dfcf613976b3bc4289b2ccbd3c02fd7cd8d168d8c7f5ba9c58d64b2bb141517479ef0b8e7acc96	common_voice_rm-vallader_20575621.mp3	Tanter bler oter s’ha Toia eir partecipà a registraziuns radiofonicas pel Radio Rumantsch.	2	0	fourties	male			rm-vallader	
529c11accc6b1306c119debe495694953e382917b5714d31f5dfcf613976b3bc4289b2ccbd3c02fd7cd8d168d8c7f5ba9c58d64b2bb141517479ef0b8e7acc96	common_voice_rm-vallader_20575627.mp3	El vaglia sco ün dals pioniers dals prüms decenis dal turissem a Scuol.	2	0	fourties	male			rm-vallader	
529c11accc6b1306c119debe495694953e382917b5714d31f5dfcf613976b3bc4289b2ccbd3c02fd7cd8d168d8c7f5ba9c58d64b2bb141517479ef0b8e7acc96	common_voice_rm-vallader_20575628.mp3	La materia es fich cumplichada.	2	0	fourties	male			rm-vallader	
529c11accc6b1306c119debe495694953e382917b5714d31f5dfcf613976b3bc4289b2ccbd3c02fd7cd8d168d8c7f5ba9c58d64b2bb141517479ef0b8e7acc96	common_voice_rm-vallader_20575629.mp3	Nun es quai ün pa lungurus dad ir adüna be culs skis?	2	0	fourties	male			rm-vallader	
