client_id	path	sentence	up_votes	down_votes	age	gender	accents	variant	locale	segment
06a9482035f05b25e8611a81fdedd868b3b28259b3f1952824713419a571159d526efb63d650b5b8766639d488b16ea9f77d04967ab43062ffa0b1a65135bf55	common_voice_rm-vallader_21870766.mp3	La cunvegna da l’agricultura pertocca in special eir l’export da chaschöl.	2	0	fourties	male			rm-vallader	
06a9482035f05b25e8611a81fdedd868b3b28259b3f1952824713419a571159d526efb63d650b5b8766639d488b16ea9f77d04967ab43062ffa0b1a65135bf55	common_voice_rm-vallader_21870772.mp3	Üna visiun da sgrischur o da spranza?	2	0	fourties	male			rm-vallader	
06a9482035f05b25e8611a81fdedd868b3b28259b3f1952824713419a571159d526efb63d650b5b8766639d488b16ea9f77d04967ab43062ffa0b1a65135bf55	common_voice_rm-vallader_21870773.mp3	Il directer eir.	2	0	fourties	male			rm-vallader	
06a9482035f05b25e8611a81fdedd868b3b28259b3f1952824713419a571159d526efb63d650b5b8766639d488b16ea9f77d04967ab43062ffa0b1a65135bf55	common_voice_rm-vallader_21870775.mp3	Boudas profuondas dadour l’orizont da las ragischs nu po il god evitar.	2	0	fourties	male			rm-vallader	
06a9482035f05b25e8611a81fdedd868b3b28259b3f1952824713419a571159d526efb63d650b5b8766639d488b16ea9f77d04967ab43062ffa0b1a65135bf55	common_voice_rm-vallader_21870776.mp3	Eu nun ha ni ün ni l’oter… schi, quai es mia confruntaziun.	2	0	fourties	male			rm-vallader	
06a9482035f05b25e8611a81fdedd868b3b28259b3f1952824713419a571159d526efb63d650b5b8766639d488b16ea9f77d04967ab43062ffa0b1a65135bf55	common_voice_rm-vallader_21870794.mp3	«Nus vain cumanzà il gö plain schlatsch e motivaziun.	2	0	fourties	male			rm-vallader	
06a9482035f05b25e8611a81fdedd868b3b28259b3f1952824713419a571159d526efb63d650b5b8766639d488b16ea9f77d04967ab43062ffa0b1a65135bf55	common_voice_rm-vallader_21870796.mp3	Davo sia mort d’eira quel gnü rimplazzà da Sepp Simonelli.	2	0	fourties	male			rm-vallader	
06a9482035f05b25e8611a81fdedd868b3b28259b3f1952824713419a571159d526efb63d650b5b8766639d488b16ea9f77d04967ab43062ffa0b1a65135bf55	common_voice_rm-vallader_21870818.mp3	Las duos legendas dal sport da box fan quai dürant trais eivnas a Samignun.	2	0	fourties	male			rm-vallader	
06a9482035f05b25e8611a81fdedd868b3b28259b3f1952824713419a571159d526efb63d650b5b8766639d488b16ea9f77d04967ab43062ffa0b1a65135bf55	common_voice_rm-vallader_21870819.mp3	Be in quatter da quels as stoja amo far tschertas reparaturas.	2	0	fourties	male			rm-vallader	
06a9482035f05b25e8611a81fdedd868b3b28259b3f1952824713419a571159d526efb63d650b5b8766639d488b16ea9f77d04967ab43062ffa0b1a65135bf55	common_voice_rm-vallader_21870820.mp3	La matura pussibiltescha l’access in mincha università svizra.	2	0	fourties	male			rm-vallader	
06a9482035f05b25e8611a81fdedd868b3b28259b3f1952824713419a571159d526efb63d650b5b8766639d488b16ea9f77d04967ab43062ffa0b1a65135bf55	common_voice_rm-vallader_21870821.mp3	Lavinas grondas fan daplü don.»	2	0	fourties	male			rm-vallader	
06a9482035f05b25e8611a81fdedd868b3b28259b3f1952824713419a571159d526efb63d650b5b8766639d488b16ea9f77d04967ab43062ffa0b1a65135bf55	common_voice_rm-vallader_21870832.mp3	Pensain be als gronds sforzs per furnir la truppa cun material, muniziun e proviant.	2	0	fourties	male			rm-vallader	
06a9482035f05b25e8611a81fdedd868b3b28259b3f1952824713419a571159d526efb63d650b5b8766639d488b16ea9f77d04967ab43062ffa0b1a65135bf55	common_voice_rm-vallader_21870833.mp3	Fingià daspö lönch es Di da Valentin inufficialmaing ün di da festa pels inamurats.	2	0	fourties	male			rm-vallader	
06a9482035f05b25e8611a81fdedd868b3b28259b3f1952824713419a571159d526efb63d650b5b8766639d488b16ea9f77d04967ab43062ffa0b1a65135bf55	common_voice_rm-vallader_21870834.mp3	Pervi da quai saja il meglder da repeter la votumaziun.	2	0	fourties	male			rm-vallader	
06a9482035f05b25e8611a81fdedd868b3b28259b3f1952824713419a571159d526efb63d650b5b8766639d488b16ea9f77d04967ab43062ffa0b1a65135bf55	common_voice_rm-vallader_21870835.mp3	El ama las muntognas ingio ch’el fa regularmaing eir gitas plü grondas.	2	0	fourties	male			rm-vallader	
06a9482035f05b25e8611a81fdedd868b3b28259b3f1952824713419a571159d526efb63d650b5b8766639d488b16ea9f77d04967ab43062ffa0b1a65135bf55	common_voice_rm-vallader_21870836.mp3	Tuots speran sün ün revair l’on chi vegn.	2	0	fourties	male			rm-vallader	
06a9482035f05b25e8611a81fdedd868b3b28259b3f1952824713419a571159d526efb63d650b5b8766639d488b16ea9f77d04967ab43062ffa0b1a65135bf55	common_voice_rm-vallader_21870838.mp3	Etern es insomma ün pled dubitaivel.	2	0	fourties	male			rm-vallader	
06a9482035f05b25e8611a81fdedd868b3b28259b3f1952824713419a571159d526efb63d650b5b8766639d488b16ea9f77d04967ab43062ffa0b1a65135bf55	common_voice_rm-vallader_21870839.mp3	L’actività da teater ha buna conjunctura in Engiadina.	2	0	fourties	male			rm-vallader	
06a9482035f05b25e8611a81fdedd868b3b28259b3f1952824713419a571159d526efb63d650b5b8766639d488b16ea9f77d04967ab43062ffa0b1a65135bf55	common_voice_rm-vallader_21870840.mp3	Il public ha giodü da tadlar ils finalists.	2	0	fourties	male			rm-vallader	
06a9482035f05b25e8611a81fdedd868b3b28259b3f1952824713419a571159d526efb63d650b5b8766639d488b16ea9f77d04967ab43062ffa0b1a65135bf55	common_voice_rm-vallader_21870879.mp3	La generaziun giuvna da Margaritta e Flurin d’eira in movimaint.	2	0	fourties	male			rm-vallader	
06a9482035f05b25e8611a81fdedd868b3b28259b3f1952824713419a571159d526efb63d650b5b8766639d488b16ea9f77d04967ab43062ffa0b1a65135bf55	common_voice_rm-vallader_21870880.mp3	Da quella savur nun han da patir però be ils vaschins.	2	0	fourties	male			rm-vallader	
06a9482035f05b25e8611a81fdedd868b3b28259b3f1952824713419a571159d526efb63d650b5b8766639d488b16ea9f77d04967ab43062ffa0b1a65135bf55	common_voice_rm-vallader_21870881.mp3	«PurePower Grischun» es suottamiss ad üna controlla da qualità rigurusa.	2	0	fourties	male			rm-vallader	
06a9482035f05b25e8611a81fdedd868b3b28259b3f1952824713419a571159d526efb63d650b5b8766639d488b16ea9f77d04967ab43062ffa0b1a65135bf55	common_voice_rm-vallader_21870882.mp3	Quista fin d’eivna han gnü lö las maestranzas svizras da mountainbike a Scuol.	2	0	fourties	male			rm-vallader	
06a9482035f05b25e8611a81fdedd868b3b28259b3f1952824713419a571159d526efb63d650b5b8766639d488b16ea9f77d04967ab43062ffa0b1a65135bf55	common_voice_rm-vallader_21870883.mp3	Cun quai cha quist lavuratori es nouv, daja eir amo plazzas libras.	2	0	fourties	male			rm-vallader	
06a9482035f05b25e8611a81fdedd868b3b28259b3f1952824713419a571159d526efb63d650b5b8766639d488b16ea9f77d04967ab43062ffa0b1a65135bf55	common_voice_rm-vallader_21870909.mp3	Quists schmaladits squilats.	2	0	fourties	male			rm-vallader	
06a9482035f05b25e8611a81fdedd868b3b28259b3f1952824713419a571159d526efb63d650b5b8766639d488b16ea9f77d04967ab43062ffa0b1a65135bf55	common_voice_rm-vallader_21870910.mp3	Lura as preschainta la Clostra Son Jon a Müstair darcheu in tuot sia bellezza.	2	0	fourties	male			rm-vallader	
06a9482035f05b25e8611a81fdedd868b3b28259b3f1952824713419a571159d526efb63d650b5b8766639d488b16ea9f77d04967ab43062ffa0b1a65135bf55	common_voice_rm-vallader_21870911.mp3	Perquai cha l’economia da forza electrica profita per part da las taxas previssas.	2	0	fourties	male			rm-vallader	
06a9482035f05b25e8611a81fdedd868b3b28259b3f1952824713419a571159d526efb63d650b5b8766639d488b16ea9f77d04967ab43062ffa0b1a65135bf55	common_voice_rm-vallader_21870912.mp3	Giuvnas lavuraintas sun respunsablas per lavuors in chasa, las veglias plüchöntsch per lavuors externas.	2	0	fourties	male			rm-vallader	
06a9482035f05b25e8611a81fdedd868b3b28259b3f1952824713419a571159d526efb63d650b5b8766639d488b16ea9f77d04967ab43062ffa0b1a65135bf55	common_voice_rm-vallader_21870913.mp3	Las pistas vegnan innaivadas cun aua da baiver.	2	0	fourties	male			rm-vallader	
06a9482035f05b25e8611a81fdedd868b3b28259b3f1952824713419a571159d526efb63d650b5b8766639d488b16ea9f77d04967ab43062ffa0b1a65135bf55	common_voice_rm-vallader_21871186.mp3	Sün quista spassegiada da duos dis stan a disposiziun albiergs per allogi.	2	0	fourties	male			rm-vallader	
06a9482035f05b25e8611a81fdedd868b3b28259b3f1952824713419a571159d526efb63d650b5b8766639d488b16ea9f77d04967ab43062ffa0b1a65135bf55	common_voice_rm-vallader_21871187.mp3	Per intant nu funcziuna amo, mo forsa chi’s sviluppa amo.	2	0	fourties	male			rm-vallader	
06a9482035f05b25e8611a81fdedd868b3b28259b3f1952824713419a571159d526efb63d650b5b8766639d488b16ea9f77d04967ab43062ffa0b1a65135bf55	common_voice_rm-vallader_21871188.mp3	Probabelmaing d’eira’l bescher.	2	0	fourties	male			rm-vallader	
06a9482035f05b25e8611a81fdedd868b3b28259b3f1952824713419a571159d526efb63d650b5b8766639d488b16ea9f77d04967ab43062ffa0b1a65135bf55	common_voice_rm-vallader_21871189.mp3	Co sto el viver per nu periclitar sia substanza a lunga vista?	2	0	fourties	male			rm-vallader	
06a9482035f05b25e8611a81fdedd868b3b28259b3f1952824713419a571159d526efb63d650b5b8766639d488b16ea9f77d04967ab43062ffa0b1a65135bf55	common_voice_rm-vallader_21871190.mp3	Per cha quai saja pussibel, sto la terra, il fuond as stabilir.	2	0	fourties	male			rm-vallader	
06a9482035f05b25e8611a81fdedd868b3b28259b3f1952824713419a571159d526efb63d650b5b8766639d488b16ea9f77d04967ab43062ffa0b1a65135bf55	common_voice_rm-vallader_21872659.mp3	Quai chi vain eir promovü da la politica agrara.	2	0	fourties	male			rm-vallader	
06a9482035f05b25e8611a81fdedd868b3b28259b3f1952824713419a571159d526efb63d650b5b8766639d488b16ea9f77d04967ab43062ffa0b1a65135bf55	common_voice_rm-vallader_21872660.mp3	Annunzchas per la «Traversada» vegnan tuttas incunter pro la Società da trafic da Sent.	2	0	fourties	male			rm-vallader	
06a9482035f05b25e8611a81fdedd868b3b28259b3f1952824713419a571159d526efb63d650b5b8766639d488b16ea9f77d04967ab43062ffa0b1a65135bf55	common_voice_rm-vallader_21872661.mp3	Ch’ella saja perquai gnüda in contact cul teater.	2	0	fourties	male			rm-vallader	
06a9482035f05b25e8611a81fdedd868b3b28259b3f1952824713419a571159d526efb63d650b5b8766639d488b16ea9f77d04967ab43062ffa0b1a65135bf55	common_voice_rm-vallader_21872662.mp3	Ma uossa restan cretta, vita e charità, e la plü gronda ais la charità.	2	0	fourties	male			rm-vallader	
06a9482035f05b25e8611a81fdedd868b3b28259b3f1952824713419a571159d526efb63d650b5b8766639d488b16ea9f77d04967ab43062ffa0b1a65135bf55	common_voice_rm-vallader_21872673.mp3	El d’eira adüna extremamaing bain documentà.	2	0	fourties	male			rm-vallader	
06a9482035f05b25e8611a81fdedd868b3b28259b3f1952824713419a571159d526efb63d650b5b8766639d488b16ea9f77d04967ab43062ffa0b1a65135bf55	common_voice_rm-vallader_21872674.mp3	Tenor la communicaziun da pressa da la Rega es quel servezzan gratuit.	2	1	fourties	male			rm-vallader	
06a9482035f05b25e8611a81fdedd868b3b28259b3f1952824713419a571159d526efb63d650b5b8766639d488b16ea9f77d04967ab43062ffa0b1a65135bf55	common_voice_rm-vallader_21872675.mp3	Quai pudess esser üna poesia sco ün cuort psalm da la Bibla.	2	1	fourties	male			rm-vallader	
06a9482035f05b25e8611a81fdedd868b3b28259b3f1952824713419a571159d526efb63d650b5b8766639d488b16ea9f77d04967ab43062ffa0b1a65135bf55	common_voice_rm-vallader_21872677.mp3	Quai am tira adimmaint…!	2	0	fourties	male			rm-vallader	
06a9482035f05b25e8611a81fdedd868b3b28259b3f1952824713419a571159d526efb63d650b5b8766639d488b16ea9f77d04967ab43062ffa0b1a65135bf55	common_voice_rm-vallader_21872697.mp3	I’s vezzaiva duonnas chi as vaivan schnüdadas e muossaivan lur pet.	2	0	fourties	male			rm-vallader	
06a9482035f05b25e8611a81fdedd868b3b28259b3f1952824713419a571159d526efb63d650b5b8766639d488b16ea9f77d04967ab43062ffa0b1a65135bf55	common_voice_rm-vallader_21872698.mp3	Mo quai sto far minchün sco ch’el chatta per bön.	2	1	fourties	male			rm-vallader	
06a9482035f05b25e8611a81fdedd868b3b28259b3f1952824713419a571159d526efb63d650b5b8766639d488b16ea9f77d04967ab43062ffa0b1a65135bf55	common_voice_rm-vallader_21872700.mp3	Il schef da la gruppa da salvamaint ha manà in dumengia las differentas demonstraziuns.	2	0	fourties	male			rm-vallader	
06a9482035f05b25e8611a81fdedd868b3b28259b3f1952824713419a571159d526efb63d650b5b8766639d488b16ea9f77d04967ab43062ffa0b1a65135bf55	common_voice_rm-vallader_21872702.mp3	Ün tschüvel fa tuornar be subit a l’agüdont sün quatter pattas.	2	0	fourties	male			rm-vallader	
06a9482035f05b25e8611a81fdedd868b3b28259b3f1952824713419a571159d526efb63d650b5b8766639d488b16ea9f77d04967ab43062ffa0b1a65135bf55	common_voice_rm-vallader_21872723.mp3	Il resultat para cler ed evidaint.	2	0	fourties	male			rm-vallader	
06a9482035f05b25e8611a81fdedd868b3b28259b3f1952824713419a571159d526efb63d650b5b8766639d488b16ea9f77d04967ab43062ffa0b1a65135bf55	common_voice_rm-vallader_21872724.mp3	La lavina da Gonda, schluppettada giò, chi’d ha rumi il god da Crast’auta.	2	0	fourties	male			rm-vallader	
06a9482035f05b25e8611a81fdedd868b3b28259b3f1952824713419a571159d526efb63d650b5b8766639d488b16ea9f77d04967ab43062ffa0b1a65135bf55	common_voice_rm-vallader_21872726.mp3	L’Academia Engiadina a Samedan ha almain declerà üna pusiziun clera in quella dumonda.	2	0	fourties	male			rm-vallader	
06a9482035f05b25e8611a81fdedd868b3b28259b3f1952824713419a571159d526efb63d650b5b8766639d488b16ea9f77d04967ab43062ffa0b1a65135bf55	common_voice_rm-vallader_21872727.mp3	Ed aint illa Philomela til inscuntraina eir.	2	0	fourties	male			rm-vallader	
06a9482035f05b25e8611a81fdedd868b3b28259b3f1952824713419a571159d526efb63d650b5b8766639d488b16ea9f77d04967ab43062ffa0b1a65135bf55	common_voice_rm-vallader_21872749.mp3	Dürant ils mais d’inviern vain preparada la prosma stagiun da fabrica.	2	0	fourties	male			rm-vallader	
06a9482035f05b25e8611a81fdedd868b3b28259b3f1952824713419a571159d526efb63d650b5b8766639d488b16ea9f77d04967ab43062ffa0b1a65135bf55	common_voice_rm-vallader_21872750.mp3	Quai muossa cha las competenzas tanter cumün, chantun e confederaziun sun bain cleras.	2	0	fourties	male			rm-vallader	
06a9482035f05b25e8611a81fdedd868b3b28259b3f1952824713419a571159d526efb63d650b5b8766639d488b16ea9f77d04967ab43062ffa0b1a65135bf55	common_voice_rm-vallader_21872751.mp3	«Na, na, na», as doda, «la terza tocca i’l prüm rang.	2	0	fourties	male			rm-vallader	
06a9482035f05b25e8611a81fdedd868b3b28259b3f1952824713419a571159d526efb63d650b5b8766639d488b16ea9f77d04967ab43062ffa0b1a65135bf55	common_voice_rm-vallader_21872752.mp3	Duos homens til seguan: ün meidi ed ün ravarenda.	2	0	fourties	male			rm-vallader	
06a9482035f05b25e8611a81fdedd868b3b28259b3f1952824713419a571159d526efb63d650b5b8766639d488b16ea9f77d04967ab43062ffa0b1a65135bf55	common_voice_rm-vallader_21872758.mp3	Dafatta!	2	0	fourties	male			rm-vallader	
06a9482035f05b25e8611a81fdedd868b3b28259b3f1952824713419a571159d526efb63d650b5b8766639d488b16ea9f77d04967ab43062ffa0b1a65135bf55	common_voice_rm-vallader_21872760.mp3	Vo vaivat dudi e let inandret, i’s tratta d’ün architect.	2	0	fourties	male			rm-vallader	
06a9482035f05b25e8611a81fdedd868b3b28259b3f1952824713419a571159d526efb63d650b5b8766639d488b16ea9f77d04967ab43062ffa0b1a65135bf55	common_voice_rm-vallader_21872761.mp3	Vivüdas nu vegnan però be ouvras tradiziunalas dimpersai eir talas plü modernas.	2	0	fourties	male			rm-vallader	
06a9482035f05b25e8611a81fdedd868b3b28259b3f1952824713419a571159d526efb63d650b5b8766639d488b16ea9f77d04967ab43062ffa0b1a65135bf55	common_voice_rm-vallader_21872762.mp3	Da quel fat stuvaina render quint.	2	0	fourties	male			rm-vallader	
06a9482035f05b25e8611a81fdedd868b3b28259b3f1952824713419a571159d526efb63d650b5b8766639d488b16ea9f77d04967ab43062ffa0b1a65135bf55	common_voice_rm-vallader_21872862.mp3	Na, il pövelet ladin nu po gnir isolà cumplettamaing da las otras regiuns rumantschas!	2	0	fourties	male			rm-vallader	
06a9482035f05b25e8611a81fdedd868b3b28259b3f1952824713419a571159d526efb63d650b5b8766639d488b16ea9f77d04967ab43062ffa0b1a65135bf55	common_voice_rm-vallader_21872864.mp3	Las immobiglias cha’l cumün nu douvra dessan gnir vendüdas.	2	0	fourties	male			rm-vallader	
06a9482035f05b25e8611a81fdedd868b3b28259b3f1952824713419a571159d526efb63d650b5b8766639d488b16ea9f77d04967ab43062ffa0b1a65135bf55	common_voice_rm-vallader_21872872.mp3	Nun esa ün pa bod per üna tala reclama?	2	0	fourties	male			rm-vallader	
06a9482035f05b25e8611a81fdedd868b3b28259b3f1952824713419a571159d526efb63d650b5b8766639d488b16ea9f77d04967ab43062ffa0b1a65135bf55	common_voice_rm-vallader_21872874.mp3	Pro’ls üns provocheschan ils sonchs da glatsch be ün «che es quai?»	2	0	fourties	male			rm-vallader	
06a9482035f05b25e8611a81fdedd868b3b28259b3f1952824713419a571159d526efb63d650b5b8766639d488b16ea9f77d04967ab43062ffa0b1a65135bf55	common_voice_rm-vallader_21872875.mp3	Sco Sursilvans, Sutsilvans, Surmirans, Puters, Valladers, Jauers.	2	0	fourties	male			rm-vallader	
06a9482035f05b25e8611a81fdedd868b3b28259b3f1952824713419a571159d526efb63d650b5b8766639d488b16ea9f77d04967ab43062ffa0b1a65135bf55	common_voice_rm-vallader_21872876.mp3	Duonna Madlaina lavura sur inviern sco keramista.	2	0	fourties	male			rm-vallader	
06a9482035f05b25e8611a81fdedd868b3b28259b3f1952824713419a571159d526efb63d650b5b8766639d488b16ea9f77d04967ab43062ffa0b1a65135bf55	common_voice_rm-vallader_21872877.mp3	Che bel!	2	0	fourties	male			rm-vallader	
06a9482035f05b25e8611a81fdedd868b3b28259b3f1952824713419a571159d526efb63d650b5b8766639d488b16ea9f77d04967ab43062ffa0b1a65135bf55	common_voice_rm-vallader_21872878.mp3	Lura vain ün clerai.	2	0	fourties	male			rm-vallader	
06a9482035f05b25e8611a81fdedd868b3b28259b3f1952824713419a571159d526efb63d650b5b8766639d488b16ea9f77d04967ab43062ffa0b1a65135bf55	common_voice_rm-vallader_21872887.mp3	Il protocol es gnü approvà.	2	0	fourties	male			rm-vallader	
06a9482035f05b25e8611a81fdedd868b3b28259b3f1952824713419a571159d526efb63d650b5b8766639d488b16ea9f77d04967ab43062ffa0b1a65135bf55	common_voice_rm-vallader_21872889.mp3	Ma na pels chatschaders.	2	0	fourties	male			rm-vallader	
06a9482035f05b25e8611a81fdedd868b3b28259b3f1952824713419a571159d526efb63d650b5b8766639d488b16ea9f77d04967ab43062ffa0b1a65135bf55	common_voice_rm-vallader_21872891.mp3	Quai es üna dumanda fich delicata.	2	0	fourties	male			rm-vallader	
06a9482035f05b25e8611a81fdedd868b3b28259b3f1952824713419a571159d526efb63d650b5b8766639d488b16ea9f77d04967ab43062ffa0b1a65135bf55	common_voice_rm-vallader_21872908.mp3	Eu per mia part cuntinuess gugent cun quista discussiun.	2	0	fourties	male			rm-vallader	
06a9482035f05b25e8611a81fdedd868b3b28259b3f1952824713419a571159d526efb63d650b5b8766639d488b16ea9f77d04967ab43062ffa0b1a65135bf55	common_voice_rm-vallader_21872910.mp3	Mo la plü gronda sumglientscha ha il bargunzegner cul surmiran.	2	0	fourties	male			rm-vallader	
06a9482035f05b25e8611a81fdedd868b3b28259b3f1952824713419a571159d526efb63d650b5b8766639d488b16ea9f77d04967ab43062ffa0b1a65135bf55	common_voice_rm-vallader_21872912.mp3	In magliond la «sosa» vegnan prodots gas da metan chi vegnan alura ramassats.	2	0	fourties	male			rm-vallader	
06a9482035f05b25e8611a81fdedd868b3b28259b3f1952824713419a571159d526efb63d650b5b8766639d488b16ea9f77d04967ab43062ffa0b1a65135bf55	common_voice_rm-vallader_21872914.mp3	Quella tilla ha güdà eir a passantar sco mez güdeua ils ons da guerra.	2	0	fourties	male			rm-vallader	
06a9482035f05b25e8611a81fdedd868b3b28259b3f1952824713419a571159d526efb63d650b5b8766639d488b16ea9f77d04967ab43062ffa0b1a65135bf55	common_voice_rm-vallader_21872927.mp3	Ils lets da l’hotellaria e parahotellaria sun bain occupats.	2	0	fourties	male			rm-vallader	
06a9482035f05b25e8611a81fdedd868b3b28259b3f1952824713419a571159d526efb63d650b5b8766639d488b16ea9f77d04967ab43062ffa0b1a65135bf55	common_voice_rm-vallader_21872929.mp3	Il sguard sül vast program accumpagnativ conferma quai evidaintamaing.	2	0	fourties	male			rm-vallader	
06a9482035f05b25e8611a81fdedd868b3b28259b3f1952824713419a571159d526efb63d650b5b8766639d488b16ea9f77d04967ab43062ffa0b1a65135bf55	common_voice_rm-vallader_21872930.mp3	A blers fa quai temma.	2	0	fourties	male			rm-vallader	
06a9482035f05b25e8611a81fdedd868b3b28259b3f1952824713419a571159d526efb63d650b5b8766639d488b16ea9f77d04967ab43062ffa0b1a65135bf55	common_voice_rm-vallader_21872931.mp3	Observai quella fatscha, üna bargiamina transmüdada dal temp.	2	0	fourties	male			rm-vallader	
06a9482035f05b25e8611a81fdedd868b3b28259b3f1952824713419a571159d526efb63d650b5b8766639d488b16ea9f77d04967ab43062ffa0b1a65135bf55	common_voice_rm-vallader_21872932.mp3	Gessa a fin, tenor la voluntà da la confederaziun.	2	0	fourties	male			rm-vallader	
06a9482035f05b25e8611a81fdedd868b3b28259b3f1952824713419a571159d526efb63d650b5b8766639d488b16ea9f77d04967ab43062ffa0b1a65135bf55	common_voice_rm-vallader_21872938.mp3	Ils singuls pajais han però listess reglamentà quist marchà.	2	0	fourties	male			rm-vallader	
06a9482035f05b25e8611a81fdedd868b3b28259b3f1952824713419a571159d526efb63d650b5b8766639d488b16ea9f77d04967ab43062ffa0b1a65135bf55	common_voice_rm-vallader_21872939.mp3	Brigitte Fischer ha conclüs: «Per cha la culur fetscha seis effet voula exercizi.	2	0	fourties	male			rm-vallader	
06a9482035f05b25e8611a81fdedd868b3b28259b3f1952824713419a571159d526efb63d650b5b8766639d488b16ea9f77d04967ab43062ffa0b1a65135bf55	common_voice_rm-vallader_21872940.mp3	Alch struozcha sur il tapet d'aguoglias d'larsch.	2	1	fourties	male			rm-vallader	
06a9482035f05b25e8611a81fdedd868b3b28259b3f1952824713419a571159d526efb63d650b5b8766639d488b16ea9f77d04967ab43062ffa0b1a65135bf55	common_voice_rm-vallader_21872941.mp3	La discordia aint illa direcziun da l’Ospidal d’Engiadina Bassa piglia üna fin.	2	0	fourties	male			rm-vallader	
06a9482035f05b25e8611a81fdedd868b3b28259b3f1952824713419a571159d526efb63d650b5b8766639d488b16ea9f77d04967ab43062ffa0b1a65135bf55	common_voice_rm-vallader_21872947.mp3	Il nom «Nuna» deriva dal latin.	2	0	fourties	male			rm-vallader	
06a9482035f05b25e8611a81fdedd868b3b28259b3f1952824713419a571159d526efb63d650b5b8766639d488b16ea9f77d04967ab43062ffa0b1a65135bf55	common_voice_rm-vallader_21872948.mp3	Cun quella retschercha da necessità han las respunsablas da la società erui detagls.	2	0	fourties	male			rm-vallader	
06a9482035f05b25e8611a81fdedd868b3b28259b3f1952824713419a571159d526efb63d650b5b8766639d488b16ea9f77d04967ab43062ffa0b1a65135bf55	common_voice_rm-vallader_21872949.mp3	Magnus Bonderer: «Avant pudaivan ils chantuns far quai.	2	0	fourties	male			rm-vallader	
06a9482035f05b25e8611a81fdedd868b3b28259b3f1952824713419a571159d526efb63d650b5b8766639d488b16ea9f77d04967ab43062ffa0b1a65135bf55	common_voice_rm-vallader_21872951.mp3	In seguit d’eira gnü fabrichà vetta per vetta sün quella fundamainta.	2	0	fourties	male			rm-vallader	
06a9482035f05b25e8611a81fdedd868b3b28259b3f1952824713419a571159d526efb63d650b5b8766639d488b16ea9f77d04967ab43062ffa0b1a65135bf55	common_voice_rm-vallader_21872967.mp3	I vegnan preschantats ils mezs da massa per principiants e per avanzats.	2	0	fourties	male			rm-vallader	
06a9482035f05b25e8611a81fdedd868b3b28259b3f1952824713419a571159d526efb63d650b5b8766639d488b16ea9f77d04967ab43062ffa0b1a65135bf55	common_voice_rm-vallader_21872971.mp3	In Austria sun ils tragets cun vias da velo per gronda part catramats.	2	0	fourties	male			rm-vallader	
06a9482035f05b25e8611a81fdedd868b3b28259b3f1952824713419a571159d526efb63d650b5b8766639d488b16ea9f77d04967ab43062ffa0b1a65135bf55	common_voice_rm-vallader_21873008.mp3	Plü tard füss eventualmaing previs ün uschedit funparc», ha infuormà il cuvi da Zuoz.	2	1	fourties	male			rm-vallader	
06a9482035f05b25e8611a81fdedd868b3b28259b3f1952824713419a571159d526efb63d650b5b8766639d488b16ea9f77d04967ab43062ffa0b1a65135bf55	common_voice_rm-vallader_21873011.mp3	La schminuziun dals predschs pertocca eir l’industria da transport da maniera considerabla.	2	0	fourties	male			rm-vallader	
06a9482035f05b25e8611a81fdedd868b3b28259b3f1952824713419a571159d526efb63d650b5b8766639d488b16ea9f77d04967ab43062ffa0b1a65135bf55	common_voice_rm-vallader_21873028.mp3	Vairamaing stess la prüma culuonna esser la lunga!	2	0	fourties	male			rm-vallader	
06a9482035f05b25e8611a81fdedd868b3b28259b3f1952824713419a571159d526efb63d650b5b8766639d488b16ea9f77d04967ab43062ffa0b1a65135bf55	common_voice_rm-vallader_21873037.mp3	Ün bun segn.	2	0	fourties	male			rm-vallader	
06a9482035f05b25e8611a81fdedd868b3b28259b3f1952824713419a571159d526efb63d650b5b8766639d488b16ea9f77d04967ab43062ffa0b1a65135bf55	common_voice_rm-vallader_21873038.mp3	Tanter oter quint’la da seis temp da scoula.	2	0	fourties	male			rm-vallader	
06a9482035f05b25e8611a81fdedd868b3b28259b3f1952824713419a571159d526efb63d650b5b8766639d488b16ea9f77d04967ab43062ffa0b1a65135bf55	common_voice_rm-vallader_21873039.mp3	Quai es stat ün’idea maximala.	2	0	fourties	male			rm-vallader	
06a9482035f05b25e8611a81fdedd868b3b28259b3f1952824713419a571159d526efb63d650b5b8766639d488b16ea9f77d04967ab43062ffa0b1a65135bf55	common_voice_rm-vallader_21873040.mp3	Els han gnü gronds retards o ch’els nu sun gnanca rivats fin là.	2	0	fourties	male			rm-vallader	
06a9482035f05b25e8611a81fdedd868b3b28259b3f1952824713419a571159d526efb63d650b5b8766639d488b16ea9f77d04967ab43062ffa0b1a65135bf55	common_voice_rm-vallader_21873041.mp3	Invezza d’ün s-chavd muossa quel ün guadogn.	2	0	fourties	male			rm-vallader	
06a9482035f05b25e8611a81fdedd868b3b28259b3f1952824713419a571159d526efb63d650b5b8766639d488b16ea9f77d04967ab43062ffa0b1a65135bf55	common_voice_rm-vallader_21873046.mp3	Ün contrat adattà cun la Tele-Rätia nun es percunter gnü sancziunà uschè.	2	0	fourties	male			rm-vallader	
06a9482035f05b25e8611a81fdedd868b3b28259b3f1952824713419a571159d526efb63d650b5b8766639d488b16ea9f77d04967ab43062ffa0b1a65135bf55	common_voice_rm-vallader_21873060.mp3	Davo demonstrescha’l tuot ils agüds chi dà per pudair viver plü independentamaing pussibel.	2	0	fourties	male			rm-vallader	
06a9482035f05b25e8611a81fdedd868b3b28259b3f1952824713419a571159d526efb63d650b5b8766639d488b16ea9f77d04967ab43062ffa0b1a65135bf55	common_voice_rm-vallader_21873062.mp3	S’inclegia ch’eu d’eira da la partida.	2	0	fourties	male			rm-vallader	
