client_id	path	sentence	up_votes	down_votes	age	gender	accents	variant	locale	segment
529c11accc6b1306c119debe495694953e382917b5714d31f5dfcf613976b3bc4289b2ccbd3c02fd7cd8d168d8c7f5ba9c58d64b2bb141517479ef0b8e7acc96	common_voice_rm-vallader_20575896.mp3	Candidats pel grond cussagl sun Angelo Andina e Reto Pedotti.	2	0	fourties	male			rm-vallader	
529c11accc6b1306c119debe495694953e382917b5714d31f5dfcf613976b3bc4289b2ccbd3c02fd7cd8d168d8c7f5ba9c58d64b2bb141517479ef0b8e7acc96	common_voice_rm-vallader_20575897.mp3	Perche haja plovü uschè intensivamaing?	2	0	fourties	male			rm-vallader	
529c11accc6b1306c119debe495694953e382917b5714d31f5dfcf613976b3bc4289b2ccbd3c02fd7cd8d168d8c7f5ba9c58d64b2bb141517479ef0b8e7acc96	common_voice_rm-vallader_20575898.mp3	El es stat il plü svelt Engiadinais.	2	0	fourties	male			rm-vallader	
529c11accc6b1306c119debe495694953e382917b5714d31f5dfcf613976b3bc4289b2ccbd3c02fd7cd8d168d8c7f5ba9c58d64b2bb141517479ef0b8e7acc96	common_voice_rm-vallader_20575899.mp3	Cun render pussibel als giasts da spender raps eir aint il Parc?	2	0	fourties	male			rm-vallader	
529c11accc6b1306c119debe495694953e382917b5714d31f5dfcf613976b3bc4289b2ccbd3c02fd7cd8d168d8c7f5ba9c58d64b2bb141517479ef0b8e7acc96	common_voice_rm-vallader_20575900.mp3	Da quista sfida pon tuots duos be profitar.	2	0	fourties	male			rm-vallader	
529c11accc6b1306c119debe495694953e382917b5714d31f5dfcf613976b3bc4289b2ccbd3c02fd7cd8d168d8c7f5ba9c58d64b2bb141517479ef0b8e7acc96	common_voice_rm-vallader_20575906.mp3	La mera da quella vouta es restada fin hoz.	2	0	fourties	male			rm-vallader	
529c11accc6b1306c119debe495694953e382917b5714d31f5dfcf613976b3bc4289b2ccbd3c02fd7cd8d168d8c7f5ba9c58d64b2bb141517479ef0b8e7acc96	common_voice_rm-vallader_20575907.mp3	Da quai resulta üna reducziun considerabla dal schmertsch i’l rendaquint cumünal.	2	0	fourties	male			rm-vallader	
529c11accc6b1306c119debe495694953e382917b5714d31f5dfcf613976b3bc4289b2ccbd3c02fd7cd8d168d8c7f5ba9c58d64b2bb141517479ef0b8e7acc96	common_voice_rm-vallader_20575908.mp3	Listess saja pussibel da prodüer emischiuns d’üna qualità respetabla e ragiundscher resultats remarchabels.	2	0	fourties	male			rm-vallader	
529c11accc6b1306c119debe495694953e382917b5714d31f5dfcf613976b3bc4289b2ccbd3c02fd7cd8d168d8c7f5ba9c58d64b2bb141517479ef0b8e7acc96	common_voice_rm-vallader_20575909.mp3	Maria sco premiera.	2	0	fourties	male			rm-vallader	
529c11accc6b1306c119debe495694953e382917b5714d31f5dfcf613976b3bc4289b2ccbd3c02fd7cd8d168d8c7f5ba9c58d64b2bb141517479ef0b8e7acc96	common_voice_rm-vallader_20575910.mp3	Curdin Toutsch a e da Zernez.	2	1	fourties	male			rm-vallader	
529c11accc6b1306c119debe495694953e382917b5714d31f5dfcf613976b3bc4289b2ccbd3c02fd7cd8d168d8c7f5ba9c58d64b2bb141517479ef0b8e7acc96	common_voice_rm-vallader_20575921.mp3	Chi detta ün bsögn d’agir nu contesta insè ingün.	2	0	fourties	male			rm-vallader	
529c11accc6b1306c119debe495694953e382917b5714d31f5dfcf613976b3bc4289b2ccbd3c02fd7cd8d168d8c7f5ba9c58d64b2bb141517479ef0b8e7acc96	common_voice_rm-vallader_20575922.mp3	Là prelegiaran divers concurrents lur texts e tanter aint gnarà sport ün rom musical.	2	0	fourties	male			rm-vallader	
529c11accc6b1306c119debe495694953e382917b5714d31f5dfcf613976b3bc4289b2ccbd3c02fd7cd8d168d8c7f5ba9c58d64b2bb141517479ef0b8e7acc96	common_voice_rm-vallader_20575923.mp3	«Las taxas da cura vegnan in general pajadas punctualmaing.	2	0	fourties	male			rm-vallader	
529c11accc6b1306c119debe495694953e382917b5714d31f5dfcf613976b3bc4289b2ccbd3c02fd7cd8d168d8c7f5ba9c58d64b2bb141517479ef0b8e7acc96	common_voice_rm-vallader_20575924.mp3	La chasa editura Octopus es landervia ad edir il cudesch in fuorma sinoptica.	2	0	fourties	male			rm-vallader	
529c11accc6b1306c119debe495694953e382917b5714d31f5dfcf613976b3bc4289b2ccbd3c02fd7cd8d168d8c7f5ba9c58d64b2bb141517479ef0b8e7acc96	common_voice_rm-vallader_20575925.mp3	Gerasim es i vers il portal.	2	0	fourties	male			rm-vallader	
529c11accc6b1306c119debe495694953e382917b5714d31f5dfcf613976b3bc4289b2ccbd3c02fd7cd8d168d8c7f5ba9c58d64b2bb141517479ef0b8e7acc96	common_voice_rm-vallader_20575929.mp3	Vairamaing sun quai nempe be vacanzas d'imprender - Lernferien.	2	0	fourties	male			rm-vallader	
529c11accc6b1306c119debe495694953e382917b5714d31f5dfcf613976b3bc4289b2ccbd3c02fd7cd8d168d8c7f5ba9c58d64b2bb141517479ef0b8e7acc96	common_voice_rm-vallader_20575930.mp3	Il pled tudais-ch as referischa plütost als bügls.	2	0	fourties	male			rm-vallader	
529c11accc6b1306c119debe495694953e382917b5714d31f5dfcf613976b3bc4289b2ccbd3c02fd7cd8d168d8c7f5ba9c58d64b2bb141517479ef0b8e7acc96	common_voice_rm-vallader_20575931.mp3	In seis lö surpiglia seis figl Guolf Denoth la plazza a Zernez.	2	0	fourties	male			rm-vallader	
529c11accc6b1306c119debe495694953e382917b5714d31f5dfcf613976b3bc4289b2ccbd3c02fd7cd8d168d8c7f5ba9c58d64b2bb141517479ef0b8e7acc96	common_voice_rm-vallader_20575932.mp3	Quella jada il charbun chi dovraivan nu gniva nimia fat gnir d’utrò.	2	0	fourties	male			rm-vallader	
529c11accc6b1306c119debe495694953e382917b5714d31f5dfcf613976b3bc4289b2ccbd3c02fd7cd8d168d8c7f5ba9c58d64b2bb141517479ef0b8e7acc96	common_voice_rm-vallader_20575933.mp3	Las istorgias da Natalia Lehner quinta Ernst Denoth.	2	0	fourties	male			rm-vallader	
529c11accc6b1306c119debe495694953e382917b5714d31f5dfcf613976b3bc4289b2ccbd3c02fd7cd8d168d8c7f5ba9c58d64b2bb141517479ef0b8e7acc96	common_voice_rm-vallader_20575941.mp3	Eir i’l restorant dal supermarchà vegnan vendüts quell’eivna menüs engiadinais.	2	0	fourties	male			rm-vallader	
529c11accc6b1306c119debe495694953e382917b5714d31f5dfcf613976b3bc4289b2ccbd3c02fd7cd8d168d8c7f5ba9c58d64b2bb141517479ef0b8e7acc96	common_voice_rm-vallader_20575942.mp3	Els sun gnüts salüdats dal president cumünal Jon Domenic Parolini.	2	0	fourties	male			rm-vallader	
529c11accc6b1306c119debe495694953e382917b5714d31f5dfcf613976b3bc4289b2ccbd3c02fd7cd8d168d8c7f5ba9c58d64b2bb141517479ef0b8e7acc96	common_voice_rm-vallader_20575943.mp3	La musica fa bain al corp ed a l’orma.	2	0	fourties	male			rm-vallader	
529c11accc6b1306c119debe495694953e382917b5714d31f5dfcf613976b3bc4289b2ccbd3c02fd7cd8d168d8c7f5ba9c58d64b2bb141517479ef0b8e7acc96	common_voice_rm-vallader_20575944.mp3	Intant sun immütidas eir quistas vuschs.	2	0	fourties	male			rm-vallader	
529c11accc6b1306c119debe495694953e382917b5714d31f5dfcf613976b3bc4289b2ccbd3c02fd7cd8d168d8c7f5ba9c58d64b2bb141517479ef0b8e7acc96	common_voice_rm-vallader_20575945.mp3	Il clucher in stil roman es restà in sia originalità.	2	0	fourties	male			rm-vallader	
529c11accc6b1306c119debe495694953e382917b5714d31f5dfcf613976b3bc4289b2ccbd3c02fd7cd8d168d8c7f5ba9c58d64b2bb141517479ef0b8e7acc96	common_voice_rm-vallader_20575955.mp3	Il stüdi es publichà sco cudesch e po gnir retrar illas librarias.	2	0	fourties	male			rm-vallader	
529c11accc6b1306c119debe495694953e382917b5714d31f5dfcf613976b3bc4289b2ccbd3c02fd7cd8d168d8c7f5ba9c58d64b2bb141517479ef0b8e7acc96	common_voice_rm-vallader_20575957.mp3	Natüralmaing chi nun es pussibel da manzunar tuot las persunalitats.	2	0	fourties	male			rm-vallader	
529c11accc6b1306c119debe495694953e382917b5714d31f5dfcf613976b3bc4289b2ccbd3c02fd7cd8d168d8c7f5ba9c58d64b2bb141517479ef0b8e7acc96	common_voice_rm-vallader_20575958.mp3	Ellas han chattà ricover illa chasa da scoula.	2	0	fourties	male			rm-vallader	
529c11accc6b1306c119debe495694953e382917b5714d31f5dfcf613976b3bc4289b2ccbd3c02fd7cd8d168d8c7f5ba9c58d64b2bb141517479ef0b8e7acc96	common_voice_rm-vallader_20575959.mp3	Nat e creschü sü es Jachen Curdin Arquint a Susch.	2	0	fourties	male			rm-vallader	
529c11accc6b1306c119debe495694953e382917b5714d31f5dfcf613976b3bc4289b2ccbd3c02fd7cd8d168d8c7f5ba9c58d64b2bb141517479ef0b8e7acc96	common_voice_rm-vallader_20575960.mp3	Il prüm ha referi cusglier guvernativ Martin Schmid sur da las lavuors illa regenza.	2	0	fourties	male			rm-vallader	
529c11accc6b1306c119debe495694953e382917b5714d31f5dfcf613976b3bc4289b2ccbd3c02fd7cd8d168d8c7f5ba9c58d64b2bb141517479ef0b8e7acc96	common_voice_rm-vallader_20575962.mp3	Il scenario tanter Landquart e Tavo am fa pensar ad üna guerra civila.	2	1	fourties	male			rm-vallader	
529c11accc6b1306c119debe495694953e382917b5714d31f5dfcf613976b3bc4289b2ccbd3c02fd7cd8d168d8c7f5ba9c58d64b2bb141517479ef0b8e7acc96	common_voice_rm-vallader_20575963.mp3	Noss baps scrivaivan rumantsch.	2	0	fourties	male			rm-vallader	
529c11accc6b1306c119debe495694953e382917b5714d31f5dfcf613976b3bc4289b2ccbd3c02fd7cd8d168d8c7f5ba9c58d64b2bb141517479ef0b8e7acc96	common_voice_rm-vallader_20575964.mp3	S’annunzchada s’ha be la Società da giuventüna da Sent.	2	0	fourties	male			rm-vallader	
529c11accc6b1306c119debe495694953e382917b5714d31f5dfcf613976b3bc4289b2ccbd3c02fd7cd8d168d8c7f5ba9c58d64b2bb141517479ef0b8e7acc96	common_voice_rm-vallader_20575968.mp3	I dà novitats chi’d es da leger duos jadas.	2	1	fourties	male			rm-vallader	
529c11accc6b1306c119debe495694953e382917b5714d31f5dfcf613976b3bc4289b2ccbd3c02fd7cd8d168d8c7f5ba9c58d64b2bb141517479ef0b8e7acc96	common_voice_rm-vallader_20575969.mp3	Quai manaja eir Hans Jaggi.	2	0	fourties	male			rm-vallader	
529c11accc6b1306c119debe495694953e382917b5714d31f5dfcf613976b3bc4289b2ccbd3c02fd7cd8d168d8c7f5ba9c58d64b2bb141517479ef0b8e7acc96	common_voice_rm-vallader_20575971.mp3	L’incumbenza da producziun es gnüda surdatta a l’impraisa «Elektro-Reich» a Silvaplana.	2	0	fourties	male			rm-vallader	
529c11accc6b1306c119debe495694953e382917b5714d31f5dfcf613976b3bc4289b2ccbd3c02fd7cd8d168d8c7f5ba9c58d64b2bb141517479ef0b8e7acc96	common_voice_rm-vallader_20575972.mp3	«La cuntrada ed il god as müdan.	2	1	fourties	male			rm-vallader	
529c11accc6b1306c119debe495694953e382917b5714d31f5dfcf613976b3bc4289b2ccbd3c02fd7cd8d168d8c7f5ba9c58d64b2bb141517479ef0b8e7acc96	common_voice_rm-vallader_20575981.mp3	H. - P. Zipperlen ans da amo adüna forza e sustegn.	2	1	fourties	male			rm-vallader	
529c11accc6b1306c119debe495694953e382917b5714d31f5dfcf613976b3bc4289b2ccbd3c02fd7cd8d168d8c7f5ba9c58d64b2bb141517479ef0b8e7acc96	common_voice_rm-vallader_20575982.mp3	Els han eir gnü dad improvisar e müdar minchatant la strategia.	2	0	fourties	male			rm-vallader	
529c11accc6b1306c119debe495694953e382917b5714d31f5dfcf613976b3bc4289b2ccbd3c02fd7cd8d168d8c7f5ba9c58d64b2bb141517479ef0b8e7acc96	common_voice_rm-vallader_20575983.mp3	Ils titels: «Ha l’Engiadin’Ota pers sia identità culturala?»	2	0	fourties	male			rm-vallader	
529c11accc6b1306c119debe495694953e382917b5714d31f5dfcf613976b3bc4289b2ccbd3c02fd7cd8d168d8c7f5ba9c58d64b2bb141517479ef0b8e7acc96	common_voice_rm-vallader_20575984.mp3	I’s savaiva: La chatsch’es dastrusch.	2	0	fourties	male			rm-vallader	
529c11accc6b1306c119debe495694953e382917b5714d31f5dfcf613976b3bc4289b2ccbd3c02fd7cd8d168d8c7f5ba9c58d64b2bb141517479ef0b8e7acc96	common_voice_rm-vallader_20575985.mp3	Eu sà, seis mantegnimaint nu porta profit.	2	0	fourties	male			rm-vallader	
529c11accc6b1306c119debe495694953e382917b5714d31f5dfcf613976b3bc4289b2ccbd3c02fd7cd8d168d8c7f5ba9c58d64b2bb141517479ef0b8e7acc96	common_voice_rm-vallader_20575989.mp3	Cun agüd d’inserats va’la as preschantar pro divers orchesters sainza success.	2	0	fourties	male			rm-vallader	
529c11accc6b1306c119debe495694953e382917b5714d31f5dfcf613976b3bc4289b2ccbd3c02fd7cd8d168d8c7f5ba9c58d64b2bb141517479ef0b8e7acc96	common_voice_rm-vallader_20575990.mp3	Ö char, piglia e va dalunga a clamar la duonna da part!»	2	0	fourties	male			rm-vallader	
529c11accc6b1306c119debe495694953e382917b5714d31f5dfcf613976b3bc4289b2ccbd3c02fd7cd8d168d8c7f5ba9c58d64b2bb141517479ef0b8e7acc96	common_voice_rm-vallader_20575991.mp3	Culla taxa da sach sto minchün pajar quai ch’el prodüa.	2	0	fourties	male			rm-vallader	
529c11accc6b1306c119debe495694953e382917b5714d31f5dfcf613976b3bc4289b2ccbd3c02fd7cd8d168d8c7f5ba9c58d64b2bb141517479ef0b8e7acc96	common_voice_rm-vallader_20575992.mp3	Ils partenaris principals sun Heks, Caritas, la Crusch cotschna, l’Armada dal salüd.	2	0	fourties	male			rm-vallader	
529c11accc6b1306c119debe495694953e382917b5714d31f5dfcf613976b3bc4289b2ccbd3c02fd7cd8d168d8c7f5ba9c58d64b2bb141517479ef0b8e7acc96	common_voice_rm-vallader_20575993.mp3	Leta Semadeni es nada e creschüda sü a Scuol.	2	0	fourties	male			rm-vallader	
529c11accc6b1306c119debe495694953e382917b5714d31f5dfcf613976b3bc4289b2ccbd3c02fd7cd8d168d8c7f5ba9c58d64b2bb141517479ef0b8e7acc96	common_voice_rm-vallader_20576001.mp3	Minchatant dà ün impuls aint sco üna sajetta.	2	0	fourties	male			rm-vallader	
529c11accc6b1306c119debe495694953e382917b5714d31f5dfcf613976b3bc4289b2ccbd3c02fd7cd8d168d8c7f5ba9c58d64b2bb141517479ef0b8e7acc96	common_voice_rm-vallader_20576002.mp3	E lura adüna l’istess teater mincha bunura.	2	0	fourties	male			rm-vallader	
529c11accc6b1306c119debe495694953e382917b5714d31f5dfcf613976b3bc4289b2ccbd3c02fd7cd8d168d8c7f5ba9c58d64b2bb141517479ef0b8e7acc96	common_voice_rm-vallader_20576003.mp3	Ingrazchar a l’evoluziun cha Darwin ha vis in tuot e dapertuot?	2	0	fourties	male			rm-vallader	
529c11accc6b1306c119debe495694953e382917b5714d31f5dfcf613976b3bc4289b2ccbd3c02fd7cd8d168d8c7f5ba9c58d64b2bb141517479ef0b8e7acc96	common_voice_rm-vallader_20576004.mp3	Id es previs da cuntinuar consequaintamaing cun la via inchaminada.	2	0	fourties	male			rm-vallader	
529c11accc6b1306c119debe495694953e382917b5714d31f5dfcf613976b3bc4289b2ccbd3c02fd7cd8d168d8c7f5ba9c58d64b2bb141517479ef0b8e7acc96	common_voice_rm-vallader_20576005.mp3	Perquai cussaglia Jachen Andri Planta d’evitar da traversar in costas stipas.	2	0	fourties	male			rm-vallader	
529c11accc6b1306c119debe495694953e382917b5714d31f5dfcf613976b3bc4289b2ccbd3c02fd7cd8d168d8c7f5ba9c58d64b2bb141517479ef0b8e7acc96	common_voice_rm-vallader_20576013.mp3	Al Cor masdà Zernez es gnüda sporta la pussibiltà da rapreschantar nos pajais.	2	0	fourties	male			rm-vallader	
529c11accc6b1306c119debe495694953e382917b5714d31f5dfcf613976b3bc4289b2ccbd3c02fd7cd8d168d8c7f5ba9c58d64b2bb141517479ef0b8e7acc96	common_voice_rm-vallader_20576014.mp3	Eu n’ha ün spavent da las preposiziuns rumantschas chi sun tschernüdas dal tudaisch.	2	0	fourties	male			rm-vallader	
529c11accc6b1306c119debe495694953e382917b5714d31f5dfcf613976b3bc4289b2ccbd3c02fd7cd8d168d8c7f5ba9c58d64b2bb141517479ef0b8e7acc96	common_voice_rm-vallader_20576015.mp3	Quel es previs aint illa stanza da magisters veglia.	2	0	fourties	male			rm-vallader	
529c11accc6b1306c119debe495694953e382917b5714d31f5dfcf613976b3bc4289b2ccbd3c02fd7cd8d168d8c7f5ba9c58d64b2bb141517479ef0b8e7acc96	common_voice_rm-vallader_20576017.mp3	Pelplü vegna a baiver ün cafè ed a fümar üna cigaretta.	2	0	fourties	male			rm-vallader	
529c11accc6b1306c119debe495694953e382917b5714d31f5dfcf613976b3bc4289b2ccbd3c02fd7cd8d168d8c7f5ba9c58d64b2bb141517479ef0b8e7acc96	common_voice_rm-vallader_20576018.mp3	El va pro’l fuorner, in butia, baderla qua e là cun inchün.	2	0	fourties	male			rm-vallader	
529c11accc6b1306c119debe495694953e382917b5714d31f5dfcf613976b3bc4289b2ccbd3c02fd7cd8d168d8c7f5ba9c58d64b2bb141517479ef0b8e7acc96	common_voice_rm-vallader_20576021.mp3	Id es pacs minuts avant las ot.	2	0	fourties	male			rm-vallader	
529c11accc6b1306c119debe495694953e382917b5714d31f5dfcf613976b3bc4289b2ccbd3c02fd7cd8d168d8c7f5ba9c58d64b2bb141517479ef0b8e7acc96	common_voice_rm-vallader_20576022.mp3	Davo la matura ha ella cumanzà a stübgiar etnologia e sport.	2	0	fourties	male			rm-vallader	
529c11accc6b1306c119debe495694953e382917b5714d31f5dfcf613976b3bc4289b2ccbd3c02fd7cd8d168d8c7f5ba9c58d64b2bb141517479ef0b8e7acc96	common_voice_rm-vallader_20576023.mp3	Cha quista situaziun nu possa satisfar, esa gnü remarchà.	2	0	fourties	male			rm-vallader	
529c11accc6b1306c119debe495694953e382917b5714d31f5dfcf613976b3bc4289b2ccbd3c02fd7cd8d168d8c7f5ba9c58d64b2bb141517479ef0b8e7acc96	common_voice_rm-vallader_20576024.mp3	A lur lai furtünada sun gnüds regalats trais figls.	2	0	fourties	male			rm-vallader	
529c11accc6b1306c119debe495694953e382917b5714d31f5dfcf613976b3bc4289b2ccbd3c02fd7cd8d168d8c7f5ba9c58d64b2bb141517479ef0b8e7acc96	common_voice_rm-vallader_20576025.mp3	Quellas s’ingaschan eir per part per e per part cunter il proget.	2	0	fourties	male			rm-vallader	
529c11accc6b1306c119debe495694953e382917b5714d31f5dfcf613976b3bc4289b2ccbd3c02fd7cd8d168d8c7f5ba9c58d64b2bb141517479ef0b8e7acc96	common_voice_rm-vallader_20576030.mp3	Pervi da quai, scriva, telefona o passa darcheu üna jada pro tia nona.	2	0	fourties	male			rm-vallader	
529c11accc6b1306c119debe495694953e382917b5714d31f5dfcf613976b3bc4289b2ccbd3c02fd7cd8d168d8c7f5ba9c58d64b2bb141517479ef0b8e7acc96	common_voice_rm-vallader_20576031.mp3	Illa grotta plain stachida han Nicola Bardola e Clà Riatsch preschantà il cudesch «Schlemm».	2	0	fourties	male			rm-vallader	
529c11accc6b1306c119debe495694953e382917b5714d31f5dfcf613976b3bc4289b2ccbd3c02fd7cd8d168d8c7f5ba9c58d64b2bb141517479ef0b8e7acc96	common_voice_rm-vallader_20576032.mp3	Quista stà han lö duos da quellas exposiziuns da stà.	2	0	fourties	male			rm-vallader	
529c11accc6b1306c119debe495694953e382917b5714d31f5dfcf613976b3bc4289b2ccbd3c02fd7cd8d168d8c7f5ba9c58d64b2bb141517479ef0b8e7acc96	common_voice_rm-vallader_20576033.mp3	El es stat subit perinclet.	2	0	fourties	male			rm-vallader	
529c11accc6b1306c119debe495694953e382917b5714d31f5dfcf613976b3bc4289b2ccbd3c02fd7cd8d168d8c7f5ba9c58d64b2bb141517479ef0b8e7acc96	common_voice_rm-vallader_20576034.mp3	L’attracziun sun las plantinas da cannabis.	2	1	fourties	male			rm-vallader	
529c11accc6b1306c119debe495694953e382917b5714d31f5dfcf613976b3bc4289b2ccbd3c02fd7cd8d168d8c7f5ba9c58d64b2bb141517479ef0b8e7acc96	common_voice_rm-vallader_20576041.mp3	«Nus vulain cha la glieud reponderescha e’s fa impissamaints», ha’l conclüs.	2	0	fourties	male			rm-vallader	
529c11accc6b1306c119debe495694953e382917b5714d31f5dfcf613976b3bc4289b2ccbd3c02fd7cd8d168d8c7f5ba9c58d64b2bb141517479ef0b8e7acc96	common_voice_rm-vallader_20576042.mp3	Ils capos da lur uffants e nu’s fan pisdischan ch’els ans daran sers.	2	1	fourties	male			rm-vallader	
529c11accc6b1306c119debe495694953e382917b5714d31f5dfcf613976b3bc4289b2ccbd3c02fd7cd8d168d8c7f5ba9c58d64b2bb141517479ef0b8e7acc96	common_voice_rm-vallader_20576043.mp3	Dimena ston avair survivü las plantas il temp da glatsch e lura as derasadas.	2	0	fourties	male			rm-vallader	
529c11accc6b1306c119debe495694953e382917b5714d31f5dfcf613976b3bc4289b2ccbd3c02fd7cd8d168d8c7f5ba9c58d64b2bb141517479ef0b8e7acc96	common_voice_rm-vallader_20576044.mp3	Il bogn cumbinà cuernà ed avert a Zernez es main dependent da l’ora.	2	0	fourties	male			rm-vallader	
529c11accc6b1306c119debe495694953e382917b5714d31f5dfcf613976b3bc4289b2ccbd3c02fd7cd8d168d8c7f5ba9c58d64b2bb141517479ef0b8e7acc96	common_voice_rm-vallader_20576045.mp3	Cha uschigliö as ris-cha «be da zoppar, ma na da levar il defet».	2	0	fourties	male			rm-vallader	
529c11accc6b1306c119debe495694953e382917b5714d31f5dfcf613976b3bc4289b2ccbd3c02fd7cd8d168d8c7f5ba9c58d64b2bb141517479ef0b8e7acc96	common_voice_rm-vallader_20576055.mp3	Es quai pelvaira üna restructuraziun, quai chi’d es gnü comunichà?	2	0	fourties	male			rm-vallader	
529c11accc6b1306c119debe495694953e382917b5714d31f5dfcf613976b3bc4289b2ccbd3c02fd7cd8d168d8c7f5ba9c58d64b2bb141517479ef0b8e7acc96	common_voice_rm-vallader_20576056.mp3	I nu san che ch’id es da far –co güdar.	2	0	fourties	male			rm-vallader	
529c11accc6b1306c119debe495694953e382917b5714d31f5dfcf613976b3bc4289b2ccbd3c02fd7cd8d168d8c7f5ba9c58d64b2bb141517479ef0b8e7acc96	common_voice_rm-vallader_20576058.mp3	Da las poesias da Bezzola resorta eir critica sociala ed ün impetus pedagogic.	2	0	fourties	male			rm-vallader	
529c11accc6b1306c119debe495694953e382917b5714d31f5dfcf613976b3bc4289b2ccbd3c02fd7cd8d168d8c7f5ba9c58d64b2bb141517479ef0b8e7acc96	common_voice_rm-vallader_20576059.mp3	Cun quistas masüras as voul redüer l’adozamaint dals cuosts illa sanità.	2	0	fourties	male			rm-vallader	
529c11accc6b1306c119debe495694953e382917b5714d31f5dfcf613976b3bc4289b2ccbd3c02fd7cd8d168d8c7f5ba9c58d64b2bb141517479ef0b8e7acc96	common_voice_rm-vallader_20576060.mp3	L’ediziun taliana s’adressa specialmaing als giasts dal pajais vaschin cunfinont.	2	0	fourties	male			rm-vallader	
529c11accc6b1306c119debe495694953e382917b5714d31f5dfcf613976b3bc4289b2ccbd3c02fd7cd8d168d8c7f5ba9c58d64b2bb141517479ef0b8e7acc96	common_voice_rm-vallader_20576061.mp3	Simpel, modest, prüvà.	2	0	fourties	male			rm-vallader	
529c11accc6b1306c119debe495694953e382917b5714d31f5dfcf613976b3bc4289b2ccbd3c02fd7cd8d168d8c7f5ba9c58d64b2bb141517479ef0b8e7acc96	common_voice_rm-vallader_20576062.mp3	«Samaragds» dvaintan nempe be plantas o bes-chas periclitadas ill’Europa.	2	0	fourties	male			rm-vallader	
529c11accc6b1306c119debe495694953e382917b5714d31f5dfcf613976b3bc4289b2ccbd3c02fd7cd8d168d8c7f5ba9c58d64b2bb141517479ef0b8e7acc96	common_voice_rm-vallader_20576063.mp3	Sco chi’s sa per restar permanentamaing in quaist pajais da la cucagna.	2	0	fourties	male			rm-vallader	
529c11accc6b1306c119debe495694953e382917b5714d31f5dfcf613976b3bc4289b2ccbd3c02fd7cd8d168d8c7f5ba9c58d64b2bb141517479ef0b8e7acc96	common_voice_rm-vallader_20576064.mp3	Buns resultats han ragiunt eir las squadras da las categorias bassas.	2	0	fourties	male			rm-vallader	
529c11accc6b1306c119debe495694953e382917b5714d31f5dfcf613976b3bc4289b2ccbd3c02fd7cd8d168d8c7f5ba9c58d64b2bb141517479ef0b8e7acc96	common_voice_rm-vallader_20576065.mp3	Jachen Bezzola: Eu pens da schi.	2	0	fourties	male			rm-vallader	
529c11accc6b1306c119debe495694953e382917b5714d31f5dfcf613976b3bc4289b2ccbd3c02fd7cd8d168d8c7f5ba9c58d64b2bb141517479ef0b8e7acc96	common_voice_rm-vallader_20576076.mp3	E uossa vana apunta a las maestranzas svizras.	2	0	fourties	male			rm-vallader	
529c11accc6b1306c119debe495694953e382917b5714d31f5dfcf613976b3bc4289b2ccbd3c02fd7cd8d168d8c7f5ba9c58d64b2bb141517479ef0b8e7acc96	common_voice_rm-vallader_20576077.mp3	Probabelmaing sun ellas gnüdas stampadas in Bulgaria.	2	0	fourties	male			rm-vallader	
529c11accc6b1306c119debe495694953e382917b5714d31f5dfcf613976b3bc4289b2ccbd3c02fd7cd8d168d8c7f5ba9c58d64b2bb141517479ef0b8e7acc96	common_voice_rm-vallader_20576078.mp3	Plü tard es dvantà il parlatori la stanza da mangiar dals lavuraints forestals.	2	0	fourties	male			rm-vallader	
529c11accc6b1306c119debe495694953e382917b5714d31f5dfcf613976b3bc4289b2ccbd3c02fd7cd8d168d8c7f5ba9c58d64b2bb141517479ef0b8e7acc96	common_voice_rm-vallader_20576079.mp3	Uschea sun nadas denominaziuns per part pac lusingiantas.	2	0	fourties	male			rm-vallader	
529c11accc6b1306c119debe495694953e382917b5714d31f5dfcf613976b3bc4289b2ccbd3c02fd7cd8d168d8c7f5ba9c58d64b2bb141517479ef0b8e7acc96	common_voice_rm-vallader_20576080.mp3	Cunter la vöglia da la regenza es gnüda fatta buna quista proposta.	2	0	fourties	male			rm-vallader	
529c11accc6b1306c119debe495694953e382917b5714d31f5dfcf613976b3bc4289b2ccbd3c02fd7cd8d168d8c7f5ba9c58d64b2bb141517479ef0b8e7acc96	common_voice_rm-vallader_20576089.mp3	Cumanzà ha l’occurrenza a Martina per cuntinuar a Seraplana, Ramosch, Scuol e Sent.	2	0	fourties	male			rm-vallader	
529c11accc6b1306c119debe495694953e382917b5714d31f5dfcf613976b3bc4289b2ccbd3c02fd7cd8d168d8c7f5ba9c58d64b2bb141517479ef0b8e7acc96	common_voice_rm-vallader_20576091.mp3	Surtuot glieud da Tavo nu d’eira d’accord cun quai.	2	1	fourties	male			rm-vallader	
529c11accc6b1306c119debe495694953e382917b5714d31f5dfcf613976b3bc4289b2ccbd3c02fd7cd8d168d8c7f5ba9c58d64b2bb141517479ef0b8e7acc96	common_voice_rm-vallader_20576092.mp3	Investir in nos futur.	2	0	fourties	male			rm-vallader	
529c11accc6b1306c119debe495694953e382917b5714d31f5dfcf613976b3bc4289b2ccbd3c02fd7cd8d168d8c7f5ba9c58d64b2bb141517479ef0b8e7acc96	common_voice_rm-vallader_20576093.mp3	Quista lingua vain datta inavant da generaziun a generaziun, ils giuvens imprendan dals vegls.	2	0	fourties	male			rm-vallader	
529c11accc6b1306c119debe495694953e382917b5714d31f5dfcf613976b3bc4289b2ccbd3c02fd7cd8d168d8c7f5ba9c58d64b2bb141517479ef0b8e7acc96	common_voice_rm-vallader_20576094.mp3	D’ün lavurar e d’ün scuttar.	2	0	fourties	male			rm-vallader	
529c11accc6b1306c119debe495694953e382917b5714d31f5dfcf613976b3bc4289b2ccbd3c02fd7cd8d168d8c7f5ba9c58d64b2bb141517479ef0b8e7acc96	common_voice_rm-vallader_20576096.mp3	Üna sporta essenziala da quel sun ils lavuratoris musicals.	2	0	fourties	male			rm-vallader	
529c11accc6b1306c119debe495694953e382917b5714d31f5dfcf613976b3bc4289b2ccbd3c02fd7cd8d168d8c7f5ba9c58d64b2bb141517479ef0b8e7acc96	common_voice_rm-vallader_20576097.mp3	Tuot ils collavuratuors meritan ün lod ed ün ingrazchamaint.	2	0	fourties	male			rm-vallader	
529c11accc6b1306c119debe495694953e382917b5714d31f5dfcf613976b3bc4289b2ccbd3c02fd7cd8d168d8c7f5ba9c58d64b2bb141517479ef0b8e7acc96	common_voice_rm-vallader_20576098.mp3	Nossa ruta ans maina aint per la val Murtaröl sü vers Jufplaun.	2	0	fourties	male			rm-vallader	
529c11accc6b1306c119debe495694953e382917b5714d31f5dfcf613976b3bc4289b2ccbd3c02fd7cd8d168d8c7f5ba9c58d64b2bb141517479ef0b8e7acc96	common_voice_rm-vallader_20576099.mp3	I’s pudess jo far pitschens pass.	2	0	fourties	male			rm-vallader	
529c11accc6b1306c119debe495694953e382917b5714d31f5dfcf613976b3bc4289b2ccbd3c02fd7cd8d168d8c7f5ba9c58d64b2bb141517479ef0b8e7acc96	common_voice_rm-vallader_20576100.mp3	Que chi’d es gnü lodà eir inschinà da tuot las varts.	2	0	fourties	male			rm-vallader	
529c11accc6b1306c119debe495694953e382917b5714d31f5dfcf613976b3bc4289b2ccbd3c02fd7cd8d168d8c7f5ba9c58d64b2bb141517479ef0b8e7acc96	common_voice_rm-vallader_20680319.mp3	Ün tal program exista dal rest eir in Engiadin’Ota.	2	0	fourties	male			rm-vallader	
529c11accc6b1306c119debe495694953e382917b5714d31f5dfcf613976b3bc4289b2ccbd3c02fd7cd8d168d8c7f5ba9c58d64b2bb141517479ef0b8e7acc96	common_voice_rm-vallader_20680321.mp3	Ella vain darcheu tematisada publicamaing.	2	0	fourties	male			rm-vallader	
